chapter,verse,text
1,1,"Ὃ ἦν ἀπ’ ἀρχῆς, ὃ ἀκηκόαμεν, ὃ ἑωράκαμεν τοῖς ὀφθαλμοῖς ἡμῶν, ὃ ἐθεασάμεθα, καὶ αἱ χεῖρες ἡμῶν ἐψηλάφησαν περὶ τοῦ λόγου τῆς ζωῆς."
1,2,"Καὶ ἡ ζωὴ ἐφανερώθη, καὶ ἑωράκαμεν, καὶ μαρτυροῦμεν, καὶ ἀπαγγέλλομεν ὑμῖν τὴν ζωὴν τὴν αἰώνιον, ἥτις ἦν πρὸς τὸν πατέρα, καὶ ἐφανερώθη ἡμῖν."
1,3,"Ὃ ἑωράκαμεν καὶ ἀκηκόαμεν, ἀπαγγέλλομεν ὑμῖν, {NA ὑμῖν > καὶ ὑμῖν } ἵνα καὶ ὑμεῖς κοινωνίαν ἔχητε μεθ’ ἡμῶν· καὶ ἡ κοινωνία δὲ ἡ ἡμετέρα μετὰ τοῦ πατρὸς καὶ μετὰ τοῦ υἱοῦ αὐτοῦ Ἰησοῦ χριστοῦ·"
1,4,"καὶ ταῦτα γράφομεν ὑμῖν, {NA ὑμῖν > ἡμεῖς } ἵνα ἡ χαρὰ ἡμῶν {Byz ἡμῶν > ὑμῶν } ᾖ πεπληρωμένη."
1,5,"
Καὶ ἔστιν αὕτη ἡ ἀγγελία ἣν ἀκηκόαμεν ἀπ’ αὐτοῦ καὶ ἀναγγέλλομεν ὑμῖν, ὅτι ὁ θεὸς φῶς ἐστίν, καὶ σκοτία ἐν αὐτῷ οὐκ ἔστιν οὐδεμία."
1,6,"Ἐὰν εἴπωμεν ὅτι κοινωνίαν ἔχομεν μετ’ αὐτοῦ, καὶ ἐν τῷ σκότει περιπατῶμεν, ψευδόμεθα, καὶ οὐ ποιοῦμεν τὴν ἀλήθειαν·"
1,7,"ἐὰν δὲ {NA28 δὲ > - } ἐν τῷ φωτὶ περιπατῶμεν, ὡς αὐτός ἐστιν ἐν τῷ φωτί, κοινωνίαν ἔχομεν μετ’ ἀλλήλων, καὶ τὸ αἷμα Ἰησοῦ χριστοῦ {NA χριστοῦ > - } τοῦ υἱοῦ αὐτοῦ καθαρίζει ἡμᾶς ἀπὸ πάσης ἁμαρτίας."
1,8,"Ἐὰν εἴπωμεν ὅτι ἁμαρτίαν οὐκ ἔχομεν, ἑαυτοὺς πλανῶμεν, καὶ ἡ ἀλήθεια οὐκ ἔστιν ἐν ἡμῖν."
1,9,"Ἐὰν ὁμολογῶμεν τὰς ἁμαρτίας ἡμῶν, πιστός ἐστιν καὶ δίκαιος ἵνα ἀφῇ ἡμῖν τὰς ἁμαρτίας, καὶ καθαρίσῃ ἡμᾶς ἀπὸ πάσης ἀδικίας."
1,10,"Ἐὰν εἴπωμεν ὅτι οὐχ ἡμαρτήκαμεν, ψεύστην ποιοῦμεν αὐτόν, καὶ ὁ λόγος αὐτοῦ οὐκ ἔστιν ἐν ἡμῖν."
2,1,"Τεκνία μου, ταῦτα γράφω ὑμῖν, ἵνα μὴ ἁμάρτητε. Καὶ ἐάν τις ἁμάρτῃ, παράκλητον ἔχομεν πρὸς τὸν πατέρα, Ἰησοῦν χριστὸν δίκαιον·"
2,2,"καὶ αὐτὸς ἱλασμός ἐστιν περὶ τῶν ἁμαρτιῶν ἡμῶν· οὐ περὶ τῶν ἡμετέρων δὲ μόνον, ἀλλὰ καὶ περὶ ὅλου τοῦ κόσμου."
2,3,"Καὶ ἐν τούτῳ γινώσκομεν ὅτι ἐγνώκαμεν αὐτόν, ἐὰν τὰς ἐντολὰς αὐτοῦ τηρῶμεν."
2,4,"Ὁ λέγων, Ἔγνωκα {NA Ἔγνωκα > ὅτι Ἔγνωκα } αὐτόν, καὶ τὰς ἐντολὰς αὐτοῦ μὴ τηρῶν, ψεύστης ἐστίν, καὶ ἐν τούτῳ ἡ ἀλήθεια οὐκ ἔστιν·"
2,5,"ὃς δ’ ἂν τηρῇ αὐτοῦ τὸν λόγον, ἀληθῶς ἐν τούτῳ ἡ ἀγάπη τοῦ θεοῦ τετελείωται. Ἐν τούτῳ γινώσκομεν ὅτι ἐν αὐτῷ ἐσμέν·"
2,6,"ὁ λέγων ἐν αὐτῷ μένειν ὀφείλει, καθὼς ἐκεῖνος περιεπάτησεν, καὶ αὐτὸς οὕτως {NA οὕτως > [οὕτως] } περιπατεῖν."
2,7,"
Ἀδελφοί, {NA Ἀδελφοί > Ἀγαπητοί } οὐκ ἐντολὴν καινὴν γράφω ὑμῖν, ἀλλ’ ἐντολὴν παλαιάν, ἣν εἴχετε ἀπ’ ἀρχῆς· ἡ ἐντολὴ ἡ παλαιά ἐστιν ὁ λόγος ὃν ἠκούσατε ἀπ’ {NA ἠκούσατε ἀπ’ ἀρχῆς > ἠκούσατε } ἀρχῆς."
2,8,"Πάλιν ἐντολὴν καινὴν γράφω ὑμῖν, ὅ ἐστιν ἀληθὲς ἐν αὐτῷ καὶ ἐν ὑμῖν· ὅτι ἡ σκοτία παράγεται, καὶ τὸ φῶς τὸ ἀληθινὸν ἤδη φαίνει."
2,9,"Ὁ λέγων ἐν τῷ φωτὶ εἶναι καὶ τὸν ἀδελφὸν αὐτοῦ μισῶν, ἐν τῇ σκοτίᾳ ἐστὶν ἕως ἄρτι."
2,10,"Ὁ ἀγαπῶν τὸν ἀδελφὸν αὐτοῦ ἐν τῷ φωτὶ μένει, καὶ σκάνδαλον ἐν αὐτῷ οὐκ ἔστιν."
2,11,"Ὁ δὲ μισῶν τὸν ἀδελφὸν αὐτοῦ ἐν τῇ σκοτίᾳ ἐστίν, καὶ ἐν τῇ σκοτίᾳ περιπατεῖ, καὶ οὐκ οἶδεν ποῦ ὑπάγει, ὅτι ἡ σκοτία ἐτύφλωσεν τοὺς ὀφθαλμοὺς αὐτοῦ."
2,12,"
Γράφω ὑμῖν, τεκνία, ὅτι ἀφέωνται ὑμῖν αἱ ἁμαρτίαι διὰ τὸ ὄνομα αὐτοῦ."
2,13,"Γράφω ὑμῖν, πατέρες, ὅτι ἐγνώκατε τὸν ἀπ’ ἀρχῆς. Γράφω ὑμῖν, νεανίσκοι, ὅτι νενικήκατε τὸν πονηρόν. Γράφω {NA Γράφω ὑμῖν παιδία > Ἔγραψα ὑμῖν παιδία } ὑμῖν, παιδία, ὅτι ἐγνώκατε τὸν πατέρα."
2,14,"Ἔγραψα ὑμῖν, πατέρες, ὅτι ἐγνώκατε τὸν ἀπ’ ἀρχῆς. Ἔγραψα ὑμῖν, νεανίσκοι, ὅτι ἰσχυροί ἐστε, καὶ ὁ λόγος τοῦ θεοῦ ἐν ὑμῖν μένει, καὶ νενικήκατε τὸν πονηρόν."
2,15,"Μὴ ἀγαπᾶτε τὸν κόσμον, μηδὲ τὰ ἐν τῷ κόσμῳ. Ἐάν τις ἀγαπᾷ τὸν κόσμον, οὐκ ἔστιν ἡ ἀγάπη τοῦ πατρὸς ἐν αὐτῷ."
2,16,"Ὅτι πᾶν τὸ ἐν τῷ κόσμῳ, ἡ ἐπιθυμία τῆς σαρκός, καὶ ἡ ἐπιθυμία τῶν ὀφθαλμῶν, καὶ ἡ ἀλαζονεία τοῦ βίου, οὐκ ἔστιν ἐκ τοῦ πατρός, ἀλλ’ ἐκ τοῦ κόσμου ἐστίν."
2,17,"Καὶ ὁ κόσμος παράγεται, καὶ ἡ ἐπιθυμία αὐτοῦ· ὁ δὲ ποιῶν τὸ θέλημα τοῦ θεοῦ μένει εἰς τὸν αἰῶνα."
2,18,"
Παιδία, ἐσχάτη ὥρα ἐστίν· καὶ καθὼς ἠκούσατε ὅτι ὁ {NA ὁ > - } ἀντίχριστος ἔρχεται, καὶ νῦν ἀντίχριστοι πολλοὶ γεγόνασιν· ὅθεν γινώσκομεν ὅτι ἐσχάτη ὥρα ἐστίν."
2,19,"Ἐξ ἡμῶν ἐξῆλθον, {NA ἐξῆλθον > ἐξῆλθαν } ἀλλ’ οὐκ ἦσαν ἐξ ἡμῶν· εἰ γὰρ {NA γὰρ ἦσαν ἐξ ἡμῶν > γὰρ ἐξ ἡμῶν ἦσαν } ἦσαν ἐξ ἡμῶν, μεμενήκεισαν ἂν μεθ’ ἡμῶν· ἀλλ’ ἵνα φανερωθῶσιν ὅτι οὐκ εἰσὶν πάντες ἐξ ἡμῶν."
2,20,"Καὶ ὑμεῖς χρίσμα ἔχετε ἀπὸ τοῦ ἁγίου, καὶ οἴδατε πάντα. {NA πάντα > πάντες }"
2,21,"Οὐκ ἔγραψα ὑμῖν ὅτι οὐκ οἴδατε τὴν ἀλήθειαν, ἀλλ’ ὅτι οἴδατε αὐτήν, καὶ ὅτι πᾶν ψεῦδος ἐκ τῆς ἀληθείας οὐκ ἔστιν."
2,22,"Τίς ἐστιν ὁ ψεύστης, εἰ μὴ ὁ ἀρνούμενος ὅτι Ἰησοῦς οὐκ ἔστιν ὁ χριστός; Οὗτός ἐστιν ὁ ἀντίχριστος, ὁ ἀρνούμενος τὸν πατέρα καὶ τὸν υἱόν."
2,23,"Πᾶς ὁ ἀρνούμενος τὸν υἱὸν οὐδὲ τὸν πατέρα ἔχει. {NA ἔχει > ἔχει, ὁ ὁμολογῶν τὸν υἱὸν καὶ τὸν πατέρα ἔχει }"
2,24,"Ὑμεῖς οὖν {NA οὖν > - } ὃ ἠκούσατε ἀπ’ ἀρχῆς, ἐν ὑμῖν μενέτω. Ἐὰν ἐν ὑμῖν μείνῃ ὃ ἀπ’ ἀρχῆς ἠκούσατε, καὶ ὑμεῖς ἐν τῷ υἱῷ καὶ ἐν τῷ πατρὶ μενεῖτε."
2,25,"Καὶ αὕτη ἐστὶν ἡ ἐπαγγελία ἣν αὐτὸς ἐπηγγείλατο ἡμῖν, τὴν ζωὴν τὴν αἰώνιον."
2,26,Ταῦτα ἔγραψα ὑμῖν περὶ τῶν πλανώντων ὑμᾶς.
2,27,"Καὶ ὑμεῖς, τὸ χρίσμα ὃ ἐλάβετε ἀπ’ αὐτοῦ ἐν {NA ἐν ὑμῖν μένει > μένει ἐν ὑμῖν } ὑμῖν μένει, καὶ οὐ χρείαν ἔχετε ἵνα τις διδάσκῃ ὑμᾶς· ἀλλ’ ὡς τὸ αὐτὸ {NA αὐτὸ > αὐτοῦ } χρίσμα διδάσκει ὑμᾶς περὶ πάντων, καὶ ἀληθές ἐστιν, καὶ οὐκ ἔστιν ψεῦδος, καὶ καθὼς ἐδίδαξεν ὑμᾶς, μενεῖτε {NA μενεῖτε > μένετε } ἐν αὐτῷ."
2,28,"Καὶ νῦν, τεκνία, μένετε ἐν αὐτῷ· ἵνα ὅταν {NA ὅταν φανερωθῇ ἔχωμεν > ἐὰν φανερωθῇ σχῶμεν } φανερωθῇ, ἔχωμεν παρρησίαν, καὶ μὴ αἰσχυνθῶμεν ἀπ’ αὐτοῦ ἐν τῇ παρουσίᾳ αὐτοῦ."
2,29,"Ἐὰν εἰδῆτε ὅτι δίκαιός ἐστιν, γινώσκετε ὅτι πᾶς {NA πᾶς > καὶ πᾶς } ὁ ποιῶν τὴν δικαιοσύνην ἐξ αὐτοῦ γεγέννηται."
3,1,"Ἴδετε ποταπὴν ἀγάπην δέδωκεν ἡμῖν ὁ πατήρ, ἵνα τέκνα θεοῦ κληθῶμεν. {NA κληθῶμεν. > κληθῶμεν· καὶ ἐσμέν. } Διὰ τοῦτο ὁ κόσμος οὐ γινώσκει ὑμᾶς, {NA ὑμᾶς > ἡμᾶς } ὅτι οὐκ ἔγνω αὐτόν."
3,2,"Ἀγαπητοί, νῦν τέκνα θεοῦ ἐσμέν, καὶ οὔπω ἐφανερώθη τί ἐσόμεθα· οἴδαμεν δὲ {NA δὲ > - } ὅτι ἐὰν φανερωθῇ, ὅμοιοι αὐτῷ ἐσόμεθα, ὅτι ὀψόμεθα αὐτὸν καθώς ἐστιν."
3,3,"Καὶ πᾶς ὁ ἔχων τὴν ἐλπίδα ταύτην ἐπ’ αὐτῷ ἁγνίζει ἑαυτόν, καθὼς ἐκεῖνος ἁγνός ἐστιν."
3,4,"Πᾶς ὁ ποιῶν τὴν ἁμαρτίαν, καὶ τὴν ἀνομίαν ποιεῖ· καὶ ἡ ἁμαρτία ἐστὶν ἡ ἀνομία."
3,5,"Καὶ οἴδατε ὅτι ἐκεῖνος ἐφανερώθη, ἵνα τὰς ἁμαρτίας ἡμῶν {NA ἡμῶν > - } ἄρῃ· καὶ ἁμαρτία ἐν αὐτῷ οὐκ ἔστιν."
3,6,"Πᾶς ὁ ἐν αὐτῷ μένων οὐχ ἁμαρτάνει· πᾶς ὁ ἁμαρτάνων οὐχ ἑώρακεν αὐτόν, οὐδὲ ἔγνωκεν αὐτόν."
3,7,"Τεκνία, {NA28 Τεκνία > Παιδία } μηδεὶς πλανάτω ὑμᾶς· ὁ ποιῶν τὴν δικαιοσύνην δίκαιός ἐστιν, καθὼς ἐκεῖνος δίκαιός ἐστιν·"
3,8,"ὁ ποιῶν τὴν ἁμαρτίαν ἐκ τοῦ διαβόλου ἐστίν, ὅτι ἀπ’ ἀρχῆς ὁ διάβολος ἁμαρτάνει. Εἰς τοῦτο ἐφανερώθη ὁ υἱὸς τοῦ θεοῦ, ἵνα λύσῃ τὰ ἔργα τοῦ διαβόλου."
3,9,"Πᾶς ὁ γεγεννημένος ἐκ τοῦ θεοῦ ἁμαρτίαν οὐ ποιεῖ, ὅτι σπέρμα αὐτοῦ ἐν αὐτῷ μένει· καὶ οὐ δύναται ἁμαρτάνειν, ὅτι ἐκ τοῦ θεοῦ γεγέννηται."
3,10,"Ἐν τούτῳ φανερά ἐστιν τὰ τέκνα τοῦ θεοῦ καὶ τὰ τέκνα τοῦ διαβόλου· πᾶς ὁ μὴ ποιῶν δικαιοσύνην οὐκ ἔστιν ἐκ τοῦ θεοῦ, καὶ ὁ μὴ ἀγαπῶν τὸν ἀδελφὸν αὐτοῦ."
3,11,"Ὅτι αὕτη ἐστὶν ἡ ἀγγελία ἣν ἠκούσατε ἀπ’ ἀρχῆς, ἵνα ἀγαπῶμεν ἀλλήλους·"
3,12,"οὐ καθὼς Κάϊν ἐκ τοῦ πονηροῦ ἦν, καὶ ἔσφαξεν τὸν ἀδελφὸν αὐτοῦ. Καὶ χάριν τίνος ἔσφαξεν αὐτόν; Ὅτι τὰ ἔργα αὐτοῦ πονηρὰ ἦν, τὰ δὲ τοῦ ἀδελφοῦ αὐτοῦ δίκαια."
3,13,"
Μὴ {NA Μὴ > [Καὶ] μὴ } θαυμάζετε, ἀδελφοί μου, {NA μου > - } εἰ μισεῖ ὑμᾶς ὁ κόσμος·"
3,14,"ἡμεῖς οἴδαμεν ὅτι μεταβεβήκαμεν ἐκ τοῦ θανάτου εἰς τὴν ζωήν, ὅτι ἀγαπῶμεν τοὺς ἀδελφούς. Ὁ μὴ ἀγαπῶν τὸν {NA τὸν ἀδελφόν > - } ἀδελφόν, μένει ἐν τῷ θανάτῳ."
3,15,Πᾶς ὁ μισῶν τὸν ἀδελφὸν αὐτοῦ ἀνθρωποκτόνος ἐστίν· καὶ οἴδατε ὅτι πᾶς ἀνθρωποκτόνος οὐκ ἔχει ζωὴν αἰώνιον ἐν ἑαυτῷ {NA ἑαυτῷ > αὐτῷ } μένουσαν.
3,16,"Ἐν τούτῳ ἐγνώκαμεν τὴν ἀγάπην, ὅτι ἐκεῖνος ὑπὲρ ἡμῶν τὴν ψυχὴν αὐτοῦ ἔθηκεν· καὶ ἡμεῖς ὀφείλομεν ὑπὲρ τῶν ἀδελφῶν τὰς ψυχὰς τιθέναι. {NA τιθέναι > θεῖναι }"
3,17,"Ὃς δ’ ἂν ἔχῃ τὸν βίον τοῦ κόσμου, καὶ θεωρῇ τὸν ἀδελφὸν αὐτοῦ χρείαν ἔχοντα, καὶ κλείσῃ τὰ σπλάγχνα αὐτοῦ ἀπ’ αὐτοῦ, πῶς ἡ ἀγάπη τοῦ θεοῦ μένει ἐν αὐτῷ;"
3,18,"Τεκνία μου, {NA μου > - } μὴ ἀγαπῶμεν λόγῳ μηδὲ τῇ γλώσσῃ, ἀλλ’ {NA ἀλλ’ > ἀλλὰ } ἐν ἔργῳ καὶ ἀληθείᾳ."
3,19,"Καὶ {NA Καὶ ἐν τούτῳ γινώσκομεν > [Καὶ] ἐν τούτῳ γνωσόμεθα } ἐν τούτῳ γινώσκομεν ὅτι ἐκ τῆς ἀληθείας ἐσμέν, καὶ ἔμπροσθεν αὐτοῦ πείσομεν τὰς {NA τὰς καρδίας > τὴν καρδίαν } καρδίας ἡμῶν,"
3,20,"ὅτι ἐὰν καταγινώσκῃ ἡμῶν ἡ καρδία, ὅτι μείζων ἐστὶν ὁ θεὸς τῆς καρδίας ἡμῶν, καὶ γινώσκει πάντα."
3,21,"Ἀγαπητοί, ἐὰν ἡ καρδία ἡμῶν {NA ἡμῶν μὴ καταγινώσκῃ ἡμῶν > [ἡμῶν] μὴ καταγινώσκῃ } μὴ καταγινώσκῃ ἡμῶν, παρρησίαν ἔχομεν πρὸς τὸν θεόν,"
3,22,"καὶ ὃ ἐὰν αἰτῶμεν, λαμβάνομεν παρ’ {NA παρ’ > ἀπ’ } αὐτοῦ, ὅτι τὰς ἐντολὰς αὐτοῦ τηροῦμεν, καὶ τὰ ἀρεστὰ ἐνώπιον αὐτοῦ ποιοῦμεν."
3,23,"Καὶ αὕτη ἐστὶν ἡ ἐντολὴ αὐτοῦ, ἵνα πιστεύσωμεν τῷ ὀνόματι τοῦ υἱοῦ αὐτοῦ Ἰησοῦ χριστοῦ, καὶ ἀγαπῶμεν ἀλλήλους, καθὼς ἔδωκεν ἐντολήν. {NA ἐντολήν > ἐντολὴν ἡμῖν }"
3,24,"Καὶ ὁ τηρῶν τὰς ἐντολὰς αὐτοῦ ἐν αὐτῷ μένει, καὶ αὐτὸς ἐν αὐτῷ. Καὶ ἐν τούτῳ γινώσκομεν ὅτι μένει ἐν ἡμῖν, ἐκ τοῦ πνεύματος οὗ ἡμῖν ἔδωκεν."
4,1,"Ἀγαπητοί, μὴ παντὶ πνεύματι πιστεύετε, ἀλλὰ δοκιμάζετε τὰ πνεύματα, εἰ ἐκ τοῦ θεοῦ ἐστίν· ὅτι πολλοὶ ψευδοπροφῆται ἐξεληλύθασιν εἰς τὸν κόσμον."
4,2,Ἐν τούτῳ γινώσκεται {NA γινώσκεται > γινώσκετε } τὸ πνεῦμα τοῦ θεοῦ· πᾶν πνεῦμα ὃ ὁμολογεῖ Ἰησοῦν χριστὸν ἐν σαρκὶ ἐληλυθότα ἐκ τοῦ θεοῦ ἐστίν·
4,3,"καὶ πᾶν πνεῦμα ὃ μὴ ὁμολογεῖ Ἰησοῦν {NA Ἰησοῦν χριστὸν ἐν σαρκὶ ἐληλυθότα > τὸν Ἰησοῦν } χριστὸν ἐν σαρκὶ ἐληλυθότα, ἐκ τοῦ θεοῦ οὐκ ἔστιν· καὶ τοῦτό ἐστιν τὸ τοῦ ἀντιχρίστου, ὃ ἀκηκόατε ὅτι ἔρχεται, καὶ νῦν ἐν τῷ κόσμῳ ἐστὶν ἤδη."
4,4,"Ὑμεῖς ἐκ τοῦ θεοῦ ἐστέ, τεκνία, καὶ νενικήκατε αὐτούς· ὅτι μείζων ἐστὶν ὁ ἐν ὑμῖν ἢ ὁ ἐν τῷ κόσμῳ."
4,5,"Αὐτοὶ ἐκ τοῦ κόσμου εἰσίν· διὰ τοῦτο ἐκ τοῦ κόσμου λαλοῦσιν, καὶ ὁ κόσμος αὐτῶν ἀκούει."
4,6,"Ἡμεῖς ἐκ τοῦ θεοῦ ἐσμέν· ὁ γινώσκων τὸν θεόν, ἀκούει ἡμῶν· ὃς οὐκ ἔστιν ἐκ τοῦ θεοῦ, οὐκ ἀκούει ἡμῶν. Ἐκ τούτου γινώσκομεν τὸ πνεῦμα τῆς ἀληθείας καὶ τὸ πνεῦμα τῆς πλάνης."
4,7,"
Ἀγαπητοί, ἀγαπῶμεν ἀλλήλους· ὅτι ἡ ἀγάπη ἐκ τοῦ θεοῦ ἐστίν, καὶ πᾶς ὁ ἀγαπῶν ἐκ τοῦ θεοῦ γεγέννηται, καὶ γινώσκει τὸν θεόν."
4,8,Ὁ μὴ ἀγαπῶν οὐκ ἔγνω τὸν θεόν· ὅτι ὁ θεὸς ἀγάπη ἐστίν.
4,9,"Ἐν τούτῳ ἐφανερώθη ἡ ἀγάπη τοῦ θεοῦ ἐν ἡμῖν, ὅτι τὸν υἱὸν αὐτοῦ τὸν μονογενῆ ἀπέσταλκεν ὁ θεὸς εἰς τὸν κόσμον, ἵνα ζήσωμεν δι’ αὐτοῦ."
4,10,"Ἐν τούτῳ ἐστὶν ἡ ἀγάπη, οὐχ ὅτι ἡμεῖς ἠγαπήσαμεν {NA ἠγαπήσαμεν > ἠγαπήκαμεν } τὸν θεόν, ἀλλ’ ὅτι αὐτὸς ἠγάπησεν ἡμᾶς, καὶ ἀπέστειλεν τὸν υἱὸν αὐτοῦ ἱλασμὸν περὶ τῶν ἁμαρτιῶν ἡμῶν."
4,11,"Ἀγαπητοί, εἰ οὕτως ὁ θεὸς ἠγάπησεν ἡμᾶς, καὶ ἡμεῖς ὀφείλομεν ἀλλήλους ἀγαπᾷν."
4,12,"Θεὸν οὐδεὶς πώποτε τεθέαται· ἐὰν ἀγαπῶμεν ἀλλήλους, ὁ θεὸς ἐν ἡμῖν μένει, καὶ ἡ ἀγάπη αὐτοῦ τετελειωμένη {NA τετελειωμένη ἐστὶν ἐν ἡμῖν > ἐν ἡμῖν τετελειωμένη ἐστίν } ἐστὶν ἐν ἡμῖν."
4,13,"Ἐν τούτῳ γινώσκομεν ὅτι ἐν αὐτῷ μένομεν καὶ αὐτὸς ἐν ἡμῖν, ὅτι ἐκ τοῦ πνεύματος αὐτοῦ δέδωκεν ἡμῖν."
4,14,Καὶ ἡμεῖς τεθεάμεθα καὶ μαρτυροῦμεν ὅτι ὁ πατὴρ ἀπέσταλκεν τὸν υἱὸν σωτῆρα τοῦ κόσμου.
4,15,"Ὃς ἂν {NA ἂν > ἐὰν } ὁμολογήσῃ ὅτι Ἰησοῦς ἐστὶν ὁ υἱὸς τοῦ θεοῦ, ὁ θεὸς ἐν αὐτῷ μένει, καὶ αὐτὸς ἐν τῷ θεῷ."
4,16,"Καὶ ἡμεῖς ἐγνώκαμεν καὶ πεπιστεύκαμεν τὴν ἀγάπην ἣν ἔχει ὁ θεὸς ἐν ἡμῖν. Ὁ θεὸς ἀγάπη ἐστίν, καὶ ὁ μένων ἐν τῇ ἀγάπῃ, ἐν τῷ θεῷ μένει, καὶ ὁ θεὸς ἐν αὐτῷ {Byz αὐτῷ μένει > αὐτῷ } μένει."
4,17,"Ἐν τούτῳ τετελείωται ἡ ἀγάπη μεθ’ ἡμῶν, ἵνα παρρησίαν ἔχωμεν ἐν τῇ ἡμέρᾳ τῆς κρίσεως, ὅτι καθὼς ἐκεῖνός ἐστιν, καὶ ἡμεῖς ἐσμὲν ἐν τῷ κόσμῳ τούτῳ."
4,18,"Φόβος οὐκ ἔστιν ἐν τῇ ἀγάπῃ, ἀλλ’ ἡ τελεία ἀγάπη ἔξω βάλλει τὸν φόβον, ὅτι ὁ φόβος κόλασιν ἔχει· ὁ δὲ φοβούμενος οὐ τετελείωται ἐν τῇ ἀγάπῃ."
4,19,"Ἡμεῖς ἀγαπῶμεν αὐτόν, {NA αὐτόν > - } ὅτι αὐτὸς πρῶτος ἠγάπησεν ἡμᾶς."
4,20,"Ἐάν τις εἴπῃ ὅτι Ἀγαπῶ τὸν θεόν, καὶ τὸν ἀδελφὸν αὐτοῦ μισῇ, ψεύστης ἐστίν· ὁ γὰρ μὴ ἀγαπῶν τὸν ἀδελφὸν αὐτοῦ ὃν ἑώρακεν, τὸν θεὸν ὃν οὐχ ἑώρακεν πῶς {NA πῶς > οὐ } δύναται ἀγαπᾷν;"
4,21,"Καὶ ταύτην τὴν ἐντολὴν ἔχομεν ἀπ’ αὐτοῦ, ἵνα ὁ ἀγαπῶν τὸν θεόν, ἀγαπᾷ καὶ τὸν ἀδελφὸν αὐτοῦ."
5,1,"Πᾶς ὁ πιστεύων ὅτι Ἰησοῦς ἐστὶν ὁ χριστός, ἐκ τοῦ θεοῦ γεγέννηται· καὶ πᾶς ὁ ἀγαπῶν τὸν γεννήσαντα ἀγαπᾷ καὶ {NA καὶ τὸν > [καὶ] τὸν } τὸν γεγεννημένον ἐξ αὐτοῦ."
5,2,"Ἐν τούτῳ γινώσκομεν ὅτι ἀγαπῶμεν τὰ τέκνα τοῦ θεοῦ, ὅταν τὸν θεὸν ἀγαπῶμεν, καὶ τὰς ἐντολὰς αὐτοῦ τηρῶμεν. {NA τηρῶμεν > ποιῶμεν }"
5,3,"Αὕτη γάρ ἐστιν ἡ ἀγάπη τοῦ θεοῦ, ἵνα τὰς ἐντολὰς αὐτοῦ τηρῶμεν· καὶ αἱ ἐντολαὶ αὐτοῦ βαρεῖαι οὐκ εἰσίν."
5,4,"Ὅτι πᾶν τὸ γεγεννημένον ἐκ τοῦ θεοῦ νικᾷ τὸν κόσμον· καὶ αὕτη ἐστὶν ἡ νίκη ἡ νικήσασα τὸν κόσμον, ἡ πίστις ἡμῶν. {Byz ἡμῶν > ὑμῶν }"
5,5,"Τίς {NA Τίς > Τίς [δέ] } ἐστιν ὁ νικῶν τὸν κόσμον, εἰ μὴ ὁ πιστεύων ὅτι Ἰησοῦς ἐστὶν ὁ υἱὸς τοῦ θεοῦ;"
5,6,"Οὗτός ἐστιν ὁ ἐλθὼν δι’ ὕδατος καὶ αἵματος, Ἰησοῦς χριστός· οὐκ ἐν τῷ ὕδατι μόνον, ἀλλ’ ἐν τῷ ὕδατι καὶ τῷ {NA καὶ τῷ > καὶ ἐν τῷ } αἵματι. Καὶ τὸ πνεῦμά ἐστιν τὸ μαρτυροῦν, ὅτι τὸ πνεῦμά ἐστιν ἡ ἀλήθεια."
5,7,"Ὅτι τρεῖς εἰσὶν οἱ μαρτυροῦντες,"
5,8,"τὸ πνεῦμα, καὶ τὸ ὕδωρ, καὶ τὸ αἷμα· καὶ οἱ τρεῖς εἰς τὸ ἕν εἰσιν."
5,9,"Εἰ τὴν μαρτυρίαν τῶν ἀνθρώπων λαμβάνομεν, ἡ μαρτυρία τοῦ θεοῦ μείζων ἐστίν· ὅτι αὕτη ἐστὶν ἡ μαρτυρία τοῦ θεοῦ, ἣν {NA ἣν > ὅτι } μεμαρτύρηκεν περὶ τοῦ υἱοῦ αὐτοῦ."
5,10,"Ὁ πιστεύων εἰς τὸν υἱὸν τοῦ θεοῦ ἔχει τὴν μαρτυρίαν ἐν αὐτῷ· {NA27 αὐτῷ > ἑαυτῷ } ὁ μὴ πιστεύων τῷ θεῷ ψεύστην πεποίηκεν αὐτόν, ὅτι οὐ πεπίστευκεν εἰς τὴν μαρτυρίαν, ἣν μεμαρτύρηκεν ὁ θεὸς περὶ τοῦ υἱοῦ αὐτοῦ."
5,11,"Καὶ αὕτη ἐστὶν ἡ μαρτυρία, ὅτι ζωὴν αἰώνιον ἔδωκεν ἡμῖν ὁ θεός, καὶ αὕτη ἡ ζωὴ ἐν τῷ υἱῷ αὐτοῦ ἐστίν."
5,12,Ὁ ἔχων τὸν υἱὸν ἔχει τὴν ζωήν· ὁ μὴ ἔχων τὸν υἱὸν τοῦ θεοῦ τὴν ζωὴν οὐκ ἔχει.
5,13,"
Ταῦτα ἔγραψα ὑμῖν {NA ὑμῖν τοῖς πιστεύουσιν εἰς τὸ ὄνομα τοῦ υἱοῦ τοῦ θεοῦ > ὑμῖν } τοῖς πιστεύουσιν εἰς τὸ ὄνομα τοῦ υἱοῦ τοῦ θεοῦ, ἵνα εἰδῆτε ὅτι ζωὴν αἰώνιον {NA αἰώνιον ἔχετε > ἔχετε αἰώνιον } ἔχετε, καὶ {NA καὶ ἵνα πιστεύητε > τοῖς πιστεύουσιν } ἵνα πιστεύητε εἰς τὸ ὄνομα τοῦ υἱοῦ τοῦ θεοῦ."
5,14,"Καὶ αὕτη ἐστὶν ἡ παρρησία ἣν ἔχομεν πρὸς αὐτόν, ὅτι ἐάν τι αἰτώμεθα κατὰ τὸ θέλημα αὐτοῦ, ἀκούει ἡμῶν·"
5,15,"καὶ ἐὰν οἴδαμεν ὅτι ἀκούει ἡμῶν, ὃ ἐὰν αἰτώμεθα, οἴδαμεν ὅτι ἔχομεν τὰ αἰτήματα ἃ ᾐτήκαμεν παρ’ {NA παρ’ > ἀπ’ } αὐτοῦ."
