chapter,verse,text
5,16,"Ἐάν τις ἴδῃ τὸν ἀδελφὸν αὐτοῦ ἁμαρτάνοντα ἁμαρτίαν μὴ πρὸς θάνατον, αἰτήσει, καὶ δώσει αὐτῷ ζωὴν τοῖς ἁμαρτάνουσιν μὴ πρὸς θάνατον. Ἔστιν ἁμαρτία πρὸς θάνατον· οὐ περὶ ἐκείνης λέγω ἵνα ἐρωτήσῃ."
5,17,Πᾶσα ἀδικία ἁμαρτία ἐστίν· καὶ ἔστιν ἁμαρτία οὐ πρὸς θάνατον.
5,18,"
Οἴδαμεν ὅτι πᾶς ὁ γεγεννημένος ἐκ τοῦ θεοῦ οὐχ ἁμαρτάνει· ἀλλ’ ὁ γεννηθεὶς ἐκ τοῦ θεοῦ τηρεῖ ἑαυτόν, {NA27 ἑαυτόν > αὐτόν } καὶ ὁ πονηρὸς οὐχ ἅπτεται αὐτοῦ."
5,19,"Οἴδαμεν ὅτι ἐκ τοῦ θεοῦ ἐσμέν, καὶ ὁ κόσμος ὅλος ἐν τῷ πονηρῷ κεῖται."
5,20,"Οἴδαμεν δὲ ὅτι ὁ υἱὸς τοῦ θεοῦ ἥκει, καὶ δέδωκεν ἡμῖν διάνοιαν ἵνα γινώσκωμεν τὸν ἀληθινόν· καί ἐσμεν ἐν τῷ ἀληθινῷ, ἐν τῷ υἱῷ αὐτοῦ Ἰησοῦ χριστῷ. Οὗτός ἐστιν ὁ ἀληθινὸς θεός, καὶ ζωὴ {Byz ζωὴ αἰώνιος > ἡ ζωὴ ἡ αἰώνιος } αἰώνιος."
5,21,"Τεκνία, φυλάξατε ἑαυτὰ {Byz ἑαυτὰ > ἑαυτοὺς } ἀπὸ τῶν εἰδώλων. Ἀμήν. {NA Ἀμήν > - }"
