chapter,verse,text
6,16,επι πασιν αναλαβοντες τον θυρεον της πιστεως εν ω δυνησεσθε παντα τα βελη του πονηρου τα πεπυρωμενα σβεσαι
6,17,και την περικεφαλαιαν του σωτηριου δεξασθαι και την μαχαιραν του πνευματος ο εστιν ρημα θεου
6,18,δια πασης προσευχης και δεησεως προσευχομενοι εν παντι καιρω εν πνευματι και εις αυτο τουτο αγρυπνουντες εν παση προσκαρτερησει και δεησει περι παντων των αγιων
6,19,και υπερ εμου ινα μοι δοθη λογος εν ανοιξει του στοματος μου εν παρρησια γνωρισαι το μυστηριον του ευαγγελιου
6,20,υπερ ου πρεσβευω εν αλυσει ινα εν αυτω παρρησιασωμαι ως δει με λαλησαι
6,21,ινα δε ειδητε και υμεις τα κατ εμε τι πρασσω παντα υμιν γνωρισει τυχικος ο αγαπητος αδελφος και πιστος διακονος εν κυριω
6,22,ον επεμψα προς υμας εις αυτο τουτο ινα γνωτε τα περι ημων και παρακαλεση τας καρδιας υμων
6,23,ειρηνη τοις αδελφοις και αγαπη μετα πιστεως απο θεου πατρος και κυριου ιησου χριστου
6,24,η χαρις μετα παντων των αγαπωντων τον κυριον ημων ιησουν χριστον εν αφθαρσια αμην
