chapter,verse,text
1,1,παυλος αποστολος ουκ απ ανθρωπων ουδε δι ανθρωπου αλλα δια ιησου χριστου και θεου πατρος του εγειραντος αυτον εκ νεκρων
1,2,και οι συν εμοι παντες αδελφοι ταις εκκλησιαις της γαλατιας
1,3,χαρις υμιν και ειρηνη απο θεου πατρος και κυριου ημων ιησου χριστου
1,4,του δοντος εαυτον περι των αμαρτιων ημων οπως εξεληται ημας εκ του ενεστωτος αιωνος πονηρου κατα το θελημα του θεου και πατρος ημων
1,5,ω η δοξα εις τους αιωνας των αιωνων αμην
1,6,θαυμαζω οτι ουτως ταχεως μετατιθεσθε απο του καλεσαντος υμας εν χαριτι χριστου εις ετερον ευαγγελιον
1,7,ο ουκ εστιν αλλο ει μη τινες εισιν οι ταρασσοντες υμας και θελοντες μεταστρεψαι το ευαγγελιον του χριστου
1,8,αλλα και εαν ημεις η αγγελος εξ ουρανου ευαγγελιζηται υμιν παρ ο ευηγγελισαμεθα υμιν αναθεμα εστω
1,9,ως προειρηκαμεν και αρτι παλιν λεγω ει τις υμας ευαγγελιζεται παρ ο παρελαβετε αναθεμα εστω
1,10,αρτι γαρ ανθρωπους πειθω η τον θεον η ζητω ανθρωποις αρεσκειν ει γαρ ετι ανθρωποις ηρεσκον χριστου δουλος ουκ αν ημην
1,11,γνωριζω δε υμιν αδελφοι το ευαγγελιον το ευαγγελισθεν υπ εμου οτι ουκ εστιν κατα ανθρωπον
1,12,ουδε γαρ εγω παρα ανθρωπου παρελαβον αυτο ουτε εδιδαχθην αλλα δι αποκαλυψεως ιησου χριστου
1,13,ηκουσατε γαρ την εμην αναστροφην ποτε εν τω ιουδαισμω οτι καθ υπερβολην εδιωκον την εκκλησιαν του θεου και επορθουν αυτην
1,14,και προεκοπτον εν τω ιουδαισμω υπερ πολλους συνηλικιωτας εν τω γενει μου περισσοτερως ζηλωτης υπαρχων των πατρικων μου παραδοσεων
1,15,οτε δε ευδοκησεν ο θεος ο αφορισας με εκ κοιλιας μητρος μου και καλεσας δια της χαριτος αυτου
1,16,αποκαλυψαι τον υιον αυτου εν εμοι ινα ευαγγελιζωμαι αυτον εν τοις εθνεσιν ευθεως ου προσανεθεμην σαρκι και αιματι
1,17,ουδε ανηλθον εις ιεροσολυμα προς τους προ εμου αποστολους αλλα απηλθον εις αραβιαν και παλιν υπεστρεψα εις δαμασκον
1,18,επειτα μετα ετη τρια ανηλθον εις ιεροσολυμα ιστορησαι πετρον και επεμεινα προς αυτον ημερας δεκαπεντε
1,19,ετερον δε των αποστολων ουκ ειδον ει μη ιακωβον τον αδελφον του κυριου
1,20,α δε γραφω υμιν ιδου ενωπιον του θεου οτι ου ψευδομαι
1,21,επειτα ηλθον εις τα κλιματα της συριας και της κιλικιας
1,22,ημην δε αγνοουμενος τω προσωπω ταις εκκλησιαις της ιουδαιας ταις εν χριστω
1,23,μονον δε ακουοντες ησαν οτι ο διωκων ημας ποτε νυν ευαγγελιζεται την πιστιν ην ποτε επορθει
1,24,και εδοξαζον εν εμοι τον θεον
2,1,επειτα δια δεκατεσσαρων ετων παλιν ανεβην εις ιεροσολυμα μετα βαρναβα συμπαραλαβων και τιτον
2,2,ανεβην δε κατα αποκαλυψιν και ανεθεμην αυτοις το ευαγγελιον ο κηρυσσω εν τοις εθνεσιν κατ ιδιαν δε τοις δοκουσιν μηπως εις κενον τρεχω η εδραμον
2,3,αλλ ουδε τιτος ο συν εμοι ελλην ων ηναγκασθη περιτμηθηναι
2,4,δια δε τους παρεισακτους ψευδαδελφους οιτινες παρεισηλθον κατασκοπησαι την ελευθεριαν ημων ην εχομεν εν χριστω ιησου ινα ημας καταδουλωσωνται
2,5,οις ουδε προς ωραν ειξαμεν τη υποταγη ινα η αληθεια του ευαγγελιου διαμεινη προς υμας
2,6,απο δε των δοκουντων ειναι τι οποιοι ποτε ησαν ουδεν μοι διαφερει προσωπον θεος ανθρωπου ου λαμβανει εμοι γαρ οι δοκουντες ουδεν προσανεθεντο
2,7,αλλα τουναντιον ιδοντες οτι πεπιστευμαι το ευαγγελιον της ακροβυστιας καθως πετρος της περιτομης
2,8,ο γαρ ενεργησας πετρω εις αποστολην της περιτομης ενηργησεν και εμοι εις τα εθνη
2,9,και γνοντες την χαριν την δοθεισαν μοι ιακωβος και κηφας και ιωαννης οι δοκουντες στυλοι ειναι δεξιας εδωκαν εμοι και βαρναβα κοινωνιας ινα ημεις μεν εις τα εθνη αυτοι δε εις την περιτομην
2,10,μονον των πτωχων ινα μνημονευωμεν ο και εσπουδασα αυτο τουτο ποιησαι
2,11,οτε δε ηλθεν πετρος εις αντιοχειαν κατα προσωπον αυτω αντεστην οτι κατεγνωσμενος ην
2,12,προ του γαρ ελθειν τινας απο ιακωβου μετα των εθνων συνησθιεν οτε δε ηλθον υπεστελλεν και αφωριζεν εαυτον φοβουμενος τους εκ περιτομης
2,13,και συνυπεκριθησαν αυτω και οι λοιποι ιουδαιοι ωστε και βαρναβας συναπηχθη αυτων τη υποκρισει
2,14,αλλ οτε ειδον οτι ουκ ορθοποδουσιν προς την αληθειαν του ευαγγελιου ειπον τω πετρω εμπροσθεν παντων ει συ ιουδαιος υπαρχων εθνικως ζης και ουκ ιουδαικως τι τα εθνη αναγκαζεις ιουδαιζειν
2,15,ημεις φυσει ιουδαιοι και ουκ εξ εθνων αμαρτωλοι
2,16,ειδοτες οτι ου δικαιουται ανθρωπος εξ εργων νομου εαν μη δια πιστεως ιησου χριστου και ημεις εις χριστον ιησουν επιστευσαμεν ινα δικαιωθωμεν εκ πιστεως χριστου και ουκ εξ εργων νομου διοτι ου δικαιωθησεται εξ εργων νομου πασα σαρξ
2,17,ει δε ζητουντες δικαιωθηναι εν χριστω ευρεθημεν και αυτοι αμαρτωλοι αρα χριστος αμαρτιας διακονος μη γενοιτο
2,18,ει γαρ α κατελυσα ταυτα παλιν οικοδομω παραβατην εμαυτον συνιστημι
2,19,εγω γαρ δια νομου νομω απεθανον ινα θεω ζησω
2,20,χριστω συνεσταυρωμαι ζω δε ουκετι εγω ζη δε εν εμοι χριστος ο δε νυν ζω εν σαρκι εν πιστει ζω τη του υιου του θεου του αγαπησαντος με και παραδοντος εαυτον υπερ εμου
2,21,ουκ αθετω την χαριν του θεου ει γαρ δια νομου δικαιοσυνη αρα χριστος δωρεαν απεθανεν
3,1,ω ανοητοι γαλαται τις υμας εβασκανεν τη αληθεια μη πειθεσθαι οις κατ οφθαλμους ιησους χριστος προεγραφη εν υμιν εσταυρωμενος
3,2,τουτο μονον θελω μαθειν αφ υμων εξ εργων νομου το πνευμα ελαβετε η εξ ακοης πιστεως
3,3,ουτως ανοητοι εστε εναρξαμενοι πνευματι νυν σαρκι επιτελεισθε
3,4,τοσαυτα επαθετε εικη ειγε και εικη
3,5,ο ουν επιχορηγων υμιν το πνευμα και ενεργων δυναμεις εν υμιν εξ εργων νομου η εξ ακοης πιστεως
3,6,καθως αβρααμ επιστευσεν τω θεω και ελογισθη αυτω εις δικαιοσυνην
3,7,γινωσκετε αρα οτι οι εκ πιστεως ουτοι εισιν υιοι αβρααμ
3,8,προιδουσα δε η γραφη οτι εκ πιστεως δικαιοι τα εθνη ο θεος προευηγγελισατο τω αβρααμ οτι ενευλογηθησονται εν σοι παντα τα εθνη
3,9,ωστε οι εκ πιστεως ευλογουνται συν τω πιστω αβρααμ
3,10,οσοι γαρ εξ εργων νομου εισιν υπο καταραν εισιν γεγραπται γαρ επικαταρατος πας ος ουκ εμμενει εν πασιν τοις γεγραμμενοις εν τω βιβλιω του νομου του ποιησαι αυτα
3,11,οτι δε εν νομω ουδεις δικαιουται παρα τω θεω δηλον οτι ο δικαιος εκ πιστεως ζησεται
3,12,ο δε νομος ουκ εστιν εκ πιστεως αλλ ο ποιησας αυτα ανθρωπος ζησεται εν αυτοις
3,13,χριστος ημας εξηγορασεν εκ της καταρας του νομου γενομενος υπερ ημων καταρα γεγραπται γαρ επικαταρατος πας ο κρεμαμενος επι ξυλου
3,14,ινα εις τα εθνη η ευλογια του αβρααμ γενηται εν χριστω ιησου ινα την επαγγελιαν του πνευματος λαβωμεν δια της πιστεως
3,15,αδελφοι κατα ανθρωπον λεγω ομως ανθρωπου κεκυρωμενην διαθηκην ουδεις αθετει η επιδιατασσεται
3,16,τω δε αβρααμ ερρηθησαν αι επαγγελιαι και τω σπερματι αυτου ου λεγει και τοις σπερμασιν ως επι πολλων αλλ ως εφ ενος και τω σπερματι σου ος εστιν χριστος
3,17,τουτο δε λεγω διαθηκην προκεκυρωμενην υπο του θεου εις χριστον ο μετα ετη τετρακοσια και τριακοντα γεγονως νομος ουκ ακυροι εις το καταργησαι την επαγγελιαν
3,18,ει γαρ εκ νομου η κληρονομια ουκετι εξ επαγγελιας τω δε αβρααμ δι επαγγελιας κεχαρισται ο θεος
3,19,τι ουν ο νομος των παραβασεων χαριν προσετεθη αχρι ου ελθη το σπερμα ω επηγγελται διαταγεις δι αγγελων εν χειρι μεσιτου
3,20,ο δε μεσιτης ενος ουκ εστιν ο δε θεος εις εστιν
3,21,ο ουν νομος κατα των επαγγελιων του θεου μη γενοιτο ει γαρ εδοθη νομος ο δυναμενος ζωοποιησαι οντως αν εκ νομου ην η δικαιοσυνη
3,22,αλλα συνεκλεισεν η γραφη τα παντα υπο αμαρτιαν ινα η επαγγελια εκ πιστεως ιησου χριστου δοθη τοις πιστευουσιν
3,23,προ του δε ελθειν την πιστιν υπο νομον εφρουρουμεθα συγκεκλεισμενοι εις την μελλουσαν πιστιν αποκαλυφθηναι
3,24,ωστε ο νομος παιδαγωγος ημων γεγονεν εις χριστον ινα εκ πιστεως δικαιωθωμεν
3,25,ελθουσης δε της πιστεως ουκετι υπο παιδαγωγον εσμεν
3,26,παντες γαρ υιοι θεου εστε δια της πιστεως εν χριστω ιησου
3,27,οσοι γαρ εις χριστον εβαπτισθητε χριστον ενεδυσασθε
3,28,ουκ ενι ιουδαιος ουδε ελλην ουκ ενι δουλος ουδε ελευθερος ουκ ενι αρσεν και θηλυ παντες γαρ υμεις εις εστε εν χριστω ιησου
3,29,ει δε υμεις χριστου αρα του αβρααμ σπερμα εστε και κατ επαγγελιαν κληρονομοι
4,1,λεγω δε εφ οσον χρονον ο κληρονομος νηπιος εστιν ουδεν διαφερει δουλου κυριος παντων ων
4,2,αλλα υπο επιτροπους εστιν και οικονομους αχρι της προθεσμιας του πατρος
4,3,ουτως και ημεις οτε ημεν νηπιοι υπο τα στοιχεια του κοσμου ημεν δεδουλωμενοι
4,4,οτε δε ηλθεν το πληρωμα του χρονου εξαπεστειλεν ο θεος τον υιον αυτου γενομενον εκ γυναικος γενομενον υπο νομον
4,5,ινα τους υπο νομον εξαγοραση ινα την υιοθεσιαν απολαβωμεν
4,6,οτι δε εστε υιοι εξαπεστειλεν ο θεος το πνευμα του υιου αυτου εις τας καρδιας υμων κραζον αββα ο πατηρ
4,7,ωστε ουκετι ει δουλος αλλ υιος ει δε υιος και κληρονομος θεου δια χριστου
4,8,αλλα τοτε μεν ουκ ειδοτες θεον εδουλευσατε τοις μη φυσει ουσιν θεοις
4,9,νυν δε γνοντες θεον μαλλον δε γνωσθεντες υπο θεου πως επιστρεφετε παλιν επι τα ασθενη και πτωχα στοιχεια οις παλιν ανωθεν δουλευειν θελετε
4,10,ημερας παρατηρεισθε και μηνας και καιρους και ενιαυτους
4,11,φοβουμαι υμας μηπως εικη κεκοπιακα εις υμας
4,12,γινεσθε ως εγω οτι καγω ως υμεις αδελφοι δεομαι υμων ουδεν με ηδικησατε
4,13,οιδατε δε οτι δι ασθενειαν της σαρκος ευηγγελισαμην υμιν το προτερον
4,14,και τον πειρασμον μου τον εν τη σαρκι μου ουκ εξουθενησατε ουδε εξεπτυσατε αλλ ως αγγελον θεου εδεξασθε με ως χριστον ιησουν
4,15,τις ουν ην ο μακαρισμος υμων μαρτυρω γαρ υμιν οτι ει δυνατον τους οφθαλμους υμων εξορυξαντες αν εδωκατε μοι
4,16,ωστε εχθρος υμων γεγονα αληθευων υμιν
4,17,ζηλουσιν υμας ου καλως αλλα εκκλεισαι υμας θελουσιν ινα αυτους ζηλουτε
4,18,καλον δε το ζηλουσθαι εν καλω παντοτε και μη μονον εν τω παρειναι με προς υμας
4,19,τεκνια μου ους παλιν ωδινω αχρι ου μορφωθη χριστος εν υμιν
4,20,ηθελον δε παρειναι προς υμας αρτι και αλλαξαι την φωνην μου οτι απορουμαι εν υμιν
4,21,λεγετε μοι οι υπο νομον θελοντες ειναι τον νομον ουκ ακουετε
4,22,γεγραπται γαρ οτι αβρααμ δυο υιους εσχεν ενα εκ της παιδισκης και ενα εκ της ελευθερας
4,23,αλλ ο μεν εκ της παιδισκης κατα σαρκα γεγεννηται ο δε εκ της ελευθερας δια της επαγγελιας
4,24,ατινα εστιν αλληγορουμενα αυται γαρ εισιν δυο διαθηκαι μια μεν απο ορους σινα εις δουλειαν γεννωσα ητις εστιν αγαρ
4,25,το γαρ αγαρ σινα ορος εστιν εν τη αραβια συστοιχει δε τη νυν ιερουσαλημ δουλευει δε μετα των τεκνων αυτης
4,26,η δε ανω ιερουσαλημ ελευθερα εστιν ητις εστιν μητηρ παντων ημων
4,27,γεγραπται γαρ ευφρανθητι στειρα η ου τικτουσα ρηξον και βοησον η ουκ ωδινουσα οτι πολλα τα τεκνα της ερημου μαλλον η της εχουσης τον ανδρα
4,28,ημεις δε αδελφοι κατα ισαακ επαγγελιας τεκνα εσμεν
4,29,αλλ ωσπερ τοτε ο κατα σαρκα γεννηθεις εδιωκεν τον κατα πνευμα ουτως και νυν
4,30,αλλα τι λεγει η γραφη εκβαλε την παιδισκην και τον υιον αυτης ου γαρ μη κληρονομηση ο υιος της παιδισκης μετα του υιου της ελευθερας
4,31,αρα αδελφοι ουκ εσμεν παιδισκης τεκνα αλλα της ελευθερας
5,1,τη ελευθερια ουν η χριστος ημας ηλευθερωσεν στηκετε και μη παλιν ζυγω δουλειας ενεχεσθε
5,2,ιδε εγω παυλος λεγω υμιν οτι εαν περιτεμνησθε χριστος υμας ουδεν ωφελησει
5,3,μαρτυρομαι δε παλιν παντι ανθρωπω περιτεμνομενω οτι οφειλετης εστιν ολον τον νομον ποιησαι
5,4,κατηργηθητε απο του χριστου οιτινες εν νομω δικαιουσθε της χαριτος εξεπεσατε
5,5,ημεις γαρ πνευματι εκ πιστεως ελπιδα δικαιοσυνης απεκδεχομεθα
5,6,εν γαρ χριστω ιησου ουτε περιτομη τι ισχυει ουτε ακροβυστια αλλα πιστις δι αγαπης ενεργουμενη
5,7,ετρεχετε καλως τις υμας ενεκοψεν τη αληθεια μη πειθεσθαι
5,8,η πεισμονη ουκ εκ του καλουντος υμας
5,9,μικρα ζυμη ολον το φυραμα ζυμοι
5,10,εγω πεποιθα εις υμας εν κυριω οτι ουδεν αλλο φρονησετε ο δε ταρασσων υμας βαστασει το κριμα οστις αν η
5,11,εγω δε αδελφοι ει περιτομην ετι κηρυσσω τι ετι διωκομαι αρα κατηργηται το σκανδαλον του σταυρου
5,12,οφελον και αποκοψονται οι αναστατουντες υμας
5,13,υμεις γαρ επ ελευθερια εκληθητε αδελφοι μονον μη την ελευθεριαν εις αφορμην τη σαρκι αλλα δια της αγαπης δουλευετε αλληλοις
5,14,ο γαρ πας νομος εν ενι λογω πληρουται εν τω αγαπησεις τον πλησιον σου ως εαυτον
5,15,ει δε αλληλους δακνετε και κατεσθιετε βλεπετε μη υπο αλληλων αναλωθητε
5,16,λεγω δε πνευματι περιπατειτε και επιθυμιαν σαρκος ου μη τελεσητε
5,17,η γαρ σαρξ επιθυμει κατα του πνευματος το δε πνευμα κατα της σαρκος ταυτα δε αντικειται αλληλοις ινα μη α αν θελητε ταυτα ποιητε
5,18,ει δε πνευματι αγεσθε ουκ εστε υπο νομον
5,19,φανερα δε εστιν τα εργα της σαρκος ατινα εστιν μοιχεια πορνεια ακαθαρσια ασελγεια
5,20,ειδωλολατρεια φαρμακεια εχθραι ερεις ζηλοι θυμοι εριθειαι διχοστασιαι αιρεσεις
5,21,φθονοι φονοι μεθαι κωμοι και τα ομοια τουτοις α προλεγω υμιν καθως και προειπον οτι οι τα τοιαυτα πρασσοντες βασιλειαν θεου ου κληρονομησουσιν
5,22,ο δε καρπος του πνευματος εστιν αγαπη χαρα ειρηνη μακροθυμια χρηστοτης αγαθωσυνη πιστις
5,23,πραοτης εγκρατεια κατα των τοιουτων ουκ εστιν νομος
5,24,οι δε του χριστου την σαρκα εσταυρωσαν συν τοις παθημασιν και ταις επιθυμιαις
5,25,ει ζωμεν πνευματι πνευματι και στοιχωμεν
5,26,μη γινωμεθα κενοδοξοι αλληλους προκαλουμενοι αλληλοις φθονουντες
6,1,αδελφοι εαν και προληφθη ανθρωπος εν τινι παραπτωματι υμεις οι πνευματικοι καταρτιζετε τον τοιουτον εν πνευματι πραοτητος σκοπων σεαυτον μη και συ πειρασθης
6,2,αλληλων τα βαρη βασταζετε και ουτως αναπληρωσατε τον νομον του χριστου
6,3,ει γαρ δοκει τις ειναι τι μηδεν ων εαυτον φρεναπατα
6,4,το δε εργον εαυτου δοκιμαζετω εκαστος και τοτε εις εαυτον μονον το καυχημα εξει και ουκ εις τον ετερον
6,5,εκαστος γαρ το ιδιον φορτιον βαστασει
6,6,κοινωνειτω δε ο κατηχουμενος τον λογον τω κατηχουντι εν πασιν αγαθοις
6,7,μη πλανασθε θεος ου μυκτηριζεται ο γαρ εαν σπειρη ανθρωπος τουτο και θερισει
6,8,οτι ο σπειρων εις την σαρκα εαυτου εκ της σαρκος θερισει φθοραν ο δε σπειρων εις το πνευμα εκ του πνευματος θερισει ζωην αιωνιον
6,9,το δε καλον ποιουντες μη εκκακωμεν καιρω γαρ ιδιω θερισομεν μη εκλυομενοι
6,10,αρα ουν ως καιρον εχομεν εργαζωμεθα το αγαθον προς παντας μαλιστα δε προς τους οικειους της πιστεως
6,11,ιδετε πηλικοις υμιν γραμμασιν εγραψα τη εμη χειρι
6,12,οσοι θελουσιν ευπροσωπησαι εν σαρκι ουτοι αναγκαζουσιν υμας περιτεμνεσθαι μονον ινα μη τω σταυρω του χριστου διωκωνται
6,13,ουδε γαρ οι περιτετμημενοι αυτοι νομον φυλασσουσιν αλλα θελουσιν υμας περιτεμνεσθαι ινα εν τη υμετερα σαρκι καυχησωνται
6,14,εμοι δε μη γενοιτο καυχασθαι ει μη εν τω σταυρω του κυριου ημων ιησου χριστου δι ου εμοι κοσμος εσταυρωται καγω τω κοσμω
6,15,εν γαρ χριστω ιησου ουτε περιτομη τι ισχυει ουτε ακροβυστια αλλα καινη κτισις
6,16,και οσοι τω κανονι τουτω στοιχησουσιν ειρηνη επ αυτους και ελεος και επι τον ισραηλ του θεου
6,17,του λοιπου κοπους μοι μηδεις παρεχετω εγω γαρ τα στιγματα του κυριου ιησου εν τω σωματι μου βασταζω
6,18,η χαρις του κυριου ημων ιησου χριστου μετα του πνευματος υμων αδελφοι αμην
