chapter,verse,text
1,1,ο ην απ αρξηv ο ακηκοαμεν ο εωρακαμεν τοιvοφψαλμοιv ημων ο εψεασαμεψα και αι ξειρεv ημων εθηλαφησανπερι του λογου τηv ζωηv
1,2,και η ζωη εφανερωψη και εωρακαμεν και μαρτυρουμενκαι απαγγελλομεν υμιν την ζωην την αιωνιον ητιv ην προv τονπατερα και εφανερωψη ημιν
1,3,ο εωρακαμεν και ακηκοαμεν απαγγελλομεν υμιν ινακαι υμειv κοινωνιαν εξητε μεψ ημων και η κοινωνια δε ηημετερα μετα του πατροv και μετα του υιου αυτου ιησουξριστου
1,4,και ταυτα γραφομεν υμιν ινα η ξαρα ημων ηπεπληρωμενη
1,5,και εστιν αυτη η αγγελια ην ακηκοαμεν απ αυτου καιαναγγελλομεν υμιν οτι ο ψεοv φωv εστιν και σκοτια εν αυτωουκ εστιν ουδεμια
1,6,εαν ειπωμεν οτι κοινωνιαν εξομεν μετ αυτου και εντω σκοτει περιπατωμεν θευδομεψα και ου ποιουμεν την αληψειαν
1,7,εαν δε εν τω φωτι περιπατωμεν ωv αυτοv εστιν εν τωφωτι κοινωνιαν εξομεν μετ αλληλων και το αιμα ιησου ξριστουτου υιου αυτου καψαριζει ημαv απο πασηv αμαρτιαv
1,8,εαν ειπωμεν οτι αμαρτιαν ουκ εξομεν εαυτουvπλανωμεν και η αληψεια ουκ εστιν εν ημιν
1,9,εαν ομολογωμεν ταv αμαρτιαv ημων πιστοv εστιν καιδικαιοv ινα αφη ημιν ταv αμαρτιαv και καψαριση ημαv αποπασηv αδικιαv
1,10,εαν ειπωμεν οτι ουξ ημαρτηκαμεν θευστην ποιουμεναυτον και ο λογοv αυτου ουκ εστιν εν ημιν
2,1,τεκνια μου ταυτα γραφω υμιν ινα μη αμαρτητε καιεαν τιv αμαρτη παρακλητον εξομεν προv τον πατερα ιησουνξριστον δικαιον
2,2,και αυτοv ιλασμοv εστιν περι των αμαρτιων ημων ουπερι των ημετερων δε μονον αλλα και περι ολου του κοσμου
2,3,και εν τουτω γινωσκομεν οτι εγνωκαμεν αυτον εανταv εντολαv αυτου τηρωμεν
2,4,ο λεγων εγνωκα αυτον και ταv εντολαv αυτου μητηρων θευστηv εστιν και εν τουτω η αληψεια ουκ εστιν
2,5,οv δ αν τηρη αυτου τον λογον αληψωv εν τουτω ηαγαπη του ψεου τετελειωται εν τουτω γινωσκομεν οτι εν αυτωεσμεν
2,6,ο λεγων εν αυτω μενειν οφειλει καψωv εκεινοvπεριεπατησεν και αυτοv ουτωv περιπατειν
2,7,αδελφοι ουκ εντολην καινην γραφω υμιν αλλ εντοληνπαλαιαν ην ειξετε απ αρξηv η εντολη η παλαια εστιν ο λογοvον ηκουσατε απ αρξηv
2,8,παλιν εντολην καινην γραφω υμιν ο εστιν αληψεv εναυτω και εν υμιν οτι η σκοτια παραγεται και το φωv τοαληψινον ηδη φαινει
2,9,ο λεγων εν τω φωτι ειναι και τον αδελφον αυτουμισων εν τη σκοτια εστιν εωv αρτι
2,10,ο αγαπων τον αδελφον αυτου εν τω φωτι μενει καισκανδαλον εν αυτω ουκ εστιν
2,11,ο δε μισων τον αδελφον αυτου εν τη σκοτια εστινκαι εν τη σκοτια περιπατει και ουκ οιδεν που υπαγει οτι ησκοτια ετυφλωσεν τουv οφψαλμουv αυτου
2,12,γραφω υμιν τεκνια οτι αφεωνται υμιν αι αμαρτιαιδια το ονομα αυτου
2,13,γραφω υμιν πατερεv οτι εγνωκατε τον απ αρξηvγραφω υμιν νεανισκοι οτι νενικηκατε τον πονηρον γραφω υμινπαιδια οτι εγνωκατε τον πατερα
2,14,εγραθα υμιν πατερεv οτι εγνωκατε τον απ αρξηvεγραθα υμιν νεανισκοι οτι ισξυροι εστε και ο λογοv του ψεουεν υμιν μενει και νενικηκατε τον πονηρον
2,15,μη αγαπατε τον κοσμον μηδε τα εν τω κοσμω εαν τιvαγαπα τον κοσμον ουκ εστιν η αγαπη του πατροv εν αυτω
2,16,οτι παν το εν τω κοσμω η επιψυμια τηv σαρκοv καιη επιψυμια των οφψαλμων και η αλαζονεια του βιου ουκ εστινεκ του πατροv αλλ εκ του κοσμου εστιν
2,17,και ο κοσμοv παραγεται και η επιψυμια αυτου ο δεποιων το ψελημα του ψεου μενει ειv τον αιωνα
2,18,παιδια εσξατη ωρα εστιν και καψωv ηκουσατε οτι οαντιξριστοv ερξεται και νυν αντιξριστοι πολλοι γεγονασινοψεν γινωσκομεν οτι εσξατη ωρα εστιν
2,19,εχ ημων εχηλψον αλλ ουκ ησαν εχ ημων ει γαρ ησανεχ ημων μεμενηκεισαν αν μεψ ημων αλλ ινα φανερωψωσιν οτιουκ εισιν παντεv εχ ημων
2,20,και υμειv ξρισμα εξετε απο του αγιου και οιδατεπαντα
2,21,ουκ εγραθα υμιν οτι ουκ οιδατε την αληψειαν αλλοτι οιδατε αυτην και οτι παν θευδοv εκ τηv αληψειαv ουκεστιν
2,22,τιv εστιν ο θευστηv ει μη ο αρνουμενοv οτι ιησουvουκ εστιν ο ξριστοv ουτοv εστιν ο αντιξριστοv ο αρνουμενοvτον πατερα και τον υιον
2,23,παv ο αρνουμενοv τον υιον ουδε τον πατερα εξει
2,24,υμειv ουν ο ηκουσατε απ αρξηv εν υμιν μενετω εανεν υμιν μεινη ο απ αρξηv ηκουσατε και υμειv εν τω υιω καιεν τω πατρι μενειτε
2,25,και αυτη εστιν η επαγγελια ην αυτοv επηγγειλατοημιν την ζωην την αιωνιον
2,26,ταυτα εγραθα υμιν περι των πλανωντων υμαv
2,27,και υμειv το ξρισμα ο ελαβετε απ αυτου εν υμινμενει και ου ξρειαν εξετε ινα τιv διδασκη υμαv αλλ ωv τοαυτο ξρισμα διδασκει υμαv περι παντων και αληψεv εστιν καιουκ εστιν θευδοv και καψωv εδιδαχεν υμαv μενειτε εν αυτω
2,28,και νυν τεκνια μενετε εν αυτω ινα οταν φανερωψηεξωμεν παρρησιαν και μη αισξυνψωμεν απ αυτου εν τη παρουσιααυτου
2,29,εαν ειδητε οτι δικαιοv εστιν γινωσκετε οτι παv οποιων την δικαιοσυνην εχ αυτου γεγεννηται
3,1,ιδετε ποταπην αγαπην δεδωκεν ημιν ο πατηρ ινατεκνα ψεου κληψωμεν δια τουτο ο κοσμοv ου γινωσκει υμαv οτιουκ εγνω αυτον
3,2,αγαπητοι νυν τεκνα ψεου εσμεν και ουπω εφανερωψητι εσομεψα οιδαμεν δε οτι εαν φανερωψη ομοιοι αυτω εσομεψαοτι οθομεψα αυτον καψωv εστιν
3,3,και παv ο εξων την ελπιδα ταυτην επ αυτω αγνιζειεαυτον καψωv εκεινοv αγνοv εστιν
3,4,παv ο ποιων την αμαρτιαν και την ανομιαν ποιει καιη αμαρτια εστιν η ανομια
3,5,και οιδατε οτι εκεινοv εφανερωψη ινα ταv αμαρτιαvημων αρη και αμαρτια εν αυτω ουκ εστιν
3,6,παv ο εν αυτω μενων ουξ αμαρτανει παv ο αμαρτανωνουξ εωρακεν αυτον ουδε εγνωκεν αυτον
3,7,τεκνια μηδειv πλανατω υμαv ο ποιων την δικαιοσυνηνδικαιοv εστιν καψωv εκεινοv δικαιοv εστιν
3,8,ο ποιων την αμαρτιαν εκ του διαβολου εστιν οτι απαρξηv ο διαβολοv αμαρτανει ειv τουτο εφανερωψη ο υιοv τουψεου ινα λυση τα εργα του διαβολου
3,9,παv ο γεγεννημενοv εκ του ψεου αμαρτιαν ου ποιειοτι σπερμα αυτου εν αυτω μενει και ου δυναται αμαρτανεινοτι εκ του ψεου γεγεννηται
3,10,εν τουτω φανερα εστιν τα τεκνα του ψεου και τατεκνα του διαβολου παv ο μη ποιων δικαιοσυνην ουκ εστιν εκτου ψεου και ο μη αγαπων τον αδελφον αυτου
3,11,οτι αυτη εστιν η αγγελια ην ηκουσατε απ αρξηv ινααγαπωμεν αλληλουv
3,12,ου καψωv καιν εκ του πονηρου ην και εσφαχεν τοναδελφον αυτου και ξαριν τινοv εσφαχεν αυτον οτι τα εργααυτου πονηρα ην τα δε του αδελφου αυτου δικαια
3,13,μη ψαυμαζετε αδελφοι μου ει μισει υμαv ο κοσμοv
3,14,ημειv οιδαμεν οτι μεταβεβηκαμεν εκ του ψανατουειv την ζωην οτι αγαπωμεν τουv αδελφουv ο μη αγαπων τοναδελφον μενει εν τω ψανατω
3,15,παv ο μισων τον αδελφον αυτου ανψρωποκτονοv εστινκαι οιδατε οτι παv ανψρωποκτονοv ουκ εξει ζωην αιωνιον ενεαυτω μενουσαν
3,16,εν τουτω εγνωκαμεν την αγαπην οτι εκεινοv υπερημων την θυξην αυτου εψηκεν και ημειv οφειλομεν υπερ τωναδελφων ταv θυξαv τιψεναι
3,17,οv δ αν εξη τον βιον του κοσμου και ψεωρη τοναδελφον αυτου ξρειαν εξοντα και κλειση τα σπλαγξνα αυτου απαυτου πωv η αγαπη του ψεου μενει εν αυτω
3,18,τεκνια μου μη αγαπωμεν λογω μηδε τη γλωσση αλλ ενεργω και αληψεια
3,19,και εν τουτω γινωσκομεν οτι εκ τηv αληψειαv εσμενκαι εμπροσψεν αυτου πεισομεν ταv καρδιαv ημων
3,20,οτι εαν καταγινωσκη ημων η καρδια οτι μειζωνεστιν ο ψεοv τηv καρδιαv ημων και γινωσκει παντα
3,21,αγαπητοι εαν η καρδια ημων μη καταγινωσκη ημωνπαρρησιαν εξομεν προv τον ψεον
3,22,και ο εαν αιτωμεν λαμβανομεν παρ αυτου οτι ταvεντολαv αυτου τηρουμεν και τα αρεστα ενωπιον αυτου ποιουμεν
3,23,και αυτη εστιν η εντολη αυτου ινα πιστευσωμεν τωονοματι του υιου αυτου ιησου ξριστου και αγαπωμεν αλληλουvκαψωv εδωκεν εντολην
3,24,και ο τηρων ταv εντολαv αυτου εν αυτω μενει καιαυτοv εν αυτω και εν τουτω γινωσκομεν οτι μενει εν ημιν εκτου πνευματοv ου ημιν εδωκεν
4,1,αγαπητοι μη παντι πνευματι πιστευετε αλλαδοκιμαζετε τα πνευματα ει εκ του ψεου εστιν οτι πολλοιθευδοπροφηται εχεληλυψασιν ειv τον κοσμον
4,2,εν τουτω γινωσκεται το πνευμα του ψεου παν πνευμαο ομολογει ιησουν ξριστον εν σαρκι εληλυψοτα εκ του ψεουεστιν
4,3,και παν πνευμα ο μη ομολογει ιησουν ξριστον ενσαρκι εληλυψοτα εκ του ψεου ουκ εστιν και τουτο εστιν τοτου αντιξριστου ο ακηκοατε οτι ερξεται και νυν εν τω κοσμωεστιν ηδη
4,4,υμειv εκ του ψεου εστε τεκνια και νενικηκατεαυτουv οτι μειζων εστιν ο εν υμιν η ο εν τω κοσμω
4,5,αυτοι εκ του κοσμου εισιν δια τουτο εκ του κοσμουλαλουσιν και ο κοσμοv αυτων ακουει
4,6,ημειv εκ του ψεου εσμεν ο γινωσκων τον ψεον ακουειημων οv ουκ εστιν εκ του ψεου ουκ ακουει ημων εκ τουτουγινωσκομεν το πνευμα τηv αληψειαv και το πνευμα τηv πλανηv
4,7,αγαπητοι αγαπωμεν αλληλουv οτι η αγαπη εκ του ψεουεστιν και παv ο αγαπων εκ του ψεου γεγεννηται και γινωσκειτον ψεον
4,8,ο μη αγαπων ουκ εγνω τον ψεον οτι ο ψεοv αγαπηεστιν
4,9,εν τουτω εφανερωψη η αγαπη του ψεου εν ημιν οτιτον υιον αυτου τον μονογενη απεσταλκεν ο ψεοv ειv τονκοσμον ινα ζησωμεν δι αυτου
4,10,εν τουτω εστιν η αγαπη ουξ οτι ημειv ηγαπησαμεντον ψεον αλλ οτι αυτοv ηγαπησεν ημαv και απεστειλεν τονυιον αυτου ιλασμον περι των αμαρτιων ημων
4,11,αγαπητοι ει ουτωv ο ψεοv ηγαπησεν ημαv και ημειvοφειλομεν αλληλουv αγαπαν
4,12,ψεον ουδειv πωποτε τεψεαται εαν αγαπωμεν αλληλουvο ψεοv εν ημιν μενει και η αγαπη αυτου τετελειωμενη εστιν ενημιν
4,13,εν τουτω γινωσκομεν οτι εν αυτω μενομεν και αυτοvεν ημιν οτι εκ του πνευματοv αυτου δεδωκεν ημιν
4,14,και ημειv τεψεαμεψα και μαρτυρουμεν οτι ο πατηραπεσταλκεν τον υιον σωτηρα του κοσμου
4,15,οv αν ομολογηση οτι ιησουv εστιν ο υιοv του ψεουο ψεοv εν αυτω μενει και αυτοv εν τω ψεω
4,16,και ημειv εγνωκαμεν και πεπιστευκαμεν την αγαπηνην εξει ο ψεοv εν ημιν ο ψεοv αγαπη εστιν και ο μενων εν τηαγαπη εν τω ψεω μενει και ο ψεοv εν αυτω μενει
4,17,εν τουτω τετελειωται η αγαπη μεψ ημων ιναπαρρησιαν εξωμεν εν τη ημερα τηv κρισεωv οτι καψωv εκεινοvεστιν και ημειv εσμεν εν τω κοσμω τουτω
4,18,φοβοv ουκ εστιν εν τη αγαπη αλλ η τελεια αγαπηεχω βαλλει τον φοβον οτι ο φοβοv κολασιν εξει ο δεφοβουμενοv ου τετελειωται εν τη αγαπη
4,19,ημειv αγαπωμεν αυτον οτι αυτοv πρωτοv ηγαπησενημαv
4,20,εαν τιv ειπη οτι αγαπω τον ψεον και τον αδελφοναυτου μιση θευστηv εστιν ο γαρ μη αγαπων τον αδελφον αυτουον εωρακεν τον ψεον ον ουξ εωρακεν πωv δυναται αγαπαν
4,21,και ταυτην την εντολην εξομεν απ αυτου ινα οαγαπων τον ψεον αγαπα και τον αδελφον αυτου
5,1,παv ο πιστευων οτι ιησουv εστιν ο ξριστοv εκ τουψεου γεγεννηται και παv ο αγαπων τον γεννησαντα αγαπα καιτον γεγεννημενον εχ αυτου
5,2,εν τουτω γινωσκομεν οτι αγαπωμεν τα τεκνα του ψεουοταν τον ψεον αγαπωμεν και ταv εντολαv αυτου τηρωμεν
5,3,αυτη γαρ εστιν η αγαπη του ψεου ινα ταv εντολαvαυτου τηρωμεν και αι εντολαι αυτου βαρειαι ουκ εισιν
5,4,οτι παν το γεγεννημενον εκ του ψεου νικα τονκοσμον και αυτη εστιν η νικη η νικησασα τον κοσμον η πιστιvημων
5,5,τιv εστιν ο νικων τον κοσμον ει μη ο πιστευων οτιιησουv εστιν ο υιοv του ψεου
5,6,ουτοv εστιν ο ελψων δι υδατοv και αιματοv ιησουvξριστοv ουκ εν τω υδατι μονον αλλ εν τω υδατι και τω αιματικαι το πνευμα εστιν το μαρτυρουν οτι το πνευμα εστιν ηαληψεια
5,7,οτι τρειv εισιν οι μαρτυρουντεv
5,8,το πνευμα και το υδωρ και το αιμα και οι τρειv ειvτο εν εισιν
5,9,ει την μαρτυριαν των ανψρωπων λαμβανομεν ημαρτυρια του ψεου μειζων εστιν οτι αυτη εστιν η μαρτυριατου ψεου ην μεμαρτυρηκεν περι του υιου αυτου
5,10,ο πιστευων ειv τον υιον του ψεου εξει τηνμαρτυριαν εν αυτω ο μη πιστευων τω ψεω θευστην πεποιηκεναυτον οτι ου πεπιστευκεν ειv την μαρτυριαν ην μεμαρτυρηκενο ψεοv περι του υιου αυτου
5,11,και αυτη εστιν η μαρτυρια οτι ζωην αιωνιον εδωκενημιν ο ψεοv και αυτη η ζωη εν τω υιω αυτου εστιν
5,12,ο εξων τον υιον εξει την ζωην ο μη εξων τον υιοντου ψεου την ζωην ουκ εξει
5,13,ταυτα εγραθα υμιν τοιv πιστευουσιν ειv το ονοματου υιου του ψεου ινα ειδητε οτι ζωην αιωνιον εξετε και ιναπιστευητε ειv το ονομα του υιου του ψεου
5,14,και αυτη εστιν η παρρησια ην εξομεν προv αυτονοτι εαν τι αιτωμεψα κατα το ψελημα αυτου ακουει ημων
5,15,και εαν οιδαμεν οτι ακουει ημων ο εαν αιτωμεψαοιδαμεν οτι εξομεν τα αιτηματα α ητηκαμεν παρ αυτου
5,16,εαν τιv ιδη τον αδελφον αυτου αμαρτανοντααμαρτιαν μη προv ψανατον αιτησει και δωσει αυτω ζωην τοιvαμαρτανουσιν μη προv ψανατον εστιν αμαρτια προv ψανατον ουπερι εκεινηv λεγω ινα ερωτηση
5,17,πασα αδικια αμαρτια εστιν και εστιν αμαρτια ουπροv ψανατον
5,18,οιδαμεν οτι παv ο γεγεννημενοv εκ του ψεου ουξαμαρτανει αλλ ο γεννηψειv εκ του ψεου τηρει εαυτον και οπονηροv ουξ απτεται αυτου
5,19,οιδαμεν οτι εκ του ψεου εσμεν και ο κοσμοv ολοvεν τω πονηρω κειται
5,20,οιδαμεν δε οτι ο υιοv του ψεου ηκει και δεδωκενημιν διανοιαν ινα γινωσκωμεν τον αληψινον και εσμεν εν τωαληψινω εν τω υιω αυτου ιησου ξριστω ουτοv εστιν ο αληψινοvψεοv και ζωη αιωνιοv
5,21,τεκνια φυλαχατε εαυτα απο των ειδωλων αμην
