chapter,verse,text
1,1,εν αρχη ην ο λογος και ο λογος ην προς τον θεον και θεος ην ο λογος
1,2,ουτος ην εν αρχη προς τον θεον
1,3,παντα δι αυτου εγενετο και χωρις αυτου εγενετο ουδε εν ο γεγονεν
1,4,εν αυτω ζωη ην και η ζωη ην το φως των ανθρωπων
1,5,και το φως εν τη σκοτια φαινει και η σκοτια αυτο ου κατελαβεν
1,6,εγενετο ανθρωπος απεσταλμενος παρα θεου ονομα αυτω ιωαννης
1,7,ουτος ηλθεν εις μαρτυριαν ινα μαρτυρηση περι του φωτος ινα παντες πιστευσωσιν δι αυτου
1,8,ουκ ην εκεινος το φως αλλ ινα μαρτυρηση περι του φωτος
1,9,ην το φως το αληθινον ο φωτιζει παντα ανθρωπον ερχομενον εις τον κοσμον
1,10,εν τω κοσμω ην και ο κοσμος δι αυτου εγενετο και ο κοσμος αυτον ουκ εγνω
1,11,εις τα ιδια ηλθεν και οι ιδιοι αυτον ου παρελαβον
1,12,οσοι δε ελαβον αυτον εδωκεν αυτοις εξουσιαν τεκνα θεου γενεσθαι τοις πιστευουσιν εις το ονομα αυτου
1,13,οι ουκ εξ αιματων ουδε εκ θεληματος σαρκος ουδε εκ θεληματος ανδρος αλλ εκ θεου εγεννηθησαν
1,14,και ο λογος σαρξ εγενετο και εσκηνωσεν εν ημιν και εθεασαμεθα την δοξαν αυτου δοξαν ως μονογενους παρα πατρος πληρης χαριτος και αληθειας
1,15,ιωαννης μαρτυρει περι αυτου και κεκραγεν λεγων ουτος ην ον ειπον ο οπισω μου ερχομενος εμπροσθεν μου γεγονεν οτι πρωτος μου ην
1,16,και εκ του πληρωματος αυτου ημεις παντες ελαβομεν και χαριν αντι χαριτος
1,17,οτι ο νομος δια μωσεως εδοθη η χαρις και η αληθεια δια ιησου χριστου εγενετο
1,18,θεον ουδεις εωρακεν πωποτε ο μονογενης υιος ο ων εις τον κολπον του πατρος εκεινος εξηγησατο
1,19,και αυτη εστιν η μαρτυρια του ιωαννου οτε απεστειλαν οι ιουδαιοι εξ ιεροσολυμων ιερεις και λευιτας ινα ερωτησωσιν αυτον συ τις ει
1,20,και ωμολογησεν και ουκ ηρνησατο και ωμολογησεν οτι ουκ ειμι εγω ο χριστος
1,21,και ηρωτησαν αυτον τι ουν ηλιας ει συ και λεγει ουκ ειμι ο προφητης ει συ και απεκριθη ου
1,22,ειπον ουν αυτω τις ει ινα αποκρισιν δωμεν τοις πεμψασιν ημας τι λεγεις περι σεαυτου
1,23,εφη εγω φωνη βοωντος εν τη ερημω ευθυνατε την οδον κυριου καθως ειπεν ησαιας ο προφητης
1,24,και οι απεσταλμενοι ησαν εκ των φαρισαιων
1,25,και ηρωτησαν αυτον και ειπον αυτω τι ουν βαπτιζεις ει συ ουκ ει ο χριστος ουτε ηλιας ουτε ο προφητης
1,26,απεκριθη αυτοις ο ιωαννης λεγων εγω βαπτιζω εν υδατι μεσος δε υμων εστηκεν ον υμεις ουκ οιδατε
1,27,αυτος εστιν ο οπισω μου ερχομενος ος εμπροσθεν μου γεγονεν ου εγω ουκ ειμι αξιος ινα λυσω αυτου τον ιμαντα του υποδηματος
1,28,ταυτα εν βηθανια εγενετο περαν του ιορδανου οπου ην ιωαννης βαπτιζων
1,29,τη επαυριον βλεπει τον ιησουν ερχομενον προς αυτον και λεγει ιδε ο αμνος του θεου ο αιρων την αμαρτιαν του κοσμου
1,30,ουτος εστιν περι ου εγω ειπον οπισω μου ερχεται ανηρ ος εμπροσθεν μου γεγονεν οτι πρωτος μου ην
1,31,καγω ουκ ηδειν αυτον αλλ ινα φανερωθη τω ισραηλ δια τουτο ηλθον εγω εν τω υδατι βαπτιζων
1,32,και εμαρτυρησεν ιωαννης λεγων οτι τεθεαμαι το πνευμα καταβαινον ωσει περιστεραν εξ ουρανου και εμεινεν επ αυτον
1,33,καγω ουκ ηδειν αυτον αλλ ο πεμψας με βαπτιζειν εν υδατι εκεινος μοι ειπεν εφ ον αν ιδης το πνευμα καταβαινον και μενον επ αυτον ουτος εστιν ο βαπτιζων εν πνευματι αγιω
1,34,καγω εωρακα και μεμαρτυρηκα οτι ουτος εστιν ο υιος του θεου
1,35,τη επαυριον παλιν ειστηκει ο ιωαννης και εκ των μαθητων αυτου δυο
1,36,και εμβλεψας τω ιησου περιπατουντι λεγει ιδε ο αμνος του θεου
1,37,και ηκουσαν αυτου οι δυο μαθηται λαλουντος και ηκολουθησαν τω ιησου
1,38,στραφεις δε ο ιησους και θεασαμενος αυτους ακολουθουντας λεγει αυτοις τι ζητειτε οι δε ειπον αυτω ραββι ο λεγεται ερμηνευομενον διδασκαλε που μενεις
1,39,λεγει αυτοις ερχεσθε και ιδετε ηλθον και ειδον που μενει και παρ αυτω εμειναν την ημεραν εκεινην ωρα ην ως δεκατη
1,40,ην ανδρεας ο αδελφος σιμωνος πετρου εις εκ των δυο των ακουσαντων παρα ιωαννου και ακολουθησαντων αυτω
1,41,ευρισκει ουτος πρωτος τον αδελφον τον ιδιον σιμωνα και λεγει αυτω ευρηκαμεν τον μεσιαν ο εστιν μεθερμηνευομενον χριστος
1,42,και ηγαγεν αυτον προς τον ιησουν εμβλεψας αυτω ο ιησους ειπεν συ ει σιμων ο υιος ιωνα συ κληθηση κηφας ο ερμηνευεται πετρος
1,43,τη επαυριον ηθελησεν εξελθειν εις την γαλιλαιαν και ευρισκει φιλιππον και λεγει αυτω ο ιησους ακολουθει μοι
1,44,ην δε ο φιλιππος απο βηθσαιδα εκ της πολεως ανδρεου και πετρου
1,45,ευρισκει φιλιππος τον ναθαναηλ και λεγει αυτω ον εγραψεν μωσης εν τω νομω και οι προφηται ευρηκαμεν ιησουν τον υιον του ιωσηφ τον απο ναζαρετ
1,46,και ειπεν αυτω ναθαναηλ εκ ναζαρετ δυναται τι αγαθον ειναι λεγει αυτω φιλιππος ερχου και ιδε
1,47,ειδεν ο ιησους τον ναθαναηλ ερχομενον προς αυτον και λεγει περι αυτου ιδε αληθως ισραηλιτης εν ω δολος ουκ εστιν
1,48,λεγει αυτω ναθαναηλ ποθεν με γινωσκεις απεκριθη ιησους και ειπεν αυτω προ του σε φιλιππον φωνησαι οντα υπο την συκην ειδον σε
1,49,απεκριθη ναθαναηλ και λεγει αυτω ραββι συ ει ο υιος του θεου συ ει ο βασιλευς του ισραηλ
1,50,απεκριθη ιησους και ειπεν αυτω οτι ειπον σοι ειδον σε υποκατω της συκης πιστευεις μειζω τουτων οψει
1,51,και λεγει αυτω αμην αμην λεγω υμιν απ αρτι οψεσθε τον ουρανον ανεωγοτα και τους αγγελους του θεου αναβαινοντας και καταβαινοντας επι τον υιον του ανθρωπου
2,1,και τη ημερα τη τριτη γαμος εγενετο εν κανα της γαλιλαιας και ην η μητηρ του ιησου εκει
2,2,εκληθη δε και ο ιησους και οι μαθηται αυτου εις τον γαμον
2,3,και υστερησαντος οινου λεγει η μητηρ του ιησου προς αυτον οινον ουκ εχουσιν
2,4,λεγει αυτη ο ιησους τι εμοι και σοι γυναι ουπω ηκει η ωρα μου
2,5,λεγει η μητηρ αυτου τοις διακονοις ο τι αν λεγη υμιν ποιησατε
2,6,ησαν δε εκει υδριαι λιθιναι εξ κειμεναι κατα τον καθαρισμον των ιουδαιων χωρουσαι ανα μετρητας δυο η τρεις
2,7,λεγει αυτοις ο ιησους γεμισατε τας υδριας υδατος και εγεμισαν αυτας εως ανω
2,8,και λεγει αυτοις αντλησατε νυν και φερετε τω αρχιτρικλινω και ηνεγκαν
2,9,ως δε εγευσατο ο αρχιτρικλινος το υδωρ οινον γεγενημενον και ουκ ηδει ποθεν εστιν οι δε διακονοι ηδεισαν οι ηντληκοτες το υδωρ φωνει τον νυμφιον ο αρχιτρικλινος
2,10,και λεγει αυτω πας ανθρωπος πρωτον τον καλον οινον τιθησιν και οταν μεθυσθωσιν τοτε τον ελασσω συ τετηρηκας τον καλον οινον εως αρτι
2,11,ταυτην εποιησεν την αρχην των σημειων ο ιησους εν κανα της γαλιλαιας και εφανερωσεν την δοξαν αυτου και επιστευσαν εις αυτον οι μαθηται αυτου
2,12,μετα τουτο κατεβη εις καπερναουμ αυτος και η μητηρ αυτου και οι αδελφοι αυτου και οι μαθηται αυτου και εκει εμειναν ου πολλας ημερας
2,13,και εγγυς ην το πασχα των ιουδαιων και ανεβη εις ιεροσολυμα ο ιησους
2,14,και ευρεν εν τω ιερω τους πωλουντας βοας και προβατα και περιστερας και τους κερματιστας καθημενους
2,15,και ποιησας φραγελλιον εκ σχοινιων παντας εξεβαλεν εκ του ιερου τα τε προβατα και τους βοας και των κολλυβιστων εξεχεεν το κερμα και τας τραπεζας ανεστρεψεν
2,16,και τοις τας περιστερας πωλουσιν ειπεν αρατε ταυτα εντευθεν μη ποιειτε τον οικον του πατρος μου οικον εμποριου
2,17,εμνησθησαν δε οι μαθηται αυτου οτι γεγραμμενον εστιν ο ζηλος του οικου σου καταφαγεται με
2,18,απεκριθησαν ουν οι ιουδαιοι και ειπον αυτω τι σημειον δεικνυεις ημιν οτι ταυτα ποιεις
2,19,απεκριθη ιησους και ειπεν αυτοις λυσατε τον ναον τουτον και εν τρισιν ημεραις εγερω αυτον
2,20,ειπον ουν οι ιουδαιοι τεσσαρακοντα και εξ ετεσιν ωκοδομηθη ο ναος ουτος και συ εν τρισιν ημεραις εγερεις αυτον
2,21,εκεινος δε ελεγεν περι του ναου του σωματος αυτου
2,22,οτε ουν ηγερθη εκ νεκρων εμνησθησαν οι μαθηται αυτου οτι τουτο ελεγεν και επιστευσαν τη γραφη και τω λογω ω ειπεν ο ιησους
2,23,ως δε ην εν τοις ιεροσολυμοις εν τω πασχα εν τη εορτη πολλοι επιστευσαν εις το ονομα αυτου θεωρουντες αυτου τα σημεια α εποιει
2,24,αυτος δε ο ιησους ουκ επιστευεν εαυτον αυτοις δια το αυτον γινωσκειν παντας
2,25,και οτι ου χρειαν ειχεν ινα τις μαρτυρηση περι του ανθρωπου αυτος γαρ εγινωσκεν τι ην εν τω ανθρωπω
3,1,ην δε ανθρωπος εκ των φαρισαιων νικοδημος ονομα αυτω αρχων των ιουδαιων
3,2,ουτος ηλθεν προς αυτον νυκτος και ειπεν αυτω ραββι οιδαμεν οτι απο θεου εληλυθας διδασκαλος ουδεις γαρ ταυτα τα σημεια δυναται ποιειν α συ ποιεις εαν μη η ο θεος μετ αυτου
3,3,απεκριθη ο ιησους και ειπεν αυτω αμην αμην λεγω σοι εαν μη τις γεννηθη ανωθεν ου δυναται ιδειν την βασιλειαν του θεου
3,4,λεγει προς αυτον ο νικοδημος πως δυναται ανθρωπος γεννηθηναι γερων ων μη δυναται εις την κοιλιαν της μητρος αυτου δευτερον εισελθειν και γεννηθηναι
3,5,απεκριθη ιησους αμην αμην λεγω σοι εαν μη τις γεννηθη εξ υδατος και πνευματος ου δυναται εισελθειν εις την βασιλειαν του θεου
3,6,το γεγεννημενον εκ της σαρκος σαρξ εστιν και το γεγεννημενον εκ του πνευματος πνευμα εστιν
3,7,μη θαυμασης οτι ειπον σοι δει υμας γεννηθηναι ανωθεν
3,8,το πνευμα οπου θελει πνει και την φωνην αυτου ακουεις αλλ ουκ οιδας ποθεν ερχεται και που υπαγει ουτως εστιν πας ο γεγεννημενος εκ του πνευματος
3,9,απεκριθη νικοδημος και ειπεν αυτω πως δυναται ταυτα γενεσθαι
3,10,απεκριθη ιησους και ειπεν αυτω συ ει ο διδασκαλος του ισραηλ και ταυτα ου γινωσκεις
3,11,αμην αμην λεγω σοι οτι ο οιδαμεν λαλουμεν και ο εωρακαμεν μαρτυρουμεν και την μαρτυριαν ημων ου λαμβανετε
3,12,ει τα επιγεια ειπον υμιν και ου πιστευετε πως εαν ειπω υμιν τα επουρανια πιστευσετε
3,13,και ουδεις αναβεβηκεν εις τον ουρανον ει μη ο εκ του ουρανου καταβας ο υιος του ανθρωπου ο ων εν τω ουρανω
3,14,και καθως μωσης υψωσεν τον οφιν εν τη ερημω ουτως υψωθηναι δει τον υιον του ανθρωπου
3,15,ινα πας ο πιστευων εις αυτον μη αποληται αλλ εχη ζωην αιωνιον
3,16,ουτως γαρ ηγαπησεν ο θεος τον κοσμον ωστε τον υιον αυτου τον μονογενη εδωκεν ινα πας ο πιστευων εις αυτον μη αποληται αλλ εχη ζωην αιωνιον
3,17,ου γαρ απεστειλεν ο θεος τον υιον αυτου εις τον κοσμον ινα κρινη τον κοσμον αλλ ινα σωθη ο κοσμος δι αυτου
3,18,ο πιστευων εις αυτον ου κρινεται ο δε μη πιστευων ηδη κεκριται οτι μη πεπιστευκεν εις το ονομα του μονογενους υιου του θεου
3,19,αυτη δε εστιν η κρισις οτι το φως εληλυθεν εις τον κοσμον και ηγαπησαν οι ανθρωποι μαλλον το σκοτος η το φως ην γαρ πονηρα αυτων τα εργα
3,20,πας γαρ ο φαυλα πρασσων μισει το φως και ουκ ερχεται προς το φως ινα μη ελεγχθη τα εργα αυτου
3,21,ο δε ποιων την αληθειαν ερχεται προς το φως ινα φανερωθη αυτου τα εργα οτι εν θεω εστιν ειργασμενα
3,22,μετα ταυτα ηλθεν ο ιησους και οι μαθηται αυτου εις την ιουδαιαν γην και εκει διετριβεν μετ αυτων και εβαπτιζεν
3,23,ην δε και ιωαννης βαπτιζων εν αινων εγγυς του σαλημ οτι υδατα πολλα ην εκει και παρεγινοντο και εβαπτιζοντο
3,24,ουπω γαρ ην βεβλημενος εις την φυλακην ο ιωαννης
3,25,εγενετο ουν ζητησις εκ των μαθητων ιωαννου μετα ιουδαιου περι καθαρισμου
3,26,και ηλθον προς τον ιωαννην και ειπον αυτω ραββι ος ην μετα σου περαν του ιορδανου ω συ μεμαρτυρηκας ιδε ουτος βαπτιζει και παντες ερχονται προς αυτον
3,27,απεκριθη ιωαννης και ειπεν ου δυναται ανθρωπος λαμβανειν ουδεν εαν μη η δεδομενον αυτω εκ του ουρανου
3,28,αυτοι υμεις μαρτυρειτε οτι ειπον ουκ ειμι εγω ο χριστος αλλ οτι απεσταλμενος ειμι εμπροσθεν εκεινου
3,29,ο εχων την νυμφην νυμφιος εστιν ο δε φιλος του νυμφιου ο εστηκως και ακουων αυτου χαρα χαιρει δια την φωνην του νυμφιου αυτη ουν η χαρα η εμη πεπληρωται
3,30,εκεινον δει αυξανειν εμε δε ελαττουσθαι
3,31,ο ανωθεν ερχομενος επανω παντων εστιν ο ων εκ της γης εκ της γης εστιν και εκ της γης λαλει ο εκ του ουρανου ερχομενος επανω παντων εστιν
3,32,και ο εωρακεν και ηκουσεν τουτο μαρτυρει και την μαρτυριαν αυτου ουδεις λαμβανει
3,33,ο λαβων αυτου την μαρτυριαν εσφραγισεν οτι ο θεος αληθης εστιν
3,34,ον γαρ απεστειλεν ο θεος τα ρηματα του θεου λαλει ου γαρ εκ μετρου διδωσιν ο θεος το πνευμα
3,35,ο πατηρ αγαπα τον υιον και παντα δεδωκεν εν τη χειρι αυτου
3,36,ο πιστευων εις τον υιον εχει ζωην αιωνιον ο δε απειθων τω υιω ουκ οψεται ζωην αλλ η οργη του θεου μενει επ αυτον
4,1,ως ουν εγνω ο κυριος οτι ηκουσαν οι φαρισαιοι οτι ιησους πλειονας μαθητας ποιει και βαπτιζει η ιωαννης
4,2,καιτοιγε ιησους αυτος ουκ εβαπτιζεν αλλ οι μαθηται αυτου
4,3,αφηκεν την ιουδαιαν και απηλθεν εις την γαλιλαιαν
4,4,εδει δε αυτον διερχεσθαι δια της σαμαρειας
4,5,ερχεται ουν εις πολιν της σαμαρειας λεγομενην συχαρ πλησιον του χωριου ο εδωκεν ιακωβ ιωσηφ τω υιω αυτου
4,6,ην δε εκει πηγη του ιακωβ ο ουν ιησους κεκοπιακως εκ της οδοιποριας εκαθεζετο ουτως επι τη πηγη ωρα ην ωσει εκτη
4,7,ερχεται γυνη εκ της σαμαρειας αντλησαι υδωρ λεγει αυτη ο ιησους δος μοι πιειν
4,8,οι γαρ μαθηται αυτου απεληλυθεισαν εις την πολιν ινα τροφας αγορασωσιν
4,9,λεγει ουν αυτω η γυνη η σαμαρειτις πως συ ιουδαιος ων παρ εμου πιειν αιτεις ουσης γυναικος σαμαρειτιδος ου γαρ συγχρωνται ιουδαιοι σαμαρειταις
4,10,απεκριθη ιησους και ειπεν αυτη ει ηδεις την δωρεαν του θεου και τις εστιν ο λεγων σοι δος μοι πιειν συ αν ητησας αυτον και εδωκεν αν σοι υδωρ ζων
4,11,λεγει αυτω η γυνη κυριε ουτε αντλημα εχεις και το φρεαρ εστιν βαθυ ποθεν ουν εχεις το υδωρ το ζων
4,12,μη συ μειζων ει του πατρος ημων ιακωβ ος εδωκεν ημιν το φρεαρ και αυτος εξ αυτου επιεν και οι υιοι αυτου και τα θρεμματα αυτου
4,13,απεκριθη ιησους και ειπεν αυτη πας ο πινων εκ του υδατος τουτου διψησει παλιν
4,14,ος δ αν πιη εκ του υδατος ου εγω δωσω αυτω ου μη διψηση εις τον αιωνα αλλα το υδωρ ο δωσω αυτω γενησεται εν αυτω πηγη υδατος αλλομενου εις ζωην αιωνιον
4,15,λεγει προς αυτον η γυνη κυριε δος μοι τουτο το υδωρ ινα μη διψω μηδε ερχομαι ενθαδε αντλειν
4,16,λεγει αυτη ο ιησους υπαγε φωνησον τον ανδρα σου και ελθε ενθαδε
4,17,απεκριθη η γυνη και ειπεν ουκ εχω ανδρα λεγει αυτη ο ιησους καλως ειπας οτι ανδρα ουκ εχω
4,18,πεντε γαρ ανδρας εσχες και νυν ον εχεις ουκ εστιν σου ανηρ τουτο αληθες ειρηκας
4,19,λεγει αυτω η γυνη κυριε θεωρω οτι προφητης ει συ
4,20,οι πατερες ημων εν τω ορει τουτω προσεκυνησαν και υμεις λεγετε οτι εν ιεροσολυμοις εστιν ο τοπος οπου δει προσκυνειν
4,21,λεγει αυτη ο ιησους γυναι πιστευσον μοι οτι ερχεται ωρα οτε ουτε εν τω ορει τουτω ουτε εν ιεροσολυμοις προσκυνησετε τω πατρι
4,22,υμεις προσκυνειτε ο ουκ οιδατε ημεις προσκυνουμεν ο οιδαμεν οτι η σωτηρια εκ των ιουδαιων εστιν
4,23,αλλ ερχεται ωρα και νυν εστιν οτε οι αληθινοι προσκυνηται προσκυνησουσιν τω πατρι εν πνευματι και αληθεια και γαρ ο πατηρ τοιουτους ζητει τους προσκυνουντας αυτον
4,24,πνευμα ο θεος και τους προσκυνουντας αυτον εν πνευματι και αληθεια δει προσκυνειν
4,25,λεγει αυτω η γυνη οιδα οτι μεσιας ερχεται ο λεγομενος χριστος οταν ελθη εκεινος αναγγελει ημιν παντα
4,26,λεγει αυτη ο ιησους εγω ειμι ο λαλων σοι
4,27,και επι τουτω ηλθον οι μαθηται αυτου και εθαυμασαν οτι μετα γυναικος ελαλει ουδεις μεντοι ειπεν τι ζητεις η τι λαλεις μετ αυτης
4,28,αφηκεν ουν την υδριαν αυτης η γυνη και απηλθεν εις την πολιν και λεγει τοις ανθρωποις
4,29,δευτε ιδετε ανθρωπον ος ειπεν μοι παντα οσα εποιησα μητι ουτος εστιν ο χριστος
4,30,εξηλθον εκ της πολεως και ηρχοντο προς αυτον
4,31,εν δε τω μεταξυ ηρωτων αυτον οι μαθηται λεγοντες ραββι φαγε
4,32,ο δε ειπεν αυτοις εγω βρωσιν εχω φαγειν ην υμεις ουκ οιδατε
4,33,ελεγον ουν οι μαθηται προς αλληλους μη τις ηνεγκεν αυτω φαγειν
4,34,λεγει αυτοις ο ιησους εμον βρωμα εστιν ινα ποιω το θελημα του πεμψαντος με και τελειωσω αυτου το εργον
