chapter,verse,text
12,34,απεκριθη αυτω ο οχλος ημεις ηκουσαμεν εκ του νομου οτι ο χριστος μενει εις τον αιωνα και πως συ λεγεις δει υψωθηναι τον υιον του ανθρωπου τις εστιν ουτος ο υιος του ανθρωπου
12,35,ειπεν ουν αυτοις ο ιησους ετι μικρον χρονον το φως μεθ υμων εστιν περιπατειτε εως το φως εχετε ινα μη σκοτια υμας καταλαβη και ο περιπατων εν τη σκοτια ουκ οιδεν που υπαγει
12,36,εως το φως εχετε πιστευετε εις το φως ινα υιοι φωτος γενησθε ταυτα ελαλησεν ο ιησους και απελθων εκρυβη απ αυτων
12,37,τοσαυτα δε αυτου σημεια πεποιηκοτος εμπροσθεν αυτων ουκ επιστευον εις αυτον
12,38,ινα ο λογος ησαιου του προφητου πληρωθη ον ειπεν κυριε τις επιστευσεν τη ακοη ημων και ο βραχιων κυριου τινι απεκαλυφθη
12,39,δια τουτο ουκ ηδυναντο πιστευειν οτι παλιν ειπεν ησαιας
12,40,τετυφλωκεν αυτων τους οφθαλμους και πεπωρωκεν αυτων την καρδιαν ινα μη ιδωσιν τοις οφθαλμοις και νοησωσιν τη καρδια και επιστραφωσιν και ιασωμαι αυτους
12,41,ταυτα ειπεν ησαιας οτε ειδεν την δοξαν αυτου και ελαλησεν περι αυτου
12,42,ομως μεντοι και εκ των αρχοντων πολλοι επιστευσαν εις αυτον αλλα δια τους φαρισαιους ουχ ωμολογουν ινα μη αποσυναγωγοι γενωνται
12,43,ηγαπησαν γαρ την δοξαν των ανθρωπων μαλλον ηπερ την δοξαν του θεου
12,44,ιησους δε εκραξεν και ειπεν ο πιστευων εις εμε ου πιστευει εις εμε αλλ εις τον πεμψαντα με
12,45,και ο θεωρων εμε θεωρει τον πεμψαντα με
12,46,εγω φως εις τον κοσμον εληλυθα ινα πας ο πιστευων εις εμε εν τη σκοτια μη μεινη
12,47,και εαν τις μου ακουση των ρηματων και μη πιστευση εγω ου κρινω αυτον ου γαρ ηλθον ινα κρινω τον κοσμον αλλ ινα σωσω τον κοσμον
12,48,ο αθετων εμε και μη λαμβανων τα ρηματα μου εχει τον κρινοντα αυτον ο λογος ον ελαλησα εκεινος κρινει αυτον εν τη εσχατη ημερα
12,49,οτι εγω εξ εμαυτου ουκ ελαλησα αλλ ο πεμψας με πατηρ αυτος μοι εντολην εδωκεν τι ειπω και τι λαλησω
12,50,και οιδα οτι η εντολη αυτου ζωη αιωνιος εστιν α ουν λαλω εγω καθως ειρηκεν μοι ο πατηρ ουτως λαλω
13,1,προ δε της εορτης του πασχα ειδως ο ιησους οτι εληλυθεν αυτου η ωρα ινα μεταβη εκ του κοσμου τουτου προς τον πατερα αγαπησας τους ιδιους τους εν τω κοσμω εις τελος ηγαπησεν αυτους
13,2,και δειπνου γενομενου του διαβολου ηδη βεβληκοτος εις την καρδιαν ιουδα σιμωνος ισκαριωτου ινα αυτον παραδω
13,3,ειδως ο ιησους οτι παντα δεδωκεν αυτω ο πατηρ εις τας χειρας και οτι απο θεου εξηλθεν και προς τον θεον υπαγει
13,4,εγειρεται εκ του δειπνου και τιθησιν τα ιματια και λαβων λεντιον διεζωσεν εαυτον
13,5,ειτα βαλλει υδωρ εις τον νιπτηρα και ηρξατο νιπτειν τους ποδας των μαθητων και εκμασσειν τω λεντιω ω ην διεζωσμενος
13,6,ερχεται ουν προς σιμωνα πετρον και λεγει αυτω εκεινος κυριε συ μου νιπτεις τους ποδας
13,7,απεκριθη ιησους και ειπεν αυτω ο εγω ποιω συ ουκ οιδας αρτι γνωση δε μετα ταυτα
13,8,λεγει αυτω πετρος ου μη νιψης τους ποδας μου εις τον αιωνα απεκριθη αυτω ο ιησους εαν μη νιψω σε ουκ εχεις μερος μετ εμου
13,9,λεγει αυτω σιμων πετρος κυριε μη τους ποδας μου μονον αλλα και τας χειρας και την κεφαλην
13,10,λεγει αυτω ο ιησους ο λελουμενος ου χρειαν εχει η τους ποδας νιψασθαι αλλ εστιν καθαρος ολος και υμεις καθαροι εστε αλλ ουχι παντες
13,11,ηδει γαρ τον παραδιδοντα αυτον δια τουτο ειπεν ουχι παντες καθαροι εστε
13,12,οτε ουν ενιψεν τους ποδας αυτων και ελαβεν τα ιματια αυτου αναπεσων παλιν ειπεν αυτοις γινωσκετε τι πεποιηκα υμιν
13,13,υμεις φωνειτε με ο διδασκαλος και ο κυριος και καλως λεγετε ειμι γαρ
13,14,ει ουν εγω ενιψα υμων τους ποδας ο κυριος και ο διδασκαλος και υμεις οφειλετε αλληλων νιπτειν τους ποδας
13,15,υποδειγμα γαρ εδωκα υμιν ινα καθως εγω εποιησα υμιν και υμεις ποιητε
13,16,αμην αμην λεγω υμιν ουκ εστιν δουλος μειζων του κυριου αυτου ουδε αποστολος μειζων του πεμψαντος αυτον
13,17,ει ταυτα οιδατε μακαριοι εστε εαν ποιητε αυτα
13,18,ου περι παντων υμων λεγω εγω οιδα ους εξελεξαμην αλλ ινα η γραφη πληρωθη ο τρωγων μετ εμου τον αρτον επηρεν επ εμε την πτερναν αυτου
13,19,απ αρτι λεγω υμιν προ του γενεσθαι ινα οταν γενηται πιστευσητε οτι εγω ειμι
13,20,αμην αμην λεγω υμιν ο λαμβανων εαν τινα πεμψω εμε λαμβανει ο δε εμε λαμβανων λαμβανει τον πεμψαντα με
13,21,ταυτα ειπων ο ιησους εταραχθη τω πνευματι και εμαρτυρησεν και ειπεν αμην αμην λεγω υμιν οτι εις εξ υμων παραδωσει με
13,22,εβλεπον ουν εις αλληλους οι μαθηται απορουμενοι περι τινος λεγει
13,23,ην δε ανακειμενος εις των μαθητων αυτου εν τω κολπω του ιησου ον ηγαπα ο ιησους
13,24,νευει ουν τουτω σιμων πετρος πυθεσθαι τις αν ειη περι ου λεγει
13,25,επιπεσων δε εκεινος ουτως επι το στηθος του ιησου λεγει αυτω κυριε τις εστιν
13,26,αποκρινεται ο ιησους εκεινος εστιν ω εγω βαψας το ψωμιον επιδωσω και εμβαψας το ψωμιον διδωσιν ιουδα σιμωνος ισκαριωτη
13,27,και μετα το ψωμιον τοτε εισηλθεν εις εκεινον ο σατανας λεγει ουν αυτω ο ιησους ο ποιεις ποιησον ταχιον
13,28,τουτο δε ουδεις εγνω των ανακειμενων προς τι ειπεν αυτω
13,29,τινες γαρ εδοκουν επει το γλωσσοκομον ειχεν ο ιουδας οτι λεγει αυτω ο ιησους αγορασον ων χρειαν εχομεν εις την εορτην η τοις πτωχοις ινα τι δω
13,30,λαβων ουν το ψωμιον εκεινος ευθεως εξηλθεν ην δε νυξ
13,31,οτε εξηλθεν λεγει ο ιησους νυν εδοξασθη ο υιος του ανθρωπου και ο θεος εδοξασθη εν αυτω
13,32,ει ο θεος εδοξασθη εν αυτω και ο θεος δοξασει αυτον εν εαυτω και ευθυς δοξασει αυτον
13,33,τεκνια ετι μικρον μεθ υμων ειμι ζητησετε με και καθως ειπον τοις ιουδαιοις οτι οπου υπαγω εγω υμεις ου δυνασθε ελθειν και υμιν λεγω αρτι
13,34,εντολην καινην διδωμι υμιν ινα αγαπατε αλληλους καθως ηγαπησα υμας ινα και υμεις αγαπατε αλληλους
13,35,εν τουτω γνωσονται παντες οτι εμοι μαθηται εστε εαν αγαπην εχητε εν αλληλοις
13,36,λεγει αυτω σιμων πετρος κυριε που υπαγεις απεκριθη αυτω ο ιησους οπου υπαγω ου δυνασαι μοι νυν ακολουθησαι υστερον δε ακολουθησεις μοι
13,37,λεγει αυτω πετρος κυριε δια τι ου δυναμαι σοι ακολουθησαι αρτι την ψυχην μου υπερ σου θησω
13,38,απεκριθη αυτω ο ιησους την ψυχην σου υπερ εμου θησεις αμην αμην λεγω σοι ου μη αλεκτωρ φωνηση εως ου απαρνηση με τρις
14,1,μη ταρασσεσθω υμων η καρδια πιστευετε εις τον θεον και εις εμε πιστευετε
14,2,εν τη οικια του πατρος μου μοναι πολλαι εισιν ει δε μη ειπον αν υμιν πορευομαι ετοιμασαι τοπον υμιν
14,3,και εαν πορευθω ετοιμασω υμιν τοπον παλιν ερχομαι και παραληψομαι υμας προς εμαυτον ινα οπου ειμι εγω και υμεις ητε
14,4,και οπου εγω υπαγω οιδατε και την οδον οιδατε
14,5,λεγει αυτω θωμας κυριε ουκ οιδαμεν που υπαγεις και πως δυναμεθα την οδον ειδεναι
14,6,λεγει αυτω ο ιησους εγω ειμι η οδος και η αληθεια και η ζωη ουδεις ερχεται προς τον πατερα ει μη δι εμου
14,7,ει εγνωκειτε με και τον πατερα μου εγνωκειτε αν και απ αρτι γινωσκετε αυτον και εωρακατε αυτον
14,8,λεγει αυτω φιλιππος κυριε δειξον ημιν τον πατερα και αρκει ημιν
14,9,λεγει αυτω ο ιησους τοσουτον χρονον μεθ υμων ειμι και ουκ εγνωκας με φιλιππε ο εωρακως εμε εωρακεν τον πατερα και πως συ λεγεις δειξον ημιν τον πατερα
14,10,ου πιστευεις οτι εγω εν τω πατρι και ο πατηρ εν εμοι εστιν τα ρηματα α εγω λαλω υμιν απ εμαυτου ου λαλω ο δε πατηρ ο εν εμοι μενων αυτος ποιει τα εργα
14,11,πιστευετε μοι οτι εγω εν τω πατρι και ο πατηρ εν εμοι ει δε μη δια τα εργα αυτα πιστευετε μοι
14,12,αμην αμην λεγω υμιν ο πιστευων εις εμε τα εργα α εγω ποιω κακεινος ποιησει και μειζονα τουτων ποιησει οτι εγω προς τον πατερα μου πορευομαι
14,13,και ο τι αν αιτησητε εν τω ονοματι μου τουτο ποιησω ινα δοξασθη ο πατηρ εν τω υιω
14,14,εαν τι αιτησητε με εν τω ονοματι μου εγω ποιησω
14,15,εαν αγαπατε με τας εντολας τας εμας τηρησατε
14,16,και εγω ερωτησω τον πατερα και αλλον παρακλητον δωσει υμιν ινα μενη μεθ υμων εις τον αιωνα
14,17,το πνευμα της αληθειας ο ο κοσμος ου δυναται λαβειν οτι ου θεωρει αυτο ουδε γινωσκει αυτο υμεις δε γινωσκετε αυτο οτι παρ υμιν μενει και εν υμιν εσται
14,18,ουκ αφησω υμας ορφανους ερχομαι προς υμας
14,19,ετι μικρον και ο κοσμος με ουκετι θεωρει υμεις δε θεωρειτε με οτι εγω ζω και υμεις ζησεσθε
14,20,εν εκεινη τη ημερα γνωσεσθε υμεις οτι εγω εν τω πατρι μου και υμεις εν εμοι και εγω εν υμιν
14,21,ο εχων τας εντολας μου και τηρων αυτας εκεινος εστιν ο αγαπων με ο δε αγαπων με αγαπηθησεται υπο του πατρος μου και εγω αγαπησω αυτον και εμφανισω αυτω εμαυτον
14,22,λεγει αυτω ιουδας ουχ ο ισκαριωτης κυριε και τι γεγονεν οτι ημιν μελλεις εμφανιζειν σεαυτον και ουχι τω κοσμω
14,23,απεκριθη ιησους και ειπεν αυτω εαν τις αγαπα με τον λογον μου τηρησει και ο πατηρ μου αγαπησει αυτον και προς αυτον ελευσομεθα και μονην παρ αυτω ποιησομεν
14,24,ο μη αγαπων με τους λογους μου ου τηρει και ο λογος ον ακουετε ουκ εστιν εμος αλλα του πεμψαντος με πατρος
14,25,ταυτα λελαληκα υμιν παρ υμιν μενων
14,26,ο δε παρακλητος το πνευμα το αγιον ο πεμψει ο πατηρ εν τω ονοματι μου εκεινος υμας διδαξει παντα και υπομνησει υμας παντα α ειπον υμιν
14,27,ειρηνην αφιημι υμιν ειρηνην την εμην διδωμι υμιν ου καθως ο κοσμος διδωσιν εγω διδωμι υμιν μη ταρασσεσθω υμων η καρδια μηδε δειλιατω
14,28,ηκουσατε οτι εγω ειπον υμιν υπαγω και ερχομαι προς υμας ει ηγαπατε με εχαρητε αν οτι ειπον πορευομαι προς τον πατερα οτι ο πατηρ μου μειζων μου εστιν
14,29,και νυν ειρηκα υμιν πριν γενεσθαι ινα οταν γενηται πιστευσητε
14,30,ουκετι πολλα λαλησω μεθ υμων ερχεται γαρ ο του κοσμου αρχων και εν εμοι ουκ εχει ουδεν
14,31,αλλ ινα γνω ο κοσμος οτι αγαπω τον πατερα και καθως ενετειλατο μοι ο πατηρ ουτως ποιω εγειρεσθε αγωμεν εντευθεν
15,1,εγω ειμι η αμπελος η αληθινη και ο πατηρ μου ο γεωργος εστιν
15,2,παν κλημα εν εμοι μη φερον καρπον αιρει αυτο και παν το καρπον φερον καθαιρει αυτο ινα πλειονα καρπον φερη
15,3,ηδη υμεις καθαροι εστε δια τον λογον ον λελαληκα υμιν
15,4,μεινατε εν εμοι καγω εν υμιν καθως το κλημα ου δυναται καρπον φερειν αφ εαυτου εαν μη μεινη εν τη αμπελω ουτως ουδε υμεις εαν μη εν εμοι μεινητε
15,5,εγω ειμι η αμπελος υμεις τα κληματα ο μενων εν εμοι καγω εν αυτω ουτος φερει καρπον πολυν οτι χωρις εμου ου δυνασθε ποιειν ουδεν
15,6,εαν μη τις μεινη εν εμοι εβληθη εξω ως το κλημα και εξηρανθη και συναγουσιν αυτα και εις το πυρ βαλλουσιν και καιεται
15,7,εαν μεινητε εν εμοι και τα ρηματα μου εν υμιν μεινη ο εαν θελητε αιτησεσθε και γενησεται υμιν
15,8,εν τουτω εδοξασθη ο πατηρ μου ινα καρπον πολυν φερητε και γενησεσθε εμοι μαθηται
15,9,καθως ηγαπησεν με ο πατηρ καγω ηγαπησα υμας μεινατε εν τη αγαπη τη εμη
15,10,εαν τας εντολας μου τηρησητε μενειτε εν τη αγαπη μου καθως εγω τας εντολας του πατρος μου τετηρηκα και μενω αυτου εν τη αγαπη
15,11,ταυτα λελαληκα υμιν ινα η χαρα η εμη εν υμιν μεινη και η χαρα υμων πληρωθη
15,12,αυτη εστιν η εντολη η εμη ινα αγαπατε αλληλους καθως ηγαπησα υμας
15,13,μειζονα ταυτης αγαπην ουδεις εχει ινα τις την ψυχην αυτου θη υπερ των φιλων αυτου
15,14,υμεις φιλοι μου εστε εαν ποιητε οσα εγω εντελλομαι υμιν
15,15,ουκετι υμας λεγω δουλους οτι ο δουλος ουκ οιδεν τι ποιει αυτου ο κυριος υμας δε ειρηκα φιλους οτι παντα α ηκουσα παρα του πατρος μου εγνωρισα υμιν
15,16,ουχ υμεις με εξελεξασθε αλλ εγω εξελεξαμην υμας και εθηκα υμας ινα υμεις υπαγητε και καρπον φερητε και ο καρπος υμων μενη ινα ο τι αν αιτησητε τον πατερα εν τω ονοματι μου δω υμιν
15,17,ταυτα εντελλομαι υμιν ινα αγαπατε αλληλους
15,18,ει ο κοσμος υμας μισει γινωσκετε οτι εμε πρωτον υμων μεμισηκεν
15,19,ει εκ του κοσμου ητε ο κοσμος αν το ιδιον εφιλει οτι δε εκ του κοσμου ουκ εστε αλλ εγω εξελεξαμην υμας εκ του κοσμου δια τουτο μισει υμας ο κοσμος
15,20,μνημονευετε του λογου ου εγω ειπον υμιν ουκ εστιν δουλος μειζων του κυριου αυτου ει εμε εδιωξαν και υμας διωξουσιν ει τον λογον μου ετηρησαν και τον υμετερον τηρησουσιν
15,21,αλλα ταυτα παντα ποιησουσιν υμιν δια το ονομα μου οτι ουκ οιδασιν τον πεμψαντα με
15,22,ει μη ηλθον και ελαλησα αυτοις αμαρτιαν ουκ ειχον νυν δε προφασιν ουκ εχουσιν περι της αμαρτιας αυτων
15,23,ο εμε μισων και τον πατερα μου μισει
15,24,ει τα εργα μη εποιησα εν αυτοις α ουδεις αλλος πεποιηκεν αμαρτιαν ουκ ειχον νυν δε και εωρακασιν και μεμισηκασιν και εμε και τον πατερα μου
15,25,αλλ ινα πληρωθη ο λογος ο γεγραμμενος εν τω νομω αυτων οτι εμισησαν με δωρεαν
15,26,οταν δε ελθη ο παρακλητος ον εγω πεμψω υμιν παρα του πατρος το πνευμα της αληθειας ο παρα του πατρος εκπορευεται εκεινος μαρτυρησει περι εμου
15,27,και υμεις δε μαρτυρειτε οτι απ αρχης μετ εμου εστε
16,1,ταυτα λελαληκα υμιν ινα μη σκανδαλισθητε
16,2,αποσυναγωγους ποιησουσιν υμας αλλ ερχεται ωρα ινα πας ο αποκτεινας υμας δοξη λατρειαν προσφερειν τω θεω
16,3,και ταυτα ποιησουσιν οτι ουκ εγνωσαν τον πατερα ουδε εμε
16,4,αλλα ταυτα λελαληκα υμιν ινα οταν ελθη η ωρα μνημονευητε αυτων οτι εγω ειπον υμιν ταυτα δε υμιν εξ αρχης ουκ ειπον οτι μεθ υμων ημην
16,5,νυν δε υπαγω προς τον πεμψαντα με και ουδεις εξ υμων ερωτα με που υπαγεις
16,6,αλλ οτι ταυτα λελαληκα υμιν η λυπη πεπληρωκεν υμων την καρδιαν
16,7,αλλ εγω την αληθειαν λεγω υμιν συμφερει υμιν ινα εγω απελθω εαν γαρ εγω μη απελθω ο παρακλητος ουκ ελευσεται προς υμας εαν δε πορευθω πεμψω αυτον προς υμας
16,8,και ελθων εκεινος ελεγξει τον κοσμον περι αμαρτιας και περι δικαιοσυνης και περι κρισεως
16,9,περι αμαρτιας μεν οτι ου πιστευουσιν εις εμε
16,10,περι δικαιοσυνης δε οτι προς τον πατερα μου υπαγω και ουκετι θεωρειτε με
16,11,περι δε κρισεως οτι ο αρχων του κοσμου τουτου κεκριται
16,12,ετι πολλα εχω λεγειν υμιν αλλ ου δυνασθε βασταζειν αρτι
16,13,οταν δε ελθη εκεινος το πνευμα της αληθειας οδηγησει υμας εις πασαν την αληθειαν ου γαρ λαλησει αφ εαυτου αλλ οσα αν ακουση λαλησει και τα ερχομενα αναγγελει υμιν
16,14,εκεινος εμε δοξασει οτι εκ του εμου ληψεται και αναγγελει υμιν
16,15,παντα οσα εχει ο πατηρ εμα εστιν δια τουτο ειπον οτι εκ του εμου λαμβανει και αναγγελει υμιν
16,16,μικρον και ου θεωρειτε με και παλιν μικρον και οψεσθε με οτι υπαγω προς τον πατερα
16,17,ειπον ουν εκ των μαθητων αυτου προς αλληλους τι εστιν τουτο ο λεγει ημιν μικρον και ου θεωρειτε με και παλιν μικρον και οψεσθε με και οτι εγω υπαγω προς τον πατερα
16,18,ελεγον ουν τουτο τι εστιν ο λεγει το μικρον ουκ οιδαμεν τι λαλει
16,19,εγνω ουν ο ιησους οτι ηθελον αυτον ερωταν και ειπεν αυτοις περι τουτου ζητειτε μετ αλληλων οτι ειπον μικρον και ου θεωρειτε με και παλιν μικρον και οψεσθε με
16,20,αμην αμην λεγω υμιν οτι κλαυσετε και θρηνησετε υμεις ο δε κοσμος χαρησεται υμεις δε λυπηθησεσθε αλλ η λυπη υμων εις χαραν γενησεται
16,21,η γυνη οταν τικτη λυπην εχει οτι ηλθεν η ωρα αυτης οταν δε γεννηση το παιδιον ουκετι μνημονευει της θλιψεως δια την χαραν οτι εγεννηθη ανθρωπος εις τον κοσμον
16,22,και υμεις ουν λυπην μεν νυν εχετε παλιν δε οψομαι υμας και χαρησεται υμων η καρδια και την χαραν υμων ουδεις αιρει αφ υμων
16,23,και εν εκεινη τη ημερα εμε ουκ ερωτησετε ουδεν αμην αμην λεγω υμιν οτι οσα αν αιτησητε τον πατερα εν τω ονοματι μου δωσει υμιν
16,24,εως αρτι ουκ ητησατε ουδεν εν τω ονοματι μου αιτειτε και ληψεσθε ινα η χαρα υμων η πεπληρωμενη
16,25,ταυτα εν παροιμιαις λελαληκα υμιν αλλ ερχεται ωρα οτε ουκετι εν παροιμιαις λαλησω υμιν αλλα παρρησια περι του πατρος αναγγελω υμιν
16,26,εν εκεινη τη ημερα εν τω ονοματι μου αιτησεσθε και ου λεγω υμιν οτι εγω ερωτησω τον πατερα περι υμων
