chapter,verse,text
1,1,επειδηπερ πολλοι επεξειρησαν αναταχασψαι διηγησινπερι των πεπληροφορημενων εν ημιν πραγματων
1,2,καψωv παρεδοσαν ημιν οι απ αρξηv αυτοπται καιυπηρεται γενομενοι του λογου
1,3,εδοχεν καμοι παρηκολουψηκοτι ανωψεν πασιν ακριβωvκαψεχηv σοι γραθαι κρατιστε ψεοφιλε
1,4,ινα επιγνωv περι ων κατηξηψηv λογων την ασφαλειαν
1,5,εγενετο εν ταιv ημεραιv ηρωδου του βασιλεωv τηvιουδαιαv ιερευv τιv ονοματι ζαξαριαv εχ εφημεριαv αβια καιη γυνη αυτου εκ των ψυγατερων ααρων και το ονομα αυτηvελισαβετ
1,6,ησαν δε δικαιοι αμφοτεροι ενωπιον του ψεουπορευομενοι εν πασαιv ταιv εντολαιv και δικαιωμασιν τουκυριου αμεμπτοι
1,7,και ουκ ην αυτοιv τεκνον καψοτι η ελισαβετ ηνστειρα και αμφοτεροι προβεβηκοτεv εν ταιv ημεραιv αυτων ησαν
1,8,εγενετο δε εν τω ιερατευειν αυτον εν τη ταχει τηvεφημεριαv αυτου εναντι του ψεου
1,9,κατα το εψοv τηv ιερατειαv ελαξεν του ψυμιασαιεισελψων ειv τον ναον του κυριου
1,10,και παν το πληψοv ην του λαου προσευξομενον εχωτη ωρα του ψυμιαματοv
1,11,ωφψη δε αυτω αγγελοv κυριου εστωv εκ δεχιων τουψυσιαστηριου του ψυμιαματοv
1,12,και εταραξψη ζαξαριαv ιδων και φοβοv επεπεσεν επαυτον
1,13,ειπεν δε προv αυτον ο αγγελοv μη φοβου ζαξαριαδιοτι εισηκουσψη η δεησιv σου και η γυνη σου ελισαβετγεννησει υιον σοι και καλεσειv το ονομα αυτου ιωαννην
1,14,και εσται ξαρα σοι και αγαλλιασιv και πολλοι επιτη γεννησει αυτου ξαρησονται
1,15,εσται γαρ μεγαv ενωπιον του κυριου και οινον καισικερα ου μη πιη και πνευματοv αγιου πλησψησεται ετι εκκοιλιαv μητροv αυτου
1,16,και πολλουv των υιων ισραηλ επιστρεθει επι κυριοντον ψεον αυτων
1,17,και αυτοv προελευσεται ενωπιον αυτου εν πνευματικαι δυναμει ηλιου επιστρεθαι καρδιαv πατερων επι τεκνα καιαπειψειv εν φρονησει δικαιων ετοιμασαι κυριω λαονκατεσκευασμενον
1,18,και ειπεν ζαξαριαv προv τον αγγελον κατα τιγνωσομαι τουτο εγω γαρ ειμι πρεσβυτηv και η γυνη μουπροβεβηκυια εν ταιv ημεραιv αυτηv
1,19,και αποκριψειv ο αγγελοv ειπεν αυτω εγω ειμιγαβριηλ ο παρεστηκωv ενωπιον του ψεου και απεσταλην λαλησαιπροv σε και ευαγγελισασψαι σοι ταυτα
1,20,και ιδου εση σιωπων και μη δυναμενοv λαλησαι αξριηv ημεραv γενηται ταυτα ανψ ων ουκ επιστευσαv τοιv λογοιvμου οιτινεv πληρωψησονται ειv τον καιρον αυτων
1,21,και ην ο λαοv προσδοκων τον ζαξαριαν καιεψαυμαζον εν τω ξρονιζειν αυτον εν τω ναω
1,22,εχελψων δε ουκ ηδυνατο λαλησαι αυτοιv καιεπεγνωσαν οτι οπτασιαν εωρακεν εν τω ναω και αυτοv ηνδιανευων αυτοιv και διεμενεν κωφοv
1,23,και εγενετο ωv επλησψησαν αι ημεραι τηvλειτουργιαv αυτου απηλψεν ειv τον οικον αυτου
1,24,μετα δε ταυταv ταv ημεραv συνελαβεν ελισαβετ ηγυνη αυτου και περιεκρυβεν εαυτην μηναv πεντε λεγουσα
1,25,οτι ουτωv μοι πεποιηκεν ο κυριοv εν ημεραιv αιvεπειδεν αφελειν το ονειδοv μου εν ανψρωποιv
1,26,εν δε τω μηνι τω εκτω απεσταλη ο αγγελοv γαβριηλυπο του ψεου ειv πολιν τηv γαλιλαιαv η ονομα ναζαρετ
1,27,προv παρψενον μεμνηστευμενην ανδρι ω ονομα ιωσηφεχ οικου δαυιδ και το ονομα τηv παρψενου μαριαμ
1,28,και εισελψων ο αγγελοv προv αυτην ειπεν ξαιρεκεξαριτωμενη ο κυριοv μετα σου ευλογημενη συ εν γυναιχιν
1,29,η δε ιδουσα διεταραξψη επι τω λογω αυτου καιδιελογιζετο ποταποv ειη ο ασπασμοv ουτοv
1,30,και ειπεν ο αγγελοv αυτη μη φοβου μαριαμ ευρεvγαρ ξαριν παρα τω ψεω
1,31,και ιδου συλληθη εν γαστρι και τεχη υιον καικαλεσειv το ονομα αυτου ιησουν
1,32,ουτοv εσται μεγαv και υιοv υθιστου κληψησεται καιδωσει αυτω κυριοv ο ψεοv τον ψρονον δαυιδ του πατροv αυτου
1,33,και βασιλευσει επι τον οικον ιακωβ ειv τουvαιωναv και τηv βασιλειαv αυτου ουκ εσται τελοv
1,34,ειπεν δε μαριαμ προv τον αγγελον πωv εσται τουτοεπει ανδρα ου γινωσκω
1,35,και αποκριψειv ο αγγελοv ειπεν αυτη πνευμα αγιονεπελευσεται επι σε και δυναμιv υθιστου επισκιασει σοι διοκαι το γεννωμενον αγιον κληψησεται υιοv ψεου
1,36,και ιδου ελισαβετ η συγγενηv σου και αυτησυνειληφυια υιον εν γηρει αυτηv και ουτοv μην εκτοv εστιναυτη τη καλουμενη στειρα
1,37,οτι ουκ αδυνατησει παρα τω ψεω παν ρημα
1,38,ειπεν δε μαριαμ ιδου η δουλη κυριου γενοιτο μοικατα το ρημα σου και απηλψεν απ αυτηv ο αγγελοv
1,39,αναστασα δε μαριαμ εν ταιv ημεραιv ταυταιvεπορευψη ειv την ορεινην μετα σπουδηv ειv πολιν ιουδα
1,40,και εισηλψεν ειv τον οικον ζαξαριου και ησπασατοτην ελισαβετ
1,41,και εγενετο ωv ηκουσεν η ελισαβετ τον ασπασμοντηv μαριαv εσκιρτησεν το βρεφοv εν τη κοιλια αυτηv καιεπλησψη πνευματοv αγιου η ελισαβετ
1,42,και ανεφωνησεν φωνη μεγαλη και ειπεν ευλογημενησυ εν γυναιχιν και ευλογημενοv ο καρποv τηv κοιλιαv σου
1,43,και ποψεν μοι τουτο ινα ελψη η μητηρ του κυριουμου προv με
1,44,ιδου γαρ ωv εγενετο η φωνη του ασπασμου σου ειvτα ωτα μου εσκιρτησεν το βρεφοv εν αγαλλιασει εν τη κοιλιαμου
1,45,και μακαρια η πιστευσασα οτι εσται τελειωσιv τοιvλελαλημενοιv αυτη παρα κυριου
1,46,και ειπεν μαριαμ μεγαλυνει η θυξη μου τον κυριον
1,47,και ηγαλλιασεν το πνευμα μου επι τω ψεω τω σωτηριμου
1,48,οτι επεβλεθεν επι την ταπεινωσιν τηv δουληv αυτουιδου γαρ απο του νυν μακαριουσιν με πασαι αι γενεαι
1,49,οτι εποιησεν μοι μεγαλεια ο δυνατοv και αγιον τοονομα αυτου
1,50,και το ελεοv αυτου ειv γενεαv γενεων τοιvφοβουμενοιv αυτον
1,51,εποιησεν κρατοv εν βραξιονι αυτου διεσκορπισενυπερηφανουv διανοια καρδιαv αυτων
1,52,καψειλεν δυνασταv απο ψρονων και υθωσεν ταπεινουv
1,53,πεινωνταv ενεπλησεν αγαψων και πλουτουνταvεχαπεστειλεν κενουv
1,54,αντελαβετο ισραηλ παιδοv αυτου μνησψηναι ελεουv
1,55,καψωv ελαλησεν προv τουv πατεραv ημων τω αβρααμκαι τω σπερματι αυτου ειv τον αιωνα
1,56,εμεινεν δε μαριαμ συν αυτη ωσει μηναv τρειv καιυπεστρεθεν ειv τον οικον αυτηv
1,57,τη δε ελισαβετ επλησψη ο ξρονοv του τεκειν αυτηνκαι εγεννησεν υιον
1,58,και ηκουσαν οι περιοικοι και οι συγγενειv αυτηvοτι εμεγαλυνεν κυριοv το ελεοv αυτου μετ αυτηv καισυνεξαιρον αυτη
1,59,και εγενετο εν τη ογδοη ημερα ηλψον περιτεμειν τοπαιδιον και εκαλουν αυτο επι τω ονοματι του πατροv αυτουζαξαριαν
1,60,και αποκριψεισα η μητηρ αυτου ειπεν ουξι αλλακληψησεται ιωαννηv
1,61,και ειπον προv αυτην οτι ουδειv εστιν εν τησυγγενεια σου οv καλειται τω ονοματι τουτω
1,62,ενενευον δε τω πατρι αυτου το τι αν ψελοικαλεισψαι αυτον
1,63,και αιτησαv πινακιδιον εγραθεν λεγων ιωαννηvεστιν το ονομα αυτου και εψαυμασαν παντεv
1,64,ανεωξψη δε το στομα αυτου παραξρημα και η γλωσσααυτου και ελαλει ευλογων τον ψεον
1,65,και εγενετο επι πανταv φοβοv τουv περιοικουνταvαυτουv και εν ολη τη ορεινη τηv ιουδαιαv διελαλειτο παντατα ρηματα ταυτα
1,66,και εψεντο παντεv οι ακουσαντεv εν τη καρδιααυτων λεγοντεv τι αρα το παιδιον τουτο εσται και ξειρκυριου ην μετ αυτου
1,67,και ζαξαριαv ο πατηρ αυτου επλησψη πνευματοvαγιου και προεφητευσεν λεγων
1,68,ευλογητοv κυριοv ο ψεοv του ισραηλ οτι επεσκεθατοκαι εποιησεν λυτρωσιν τω λαω αυτου
1,69,και ηγειρεν κεραv σωτηριαv ημιν εν τω οικω δαυιδτου παιδοv αυτου
1,70,καψωv ελαλησεν δια στοματοv των αγιων των απαιωνοv προφητων αυτου
1,71,σωτηριαν εχ εξψρων ημων και εκ ξειροv παντων τωνμισουντων ημαv
1,72,ποιησαι ελεοv μετα των πατερων ημων και μνησψηναιδιαψηκηv αγιαv αυτου
1,73,ορκον ον ωμοσεν προv αβρααμ τον πατερα ημων τουδουναι ημιν
1,74,αφοβωv εκ ξειροv των εξψρων ημων ρυσψενταvλατρευειν αυτω
1,75,εν οσιοτητι και δικαιοσυνη ενωπιον αυτου πασαvταv ημεραv τηv ζωηv ημων
1,76,και συ παιδιον προφητηv υθιστου κληψησηπροπορευση γαρ προ προσωπου κυριου ετοιμασαι οδουv αυτου
1,77,του δουναι γνωσιν σωτηριαv τω λαω αυτου εν αφεσειαμαρτιων αυτων
1,78,δια σπλαγξνα ελεουv ψεου ημων εν οιv επεσκεθατοημαv ανατολη εχ υθουv
1,79,επιφαναι τοιv εν σκοτει και σκια ψανατουκαψημενοιv του κατευψυναι τουv ποδαv ημων ειv οδον ειρηνηv
1,80,το δε παιδιον ηυχανεν και εκραταιουτο πνευματικαι ην εν ταιv ερημοιv εωv ημεραv αναδειχεωv αυτου προv τονισραηλ
2,1,εγενετο δε εν ταιv ημεραιv εκειναιv εχηλψεν δογμαπαρα καισαροv αυγουστου απογραφεσψαι πασαν την οικουμενην
2,2,αυτη η απογραφη πρωτη εγενετο ηγεμονευοντοv τηvσυριαv κυρηνιου
2,3,και επορευοντο παντεv απογραφεσψαι εκαστοv ειv τηνιδιαν πολιν
2,4,ανεβη δε και ιωσηφ απο τηv γαλιλαιαv εκ πολεωvναζαρετ ειv την ιουδαιαν ειv πολιν δαυιδ ητιv καλειταιβηψλεεμ δια το ειναι αυτον εχ οικου και πατριαv δαυιδ
2,5,απογραθασψαι συν μαριαμ τη μεμνηστευμενη αυτωγυναικι ουση εγκυω
2,6,εγενετο δε εν τω ειναι αυτουv εκει επλησψησαν αιημεραι του τεκειν αυτην
2,7,και ετεκεν τον υιον αυτηv τον πρωτοτοκον καιεσπαργανωσεν αυτον και ανεκλινεν αυτον εν τη φατνη διοτιουκ ην αυτοιv τοποv εν τω καταλυματι
2,8,και ποιμενεv ησαν εν τη ξωρα τη αυτη αγραυλουντεvκαι φυλασσοντεv φυλακαv τηv νυκτοv επι την ποιμνην αυτων
2,9,και ιδου αγγελοv κυριου επεστη αυτοιv και δοχακυριου περιελαμθεν αυτουv και εφοβηψησαν φοβον μεγαν
2,10,και ειπεν αυτοιv ο αγγελοv μη φοβεισψε ιδου γαρευαγγελιζομαι υμιν ξαραν μεγαλην ητιv εσται παντι τω λαω
2,11,οτι ετεξψη υμιν σημερον σωτηρ οv εστιν ξριστοvκυριοv εν πολει δαυιδ
2,12,και τουτο υμιν το σημειον ευρησετε βρεφοvεσπαργανωμενον κειμενον εν φατνη
2,13,και εχαιφνηv εγενετο συν τω αγγελω πληψοvστρατιαv ουρανιου αινουντων τον ψεον και λεγοντων
2,14,δοχα εν υθιστοιv ψεω και επι γηv ειρηνη ενανψρωποιv ευδοκια
2,15,και εγενετο ωv απηλψον απ αυτων ειv τον ουρανονοι αγγελοι και οι ανψρωποι οι ποιμενεv ειπον προv αλληλουvδιελψωμεν δη εωv βηψλεεμ και ιδωμεν το ρημα τουτο τογεγονοv ο ο κυριοv εγνωρισεν ημιν
2,16,και ηλψον σπευσαντεv και ανευρον την τε μαριαμκαι τον ιωσηφ και το βρεφοv κειμενον εν τη φατνη
2,17,ιδοντεv δε διεγνωρισαν περι του ρηματοv τουλαληψεντοv αυτοιv περι του παιδιου τουτου
2,18,και παντεv οι ακουσαντεv εψαυμασαν περι τωνλαληψεντων υπο των ποιμενων προv αυτουv
2,19,η δε μαριαμ παντα συνετηρει τα ρηματα ταυτασυμβαλλουσα εν τη καρδια αυτηv
2,20,και υπεστρεθαν οι ποιμενεv δοχαζοντεv καιαινουντεv τον ψεον επι πασιν οιv ηκουσαν και ειδον καψωvελαληψη προv αυτουv
2,21,και οτε επλησψησαν ημεραι οκτω του περιτεμειναυτον και εκληψη το ονομα αυτου ιησουv το κληψεν υπο τουαγγελου προ του συλληφψηναι αυτον εν τη κοιλια
2,22,και οτε επλησψησαν αι ημεραι του καψαρισμου αυτωνκατα τον νομον μωσεωv ανηγαγον αυτον ειv ιεροσολυμαπαραστησαι τω κυριω
2,23,καψωv γεγραπται εν νομω κυριου οτι παν αρσενδιανοιγον μητραν αγιον τω κυριω κληψησεται
2,24,και του δουναι ψυσιαν κατα το ειρημενον εν νομωκυριου ζευγοv τρυγονων η δυο νεοσσουv περιστερων
2,25,και ιδου ην ανψρωποv εν ιερουσαλημ ω ονομα συμεωνκαι ο ανψρωποv ουτοv δικαιοv και ευλαβηv προσδεξομενοvπαρακλησιν του ισραηλ και πνευμα ην αγιον επ αυτον
2,26,και ην αυτω κεξρηματισμενον υπο του πνευματοv τουαγιου μη ιδειν ψανατον πριν η ιδη τον ξριστον κυριου
2,27,και ηλψεν εν τω πνευματι ειv το ιερον και εν τωεισαγαγειν τουv γονειv το παιδιον ιησουν του ποιησαι αυτουvκατα το ειψισμενον του νομου περι αυτου
2,28,και αυτοv εδεχατο αυτο ειv ταv αγκαλαv αυτου καιευλογησεν τον ψεον και ειπεν
2,29,νυν απολυειv τον δουλον σου δεσποτα κατα το ρημασου εν ειρηνη
2,30,οτι ειδον οι οφψαλμοι μου το σωτηριον σου
2,31,ο ητοιμασαv κατα προσωπον παντων των λαων
2,32,φωv ειv αποκαλυθιν εψνων και δοχαν λαου σου ισραηλ
2,33,και ην ιωσηφ και η μητηρ αυτου ψαυμαζοντεv επιτοιv λαλουμενοιv περι αυτου
2,34,και ευλογησεν αυτουv συμεων και ειπεν προv μαριαμτην μητερα αυτου ιδου ουτοv κειται ειv πτωσιν και αναστασινπολλων εν τω ισραηλ και ειv σημειον αντιλεγομενον
2,35,και σου δε αυτηv την θυξην διελευσεται ρομφαιαοπωv αν αποκαλυφψωσιν εκ πολλων καρδιων διαλογισμοι
2,36,και ην αννα προφητιv ψυγατηρ φανουηλ εκ φυληvασηρ αυτη προβεβηκυια εν ημεραιv πολλαιv ζησασα ετη μεταανδροv επτα απο τηv παρψενιαv αυτηv
2,37,και αυτη ξηρα ωv ετων ογδοηκοντα τεσσαρων η ουκαφιστατο απο του ιερου νηστειαιv και δεησεσιν λατρευουσανυκτα και ημεραν
2,38,και αυτη αυτη τη ωρα επιστασα ανψωμολογειτο τωκυριω και ελαλει περι αυτου πασιν τοιv προσδεξομενοιvλυτρωσιν εν ιερουσαλημ
2,39,και ωv ετελεσαν απαντα τα κατα τον νομον κυριουυπεστρεθαν ειv την γαλιλαιαν ειv την πολιν εαυτων ναζαρετ
2,40,το δε παιδιον ηυχανεν και εκραταιουτο πνευματιπληρουμενον σοφιαv και ξαριv ψεου ην επ αυτο
2,41,και επορευοντο οι γονειv αυτου κατ ετοv ειvιερουσαλημ τη εορτη του πασξα
2,42,και οτε εγενετο ετων δωδεκα αναβαντων αυτων ειvιεροσολυμα κατα το εψοv τηv εορτηv
2,43,και τελειωσαντων ταv ημεραv εν τω υποστρεφειναυτουv υπεμεινεν ιησουv ο παιv εν ιερουσαλημ και ουκ εγνωιωσηφ και η μητηρ αυτου
2,44,νομισαντεv δε αυτον εν τη συνοδια ειναι ηλψονημεραv οδον και ανεζητουν αυτον εν τοιv συγγενεσιν και εντοιv γνωστοιv
2,45,και μη ευροντεv αυτον υπεστρεθαν ειv ιερουσαλημζητουντεv αυτον
2,46,και εγενετο μεψ ημεραv τρειv ευρον αυτον εν τωιερω καψεζομενον εν μεσω των διδασκαλων και ακουοντα αυτωνκαι επερωτωντα αυτουv
2,47,εχισταντο δε παντεv οι ακουοντεv αυτου επι τησυνεσει και ταιv αποκρισεσιν αυτου
2,48,και ιδοντεv αυτον εχεπλαγησαν και προv αυτον ημητηρ αυτου ειπεν τεκνον τι εποιησαv ημιν ουτωv ιδου οπατηρ σου καγω οδυνωμενοι εζητουμεν σε
2,49,και ειπεν προv αυτουv τι οτι εζητειτε με ουκηδειτε οτι εν τοιv του πατροv μου δει ειναι με
2,50,και αυτοι ου συνηκαν το ρημα ο ελαλησεν αυτοιv
2,51,και κατεβη μετ αυτων και ηλψεν ειv ναζαρετ και ηνυποτασσομενοv αυτοιv και η μητηρ αυτου διετηρει παντα ταρηματα ταυτα εν τη καρδια αυτηv
2,52,και ιησουv προεκοπτεν σοφια και ηλικια και ξαριτιπαρα ψεω και ανψρωποιv
3,1,εν ετει δε πεντεκαιδεκατω τηv ηγεμονιαv τιβεριουκαισαροv ηγεμονευοντοv ποντιου πιλατου τηv ιουδαιαv καιτετραρξουντοv τηv γαλιλαιαv ηρωδου φιλιππου δε του αδελφουαυτου τετραρξουντοv τηv ιτουραιαv και τραξωνιτιδοv ξωραvκαι λυσανιου τηv αβιληνηv τετραρξουντοv
3,2,επι αρξιερεωv αννα και καιαφα εγενετο ρημα ψεουεπι ιωαννην τον ζαξαριου υιον εν τη ερημω
3,3,και ηλψεν ειv πασαν την περιξωρον του ιορδανουκηρυσσων βαπτισμα μετανοιαv ειv αφεσιν αμαρτιων
3,4,ωv γεγραπται εν βιβλω λογων ησαιου του προφητουλεγοντοv φωνη βοωντοv εν τη ερημω ετοιμασατε την οδονκυριου ευψειαv ποιειτε ταv τριβουv αυτου
3,5,πασα φαραγχ πληρωψησεται και παν οροv και βουνοvταπεινωψησεται και εσται τα σκολια ειv ευψειαν και αιτραξειαι ειv οδουv λειαv
3,6,και οθεται πασα σαρχ το σωτηριον του ψεου
3,7,ελεγεν ουν τοιv εκπορευομενοιv οξλοιv βαπτισψηναιυπ αυτου γεννηματα εξιδνων τιv υπεδειχεν υμιν φυγειν αποτηv μελλουσηv οργηv
3,8,ποιησατε ουν καρπουv αχιουv τηv μετανοιαv και μηαρχησψε λεγειν εν εαυτοιv πατερα εξομεν τον αβρααμ λεγω γαρυμιν οτι δυναται ο ψεοv εκ των λιψων τουτων εγειραι τεκνα τωαβρααμ
3,9,ηδη δε και η αχινη προv την ριζαν των δενδρωνκειται παν ουν δενδρον μη ποιουν καρπον καλον εκκοπτεταικαι ειv πυρ βαλλεται
3,10,και επηρωτων αυτον οι οξλοι λεγοντεv τι ουνποιησομεν
3,11,αποκριψειv δε λεγει αυτοιv ο εξων δυο ξιτωναvμεταδοτω τω μη εξοντι και ο εξων βρωματα ομοιωv ποιειτω
3,12,ηλψον δε και τελωναι βαπτισψηναι και ειπον προvαυτον διδασκαλε τι ποιησομεν
3,13,ο δε ειπεν προv αυτουv μηδεν πλεον παρα τοδιατεταγμενον υμιν πρασσετε
3,14,επηρωτων δε αυτον και στρατευομενοι λεγοντεv καιημειv τι ποιησομεν και ειπεν προv αυτουv μηδενα διασεισητεμηδε συκοφαντησητε και αρκεισψε τοιv οθωνιοιv υμων
3,15,προσδοκωντοv δε του λαου και διαλογιζομενωνπαντων εν ταιv καρδιαιv αυτων περι του ιωαννου μηποτε αυτοvειη ο ξριστοv
