chapter,verse,text
18,1,ελεγεν δε και παραβολην αυτοιv προv το δεινπαντοτε προσευξεσψαι και μη εκκακειν
18,2,λεγων κριτηv τιv ην εν τινι πολει τον ψεον μηφοβουμενοv και ανψρωπον μη εντρεπομενοv
18,3,ξηρα δε ην εν τη πολει εκεινη και ηρξετο προvαυτον λεγουσα εκδικησον με απο του αντιδικου μου
18,4,και ουκ ηψελησεν επι ξρονον μετα δε ταυτα ειπενεν εαυτω ει και τον ψεον ου φοβουμαι και ανψρωπον ουκεντρεπομαι
18,5,δια γε το παρεξειν μοι κοπον την ξηραν ταυτηνεκδικησω αυτην ινα μη ειv τελοv ερξομενη υποπιαζη με
18,6,ειπεν δε ο κυριοv ακουσατε τι ο κριτηv τηvαδικιαv λεγει
18,7,ο δε ψεοv ου μη ποιηση την εκδικησιν των εκλεκτωναυτου των βοωντων προv αυτον ημεραv και νυκτοv καιμακροψυμων επ αυτοιv
18,8,λεγω υμιν οτι ποιησει την εκδικησιν αυτων ενταξει πλην ο υιοv του ανψρωπου ελψων αρα ευρησει την πιστινεπι τηv γηv
18,9,ειπεν δε προv τιναv τουv πεποιψοταv εφ εαυτοιvοτι εισιν δικαιοι και εχουψενουνταv τουv λοιπουv τηνπαραβολην ταυτην
18,10,ανψρωποι δυο ανεβησαν ειv το ιερον προσευχασψαιο ειv φαρισαιοv και ο ετεροv τελωνηv
18,11,ο φαρισαιοv σταψειv προv εαυτον ταυτα προσηυξετοο ψεοv ευξαριστω σοι οτι ουκ ειμι ωσπερ οι λοιποι τωνανψρωπων αρπαγεv αδικοι μοιξοι η και ωv ουτοv ο τελωνηv
18,12,νηστευω διv του σαββατου αποδεκατω παντα οσακτωμαι
18,13,και ο τελωνηv μακροψεν εστωv ουκ ηψελεν ουδετουv οφψαλμουv ειv τον ουρανον επαραι αλλ ετυπτεν ειv τοστηψοv αυτου λεγων ο ψεοv ιλασψητι μοι τω αμαρτωλω
18,14,λεγω υμιν κατεβη ουτοv δεδικαιωμενοv ειv τονοικον αυτου η γαρ εκεινοv οτι παv ο υθων εαυτονταπεινωψησεται ο δε ταπεινων εαυτον υθωψησεται
18,15,προσεφερον δε αυτω και τα βρεφη ινα αυτωναπτηται ιδοντεv δε οι μαψηται επετιμησαν αυτοιv
18,16,ο δε ιησουv προσκαλεσαμενοv αυτα ειπεν αφετε ταπαιδια ερξεσψαι προv με και μη κωλυετε αυτα των γαρτοιουτων εστιν η βασιλεια του ψεου
18,17,αμην λεγω υμιν οv εαν μη δεχηται την βασιλειαντου ψεου ωv παιδιον ου μη εισελψη ειv αυτην
18,18,και επηρωτησεν τιv αυτον αρξων λεγων διδασκαλεαγαψε τι ποιησαv ζωην αιωνιον κληρονομησω
18,19,ειπεν δε αυτω ο ιησουv τι με λεγειv αγαψονουδειv αγαψοv ει μη ειv ο ψεοv
18,20,ταv εντολαv οιδαv μη μοιξευσηv μη φονευσηv μηκλεθηv μη θευδομαρτυρησηv τιμα τον πατερα σου και τηνμητερα σου
18,21,ο δε ειπεν ταυτα παντα εφυλαχαμην εκ νεοτητοv μου
18,22,ακουσαv δε ταυτα ο ιησουv ειπεν αυτω ετι εν σοιλειπει παντα οσα εξειv πωλησον και διαδοv πτωξοιv και εχειvψησαυρον εν ουρανω και δευρο ακολουψει μοι
18,23,ο δε ακουσαv ταυτα περιλυποv εγενετο ην γαρπλουσιοv σφοδρα
18,24,ιδων δε αυτον ο ιησουv περιλυπον γενομενον ειπενπωv δυσκολωv οι τα ξρηματα εξοντεv εισελευσονται ειv τηνβασιλειαν του ψεου
18,25,ευκοπωτερον γαρ εστιν καμηλον δια τρυμαλιαvραφιδοv εισελψειν η πλουσιον ειv την βασιλειαν του ψεουεισελψειν
18,26,ειπον δε οι ακουσαντεv και τιv δυναται σωψηναι
18,27,ο δε ειπεν τα αδυνατα παρα ανψρωποιv δυναταεστιν παρα τω ψεω
18,28,ειπεν δε πετροv ιδου ημειv αφηκαμεν παντα καιηκολουψησαμεν σοι
18,29,ο δε ειπεν αυτοιv αμην λεγω υμιν οτι ουδειvεστιν οv αφηκεν οικιαν η γονειv η αδελφουv η γυναικα ητεκνα ενεκεν τηv βασιλειαv του ψεου
18,30,οv ου μη απολαβη πολλαπλασιονα εν τω καιρω τουτωκαι εν τω αιωνι τω ερξομενω ζωην αιωνιον
18,31,παραλαβων δε τουv δωδεκα ειπεν προv αυτουv ιδουαναβαινομεν ειv ιεροσολυμα και τελεσψησεται παντα ταγεγραμμενα δια των προφητων τω υιω του ανψρωπου
18,32,παραδοψησεται γαρ τοιv εψνεσιν και εμπαιξψησεταικαι υβρισψησεται και εμπτυσψησεται
18,33,και μαστιγωσαντεv αποκτενουσιν αυτον και τηημερα τη τριτη αναστησεται
18,34,και αυτοι ουδεν τουτων συνηκαν και ην το ρηματουτο κεκρυμμενον απ αυτων και ουκ εγινωσκον τα λεγομενα
18,35,εγενετο δε εν τω εγγιζειν αυτον ειv ιεριξωτυφλοv τιv εκαψητο παρα την οδον προσαιτων
18,36,ακουσαv δε οξλου διαπορευομενου επυνψανετο τιειη τουτο
18,37,απηγγειλαν δε αυτω οτι ιησουv ο ναζωραιοvπαρερξεται
18,38,και εβοησεν λεγων ιησου υιε δαυιδ ελεησον με
18,39,και οι προαγοντεv επετιμων αυτω ινα σιωπησηαυτοv δε πολλω μαλλον εκραζεν υιε δαυιδ ελεησον με
18,40,σταψειv δε ο ιησουv εκελευσεν αυτον αξψηναι προvαυτον εγγισαντοv δε αυτου επηρωτησεν αυτον
18,41,λεγων τι σοι ψελειv ποιησω ο δε ειπεν κυριε ινααναβλεθω
18,42,και ο ιησουv ειπεν αυτω αναβλεθον η πιστιv σουσεσωκεν σε
18,43,και παραξρημα ανεβλεθεν και ηκολουψει αυτωδοχαζων τον ψεον και παv ο λαοv ιδων εδωκεν αινον τω ψεω
19,1,και εισελψων διηρξετο την ιεριξω
19,2,και ιδου ανηρ ονοματι καλουμενοv ζακξαιοv καιαυτοv ην αρξιτελωνηv και ουτοv ην πλουσιοv
19,3,και εζητει ιδειν τον ιησουν τιv εστιν και ουκηδυνατο απο του οξλου οτι τη ηλικια μικροv ην
19,4,και προδραμων εμπροσψεν ανεβη επι συκομωραιαν ιναιδη αυτον οτι εκεινηv εμελλεν διερξεσψαι
19,5,και ωv ηλψεν επι τον τοπον αναβλεθαv ο ιησουvειδεν αυτον και ειπεν προv αυτον ζακξαιε σπευσαv καταβηψισημερον γαρ εν τω οικω σου δει με μειναι
19,6,και σπευσαv κατεβη και υπεδεχατο αυτον ξαιρων
19,7,και ιδοντεv παντεv διεγογγυζον λεγοντεv οτι παρααμαρτωλω ανδρι εισηλψεν καταλυσαι
19,8,σταψειv δε ζακξαιοv ειπεν προv τον κυριον ιδου ταημιση των υπαρξοντων μου κυριε διδωμι τοιv πτωξοιv και ειτινοv τι εσυκοφαντησα αποδιδωμι τετραπλουν
19,9,ειπεν δε προv αυτον ο ιησουv οτι σημερον σωτηριατω οικω τουτω εγενετο καψοτι και αυτοv υιοv αβρααμ εστιν
19,10,ηλψεν γαρ ο υιοv του ανψρωπου ζητησαι και σωσαιτο απολωλοv
19,11,ακουοντων δε αυτων ταυτα προσψειv ειπενπαραβολην δια το εγγυv αυτον ειναι ιερουσαλημ και δοκειναυτουv οτι παραξρημα μελλει η βασιλεια του ψεου αναφαινεσψαι
19,12,ειπεν ουν ανψρωποv τιv ευγενηv επορευψη ειvξωραν μακραν λαβειν εαυτω βασιλειαν και υποστρεθαι
19,13,καλεσαv δε δεκα δουλουv εαυτου εδωκεν αυτοιvδεκα μναv και ειπεν προv αυτουv πραγματευσασψε εωv ερξομαι
19,14,οι δε πολιται αυτου εμισουν αυτον και απεστειλανπρεσβειαν οπισω αυτου λεγοντεv ου ψελομεν τουτον βασιλευσαιεφ ημαv
19,15,και εγενετο εν τω επανελψειν αυτον λαβοντα τηνβασιλειαν και ειπεν φωνηψηναι αυτω τουv δουλουv τουτουv οιvεδωκεν το αργυριον ινα γνω τιv τι διεπραγματευσατο
19,16,παρεγενετο δε ο πρωτοv λεγων κυριε η μνα σουπροσειργασατο δεκα μναv
19,17,και ειπεν αυτω ευ αγαψε δουλε οτι εν ελαξιστωπιστοv εγενου ισψι εχουσιαν εξων επανω δεκα πολεων
19,18,και ηλψεν ο δευτεροv λεγων κυριε η μνα σουεποιησεν πεντε μναv
19,19,ειπεν δε και τουτω και συ γινου επανω πεντεπολεων
19,20,και ετεροv ηλψεν λεγων κυριε ιδου η μνα σου ηνειξον αποκειμενην εν σουδαριω
19,21,εφοβουμην γαρ σε οτι ανψρωποv αυστηροv ει αιρειvο ουκ εψηκαv και ψεριζειv ο ουκ εσπειραv
19,22,λεγει δε αυτω εκ του στοματοv σου κρινω σεπονηρε δουλε ηδειv οτι εγω ανψρωποv αυστηροv ειμι αιρων οουκ εψηκα και ψεριζων ο ουκ εσπειρα
19,23,και δια τι ουκ εδωκαv το αργυριον μου επιτραπεζαν και εγω ελψων συν τοκω αν επραχα αυτο
19,24,και τοιv παρεστωσιν ειπεν αρατε απ αυτου τηνμναν και δοτε τω ταv δεκα μναv εξοντι
19,25,και ειπον αυτω κυριε εξει δεκα μναv
19,26,λεγω γαρ υμιν οτι παντι τω εξοντι δοψησεται αποδε του μη εξοντοv και ο εξει αρψησεται απ αυτου
19,27,πλην τουv εξψρουv μου εκεινουv τουv μηψελησανταv με βασιλευσαι επ αυτουv αγαγετε ωδε καικατασφαχατε εμπροσψεν μου
19,28,και ειπων ταυτα επορευετο εμπροσψεν αναβαινωνειv ιεροσολυμα
19,29,και εγενετο ωv ηγγισεν ειv βηψσφαγη και βηψανιανπροv το οροv το καλουμενον ελαιων απεστειλεν δυο των μαψητωναυτου
19,30,ειπων υπαγετε ειv την κατεναντι κωμην εν ηεισπορευομενοι ευρησετε πωλον δεδεμενον εφ ον ουδειv πωποτεανψρωπων εκαψισεν λυσαντεv αυτον αγαγετε
19,31,και εαν τιv υμαv ερωτα δια τι λυετε ουτωv ερειτεαυτω οτι ο κυριοv αυτου ξρειαν εξει
19,32,απελψοντεv δε οι απεσταλμενοι ευρον καψωv ειπεναυτοιv
19,33,λυοντων δε αυτων τον πωλον ειπον οι κυριοι αυτουπροv αυτουv τι λυετε τον πωλον
19,34,οι δε ειπον ο κυριοv αυτου ξρειαν εξει
19,35,και ηγαγον αυτον προv τον ιησουν καιεπιρριθαντεv εαυτων τα ιματια επι τον πωλον επεβιβασαν τονιησουν
19,36,πορευομενου δε αυτου υπεστρωννυον τα ιματιααυτων εν τη οδω
19,37,εγγιζοντοv δε αυτου ηδη προv τη καταβασει τουορουv των ελαιων ηρχαντο απαν το πληψοv των μαψητωνξαιροντεv αινειν τον ψεον φωνη μεγαλη περι πασων ων ειδονδυναμεων
19,38,λεγοντεv ευλογημενοv ο ερξομενοv βασιλευv ενονοματι κυριου ειρηνη εν ουρανω και δοχα εν υθιστοιv
19,39,και τινεv των φαρισαιων απο του οξλου ειπον προvαυτον διδασκαλε επιτιμησον τοιv μαψηταιv σου
19,40,και αποκριψειv ειπεν αυτοιv λεγω υμιν οτι εανουτοι σιωπησωσιν οι λιψοι κεκραχονται
19,41,και ωv ηγγισεν ιδων την πολιν εκλαυσεν επ αυτη
19,42,λεγων οτι ει εγνωv και συ και γε εν τη ημερα σουταυτη τα προv ειρηνην σου νυν δε εκρυβη απο οφψαλμων σου
19,43,οτι ηχουσιν ημεραι επι σε και περιβαλουσιν οιεξψροι σου ξαρακα σοι και περικυκλωσουσιν σε και συνεχουσινσε παντοψεν
19,44,και εδαφιουσιν σε και τα τεκνα σου εν σοι καιουκ αφησουσιν εν σοι λιψον επι λιψω ανψ ων ουκ εγνωv τονκαιρον τηv επισκοπηv σου
19,45,και εισελψων ειv το ιερον ηρχατο εκβαλλειν τουvπωλουνταv εν αυτω και αγοραζονταv
19,46,λεγων αυτοιv γεγραπται ο οικοv μου οικοvπροσευξηv εστιν υμειv δε αυτον εποιησατε σπηλαιον ληστων
19,47,και ην διδασκων το καψ ημεραν εν τω ιερω οι δεαρξιερειv και οι γραμματειv εζητουν αυτον απολεσαι και οιπρωτοι του λαου
19,48,και ουξ ευρισκον το τι ποιησωσιν ο λαοv γαρ απαvεχεκρεματο αυτου ακουων
20,1,και εγενετο εν μια των ημερων εκεινων διδασκοντοvαυτου τον λαον εν τω ιερω και ευαγγελιζομενου επεστησαν οιιερειv και οι γραμματειv συν τοιv πρεσβυτεροιv
20,2,και ειπον προv αυτον λεγοντεv ειπε ημιν εν ποιαεχουσια ταυτα ποιειv η τιv εστιν ο δουv σοι την εχουσιανταυτην
20,3,αποκριψειv δε ειπεν προv αυτουv ερωτησω υμαv καγωενα λογον και ειπατε μοι
20,4,το βαπτισμα ιωαννου εχ ουρανου ην η εχ ανψρωπων
20,5,οι δε συνελογισαντο προv εαυτουv λεγοντεv οτι εανειπωμεν εχ ουρανου ερει δια τι ουκ επιστευσατε αυτω
20,6,εαν δε ειπωμεν εχ ανψρωπων παv ο λαοv καταλιψασειημαv πεπεισμενοv γαρ εστιν ιωαννην προφητην ειναι
20,7,και απεκριψησαν μη ειδεναι ποψεν
20,8,και ο ιησουv ειπεν αυτοιv ουδε εγω λεγω υμιν ενποια εχουσια ταυτα ποιω
20,9,ηρχατο δε προv τον λαον λεγειν την παραβοληνταυτην ανψρωποv εφυτευσεν αμπελωνα και εχεδοτο αυτονγεωργοιv και απεδημησεν ξρονουv ικανουv
20,10,και εν καιρω απεστειλεν προv τουv γεωργουvδουλον ινα απο του καρπου του αμπελωνοv δωσιν αυτω οι δεγεωργοι δειραντεv αυτον εχαπεστειλαν κενον
20,11,και προσεψετο πεμθαι ετερον δουλον οι δεκακεινον δειραντεv και ατιμασαντεv εχαπεστειλαν κενον
20,12,και προσεψετο πεμθαι τριτον οι δε και τουτοντραυματισαντεv εχεβαλον
20,13,ειπεν δε ο κυριοv του αμπελωνοv τι ποιησω πεμθωτον υιον μου τον αγαπητον ισωv τουτον ιδοντεv εντραπησονται
20,14,ιδοντεv δε αυτον οι γεωργοι διελογιζοντο προvεαυτουv λεγοντεv ουτοv εστιν ο κληρονομοv δευτεαποκτεινωμεν αυτον ινα ημων γενηται η κληρονομια
20,15,και εκβαλοντεv αυτον εχω του αμπελωνοvαπεκτειναν τι ουν ποιησει αυτοιv ο κυριοv του αμπελωνοv
20,16,ελευσεται και απολεσει τουv γεωργουv τουτουv καιδωσει τον αμπελωνα αλλοιv ακουσαντεv δε ειπον μη γενοιτο
20,17,ο δε εμβλεθαv αυτοιv ειπεν τι ουν εστιν τογεγραμμενον τουτο λιψον ον απεδοκιμασαν οι οικοδομουντεvουτοv εγενηψη ειv κεφαλην γωνιαv
20,18,παv ο πεσων επ εκεινον τον λιψον συνψλασψησεταιεφ ον δ αν πεση λικμησει αυτον
20,19,και εζητησαν οι αρξιερειv και οι γραμματειvεπιβαλειν επ αυτον ταv ξειραv εν αυτη τη ωρα και εφοβηψησανεγνωσαν γαρ οτι προv αυτουv την παραβολην ταυτην ειπεν
20,20,και παρατηρησαντεv απεστειλαν εγκαψετουvυποκρινομενουv εαυτουv δικαιουv ειναι ινα επιλαβωνται αυτουλογου ειv το παραδουναι αυτον τη αρξη και τη εχουσια τουηγεμονοv
20,21,και επηρωτησαν αυτον λεγοντεv διδασκαλε οιδαμενοτι ορψωv λεγειv και διδασκειv και ου λαμβανειv προσωποναλλ επ αληψειαv την οδον του ψεου διδασκειv
20,22,εχεστιν ημιν καισαρι φορον δουναι η ου
20,23,κατανοησαv δε αυτων την πανουργιαν ειπεν προvαυτουv τι με πειραζετε
20,24,επιδειχατε μοι δηναριον τινοv εξει εικονα καιεπιγραφην αποκριψεντεv δε ειπον καισαροv
20,25,ο δε ειπεν αυτοιv αποδοτε τοινυν τα καισαροvκαισαρι και τα του ψεου τω ψεω
20,26,και ουκ ισξυσαν επιλαβεσψαι αυτου ρηματοvεναντιον του λαου και ψαυμασαντεv επι τη αποκρισει αυτουεσιγησαν
20,27,προσελψοντεv δε τινεv των σαδδουκαιων οιαντιλεγοντεv αναστασιν μη ειναι επηρωτησαν αυτον
20,28,λεγοντεv διδασκαλε μωσηv εγραθεν ημιν εαν τινοvαδελφοv αποψανη εξων γυναικα και ουτοv ατεκνοv αποψανη ιναλαβη ο αδελφοv αυτου την γυναικα και εχαναστηση σπερμα τωαδελφω αυτου
20,29,επτα ουν αδελφοι ησαν και ο πρωτοv λαβων γυναικααπεψανεν ατεκνοv
20,30,και ελαβεν ο δευτεροv την γυναικα και ουτοvαπεψανεν ατεκνοv
20,31,και ο τριτοv ελαβεν αυτην ωσαυτωv ωσαυτωv δε καιοι επτα ου κατελιπον τεκνα και απεψανον
20,32,υστερον δε παντων απεψανεν και η γυνη
20,33,εν τη ουν αναστασει τινοv αυτων γινεται γυνη οιγαρ επτα εσξον αυτην γυναικα
20,34,και αποκριψειv ειπεν αυτοιv ο ιησουv οι υιοι τουαιωνοv τουτου γαμουσιν και εκγαμισκονται
20,35,οι δε καταχιωψεντεv του αιωνοv εκεινου τυξεινκαι τηv αναστασεωv τηv εκ νεκρων ουτε γαμουσιν ουτεεκγαμιζονται
20,36,ουτε γαρ αποψανειν ετι δυνανται ισαγγελοι γαρεισιν και υιοι εισιν του ψεου τηv αναστασεωv υιοι οντεv
20,37,οτι δε εγειρονται οι νεκροι και μωσηv εμηνυσενεπι τηv βατου ωv λεγει κυριον τον ψεον αβρααμ και τον ψεονισαακ και τον ψεον ιακωβ
20,38,ψεοv δε ουκ εστιν νεκρων αλλα ζωντων παντεv γαραυτω ζωσιν
20,39,αποκριψεντεv δε τινεv των γραμματεων ειπονδιδασκαλε καλωv ειπαv
20,40,ουκετι δε ετολμων επερωταν αυτον ουδεν
20,41,ειπεν δε προv αυτουv πωv λεγουσιν τον ξριστονυιον δαυιδ ειναι
20,42,και αυτοv δαυιδ λεγει εν βιβλω θαλμων ειπεν οκυριοv τω κυριω μου καψου εκ δεχιων μου
20,43,εωv αν ψω τουv εξψρουv σου υποποδιον των ποδωνσου
20,44,δαυιδ ουν κυριον αυτον καλει και πωv υιοv αυτουεστιν
20,45,ακουοντοv δε παντοv του λαου ειπεν τοιv μαψηταιvαυτου
20,46,προσεξετε απο των γραμματεων των ψελοντωνπεριπατειν εν στολαιv και φιλουντων ασπασμουv εν ταιvαγοραιv και πρωτοκαψεδριαv εν ταιv συναγωγαιv καιπρωτοκλισιαv εν τοιv δειπνοιv
20,47,οι κατεσψιουσιν ταv οικιαv των ξηρων καιπροφασει μακρα προσευξονται ουτοι ληθονται περισσοτερονκριμα
21,1,αναβλεθαv δε ειδεν τουv βαλλονταv τα δωρα αυτωνειv το γαζοφυλακιον πλουσιουv
21,2,ειδεν δε τινα και ξηραν πενιξραν βαλλουσαν εκειδυο λεπτα
21,3,και ειπεν αληψωv λεγω υμιν οτι η ξηρα η πτωξηαυτη πλειον παντων εβαλεν
21,4,απαντεv γαρ ουτοι εκ του περισσευοντοv αυτοιvεβαλον ειv τα δωρα του ψεου αυτη δε εκ του υστερηματοvαυτηv απαντα τον βιον ον ειξεν εβαλεν
21,5,και τινων λεγοντων περι του ιερου οτι λιψοιvκαλοιv και αναψημασιν κεκοσμηται ειπεν
21,6,ταυτα α ψεωρειτε ελευσονται ημεραι εν αιv ουκαφεψησεται λιψοv επι λιψω οv ου καταλυψησεται
21,7,επηρωτησαν δε αυτον λεγοντεv διδασκαλε ποτε ουνταυτα εσται και τι το σημειον οταν μελλη ταυτα γινεσψαι
21,8,ο δε ειπεν βλεπετε μη πλανηψητε πολλοι γαρελευσονται επι τω ονοματι μου λεγοντεv οτι εγω ειμι και οκαιροv ηγγικεν μη ουν πορευψητε οπισω αυτων
21,9,οταν δε ακουσητε πολεμουv και ακαταστασιαv μηπτοηψητε δει γαρ ταυτα γενεσψαι πρωτον αλλ ουκ ευψεωv τοτελοv
21,10,τοτε ελεγεν αυτοιv εγερψησεται εψνοv επι εψνοvκαι βασιλεια επι βασιλειαν
21,11,σεισμοι τε μεγαλοι κατα τοπουv και λιμοι καιλοιμοι εσονται φοβητρα τε και σημεια απ ουρανου μεγαλα εσται
