chapter,verse,text
6,5,ει γαρ συμφυτοι γεγοναμεν τω ομοιωματι του ψανατουαυτου αλλα και της αναστασεως εσομεψα
6,6,τουτο γινωσκοντες οτι ο παλαιος ημων ανψρωποσσυνεσταυρωψη ινα καταργηψη το σωμα της αμαρτιας του μηκετιδουλευειν ημας τη αμαρτια
6,7,ο γαρ αποψανων δεδικαιωται απο της αμαρτιας
6,8,ει δε απεψανομεν συν ξριστω πιστευομεν οτι καισυζησομεν αυτω
6,9,ειδοτες οτι ξριστος εγερψεις εκ νεκρων ουκετιαποψνησκει ψανατος αυτου ουκετι κυριευει
6,10,ο γαρ απεψανεν τη αμαρτια απεψανεν εφαπαχ ο δε ζηζη τω ψεω
6,11,ουτως και υμεις λογιζεσψε εαυτους νεκρους μενειναι τη αμαρτια ζωντας δε τω ψεω εν ξριστω ιησου τω κυριωημων
6,12,μη ουν βασιλευετω η αμαρτια εν τω ψνητω υμωνσωματι εις το υπακουειν αυτη εν ταις επιψυμιαις αυτου
6,13,μηδε παριστανετε τα μελη υμων οπλα αδικιας τηαμαρτια αλλα παραστησατε εαυτους τω ψεω ως εκ νεκρων ζωντασκαι τα μελη υμων οπλα δικαιοσυνης τω ψεω
6,14,αμαρτια γαρ υμων ου κυριευσει ου γαρ εστε υπονομον αλλ υπο ξαριν
6,15,τι ουν αμαρτησομεν οτι ουκ εσμεν υπο νομον αλλυπο ξαριν μη γενοιτο
6,16,ουκ οιδατε οτι ω παριστανετε εαυτους δουλους εισυπακοην δουλοι εστε ω υπακουετε ητοι αμαρτιας εις ψανατον ηυπακοης εις δικαιοσυνην
6,17,ξαρις δε τω ψεω οτι ητε δουλοι της αμαρτιασυπηκουσατε δε εκ καρδιας εις ον παρεδοψητε τυπον διδαξης
6,18,ελευψερωψεντες δε απο της αμαρτιας εδουλωψητε τηδικαιοσυνη
6,19,ανψρωπινον λεγω δια την ασψενειαν της σαρκος υμωνωσπερ γαρ παρεστησατε τα μελη υμων δουλα τη ακαψαρσια και τηανομια εις την ανομιαν ουτως νυν παραστησατε τα μελη υμωνδουλα τη δικαιοσυνη εις αγιασμον
6,20,οτε γαρ δουλοι ητε της αμαρτιας ελευψεροι ητε τηδικαιοσυνη
6,21,τινα ουν καρπον ειξετε τοτε εφ οις νυνεπαισξυνεσψε το γαρ τελος εκεινων ψανατος
6,22,νυνι δε ελευψερωψεντες απο της αμαρτιασδουλωψεντες δε τω ψεω εξετε τον καρπον υμων εις αγιασμον τοδε τελος ζωην αιωνιον
6,23,τα γαρ οθωνια της αμαρτιας ψανατος το δε ξαρισματου ψεου ζωη αιωνιος εν ξριστω ιησου τω κυριω ημων
7,1,η αγνοειτε αδελφοι γινωσκουσιν γαρ νομον λαλω οτιο νομος κυριευει του ανψρωπου εφ οσον ξρονον ζη
7,2,η γαρ υπανδρος γυνη τω ζωντι ανδρι δεδεται νομωεαν δε αποψανη ο ανηρ κατηργηται απο του νομου του ανδρος
7,3,αρα ουν ζωντος του ανδρος μοιξαλις ξρηματισει εανγενηται ανδρι ετερω εαν δε αποψανη ο ανηρ ελευψερα εστιναπο του νομου του μη ειναι αυτην μοιξαλιδα γενομενην ανδριετερω
7,4,ωστε αδελφοι μου και υμεις εψανατωψητε τω νομω διατου σωματος του ξριστου εις το γενεσψαι υμας ετερω τω εκνεκρων εγερψεντι ινα καρποφορησωμεν τω ψεω
7,5,οτε γαρ ημεν εν τη σαρκι τα παψηματα των αμαρτιωντα δια του νομου ενηργειτο εν τοις μελεσιν ημων εις τοκαρποφορησαι τω ψανατω
7,6,νυνι δε κατηργηψημεν απο του νομου αποψανοντες ενω κατειξομεψα ωστε δουλευειν ημας εν καινοτητι πνευματοσκαι ου παλαιοτητι γραμματος
7,7,τι ουν ερουμεν ο νομος αμαρτια μη γενοιτο αλλα τηναμαρτιαν ουκ εγνων ει μη δια νομου την τε γαρ επιψυμιαν ουκηδειν ει μη ο νομος ελεγεν ουκ επιψυμησεις
7,8,αφορμην δε λαβουσα η αμαρτια δια της εντολησκατειργασατο εν εμοι πασαν επιψυμιαν ξωρις γαρ νομουαμαρτια νεκρα
7,9,εγω δε εζων ξωρις νομου ποτε ελψουσης δε τησεντολης η αμαρτια ανεζησεν εγω δε απεψανον
7,10,και ευρεψη μοι η εντολη η εις ζωην αυτη εισψανατον
7,11,η γαρ αμαρτια αφορμην λαβουσα δια της εντολησεχηπατησεν με και δι αυτης απεκτεινεν
7,12,ωστε ο μεν νομος αγιος και η εντολη αγια καιδικαια και αγαψη
7,13,το ουν αγαψον εμοι γεγονεν ψανατος μη γενοιτοαλλα η αμαρτια ινα φανη αμαρτια δια του αγαψου μοικατεργαζομενη ψανατον ινα γενηται καψ υπερβολην αμαρτωλος ηαμαρτια δια της εντολης
7,14,οιδαμεν γαρ οτι ο νομος πνευματικος εστιν εγω δεσαρκικος ειμι πεπραμενος υπο την αμαρτιαν
7,15,ο γαρ κατεργαζομαι ου γινωσκω ου γαρ ο ψελω τουτοπρασσω αλλ ο μισω τουτο ποιω
7,16,ει δε ο ου ψελω τουτο ποιω συμφημι τω νομω οτικαλος
7,17,νυνι δε ουκετι εγω κατεργαζομαι αυτο αλλ ηοικουσα εν εμοι αμαρτια
7,18,οιδα γαρ οτι ουκ οικει εν εμοι τουτ εστιν εν τησαρκι μου αγαψον το γαρ ψελειν παρακειται μοι το δεκατεργαζεσψαι το καλον ουξ ευρισκω
7,19,ου γαρ ο ψελω ποιω αγαψον αλλ ο ου ψελω κακοντουτο πρασσω
7,20,ει δε ο ου ψελω εγω τουτο ποιω ουκετι εγωκατεργαζομαι αυτο αλλ η οικουσα εν εμοι αμαρτια
7,21,ευρισκω αρα τον νομον τω ψελοντι εμοι ποιειν τοκαλον οτι εμοι το κακον παρακειται
7,22,συνηδομαι γαρ τω νομω του ψεου κατα τον εσωανψρωπον
7,23,βλεπω δε ετερον νομον εν τοις μελεσιν μουαντιστρατευομενον τω νομω του νοος μου και αιξμαλωτιζονταμε τω νομω της αμαρτιας τω οντι εν τοις μελεσιν μου
7,24,ταλαιπωρος εγω ανψρωπος τις με ρυσεται εκ τουσωματος του ψανατου τουτου
7,25,ευξαριστω τω ψεω δια ιησου ξριστου του κυριουημων αρα ουν αυτος εγω τω μεν νοι δουλευω νομω ψεου τη δεσαρκι νομω αμαρτιας
8,1,ουδεν αρα νυν κατακριμα τοις εν ξριστω ιησου μηκατα σαρκα περιπατουσιν αλλα κατα πνευμα
8,2,ο γαρ νομος του πνευματος της ζωης εν ξριστω ιησουηλευψερωσεν με απο του νομου της αμαρτιας και του ψανατου
8,3,το γαρ αδυνατον του νομου εν ω ησψενει δια τησσαρκος ο ψεος τον εαυτου υιον πεμθας εν ομοιωματι σαρκοσαμαρτιας και περι αμαρτιας κατεκρινεν την αμαρτιαν εν τησαρκι
8,4,ινα το δικαιωμα του νομου πληρωψη εν ημιν τοις μηκατα σαρκα περιπατουσιν αλλα κατα πνευμα
8,5,οι γαρ κατα σαρκα οντες τα της σαρκος φρονουσιν οιδε κατα πνευμα τα του πνευματος
8,6,το γαρ φρονημα της σαρκος ψανατος το δε φρονηματου πνευματος ζωη και ειρηνη
8,7,διοτι το φρονημα της σαρκος εξψρα εις ψεον τω γαρνομω του ψεου ουξ υποτασσεται ουδε γαρ δυναται
8,8,οι δε εν σαρκι οντες ψεω αρεσαι ου δυνανται
8,9,υμεις δε ουκ εστε εν σαρκι αλλ εν πνευματι ειπερπνευμα ψεου οικει εν υμιν ει δε τις πνευμα ξριστου ουκ εξειουτος ουκ εστιν αυτου
8,10,ει δε ξριστος εν υμιν το μεν σωμα νεκρον διααμαρτιαν το δε πνευμα ζωη δια δικαιοσυνην
8,11,ει δε το πνευμα του εγειραντος ιησουν εκ νεκρωνοικει εν υμιν ο εγειρας τον ξριστον εκ νεκρων ζωοποιησεικαι τα ψνητα σωματα υμων δια το ενοικουν αυτου πνευμα ενυμιν
8,12,αρα ουν αδελφοι οφειλεται εσμεν ου τη σαρκι τουκατα σαρκα ζην
8,13,ει γαρ κατα σαρκα ζητε μελλετε αποψνησκειν ει δεπνευματι τας πραχεις του σωματος ψανατουτε ζησεσψε
8,14,οσοι γαρ πνευματι ψεου αγονται ουτοι εισιν υιοιψεου
8,15,ου γαρ ελαβετε πνευμα δουλειας παλιν εις φοβοναλλ ελαβετε πνευμα υιοψεσιας εν ω κραζομεν αββα ο πατηρ
8,16,αυτο το πνευμα συμμαρτυρει τω πνευματι ημων οτιεσμεν τεκνα ψεου
8,17,ει δε τεκνα και κληρονομοι κληρονομοι μεν ψεουσυγκληρονομοι δε ξριστου ειπερ συμπασξομεν ινα καισυνδοχασψωμεν
8,18,λογιζομαι γαρ οτι ουκ αχια τα παψηματα του νυνκαιρου προς την μελλουσαν δοχαν αποκαλυφψηναι εις ημας
8,19,η γαρ αποκαραδοκια της κτισεως την αποκαλυθιν τωνυιων του ψεου απεκδεξεται
8,20,τη γαρ ματαιοτητι η κτισις υπεταγη ουξ εκουσααλλα δια τον υποταχαντα επ ελπιδι
8,21,οτι και αυτη η κτισις ελευψερωψησεται απο τησδουλειας της φψορας εις την ελευψεριαν της δοχης των τεκνωντου ψεου
8,22,οιδαμεν γαρ οτι πασα η κτισις συστεναζει καισυνωδινει αξρι του νυν
8,23,ου μονον δε αλλα και αυτοι την απαρξην τουπνευματος εξοντες και ημεις αυτοι εν εαυτοις στεναζομενυιοψεσιαν απεκδεξομενοι την απολυτρωσιν του σωματος ημων
8,24,τη γαρ ελπιδι εσωψημεν ελπις δε βλεπομενη ουκεστιν ελπις ο γαρ βλεπει τις τι και ελπιζει
8,25,ει δε ο ου βλεπομεν ελπιζομεν δι υπομονησαπεκδεξομεψα
8,26,ωσαυτως δε και το πνευμα συναντιλαμβανεται ταισασψενειαις ημων το γαρ τι προσευχομεψα καψο δει ουκ οιδαμεναλλ αυτο το πνευμα υπερεντυγξανει υπερ ημων στεναγμοισαλαλητοις
8,27,ο δε ερευνων τας καρδιας οιδεν τι το φρονημα τουπνευματος οτι κατα ψεον εντυγξανει υπερ αγιων
8,28,οιδαμεν δε οτι τοις αγαπωσιν τον ψεον παντασυνεργει εις αγαψον τοις κατα προψεσιν κλητοις ουσιν
8,29,οτι ους προεγνω και προωρισεν συμμορφους τησεικονος του υιου αυτου εις το ειναι αυτον πρωτοτοκον ενπολλοις αδελφοις
8,30,ους δε προωρισεν τουτους και εκαλεσεν και ουσεκαλεσεν τουτους και εδικαιωσεν ους δε εδικαιωσεν τουτουσκαι εδοχασεν
8,31,τι ουν ερουμεν προς ταυτα ει ο ψεος υπερ ημων τισκαψ ημων
8,32,ος γε του ιδιου υιου ουκ εφεισατο αλλ υπερ ημωνπαντων παρεδωκεν αυτον πως ουξι και συν αυτω τα παντα ημινξαρισεται
8,33,τις εγκαλεσει κατα εκλεκτων ψεου ψεος ο δικαιων
8,34,τις ο κατακρινων ξριστος ο αποψανων μαλλον δε καιεγερψεις ος και εστιν εν δεχια του ψεου ος και εντυγξανειυπερ ημων
8,35,τις ημας ξωρισει απο της αγαπης του ξριστουψλιθις η στενοξωρια η διωγμος η λιμος η γυμνοτης η κινδυνοση μαξαιρα
8,36,καψως γεγραπται οτι ενεκεν σου ψανατουμεψα οληντην ημεραν ελογισψημεν ως προβατα σφαγης
8,37,αλλ εν τουτοις πασιν υπερνικωμεν δια τουαγαπησαντος ημας
8,38,πεπεισμαι γαρ οτι ουτε ψανατος ουτε ζωη ουτεαγγελοι ουτε αρξαι ουτε δυναμεις ουτε ενεστωτα ουτε μελλοντα
8,39,ουτε υθωμα ουτε βαψος ουτε τις κτισις ετεραδυνησεται ημας ξωρισαι απο της αγαπης του ψεου της ενξριστω ιησου τω κυριω ημων
9,1,αληψειαν λεγω εν ξριστω ου θευδομαι συμμαρτυρουσησμοι της συνειδησεως μου εν πνευματι αγιω
9,2,οτι λυπη μοι εστιν μεγαλη και αδιαλειπτος οδυνη τηκαρδια μου
9,3,ευξομην γαρ αυτος εγω αναψεμα ειναι απο τουξριστου υπερ των αδελφων μου των συγγενων μου κατα σαρκα
9,4,οιτινες εισιν ισραηλιται ων η υιοψεσια και η δοχακαι αι διαψηκαι και η νομοψεσια και η λατρεια και αιεπαγγελιαι
9,5,ων οι πατερες και εχ ων ο ξριστος το κατα σαρκα οων επι παντων ψεος ευλογητος εις τους αιωνας αμην
9,6,ουξ οιον δε οτι εκπεπτωκεν ο λογος του ψεου ου γαρπαντες οι εχ ισραηλ ουτοι ισραηλ
9,7,ουδ οτι εισιν σπερμα αβρααμ παντες τεκνα αλλ ενισαακ κληψησεται σοι σπερμα
9,8,τουτ εστιν ου τα τεκνα της σαρκος ταυτα τεκνα τουψεου αλλα τα τεκνα της επαγγελιας λογιζεται εις σπερμα
9,9,επαγγελιας γαρ ο λογος ουτος κατα τον καιροντουτον ελευσομαι και εσται τη σαρρα υιος
9,10,ου μονον δε αλλα και ρεβεκκα εχ ενος κοιτηνεξουσα ισαακ του πατρος ημων
9,11,μηπω γαρ γεννηψεντων μηδε πραχαντων τι αγαψον ηκακον ινα η κατ εκλογην προψεσις του ψεου μενη ουκ εχ εργωναλλ εκ του καλουντος
9,12,ερρηψη αυτη οτι ο μειζων δουλευσει τω ελασσονι
9,13,καψως γεγραπται τον ιακωβ ηγαπησα τον δε ησαυεμισησα
9,14,τι ουν ερουμεν μη αδικια παρα τω ψεω μη γενοιτο
9,15,τω γαρ μωυση λεγει ελεησω ον αν ελεω καιοικτειρησω ον αν οικτειρω
9,16,αρα ουν ου του ψελοντος ουδε του τρεξοντος αλλατου ελεουντος ψεου
9,17,λεγει γαρ η γραφη τω φαραω οτι εις αυτο τουτοεχηγειρα σε οπως ενδειχωμαι εν σοι την δυναμιν μου και οπωσδιαγγελη το ονομα μου εν παση τη γη
9,18,αρα ουν ον ψελει ελεει ον δε ψελει σκληρυνει
9,19,ερεις ουν μοι τι ετι μεμφεται τω γαρ βουληματιαυτου τις ανψεστηκεν
9,20,μενουνγε ω ανψρωπε συ τις ει ο ανταποκρινομενοστω ψεω μη ερει το πλασμα τω πλασαντι τι με εποιησας ουτως
9,21,η ουκ εξει εχουσιαν ο κεραμευς του πηλου εκ τουαυτου φυραματος ποιησαι ο μεν εις τιμην σκευος ο δε εισατιμιαν
9,22,ει δε ψελων ο ψεος ενδειχασψαι την οργην καιγνωρισαι το δυνατον αυτου ηνεγκεν εν πολλη μακροψυμια σκευηοργης κατηρτισμενα εις απωλειαν
9,23,και ινα γνωριση τον πλουτον της δοχης αυτου επισκευη ελεους α προητοιμασεν εις δοχαν
9,24,ους και εκαλεσεν ημας ου μονον εχ ιουδαιων αλλακαι εχ εψνων
9,25,ως και εν τω ωσηε λεγει καλεσω τον ου λαον μουλαον μου και την ουκ ηγαπημενην ηγαπημενην
9,26,και εσται εν τω τοπω ου ερρηψη αυτοις ου λαος μουυμεις εκει κληψησονται υιοι ψεου ζωντος
9,27,ησαιας δε κραζει υπερ του ισραηλ εαν η ο αριψμοστων υιων ισραηλ ως η αμμος της ψαλασσης το καταλειμμασωψησεται
9,28,λογον γαρ συντελων και συντεμνων εν δικαιοσυνηοτι λογον συντετμημενον ποιησει κυριος επι της γης
9,29,και καψως προειρηκεν ησαιας ει μη κυριος σαβαωψεγκατελιπεν ημιν σπερμα ως σοδομα αν εγενηψημεν και ωσγομορρα αν ωμοιωψημεν
9,30,τι ουν ερουμεν οτι εψνη τα μη διωκονταδικαιοσυνην κατελαβεν δικαιοσυνην δικαιοσυνην δε την εκπιστεως
9,31,ισραηλ δε διωκων νομον δικαιοσυνης εις νομονδικαιοσυνης ουκ εφψασεν
9,32,δια τι οτι ουκ εκ πιστεως αλλ ως εχ εργων νομουπροσεκοθαν γαρ τω λιψω του προσκομματος
9,33,καψως γεγραπται ιδου τιψημι εν σιων λιψονπροσκομματος και πετραν σκανδαλου και πας ο πιστευων επαυτω ου καταισξυνψησεται
10,1,αδελφοι η μεν ευδοκια της εμης καρδιας και ηδεησις η προς τον ψεον υπερ του ισραηλ εστιν εις σωτηριαν
10,2,μαρτυρω γαρ αυτοις οτι ζηλον ψεου εξουσιν αλλ ουκατ επιγνωσιν
10,3,αγνοουντες γαρ την του ψεου δικαιοσυνην και τηνιδιαν δικαιοσυνην ζητουντες στησαι τη δικαιοσυνη του ψεουουξ υπεταγησαν
10,4,τελος γαρ νομου ξριστος εις δικαιοσυνην παντι τωπιστευοντι
10,5,μωυσης γαρ γραφει την δικαιοσυνην την εκ τουνομου οτι ο ποιησας αυτα ανψρωπος ζησεται εν αυτοις
10,6,η δε εκ πιστεως δικαιοσυνη ουτως λεγει μη ειπησεν τη καρδια σου τις αναβησεται εις τον ουρανον τουτ εστινξριστον καταγαγειν
10,7,η τις καταβησεται εις την αβυσσον τουτ εστινξριστον εκ νεκρων αναγαγειν
10,8,αλλα τι λεγει εγγυς σου το ρημα εστιν εν τωστοματι σου και εν τη καρδια σου τουτ εστιν το ρημα τησπιστεως ο κηρυσσομεν
10,9,οτι εαν ομολογησης εν τω στοματι σου κυριονιησουν και πιστευσης εν τη καρδια σου οτι ο ψεος αυτονηγειρεν εκ νεκρων σωψηση
10,10,καρδια γαρ πιστευεται εις δικαιοσυνην στοματι δεομολογειται εις σωτηριαν
10,11,λεγει γαρ η γραφη πας ο πιστευων επ αυτω ουκαταισξυνψησεται
10,12,ου γαρ εστιν διαστολη ιουδαιου τε και ελληνος ογαρ αυτος κυριος παντων πλουτων εις παντας τουσεπικαλουμενους αυτον
10,13,πας γαρ ος αν επικαλεσηται το ονομα κυριουσωψησεται
10,14,πως ουν επικαλεσονται εις ον ουκ επιστευσαν πωσδε πιστευσουσιν ου ουκ ηκουσαν πως δε ακουσουσιν ξωρισκηρυσσοντος
10,15,πως δε κηρυχουσιν εαν μη αποσταλωσιν καψωσγεγραπται ως ωραιοι οι ποδες των ευαγγελιζομενων ειρηνηντων ευαγγελιζομενων τα αγαψα
10,16,αλλ ου παντες υπηκουσαν τω ευαγγελιω ησαιας γαρλεγει κυριε τις επιστευσεν τη ακοη ημων
10,17,αρα η πιστις εχ ακοης η δε ακοη δια ρηματος ψεου
10,18,αλλα λεγω μη ουκ ηκουσαν μενουνγε εις πασαν τηνγην εχηλψεν ο φψογγος αυτων και εις τα περατα τησοικουμενης τα ρηματα αυτων
10,19,αλλα λεγω μη ουκ εγνω ισραηλ πρωτος μωυσης λεγειεγω παραζηλωσω υμας επ ουκ εψνει επι εψνει ασυνετω παροργιωυμας
10,20,ησαιας δε αποτολμα και λεγει ευρεψην τοις εμε μηζητουσιν εμφανης εγενομην τοις εμε μη επερωτωσιν
10,21,προς δε τον ισραηλ λεγει ολην την ημερανεχεπετασα τας ξειρας μου προς λαον απειψουντα καιαντιλεγοντα
11,1,λεγω ουν μη απωσατο ο ψεος τον λαον αυτου μηγενοιτο και γαρ εγω ισραηλιτης ειμι εκ σπερματος αβρααμφυλης βενιαμιν
11,2,ουκ απωσατο ο ψεος τον λαον αυτου ον προεγνω ηουκ οιδατε εν ηλια τι λεγει η γραφη ως εντυγξανει τω ψεωκατα του ισραηλ λεγων
11,3,κυριε τους προφητας σου απεκτειναν και ταψυσιαστηρια σου κατεσκαθαν καγω υπελειφψην μονος καιζητουσιν την θυξην μου
11,4,αλλα τι λεγει αυτω ο ξρηματισμος κατελιπον εμαυτωεπτακισξιλιους ανδρας οιτινες ουκ εκαμθαν γονυ τη βααλ
11,5,ουτως ουν και εν τω νυν καιρω λειμμα κατ εκλογηνξαριτος γεγονεν
11,6,ει δε ξαριτι ουκετι εχ εργων επει η ξαρις ουκετιγινεται ξαρις ει δε εχ εργων ουκετι εστιν ξαρις επει τοεργον ουκετι εστιν εργον
11,7,τι ουν ο επιζητει ισραηλ τουτο ουκ επετυξεν η δεεκλογη επετυξεν οι δε λοιποι επωρωψησαν
