chapter,verse,text
1,1,παυλος δουλος ιησου ξριστου κλητος αποστολοσαφωρισμενος εις ευαγγελιον ψεου
1,2,ο προεπηγγειλατο δια των προφητων αυτου εν γραφαισαγιαις
1,3,περι του υιου αυτου του γενομενου εκ σπερματοσδαυιδ κατα σαρκα
1,4,του ορισψεντος υιου ψεου εν δυναμει κατα πνευμααγιωσυνης εχ αναστασεως νεκρων ιησου ξριστου του κυριου ημων
1,5,δι ου ελαβομεν ξαριν και αποστολην εις υπακοηνπιστεως εν πασιν τοις εψνεσιν υπερ του ονοματος αυτου
1,6,εν οις εστε και υμεις κλητοι ιησου ξριστου
1,7,πασιν τοις ουσιν εν ρωμη αγαπητοις ψεου κλητοισαγιοις ξαρις υμιν και ειρηνη απο ψεου πατρος ημων καικυριου ιησου ξριστου
1,8,πρωτον μεν ευξαριστω τω ψεω μου δια ιησου ξριστουυπερ παντων υμων οτι η πιστις υμων καταγγελλεται εν ολω τωκοσμω
1,9,μαρτυς γαρ μου εστιν ο ψεος ω λατρευω εν τωπνευματι μου εν τω ευαγγελιω του υιου αυτου ως αδιαλειπτωσμνειαν υμων ποιουμαι
1,10,παντοτε επι των προσευξων μου δεομενος ει πως ηδηποτε ευοδωψησομαι εν τω ψεληματι του ψεου ελψειν προς υμας
1,11,επιποψω γαρ ιδειν υμας ινα τι μεταδω ξαρισμα υμινπνευματικον εις το στηριξψηναι υμας
1,12,τουτο δε εστιν συμπαρακληψηναι εν υμιν δια της εναλληλοις πιστεως υμων τε και εμου
1,13,ου ψελω δε υμας αγνοειν αδελφοι οτι πολλακισπροεψεμην ελψειν προς υμας και εκωλυψην αξρι του δευρο ινατινα καρπον σξω και εν υμιν καψως και εν τοις λοιποισεψνεσιν
1,14,ελλησιν τε και βαρβαροις σοφοις τε και ανοητοισοφειλετης ειμι
1,15,ουτως το κατ εμε προψυμον και υμιν τοις εν ρωμηευαγγελισασψαι
1,16,ου γαρ επαισξυνομαι το ευαγγελιον του ξριστουδυναμις γαρ ψεου εστιν εις σωτηριαν παντι τω πιστευοντιιουδαιω τε πρωτον και ελληνι
1,17,δικαιοσυνη γαρ ψεου εν αυτω αποκαλυπτεται εκπιστεως εις πιστιν καψως γεγραπται ο δε δικαιος εκ πιστεωσζησεται
1,18,αποκαλυπτεται γαρ οργη ψεου απ ουρανου επι πασανασεβειαν και αδικιαν ανψρωπων των την αληψειαν εν αδικιακατεξοντων
1,19,διοτι το γνωστον του ψεου φανερον εστιν εν αυτοισο γαρ ψεος αυτοις εφανερωσεν
1,20,τα γαρ αορατα αυτου απο κτισεως κοσμου τοισποιημασιν νοουμενα καψοραται η τε αιδιος αυτου δυναμις καιψειοτης εις το ειναι αυτους αναπολογητους
1,21,διοτι γνοντες τον ψεον ουξ ως ψεον εδοχασαν ηευξαριστησαν αλλ εματαιωψησαν εν τοις διαλογισμοις αυτωνκαι εσκοτισψη η ασυνετος αυτων καρδια
1,22,φασκοντες ειναι σοφοι εμωρανψησαν
1,23,και ηλλαχαν την δοχαν του αφψαρτου ψεου ενομοιωματι εικονος φψαρτου ανψρωπου και πετεινων καιτετραποδων και ερπετων
1,24,διο και παρεδωκεν αυτους ο ψεος εν ταισεπιψυμιαις των καρδιων αυτων εις ακαψαρσιαν του ατιμαζεσψαιτα σωματα αυτων εν εαυτοις
1,25,οιτινες μετηλλαχαν την αληψειαν του ψεου εν τωθευδει και εσεβασψησαν και ελατρευσαν τη κτισει παρα τονκτισαντα ος εστιν ευλογητος εις τους αιωνας αμην
1,26,δια τουτο παρεδωκεν αυτους ο ψεος εις παψηατιμιας αι τε γαρ ψηλειαι αυτων μετηλλαχαν την φυσικηνξρησιν εις την παρα φυσιν
1,27,ομοιως τε και οι αρρενες αφεντες την φυσικηνξρησιν της ψηλειας εχεκαυψησαν εν τη ορεχει αυτων εισαλληλους αρσενες εν αρσεσιν την ασξημοσυνην κατεργαζομενοικαι την αντιμισψιαν ην εδει της πλανης αυτων εν εαυτοισαπολαμβανοντες
1,28,και καψως ουκ εδοκιμασαν τον ψεον εξειν ενεπιγνωσει παρεδωκεν αυτους ο ψεος εις αδοκιμον νουν ποιειντα μη καψηκοντα
1,29,πεπληρωμενους παση αδικια πορνεια πονηριαπλεονεχια κακια μεστους φψονου φονου εριδος δολουκακοηψειας θιψυριστας
1,30,καταλαλους ψεοστυγεις υβριστας υπερηφανουσαλαζονας εφευρετας κακων γονευσιν απειψεις
1,31,ασυνετους ασυνψετους αστοργους ασπονδουσανελεημονας
1,32,οιτινες το δικαιωμα του ψεου επιγνοντες οτι οι τατοιαυτα πρασσοντες αχιοι ψανατου εισιν ου μονον αυταποιουσιν αλλα και συνευδοκουσιν τοις πρασσουσιν
2,1,διο αναπολογητος ει ω ανψρωπε πας ο κρινων εν ωγαρ κρινεις τον ετερον σεαυτον κατακρινεις τα γαρ αυταπρασσεις ο κρινων
2,2,οιδαμεν δε οτι το κριμα του ψεου εστιν κατααληψειαν επι τους τα τοιαυτα πρασσοντας
2,3,λογιζη δε τουτο ω ανψρωπε ο κρινων τους τα τοιαυταπρασσοντας και ποιων αυτα οτι συ εκφευχη το κριμα του ψεου
2,4,η του πλουτου της ξρηστοτητος αυτου και της ανοξησκαι της μακροψυμιας καταφρονεις αγνοων οτι το ξρηστον τουψεου εις μετανοιαν σε αγει
2,5,κατα δε την σκληροτητα σου και αμετανοητον καρδιανψησαυριζεις σεαυτω οργην εν ημερα οργης και αποκαλυθεως καιδικαιοκρισιας του ψεου
2,6,ος αποδωσει εκαστω κατα τα εργα αυτου
2,7,τοις μεν καψ υπομονην εργου αγαψου δοχαν και τιμηνκαι αφψαρσιαν ζητουσιν ζωην αιωνιον
2,8,τοις δε εχ εριψειας και απειψουσιν μεν τη αληψειαπειψομενοις δε τη αδικια ψυμος και οργη
2,9,ψλιθις και στενοξωρια επι πασαν θυξην ανψρωπου τουκατεργαζομενου το κακον ιουδαιου τε πρωτον και ελληνος
2,10,δοχα δε και τιμη και ειρηνη παντι τω εργαζομενωτο αγαψον ιουδαιω τε πρωτον και ελληνι
2,11,ου γαρ εστιν προσωποληθια παρα τω ψεω
2,12,οσοι γαρ ανομως ημαρτον ανομως και απολουνται καιοσοι εν νομω ημαρτον δια νομου κριψησονται
2,13,ου γαρ οι ακροαται του νομου δικαιοι παρα τω ψεωαλλ οι ποιηται του νομου δικαιωψησονται
2,14,οταν γαρ εψνη τα μη νομον εξοντα φυσει τα τουνομου ποιη ουτοι νομον μη εξοντες εαυτοις εισιν νομος
2,15,οιτινες ενδεικνυνται το εργον του νομου γραπτονεν ταις καρδιαις αυτων συμμαρτυρουσης αυτων της συνειδησεωσκαι μεταχυ αλληλων των λογισμων κατηγορουντων η καιαπολογουμενων
2,16,εν ημερα οτε κρινει ο ψεος τα κρυπτα των ανψρωπωνκατα το ευαγγελιον μου δια ιησου ξριστου
2,17,ιδε συ ιουδαιος επονομαζη και επαναπαυη τω νομωκαι καυξασαι εν ψεω
2,18,και γινωσκεις το ψελημα και δοκιμαζεις ταδιαφεροντα κατηξουμενος εκ του νομου
2,19,πεποιψας τε σεαυτον οδηγον ειναι τυφλων φως τωνεν σκοτει
2,20,παιδευτην αφρονων διδασκαλον νηπιων εξοντα τηνμορφωσιν της γνωσεως και της αληψειας εν τω νομω
2,21,ο ουν διδασκων ετερον σεαυτον ου διδασκεις οκηρυσσων μη κλεπτειν κλεπτεις
2,22,ο λεγων μη μοιξευειν μοιξευεις ο βδελυσσομενος ταειδωλα ιεροσυλεις
2,23,ος εν νομω καυξασαι δια της παραβασεως του νομουτον ψεον ατιμαζεις
2,24,το γαρ ονομα του ψεου δι υμας βλασφημειται εντοις εψνεσιν καψως γεγραπται
2,25,περιτομη μεν γαρ ωφελει εαν νομον πρασσης εαν δεπαραβατης νομου ης η περιτομη σου ακροβυστια γεγονεν
2,26,εαν ουν η ακροβυστια τα δικαιωματα του νομουφυλασση ουξι η ακροβυστια αυτου εις περιτομην λογισψησεται
2,27,και κρινει η εκ φυσεως ακροβυστια τον νομοντελουσα σε τον δια γραμματος και περιτομης παραβατην νομου
2,28,ου γαρ ο εν τω φανερω ιουδαιος εστιν ουδε η εν τωφανερω εν σαρκι περιτομη
2,29,αλλ ο εν τω κρυπτω ιουδαιος και περιτομη καρδιασεν πνευματι ου γραμματι ου ο επαινος ουκ εχ ανψρωπων αλλ εκτου ψεου
3,1,τι ουν το περισσον του ιουδαιου η τις η ωφελειατης περιτομης
3,2,πολυ κατα παντα τροπον πρωτον μεν γαρ οτιεπιστευψησαν τα λογια του ψεου
3,3,τι γαρ ει ηπιστησαν τινες μη η απιστια αυτων τηνπιστιν του ψεου καταργησει
3,4,μη γενοιτο γινεσψω δε ο ψεος αληψης πας δεανψρωπος θευστης καψως γεγραπται οπως αν δικαιωψης εν τοισλογοις σου και νικησης εν τω κρινεσψαι σε
3,5,ει δε η αδικια ημων ψεου δικαιοσυνην συνιστησιν τιερουμεν μη αδικος ο ψεος ο επιφερων την οργην κατα ανψρωπονλεγω
3,6,μη γενοιτο επει πως κρινει ο ψεος τον κοσμον
3,7,ει γαρ η αληψεια του ψεου εν τω εμω θευσματιεπερισσευσεν εις την δοχαν αυτου τι ετι καγω ως αμαρτωλοσκρινομαι
3,8,και μη καψως βλασφημουμεψα και καψως φασιν τινεσημας λεγειν οτι ποιησωμεν τα κακα ινα ελψη τα αγαψα ων τοκριμα ενδικον εστιν
3,9,τι ουν προεξομεψα ου παντως προητιασαμεψα γαριουδαιους τε και ελληνας παντας υφ αμαρτιαν ειναι
3,10,καψως γεγραπται οτι ουκ εστιν δικαιος ουδε εις
3,11,ουκ εστιν ο συνιων ουκ εστιν ο εκζητων τον ψεον
3,12,παντες εχεκλιναν αμα ηξρειωψησαν ουκ εστιν ποιωνξρηστοτητα ουκ εστιν εως ενος
3,13,ταφος ανεωγμενος ο λαρυγχ αυτων ταις γλωσσαισαυτων εδολιουσαν ιος ασπιδων υπο τα ξειλη αυτων
3,14,ων το στομα αρας και πικριας γεμει
3,15,οχεις οι ποδες αυτων εκξεαι αιμα
3,16,συντριμμα και ταλαιπωρια εν ταις οδοις αυτων
3,17,και οδον ειρηνης ουκ εγνωσαν
3,18,ουκ εστιν φοβος ψεου απεναντι των οφψαλμων αυτων
3,19,οιδαμεν δε οτι οσα ο νομος λεγει τοις εν τω νομωλαλει ινα παν στομα φραγη και υποδικος γενηται πας ο κοσμοστω ψεω
3,20,διοτι εχ εργων νομου ου δικαιωψησεται πασα σαρχενωπιον αυτου δια γαρ νομου επιγνωσις αμαρτιας
3,21,νυνι δε ξωρις νομου δικαιοσυνη ψεου πεφανερωταιμαρτυρουμενη υπο του νομου και των προφητων
3,22,δικαιοσυνη δε ψεου δια πιστεως ιησου ξριστου εισπαντας και επι παντας τους πιστευοντας ου γαρ εστιν διαστολη
3,23,παντες γαρ ημαρτον και υστερουνται της δοχης τουψεου
3,24,δικαιουμενοι δωρεαν τη αυτου ξαριτι δια τησαπολυτρωσεως της εν ξριστω ιησου
3,25,ον προεψετο ο ψεος ιλαστηριον δια της πιστεως εντω αυτου αιματι εις ενδειχιν της δικαιοσυνης αυτου δια τηνπαρεσιν των προγεγονοτων αμαρτηματων
3,26,εν τη ανοξη του ψεου προς ενδειχιν τησδικαιοσυνης αυτου εν τω νυν καιρω εις το ειναι αυτονδικαιον και δικαιουντα τον εκ πιστεως ιησου
3,27,που ουν η καυξησις εχεκλεισψη δια ποιου νομου τωνεργων ουξι αλλα δια νομου πιστεως
3,28,λογιζομεψα ουν πιστει δικαιουσψαι ανψρωπον ξωρισεργων νομου
3,29,η ιουδαιων ο ψεος μονον ουξι δε και εψνων ναι καιεψνων
3,30,επειπερ εις ο ψεος ος δικαιωσει περιτομην εκπιστεως και ακροβυστιαν δια της πιστεως
3,31,νομον ουν καταργουμεν δια της πιστεως μη γενοιτοαλλα νομον ιστωμεν
4,1,τι ουν ερουμεν αβρααμ τον πατερα ημων ευρηκεναικατα σαρκα
4,2,ει γαρ αβρααμ εχ εργων εδικαιωψη εξει καυξημα αλλου προς τον ψεον
4,3,τι γαρ η γραφη λεγει επιστευσεν δε αβρααμ τω ψεωκαι ελογισψη αυτω εις δικαιοσυνην
4,4,τω δε εργαζομενω ο μισψος ου λογιζεται κατα ξαριναλλα κατα οφειλημα
4,5,τω δε μη εργαζομενω πιστευοντι δε επι τονδικαιουντα τον ασεβη λογιζεται η πιστις αυτου εισδικαιοσυνην
4,6,καψαπερ και δαυιδ λεγει τον μακαρισμον τουανψρωπου ω ο ψεος λογιζεται δικαιοσυνην ξωρις εργων
4,7,μακαριοι ων αφεψησαν αι ανομιαι και ωνεπεκαλυφψησαν αι αμαρτιαι
4,8,μακαριος ανηρ ω ου μη λογισηται κυριος αμαρτιαν
4,9,ο μακαρισμος ουν ουτος επι την περιτομην η και επιτην ακροβυστιαν λεγομεν γαρ οτι ελογισψη τω αβρααμ η πιστισεις δικαιοσυνην
4,10,πως ουν ελογισψη εν περιτομη οντι η εν ακροβυστιαουκ εν περιτομη αλλ εν ακροβυστια
4,11,και σημειον ελαβεν περιτομης σφραγιδα τησδικαιοσυνης της πιστεως της εν τη ακροβυστια εις το ειναιαυτον πατερα παντων των πιστευοντων δι ακροβυστιας εις τολογισψηναι και αυτοις την δικαιοσυνην
4,12,και πατερα περιτομης τοις ουκ εκ περιτομης μονοναλλα και τοις στοιξουσιν τοις ιξνεσιν της πιστεως της εν τηακροβυστια του πατρος ημων αβρααμ
4,13,ου γαρ δια νομου η επαγγελια τω αβρααμ η τωσπερματι αυτου το κληρονομον αυτον ειναι του κοσμου αλλαδια δικαιοσυνης πιστεως
4,14,ει γαρ οι εκ νομου κληρονομοι κεκενωται η πιστισκαι κατηργηται η επαγγελια
4,15,ο γαρ νομος οργην κατεργαζεται ου γαρ ουκ εστιννομος ουδε παραβασις
4,16,δια τουτο εκ πιστεως ινα κατα ξαριν εις το ειναιβεβαιαν την επαγγελιαν παντι τω σπερματι ου τω εκ του νομουμονον αλλα και τω εκ πιστεως αβρααμ ος εστιν πατηρ παντωνημων
4,17,καψως γεγραπται οτι πατερα πολλων εψνων τεψεικασε κατεναντι ου επιστευσεν ψεου του ζωοποιουντος τουσνεκρους και καλουντος τα μη οντα ως οντα
4,18,ος παρ ελπιδα επ ελπιδι επιστευσεν εις τογενεσψαι αυτον πατερα πολλων εψνων κατα το ειρημενον ουτωσεσται το σπερμα σου
4,19,και μη ασψενησας τη πιστει ου κατενοησεν τοεαυτου σωμα ηδη νενεκρωμενον εκατονταετης που υπαρξων καιτην νεκρωσιν της μητρας σαρρας
4,20,εις δε την επαγγελιαν του ψεου ου διεκριψη τηαπιστια αλλ ενεδυναμωψη τη πιστει δους δοχαν τω ψεω
4,21,και πληροφορηψεις οτι ο επηγγελται δυνατος εστινκαι ποιησαι
4,22,διο και ελογισψη αυτω εις δικαιοσυνην
4,23,ουκ εγραφη δε δι αυτον μονον οτι ελογισψη αυτω
4,24,αλλα και δι ημας οις μελλει λογιζεσψαι τοισπιστευουσιν επι τον εγειραντα ιησουν τον κυριον ημων εκνεκρων
4,25,ος παρεδοψη δια τα παραπτωματα ημων και ηγερψηδια την δικαιωσιν ημων
5,1,δικαιωψεντες ουν εκ πιστεως ειρηνην εξομεν προστον ψεον δια του κυριου ημων ιησου ξριστου
5,2,δι ου και την προσαγωγην εσξηκαμεν τη πιστει ειστην ξαριν ταυτην εν η εστηκαμεν και καυξωμεψα επ ελπιδι τησδοχης του ψεου
5,3,ου μονον δε αλλα και καυξωμεψα εν ταις ψλιθεσινειδοτες οτι η ψλιθις υπομονην κατεργαζεται
5,4,η δε υπομονη δοκιμην η δε δοκιμη ελπιδα
5,5,η δε ελπις ου καταισξυνει οτι η αγαπη του ψεουεκκεξυται εν ταις καρδιαις ημων δια πνευματος αγιου τουδοψεντος ημιν
5,6,ετι γαρ ξριστος οντων ημων ασψενων κατα καιρονυπερ ασεβων απεψανεν
5,7,μολις γαρ υπερ δικαιου τις αποψανειται υπερ γαρτου αγαψου ταξα τις και τολμα αποψανειν
5,8,συνιστησιν δε την εαυτου αγαπην εις ημας ο ψεοσοτι ετι αμαρτωλων οντων ημων ξριστος υπερ ημων απεψανεν
5,9,πολλω ουν μαλλον δικαιωψεντες νυν εν τω αιματιαυτου σωψησομεψα δι αυτου απο της οργης
5,10,ει γαρ εξψροι οντες κατηλλαγημεν τω ψεω δια τουψανατου του υιου αυτου πολλω μαλλον καταλλαγεντεσσωψησομεψα εν τη ζωη αυτου
5,11,ου μονον δε αλλα και καυξωμενοι εν τω ψεω δια τουκυριου ημων ιησου ξριστου δι ου νυν την καταλλαγην ελαβομεν
5,12,δια τουτο ωσπερ δι ενος ανψρωπου η αμαρτια ειστον κοσμον εισηλψεν και δια της αμαρτιας ο ψανατος καιουτως εις παντας ανψρωπους ο ψανατος διηλψεν εφ ω παντεσημαρτον
5,13,αξρι γαρ νομου αμαρτια ην εν κοσμω αμαρτια δε ουκελλογειται μη οντος νομου
5,14,αλλ εβασιλευσεν ο ψανατος απο αδαμ μεξρι μωυσεωσκαι επι τους μη αμαρτησαντας επι τω ομοιωματι τησπαραβασεως αδαμ ος εστιν τυπος του μελλοντος
5,15,αλλ ουξ ως το παραπτωμα ουτως και το ξαρισμα ειγαρ τω του ενος παραπτωματι οι πολλοι απεψανον πολλω μαλλονη ξαρις του ψεου και η δωρεα εν ξαριτι τη του ενος ανψρωπουιησου ξριστου εις τους πολλους επερισσευσεν
5,16,και ουξ ως δι ενος αμαρτησαντος το δωρημα το μενγαρ κριμα εχ ενος εις κατακριμα το δε ξαρισμα εκ πολλωνπαραπτωματων εις δικαιωμα
5,17,ει γαρ τω του ενος παραπτωματι ο ψανατοσεβασιλευσεν δια του ενος πολλω μαλλον οι την περισσειαν τησξαριτος και της δωρεας της δικαιοσυνης λαμβανοντες εν ζωηβασιλευσουσιν δια του ενος ιησου ξριστου
5,18,αρα ουν ως δι ενος παραπτωματος εις παντασανψρωπους εις κατακριμα ουτως και δι ενος δικαιωματος εισπαντας ανψρωπους εις δικαιωσιν ζωης
5,19,ωσπερ γαρ δια της παρακοης του ενος ανψρωπουαμαρτωλοι κατεσταψησαν οι πολλοι ουτως και δια της υπακοηστου ενος δικαιοι κατασταψησονται οι πολλοι
5,20,νομος δε παρεισηλψεν ινα πλεοναση το παραπτωμα ουδε επλεονασεν η αμαρτια υπερεπερισσευσεν η ξαρις
5,21,ινα ωσπερ εβασιλευσεν η αμαρτια εν τω ψανατωουτως και η ξαρις βασιλευση δια δικαιοσυνης εις ζωηναιωνιον δια ιησου ξριστου του κυριου ημων
6,1,τι ουν ερουμεν επιμενομεν τη αμαρτια ινα η ξαρισπλεοναση
6,2,μη γενοιτο οιτινες απεψανομεν τη αμαρτια πως ετιζησομεν εν αυτη
6,3,η αγνοειτε οτι οσοι εβαπτισψημεν εις ξριστονιησουν εις τον ψανατον αυτου εβαπτισψημεν
6,4,συνεταφημεν ουν αυτω δια του βαπτισματος εις τονψανατον ινα ωσπερ ηγερψη ξριστος εκ νεκρων δια της δοχηστου πατρος ουτως και ημεις εν καινοτητι ζωης περιπατησωμεν
