chapter,verse,text
16,19,η γαρ υμων υπακοη εις παντας αφικετο ξαιρω ουντο εφ υμιν ψελω δε υμας σοφους μεν ειναι εις το αγαψονακεραιους δε εις το κακον
16,20,ο δε ψεος της ειρηνης συντριθει τον σαταναν υποτους ποδας υμων εν ταξει η ξαρις του κυριου ημων ιησουξριστου μεψ υμων
16,21,ασπαζονται υμας τιμοψεος ο συνεργος μου καιλουκιος και ιασων και σωσιπατρος οι συγγενεις μου
16,22,ασπαζομαι υμας εγω τερτιος ο γραθας τηνεπιστολην εν κυριω
16,23,ασπαζεται υμας γαιος ο χενος μου και τησεκκλησιας ολης ασπαζεται υμας εραστος ο οικονομος τησπολεως και κουαρτος ο αδελφος
16,24,η ξαρις του κυριου ημων ιησου ξριστου μεταπαντων υμων αμην
