chapter,verse,text
11,9,"Καὶ οἱ προάγοντες καὶ οἱ ἀκολουθοῦντες ἔκραζον, λέγοντες, {Ν λέγοντες > - } ʽΩσαννά· εὐλογημένος ὁ ἐρχόμενος ἐν ὀνόματι κυρίου."
11,10,Εὐλογημένη ἡ ἐρχομένη βασιλεία ἐν {Ν ἐν ὀνόματι κυρίου > - } ὀνόματι κυρίου τοῦ πατρὸς ἡμῶν Δαυίδ. ʽΩσαννὰ ἐν τοῖς ὑψίστοις.
11,11,"Καὶ εἰσῆλθεν εἰς ʽΙεροσόλυμα ὁ {Ν ὁ ʼΙησοῦς καὶ > - } ʼΙησοῦς, καὶ εἰς τὸ ἱερόν· καὶ περιβλεψάμενος πάντα, ὀψίας ἤδη οὔσης τῆς ὥρας, ἐξῆλθεν εἰς Βηθανίαν μετὰ τῶν δώδεκα."
11,12,"Καὶ τῇ ἐπαύριον ἐξελθόντων αὐτῶν ἀπὸ Βηθανίας, ἐπείνασεν."
11,13,"Καὶ ἰδὼν συκῆν μακρόθεν, {Ν μακρόθεν > ἀπὸ μακρόθεν } ἔχουσαν φύλλα, ἦλθεν εἰ ἄρα εὑρήσει {Ν εὑρήσει τι > τι εὑρήσει } τι ἐν αὐτῇ· καὶ ἐλθὼν ἐπ' αὐτήν, οὐδὲν εὗρεν εἰ μὴ φύλλα· οὐ {Ν οὐ γὰρ ἦν καιρὸς > ὁ γὰρ καιρὸς οὐκ ἦν } γὰρ ἦν καιρὸς σύκων."
11,14,"Καὶ ἀποκριθεὶς ὁ {Ν ὁ ʼΙησοῦς > - } ʼΙησοῦς εἶπεν αὐτῇ, Μηκέτι ἐκ {Ν ἐκ σοῦ εἰς τὸν αἰῶνα > εἰς τὸν αἰῶνα ἐκ σοῦ } σοῦ εἰς τὸν αἰῶνα μηδεὶς καρπὸν φάγοι. Καὶ ἤκουον οἱ μαθηταὶ αὐτοῦ."
11,15,"Καὶ ἔρχονται εἰς ʽΙεροσόλυμα· καὶ εἰσελθὼν ὁ {Ν ὁ ʼΙησοῦς > - } ʼΙησοῦς εἰς τὸ ἱερὸν ἤρξατο ἐκβάλλειν τοὺς πωλοῦντας καὶ ἀγοράζοντας {Ν ἀγοράζοντας > τοὺς ἀγοράζοντας } ἐν τῷ ἱερῷ· καὶ τὰς τραπέζας τῶν κολλυβιστῶν, καὶ τὰς καθέδρας τῶν πωλούντων τὰς περιστερὰς κατέστρεψεν·"
11,16,καὶ οὐκ ἤφιεν ἵνα τις διενέγκῃ σκεῦος διὰ τοῦ ἱεροῦ.
11,17,"Καὶ ἐδίδασκεν, λέγων {Ν λέγων > καὶ ἔλεγεν } αὐτοῖς, Οὐ γέγραπται ὅτι ʽΟ οἶκός μου οἶκος προσευχῆς κληθήσεται πᾶσιν τοῖς ἔθνεσιν; ʽΥμεῖς δὲ ἐποιήσατε {Ν ἐποιήσατε > πεποιήκατε } αὐτὸν σπήλαιον λῃστῶν."
11,18,"Καὶ ἤκουσαν οἱ γραμματεῖς {Ν γραμματεῖς καὶ οἱ ἀρχιερεῖς > ἀρχιερεῖς καὶ οἱ γραμματεῖς } καὶ οἱ ἀρχιερεῖς, καὶ ἐζήτουν πῶς αὐτὸν ἀπολέσωσιν· ἐφοβοῦντο γὰρ αὐτόν, ὅτι {Ν ὅτι πᾶς > πᾶς γὰρ } πᾶς ὁ ὄχλος ἐξεπλήσσετο ἐπὶ τῇ διδαχῇ αὐτοῦ."
11,19,"Καὶ ὅτε {Ν ὅτε > ὅταν } ὀψὲ ἐγένετο, ἐξεπορεύετο {Ν ἐξεπορεύετο > ἐξεπορεύοντο } ἔξω τῆς πόλεως."
11,20,"Καὶ πρωϊ` {Ν πρωϊ` παραπορευόμενοι > παραπορευόμενοι πρωϊ ́ } παραπορευόμενοι, εἶδον τὴν συκῆν ἐξηραμμένην ἐκ ῥιζῶν."
11,21,"Καὶ ἀναμνησθεὶς ὁ Πέτρος λέγει αὐτῷ, ʽΡαββί, ἴδε, ἡ συκῆ ἣν κατηράσω ἐξήρανται."
11,22,"Καὶ ἀποκριθεὶς ὁ ʼΙησοῦς λέγει αὐτοῖς, ʼΈχετε πίστιν θεοῦ."
11,23,"ʼΑμὴν γὰρ {Ν γὰρ > - } λέγω ὑμῖν ὅτι ὃς ἂν εἴπῃ τῷ ὄρει τούτῳ, ʼΆρθητι, καὶ βλήθητι εἰς τὴν θάλασσαν, καὶ μὴ διακριθῇ ἐν τῇ καρδίᾳ αὐτοῦ, ἀλλὰ πιστεύσῃ {Ν πιστεύσῃ > πιστεύῃ } ὅτι ἃ {Ν ἃ λέγει > ὃ λαλεῖ } λέγει γίνεται· ἔσται αὐτῷ ὃ {Ν ὃ ἐὰν εἴπῃ > - } ἐὰν εἴπῃ."
11,24,"Διὰ τοῦτο λέγω ὑμῖν, Πάντα ὅσα ἂν {Ν ἂν προσευχόμενοι αἰτῆσθε > προσεύχεσθε καὶ αἰτεῖσθε } προσευχόμενοι αἰτῆσθε, {Β αἰτῆσθε > αἰτεῖσθε } πιστεύετε ὅτι λαμβάνετε, {Ν λαμβάνετε > ἐλάβετε } καὶ ἔσται ὑμῖν."
11,25,"Καὶ ὅταν στήκητε {Ν στήκητε > στήκετε } προσευχόμενοι, ἀφίετε εἴ τι ἔχετε κατά τινος· ἵνα καὶ ὁ πατὴρ ὑμῶν ὁ ἐν τοῖς οὐρανοῖς ἀφῇ ὑμῖν τὰ παραπτώματα ὑμῶν."
11,26,"Εἰ δὲ ὑμεῖς οὐκ ἀφίετε, οὐδὲ ὁ πατὴρ ὑμῶν ὁ ἐν τοῖς οὐρανοῖς ἀφήσει τὰ παραπτώματα ὑμῶν. {Ν - }"
11,27,"Καὶ ἔρχονται πάλιν εἰς ʽΙεροσόλυμα· καὶ ἐν τῷ ἱερῷ περιπατοῦντος αὐτοῦ, ἔρχονται πρὸς αὐτὸν οἱ ἀρχιερεῖς καὶ οἱ γραμματεῖς καὶ οἱ πρεσβύτεροι,"
11,28,"καὶ λέγουσιν {Ν λέγουσιν > ἔλεγον } αὐτῷ, ʼΕν ποίᾳ ἐξουσίᾳ ταῦτα ποιεῖς; Καὶ {Ν Καὶ τίς > ʼῊ τίς } τίς σοι τὴν {Ν τὴν ἐξουσίαν ταύτην ἔδωκεν > ἔδωκεν τὴν ἐξουσίαν ταύτην } ἐξουσίαν ταύτην ἔδωκεν ἵνα ταῦτα ποιῇς;"
11,29,"ʽΟ δὲ ʼΙησοῦς ἀποκριθεὶς {Ν ἀποκριθεὶς > - } εἶπεν αὐτοῖς, ʼΕπερωτήσω ὑμᾶς καὶ {Ν καὶ ἐγὼ > - } ἐγὼ ἕνα λόγον, καὶ ἀποκρίθητέ μοι, καὶ ἐρῶ ὑμῖν ἐν ποίᾳ ἐξουσίᾳ ταῦτα ποιῶ."
11,30,"Τὸ βάπτισμα ʼΙωάννου {Ν ʼΙωάννου > τὸ ʼΙωάννου } ἐξ οὐρανοῦ ἦν, ἢ ἐξ ἀνθρώπων; ʼΑποκρίθητέ μοι."
11,31,"Καὶ ἐλογίζοντο {Ν ἐλογίζοντο > διελογίζοντο } πρὸς ἑαυτούς, λέγοντες, ʼΕὰν εἴπωμεν, ʼΕξ οὐρανοῦ, ἐρεῖ, Διὰ τί οὖν {Ν οὖν > [οὖν] } οὐκ ἐπιστεύσατε αὐτῷ;"
11,32,"ʼΑλλ' {Ν ʼΑλλ' > ʼΑλλὰ } εἴπωμεν, ʼΕξ ἀνθρώπων, ἐφοβοῦντο τὸν λαόν· {Ν λαόν > ὄχλον } ἅπαντες γὰρ εἶχον τὸν ʼΙωάννην, ὅτι {Ν ὅτι ὄντως > ὄντως ὅτι } ὄντως προφήτης ἦν."
11,33,"Καὶ ἀποκριθέντες λέγουσιν {Ν λέγουσιν τῷ ʼΙησοῦ > τῷ ʼΙησοῦ λέγουσιν } τῷ ʼΙησοῦ, Οὐκ οἴδαμεν. Καὶ ὁ ʼΙησοῦς ἀποκριθεὶς {Ν ἀποκριθεὶς > - } λέγει αὐτοῖς, Οὐδὲ ἐγὼ λέγω ὑμῖν ἐν ποίᾳ ἐξουσίᾳ ταῦτα ποιῶ."
12,1,"Καὶ ἤρξατο αὐτοῖς ἐν παραβολαῖς λέγειν, {Ν λέγειν > λαλεῖν } ʼΑμπελῶνα ἐφύτευσεν {Ν ἐφύτευσεν ἄνθρωπος > ἄνθρωπος ἐφύτευσεν } ἄνθρωπος, καὶ περιέθηκεν φραγμόν, καὶ ὤρυξεν ὑπολήνιον, καὶ ᾠκοδόμησεν πύργον, καὶ ἐξέδοτο {Ν ἐξέδοτο > ἐξέδετο } αὐτὸν γεωργοῖς, καὶ ἀπεδήμησεν."
12,2,"Καὶ ἀπέστειλεν πρὸς τοὺς γεωργοὺς τῷ καιρῷ δοῦλον, ἵνα παρὰ τῶν γεωργῶν λάβῃ ἀπὸ τοῦ {Ν τοῦ καρποῦ > τῶν καρπῶν } καρποῦ τοῦ ἀμπελῶνος."
12,3,"Οἱ {Ν Οἱ δὲ > Καὶ } δὲ λαβόντες αὐτὸν ἔδειραν, καὶ ἀπέστειλαν κενόν."
12,4,"Καὶ πάλιν ἀπέστειλεν πρὸς αὐτοὺς ἄλλον δοῦλον· κἀκεῖνον λιθοβολήσαντες {Ν λιθοβολήσαντες > - } ἐκεφαλαίωσαν, {Ν ἐκεφαλαίωσαν > ἐκεφαλίωσαν } καὶ ἀπέστειλαν {Ν ἀπέστειλαν ἠτιμωμένον > ἠτίμασαν } ἠτιμωμένον."
12,5,"Καὶ πάλιν {Ν πάλιν > - } ἄλλον ἀπέστειλεν· κἀκεῖνον ἀπέκτειναν· καὶ πολλοὺς ἄλλους, τοὺς {Ν τοὺς μὲν δέροντες τοὺς δὲ ἀποκτένοντες > οὓς μὲν δέροντες οὓς δὲ ἀποκτέννοντες } μὲν δέροντες, τοὺς δὲ ἀποκτένοντες."
12,6,"ʼΈτι οὖν {Ν οὖν > - } ἕνα υἱὸν {Ν υἱὸν ἔχων > εἶχεν υἱὸν } ἔχων ἀγαπητὸν αὐτοῦ, {Ν αὐτοῦ > - } ἀπέστειλεν καὶ {Ν καὶ > - } αὐτὸν πρὸς {Ν πρὸς αὐτοὺς ἔσχατον > ἔσχατον πρὸς αὐτούς } αὐτοὺς ἔσχατον, λέγων ὅτι ʼΕντραπήσονται τὸν υἱόν μου."
12,7,"ʼΕκεῖνοι δὲ οἱ γεωργοὶ εἶπον {Ν εἶπον πρὸς ἑαυτοὺς > πρὸς ἑαυτοὺς εἶπαν } πρὸς ἑαυτοὺς ὅτι Οὗτός ἐστιν ὁ κληρονόμος· δεῦτε, ἀποκτείνωμεν αὐτόν, καὶ ἡμῶν ἔσται ἡ κληρονομία."
12,8,"Καὶ λαβόντες αὐτὸν {Ν αὐτὸν ἀπέκτειναν > ἀπέκτειναν αὐτόν } ἀπέκτειναν, καὶ ἐξέβαλον {Ν ἐξέβαλον > ἐξέβαλον αὐτὸν } ἔξω τοῦ ἀμπελῶνος."
12,9,"Τί οὖν {Ν οὖν > [οὖν] } ποιήσει ὁ κύριος τοῦ ἀμπελῶνος; ʼΕλεύσεται καὶ ἀπολέσει τοὺς γεωργούς, καὶ δώσει τὸν ἀμπελῶνα ἄλλοις."
12,10,"Οὐδὲ τὴν γραφὴν ταύτην ἀνέγνωτε, Λίθον ὃν ἀπεδοκίμασαν οἱ οἰκοδομοῦντες, οὗτος ἐγενήθη εἰς κεφαλὴν γωνίας·"
12,11,"παρὰ κυρίου ἐγένετο αὕτη, καὶ ἔστιν θαυμαστὴ ἐν ὀφθαλμοῖς ἡμῶν;"
12,12,"Καὶ ἐζήτουν αὐτὸν κρατῆσαι, καὶ ἐφοβήθησαν τὸν ὄχλον· ἔγνωσαν γὰρ ὅτι πρὸς αὐτοὺς τὴν παραβολὴν εἶπεν· καὶ ἀφέντες αὐτὸν ἀπῆλθον."
12,13,"Καὶ ἀποστέλλουσιν πρὸς αὐτόν τινας τῶν Φαρισαίων καὶ τῶν ʽΗρῳδιανῶν, ἵνα αὐτὸν ἀγρεύσωσιν λόγῳ."
12,14,"Οἱ {Ν Οἱ δὲ ἐλθόντες > Καὶ ἐλθόντες } δὲ ἐλθόντες λέγουσιν αὐτῷ, Διδάσκαλε, οἴδαμεν ὅτι ἀληθὴς εἶ, καὶ οὐ μέλει σοι περὶ οὐδενός· οὐ γὰρ βλέπεις εἰς πρόσωπον ἀνθρώπων, ἀλλ' ἐπ' ἀληθείας τὴν ὁδὸν τοῦ θεοῦ διδάσκεις. ʼΈξεστιν κῆνσον {Ν κῆνσον Καίσαρι δοῦναι > δοῦναι κῆνσον Καίσαρι } Καίσαρι δοῦναι, ἢ οὔ;"
12,15,"Δῶμεν, ἢ μὴ δῶμεν; ʽΟ δὲ εἰδὼς αὐτῶν τὴν ὑπόκρισιν εἶπεν αὐτοῖς, Τί με πειράζετε; Φέρετέ μοι δηνάριον, ἵνα ἴδω."
12,16,"Οἱ δὲ ἤνεγκαν. Καὶ λέγει αὐτοῖς, Τίνος ἡ εἰκὼν αὕτη καὶ ἡ ἐπιγραφή; Οἱ δὲ εἶπον {Ν εἶπον > εἶπαν } αὐτῷ, Καίσαρος."
12,17,"Καὶ {Ν Καὶ ἀποκριθεὶς ὁ > ʽΟ δὲ } ἀποκριθεὶς ὁ ʼΙησοῦς εἶπεν αὐτοῖς, ʼΑπόδοτε {Ν ʼΑπόδοτε τὰ Καίσαρος >  Τὰ Καίσαρος ἀπόδοτε } τὰ Καίσαρος Καίσαρι, καὶ τὰ τοῦ θεοῦ τῷ θεῷ. Καὶ ἐθαύμασαν {Ν ἐθαύμασαν > ἐξεθαύμαζον } ἐπ' αὐτῷ."
12,18,"Καὶ ἔρχονται Σαδδουκαῖοι πρὸς αὐτόν, οἵτινες λέγουσιν ἀνάστασιν μὴ εἶναι· καὶ ἐπηρώτησαν {Ν ἐπηρώτησαν > ἐπηρώτων } αὐτόν, λέγοντες,"
12,19,"Διδάσκαλε, Μωσῆς {Ν Μωσῆς > Μωϋσῆς } ἔγραψεν ἡμῖν ὅτι ʼΕάν τινος ἀδελφὸς ἀποθάνῃ, καὶ καταλίπῃ γυναῖκα, καὶ τέκνα {Ν τέκνα μὴ ἀφῇ > μὴ ἀφῇ τέκνον } μὴ ἀφῇ, ἵνα λάβῃ ὁ ἀδελφὸς αὐτοῦ τὴν γυναῖκα αὐτοῦ, {Ν αὐτοῦ καὶ > καὶ } καὶ ἐξαναστήσῃ σπέρμα τῷ ἀδελφῷ αὐτοῦ."
12,20,"ʽΕπτὰ ἀδελφοὶ ἦσαν· καὶ ὁ πρῶτος ἔλαβεν γυναῖκα, καὶ ἀποθνῄσκων οὐκ ἀφῆκεν σπέρμα·"
12,21,"καὶ ὁ δεύτερος ἔλαβεν αὐτήν, καὶ ἀπέθανεν, καὶ {Ν καὶ οὐδὲ αὐτὸς ἀφῆκεν > μὴ καταλιπὼν } οὐδὲ αὐτὸς ἀφῆκεν σπέρμα· καὶ ὁ τρίτος ὡσαύτως."
12,22,"Καὶ ἔλαβον {Ν ἔλαβον αὐτὴν > - } αὐτὴν οἱ ἑπτά, καὶ οὐκ {Ν καὶ οὐκ > οὐκ } ἀφῆκαν σπέρμα. ʼΕσχάτη {Ν ʼΕσχάτη > ʼΈσχατον } πάντων ἀπέθανεν {Ν ἀπέθανεν καὶ ἡ γυνή > καὶ ἡ γυνὴ ἀπέθανεν } καὶ ἡ γυνή."
12,23,"ʼΕν τῇ ἀναστάσει, ὅταν {Ν ὅταν ἀναστῶσιν > [ὅταν ἀναστῶσιν] } ἀναστῶσιν, τίνος αὐτῶν ἔσται γυνή; Οἱ γὰρ ἑπτὰ ἔσχον αὐτὴν γυναῖκα."
12,24,"Καὶ {Ν Καὶ ἀποκριθεὶς ὁ ʼΙησοῦς εἶπεν αὐτοῖς > ʼΈφη αὐτοῖς ὁ ʼΙησοῦς } ἀποκριθεὶς ὁ ʼΙησοῦς εἶπεν αὐτοῖς, Οὐ διὰ τοῦτο πλανᾶσθε, μὴ εἰδότες τὰς γραφάς, μηδὲ τὴν δύναμιν τοῦ θεοῦ;"
12,25,"ʽΌταν γὰρ ἐκ νεκρῶν ἀναστῶσιν, οὔτε γαμοῦσιν, οὔτε γαμίσκονται, {Ν γαμίσκονται > γαμίζονται } ἀλλ' εἰσὶν ὡς ἄγγελοι οἱ {Ν οἱ > - } ἐν τοῖς οὐρανοῖς."
12,26,"Περὶ δὲ τῶν νεκρῶν, ὅτι ἐγείρονται, οὐκ ἀνέγνωτε ἐν τῇ βίβλῳ Μωσέως, {Β Μωσέως > Μωϋσέως } {Ν Μωσέως > Μωϋσέως } ἐπὶ τοῦ βάτου, ὡς {Ν ὡς > πῶς } εἶπεν αὐτῷ ὁ θεός, λέγων, ʼΕγὼ ὁ θεὸς ʼΑβραάμ, καὶ ὁ {Ν ὁ θεὸς ʼΙσαάκ > [ὁ] θεὸς ʼΙσαάκ } θεὸς ʼΙσαάκ, καὶ ὁ θεὸς ʼΙακώβ; {Ν ὁ θεὸς ʼΙακώβ > [ὁ] θεὸς ʼΙακώβ }"
12,27,"Οὐκ ἔστιν ὁ {Ν ὁ > - } θεὸς νεκρῶν, ἀλλὰ θεὸς {Ν θεὸς ζώντων > ζώντων } ζώντων· ὑμεῖς {Ν ὑμεῖς οὖν > - } οὖν πολὺ πλανᾶσθε."
12,28,"Καὶ προσελθὼν εἷς τῶν γραμματέων, ἀκούσας αὐτῶν συζητούντων, εἰδὼς {Ν εἰδὼς > ἰδὼν } ὅτι καλῶς αὐτοῖς {Ν αὐτοῖς ἀπεκρίθη > ἀπεκρίθη αὐτοῖς } ἀπεκρίθη, ἐπηρώτησεν αὐτόν, Ποία ἐστὶν πρώτη {Ν πρώτη πάντων ἐντολή > ἐντολὴ πρώτη πάντων } πάντων ἐντολή;"
12,29,"ʽΟ {Ν ʽΟ δὲ ʼΙησοῦς ἀπεκρίθη αὐτῷ > ʼΑπεκρίθη ὁ ʼΙησοῦς } δὲ ʼΙησοῦς ἀπεκρίθη αὐτῷ ὅτι Πρώτη πάντων {Ν πάντων τῶν ἐντολῶν > ἐστίν } τῶν ἐντολῶν, ʼΆκουε, ʼΙσραήλ· κύριος ὁ θεὸς ἡμῶν, κύριος εἷς ἐστίν·"
12,30,"καὶ ἀγαπήσεις κύριον τὸν θεόν σου ἐξ ὅλης τῆς καρδίας σου, καὶ ἐξ ὅλης τῆς ψυχῆς σου, καὶ ἐξ ὅλης τῆς διανοίας σου, καὶ ἐξ ὅλης τῆς ἰσχύος σου. Αὕτη {Ν Αὕτη πρώτη ἐντολή > - } πρώτη ἐντολή."
12,31,"Καὶ {Ν Καὶ δευτέρα ὁμοία > Δευτέρα } δευτέρα ὁμοία αὕτη, ʼΑγαπήσεις τὸν πλησίον σου ὡς σεαυτόν. Μείζων τούτων ἄλλη ἐντολὴ οὐκ ἔστιν."
12,32,"Καὶ εἶπεν αὐτῷ ὁ γραμματεύς, Καλῶς, διδάσκαλε, ἐπ' ἀληθείας εἶπας {Ν εἶπας > εἶπες } ὅτι εἷς ἐστιν, καὶ οὐκ ἔστιν ἄλλος πλὴν αὐτοῦ·"
12,33,"καὶ τὸ ἀγαπᾷν αὐτὸν ἐξ ὅλης τῆς καρδίας, καὶ ἐξ ὅλης τῆς συνέσεως, καὶ ἐξ ὅλης τῆς ψυχῆς, {Ν ψυχῆς καὶ ἐξ ὅλης τῆς > - } καὶ ἐξ ὅλης τῆς ἰσχύος, καὶ τὸ ἀγαπᾷν τὸν πλησίον ὡς ἑαυτόν, πλεῖόν {Ν πλεῖόν > περισσότερόν } ἐστιν πάντων τῶν ὁλοκαυτωμάτων καὶ θυσιῶν."
12,34,"Καὶ ὁ ʼΙησοῦς ἰδὼν αὐτὸν {Ν αὐτὸν ὅτι > [αὐτὸν] ὅτι } ὅτι νουνεχῶς ἀπεκρίθη, εἶπεν αὐτῷ, Οὐ μακρὰν εἶ ἀπὸ τῆς βασιλείας τοῦ θεοῦ. Καὶ οὐδεὶς οὐκέτι ἐτόλμα αὐτὸν ἐπερωτῆσαι."
12,35,"Καὶ ἀποκριθεὶς ὁ ʼΙησοῦς ἔλεγεν, διδάσκων ἐν τῷ ἱερῷ, Πῶς λέγουσιν οἱ γραμματεῖς ὅτι ὁ χριστὸς υἱός ἐστιν {Ν ἐστιν Δαυίδ > Δαυίδ ἐστιν } Δαυίδ;"
12,36,"Αὐτὸς γὰρ {Ν γὰρ > - } Δαυὶδ εἶπεν ἐν πνεύματι {Ν πνεύματι ἁγίῳ > τῷ πνεύματι τῷ ἁγίῳ } ἁγίῳ, Λέγει {Ν Λέγει ὁ > Εἶπεν } ὁ κύριος τῷ κυρίῳ μου, Κάθου ἐκ δεξιῶν μου, ἕως ἂν θῶ τοὺς ἐχθρούς σου ὑποπόδιον {Ν ὑποπόδιον > ὑποκάτω } τῶν ποδῶν σου."
12,37,Αὐτὸς οὖν {Ν οὖν > - } Δαυὶδ λέγει αὐτὸν κύριον· καὶ πόθεν υἱὸς {Ν υἱὸς αὐτοῦ ἐστιν > αὐτοῦ ἐστιν υἱός } αὐτοῦ ἐστιν; Καὶ ὁ {Ν ὁ > [ὁ] } πολὺς ὄχλος ἤκουεν αὐτοῦ ἡδέως.
12,38,"Καὶ ἔλεγεν {Ν ἔλεγεν αὐτοῖς ἐν τῇ διδαχῇ αὐτοῦ > ἐν τῇ διδαχῇ αὐτοῦ ἔλεγεν } αὐτοῖς ἐν τῇ διδαχῇ αὐτοῦ, Βλέπετε ἀπὸ τῶν γραμματέων, τῶν θελόντων ἐν στολαῖς περιπατεῖν, καὶ ἀσπασμοὺς ἐν ταῖς ἀγοραῖς,"
12,39,"καὶ πρωτοκαθεδρίας ἐν ταῖς συναγωγαῖς, καὶ πρωτοκλισίας ἐν τοῖς δείπνοις·"
12,40,"οἱ κατεσθίοντες τὰς οἰκίας τῶν χηρῶν, καὶ προφάσει μακρὰ προσευχόμενοι· οὗτοι λήψονται {Ν λήψονται > λήμψονται } περισσότερον κρίμα."
12,41,Καὶ καθίσας ὁ {Ν ὁ ʼΙησοῦς > - } ʼΙησοῦς κατέναντι τοῦ γαζοφυλακίου ἐθεώρει πῶς ὁ ὄχλος βάλλει χαλκὸν εἰς τὸ γαζοφυλάκιον· καὶ πολλοὶ πλούσιοι ἔβαλλον πολλά.
12,42,"Καὶ ἐλθοῦσα μία χήρα πτωχὴ ἔβαλεν λεπτὰ δύο, ὅ ἐστιν κοδράντης."
12,43,"Καὶ προσκαλεσάμενος τοὺς μαθητὰς αὐτοῦ, λέγει {Ν λέγει > εἶπεν } αὐτοῖς, ʼΑμὴν λέγω ὑμῖν ὅτι ἡ χήρα αὕτη ἡ πτωχὴ πλεῖον πάντων βέβληκεν {Ν βέβληκεν > ἔβαλεν } τῶν βαλλόντων {Β βαλλόντων > βαλόντων } εἰς τὸ γαζοφυλάκιον·"
12,44,"πάντες γὰρ ἐκ τοῦ περισσεύοντος αὐτοῖς ἔβαλον· αὕτη δὲ ἐκ τῆς ὑστερήσεως αὐτῆς πάντα ὅσα εἶχεν ἔβαλεν, ὅλον τὸν βίον αὐτῆς."
13,1,"Καὶ ἐκπορευομένου αὐτοῦ ἐκ τοῦ ἱεροῦ, λέγει αὐτῷ εἷς τῶν μαθητῶν αὐτοῦ, Διδάσκαλε, ἴδε, ποταποὶ λίθοι καὶ ποταπαὶ οἰκοδομαί."
13,2,"Καὶ ὁ ʼΙησοῦς ἀποκριθεὶς {Ν ἀποκριθεὶς > - } εἶπεν αὐτῷ, Βλέπεις ταύτας τὰς μεγάλας οἰκοδομάς; Οὐ μὴ ἀφεθῇ λίθος {Ν λίθος ἐπὶ λίθῳ > ὧδε λίθος ἐπὶ λίθον } ἐπὶ λίθῳ, ὃς οὐ μὴ καταλυθῇ."
13,3,"Καὶ καθημένου αὐτοῦ εἰς τὸ ὄρος τῶν ʼΕλαιῶν κατέναντι τοῦ ἱεροῦ, ἐπηρώτων {Ν ἐπηρώτων > ἐπηρώτα } αὐτὸν κατ' ἰδίαν Πέτρος καὶ ʼΙάκωβος καὶ ʼΙωάννης καὶ ʼΑνδρέας,"
13,4,"Εἰπὲ {Ν Εἰπὲ > Εἰπὸν } ἡμῖν, πότε ταῦτα ἔσται; Καὶ τί τὸ σημεῖον ὅταν μέλλῃ πάντα {Ν πάντα ταῦτα συντελεῖσθαι > ταῦτα συντελεῖσθαι πάντα } ταῦτα συντελεῖσθαι;"
13,5,"ʽΟ δὲ ʼΙησοῦς ἀποκριθεὶς {Ν ἀποκριθεὶς αὐτοῖς ἤρξατο λέγειν > ἤρξατο λέγειν αὐτοῖς } αὐτοῖς ἤρξατο λέγειν, Βλέπετε μή τις ὑμᾶς πλανήσῃ."
13,6,"Πολλοὶ γὰρ {Ν γὰρ > - } ἐλεύσονται ἐπὶ τῷ ὀνόματί μου, λέγοντες ὅτι ʼΕγώ εἰμι· καὶ πολλοὺς πλανήσουσιν."
13,7,"ʽΌταν δὲ ἀκούσητε πολέμους καὶ ἀκοὰς πολέμων, μὴ θροεῖσθε· δεῖ γὰρ {Ν γὰρ > - } γενέσθαι, ἀλλ' οὔπω τὸ τέλος."
13,8,"ʼΕγερθήσεται γὰρ ἔθνος ἐπὶ {Ν ἐπὶ ἔθνος > ἐπ' ἔθνος } ἔθνος, καὶ βασιλεία ἐπὶ βασιλείαν· καὶ {Ν καὶ ἔσονται σεισμοὶ > ἔσονται σεισμοὶ } ἔσονται σεισμοὶ κατὰ τόπους, καὶ {Ν καὶ ἔσονται λιμοὶ καὶ ταραχαί ἀρχαὶ > ἔσονται λιμοί ἀρχὴ } ἔσονται λιμοὶ καὶ ταραχαί· ἀρχαὶ ὠδίνων ταῦτα."
13,9,"Βλέπετε δὲ ὑμεῖς ἑαυτούς· παραδώσουσιν γὰρ {Ν γὰρ > - } ὑμᾶς εἰς συνέδρια, καὶ εἰς συναγωγὰς δαρήσεσθε, καὶ ἐπὶ ἡγεμόνων καὶ βασιλέων σταθήσεσθε ἕνεκεν ἐμοῦ, εἰς μαρτύριον αὐτοῖς."
13,10,Καὶ εἰς πάντα τὰ ἔθνη δεῖ {Ν δεῖ πρῶτον > πρῶτον δεῖ } πρῶτον κηρυχθῆναι τὸ εὐαγγέλιον.
13,11,"ʽΌταν {Ν ʽΌταν δὲ ἀγάγωσιν > Καὶ ὅταν ἄγωσιν } δὲ ἀγάγωσιν ὑμᾶς παραδιδόντες, μὴ προμεριμνᾶτε τί λαλήσητε, μηδὲ {Ν μηδὲ μελετᾶτε > - } μελετᾶτε· ἀλλ' ὃ ἐὰν δοθῇ ὑμῖν ἐν ἐκείνῃ τῇ ὥρᾳ, τοῦτο λαλεῖτε· οὐ γάρ ἐστε ὑμεῖς οἱ λαλοῦντες, ἀλλὰ τὸ πνεῦμα τὸ ἅγιον."
13,12,"Παραδώσει {Ν Παραδώσει δὲ > Καὶ παραδώσει } δὲ ἀδελφὸς ἀδελφὸν εἰς θάνατον, καὶ πατὴρ τέκνον· καὶ ἐπαναστήσονται τέκνα ἐπὶ γονεῖς, καὶ θανατώσουσιν αὐτούς."
13,13,"Καὶ ἔσεσθε μισούμενοι ὑπὸ πάντων διὰ τὸ ὄνομά μου· ὁ δὲ ὑπομείνας εἰς τέλος, οὗτος σωθήσεται."
