chapter,verse,text
5,27,"ἀκούσασα περὶ τοῦ ʼΙησοῦ, ἐλθοῦσα ἐν τῷ ὄχλῳ ὄπισθεν, ἥψατο τοῦ ἱματίου αὐτοῦ·"
5,28,"ἔλεγεν γὰρ ὅτι Κἂν {Ν Κἂν > ʼΕὰν ἅψωμαι κἂν } τῶν ἱματίων αὐτοῦ ἅψωμαι, {Ν ἅψωμαι > - } σωθήσομαι."
5,29,"Καὶ εὐθέως {Ν εὐθέως > εὐθὺς } ἐξηράνθη ἡ πηγὴ τοῦ αἵματος αὐτῆς, καὶ ἔγνω τῷ σώματι ὅτι ἴαται ἀπὸ τῆς μάστιγος."
5,30,"Καὶ εὐθέως {Ν εὐθέως > εὐθὺς } ὁ ʼΙησοῦς ἐπιγνοὺς ἐν ἑαυτῷ τὴν ἐξ αὐτοῦ δύναμιν ἐξελθοῦσαν, ἐπιστραφεὶς ἐν τῷ ὄχλῳ, ἔλεγεν, Τίς μου ἥψατο τῶν ἱματίων;"
5,31,"Καὶ ἔλεγον αὐτῷ οἱ μαθηταὶ αὐτοῦ, Βλέπεις τὸν ὄχλον συνθλίβοντά σε, καὶ λέγεις, Τίς μου ἥψατο;"
5,32,Καὶ περιεβλέπετο ἰδεῖν τὴν τοῦτο ποιήσασαν.
5,33,"ʽΗ δὲ γυνὴ φοβηθεῖσα καὶ τρέμουσα, εἰδυῖα ὃ γέγονεν ἐπ' {Ν ἐπ' > - } αὐτῇ, ἦλθεν καὶ προσέπεσεν αὐτῷ, καὶ εἶπεν αὐτῷ πᾶσαν τὴν ἀλήθειαν."
5,34,"ʽΟ δὲ εἶπεν αὐτῇ, Θύγατερ, {Ν Θύγατερ > Θυγάτηρ } ἡ πίστις σου σέσωκέν σε· ὕπαγε εἰς εἰρήνην, καὶ ἴσθι ὑγιὴς ἀπὸ τῆς μάστιγός σου."
5,35,"ʼΈτι αὐτοῦ λαλοῦντος, ἔρχονται ἀπὸ τοῦ ἀρχισυναγώγου, λέγοντες ὅτι ʽΗ θυγάτηρ σου ἀπέθανεν· τί ἔτι σκύλλεις τὸν διδάσκαλον;"
5,36,"ʽΟ δὲ ʼΙησοῦς εὐθέως {Ν εὐθέως ἀκούσας > παρακούσας } ἀκούσας τὸν λόγον λαλούμενον λέγει τῷ ἀρχισυναγώγῳ, Μὴ φοβοῦ· μόνον πίστευε."
5,37,"Καὶ οὐκ ἀφῆκεν οὐδένα αὐτῷ {Ν αὐτῷ > μετ' αὐτοῦ } συνακολουθῆσαι, εἰ μὴ Πέτρον {Ν Πέτρον > τὸν Πέτρον } καὶ ʼΙάκωβον καὶ ʼΙωάννην τὸν ἀδελφὸν ʼΙακώβου."
5,38,"Καὶ ἔρχεται {Ν ἔρχεται > ἔρχονται } εἰς τὸν οἶκον τοῦ ἀρχισυναγώγου, καὶ θεωρεῖ θόρυβον, κλαίοντας {Ν κλαίοντας > καὶ κλαίοντας } καὶ ἀλαλάζοντας πολλά."
5,39,"Καὶ εἰσελθὼν λέγει αὐτοῖς, Τί θορυβεῖσθε καὶ κλαίετε; Τὸ παιδίον οὐκ ἀπέθανεν, ἀλλὰ καθεύδει."
5,40,"Καὶ κατεγέλων αὐτοῦ. ʽΟ {Ν ʽΟ > Αὐτὸς } δέ, ἐκβαλὼν πάντας, παραλαμβάνει τὸν πατέρα τοῦ παιδίου καὶ τὴν μητέρα καὶ τοὺς μετ' αὐτοῦ, καὶ εἰσπορεύεται ὅπου ἦν τὸ παιδίον ἀνακείμενον. {Ν ἀνακείμενον > - }"
5,41,"Καὶ κρατήσας τῆς χειρὸς τοῦ παιδίου, λέγει αὐτῇ, Ταλιθά, κοῦμι· {Ν κοῦμι > κοῦμ } ὅ ἐστιν μεθερμηνευόμενον, Τὸ κοράσιον, σοὶ λέγω, ἔγειραι. {Ν ἔγειραι > ἔγειρε }"
5,42,"Καὶ εὐθέως {Ν εὐθέως > εὐθὺς } ἀνέστη τὸ κοράσιον καὶ περιεπάτει, ἦν γὰρ ἐτῶν δώδεκα· καὶ ἐξέστησαν ἐκστάσει {Ν ἐκστάσει > [εὐθὺσ] ἐκστάσει } μεγάλῃ."
5,43,Καὶ διεστείλατο αὐτοῖς πολλὰ ἵνα μηδεὶς γνῷ {Ν γνῷ > γνοῖ } τοῦτο· καὶ εἶπεν δοθῆναι αὐτῇ φαγεῖν.
6,1,"Καὶ ἐξῆλθεν ἐκεῖθεν, καὶ ἦλθεν {Ν ἦλθεν > ἔρχεται } εἰς τὴν πατρίδα αὐτοῦ· καὶ ἀκολουθοῦσιν αὐτῷ οἱ μαθηταὶ αὐτοῦ."
6,2,"Καὶ γενομένου σαββάτου, ἤρξατο ἐν {Ν ἐν τῇ συναγωγῇ διδάσκειν > διδάσκειν ἐν τῇ συναγωγῇ } τῇ συναγωγῇ διδάσκειν· καὶ πολλοὶ ἀκούοντες ἐξεπλήσσοντο, λέγοντες, Πόθεν τούτῳ ταῦτα; Καὶ τίς ἡ σοφία ἡ δοθεῖσα αὐτῷ, {Ν αὐτῷ καὶ > τούτῳ καὶ αἱ } καὶ δυνάμεις τοιαῦται διὰ τῶν χειρῶν αὐτοῦ γίνονται; {Ν γίνονται > γινόμεναι }"
6,3,"Οὐχ οὗτός ἐστιν ὁ τέκτων, ὁ υἱὸς Μαρίας, {Ν Μαρίας > τῆς Μαρίας } ἀδελφὸς {Ν ἀδελφὸς δὲ > καὶ ἀδελφὸς } δὲ ʼΙακώβου καὶ ʼΙωσῆ {Ν ʼΙωσῆ > ʼΙωσῆτος } καὶ ʼΙούδα καὶ Σίμωνος; Καὶ οὐκ εἰσὶν αἱ ἀδελφαὶ αὐτοῦ ὧδε πρὸς ἡμᾶς; Καὶ ἐσκανδαλίζοντο ἐν αὐτῷ."
6,4,"ʼΈλεγεν {Ν ʼΈλεγεν δὲ > Καὶ ἔλεγεν } δὲ αὐτοῖς ὁ ʼΙησοῦς ὅτι Οὐκ ἔστιν προφήτης ἄτιμος, εἰ μὴ ἐν τῇ πατρίδι αὐτοῦ, καὶ ἐν τοῖς συγγενέσιν {Ν συγγενέσιν > συγγενεῦσιν αὐτοῦ } καὶ ἐν τῇ οἰκίᾳ αὐτοῦ."
6,5,"Καὶ οὐκ ἠδύνατο {Ν ἠδύνατο ἐκεῖ οὐδεμίαν δύναμιν ποιῆσαι > ἐδύνατο ἐκεῖ ποιῆσαι οὐδεμίαν δύναμιν } ἐκεῖ οὐδεμίαν δύναμιν ποιῆσαι, εἰ μὴ ὀλίγοις ἀρρώστοις ἐπιθεὶς τὰς χεῖρας, ἐθεράπευσεν."
6,6,Καὶ ἐθαύμαζεν διὰ τὴν ἀπιστίαν αὐτῶν.  Καὶ περιῆγεν τὰς κώμας κύκλῳ διδάσκων.
6,7,"Καὶ προσκαλεῖται τοὺς δώδεκα, καὶ ἤρξατο αὐτοὺς ἀποστέλλειν δύο δύο, καὶ ἐδίδου αὐτοῖς ἐξουσίαν τῶν πνευμάτων τῶν ἀκαθάρτων."
6,8,"Καὶ παρήγγειλεν αὐτοῖς ἵνα μηδὲν αἴρωσιν εἰς ὁδόν, εἰ μὴ ῥάβδον μόνον· μὴ πήραν, {Ν πήραν μὴ ἄρτον > ἄρτον μὴ πήραν } μὴ ἄρτον, μὴ εἰς τὴν ζώνην χαλκόν·"
6,9,ἀλλ' {Ν ἀλλ' > ἀλλὰ } ὑποδεδεμένους σανδάλια· καὶ μὴ ἐνδύσησθε δύο χιτῶνας.
6,10,"Καὶ ἔλεγεν αὐτοῖς, ʽΌπου ἐὰν εἰσέλθητε εἰς οἰκίαν, ἐκεῖ μένετε ἕως ἂν ἐξέλθητε ἐκεῖθεν."
6,11,"Καὶ ὅσοι {Ν ὅσοι ἂν μὴ δέξωνται > ὃς ἂν τόπος μὴ δέξηται } ἂν μὴ δέξωνται ὑμᾶς, μηδὲ ἀκούσωσιν ὑμῶν, ἐκπορευόμενοι ἐκεῖθεν, ἐκτινάξατε τὸν χοῦν τὸν ὑποκάτω τῶν ποδῶν ὑμῶν εἰς μαρτύριον αὐτοῖς. ʼΑμὴν {Ν ʼΑμὴν λέγω ὑμῖν ἀνεκτότερον ἔσται Σοδόμοις ἢ Γομόρροις ἐν ἡμέρᾳ κρίσεως ἢ τῇ πόλει ἐκείνῃ > - } λέγω ὑμῖν, ἀνεκτότερον ἔσται Σοδόμοις ἢ Γομόρροις ἐν ἡμέρᾳ κρίσεως, ἢ τῇ πόλει ἐκείνῃ."
6,12,Καὶ ἐξελθόντες ἐκήρυσσον {Ν ἐκήρυσσον ἵνα μετανοήσωσιν > ἐκήρυξαν ἵνα μετανοῶσιν } ἵνα μετανοήσωσιν·
6,13,"καὶ δαιμόνια πολλὰ ἐξέβαλλον, καὶ ἤλειφον ἐλαίῳ πολλοὺς ἀρρώστους καὶ ἐθεράπευον."
6,14,"Καὶ ἤκουσεν ὁ βασιλεὺς ʽΗρῴδης, φανερὸν γὰρ ἐγένετο τὸ ὄνομα αὐτοῦ, καὶ ἔλεγεν {Ν ἔλεγεν > ἔλεγον } ὅτι ʼΙωάννης ὁ βαπτίζων ἐκ {Ν ἐκ νεκρῶν ἠγέρθη > ἐγήγερται ἐκ νεκρῶν } νεκρῶν ἠγέρθη, καὶ διὰ τοῦτο ἐνεργοῦσιν αἱ δυνάμεις ἐν αὐτῷ."
6,15,"ʼΆλλοι ἔλεγον {Ν ʼΆλλοι ἔλεγον > ʼΆλλοι δὲ ἔλεγον } ὅτι ʼΗλίας ἐστίν· ἄλλοι δὲ ἔλεγον ὅτι Προφήτης ἐστίν, {Ν ἐστίν ὡς > ὡς } ὡς εἷς τῶν προφητῶν."
6,16,"ʼΑκούσας δὲ ʽΗρῴδης {Β ʽΗρῴδης > ὁ ʽΗρῴδης } {Ν ʽΗρῴδης εἶπεν ὅτι > ὁ ʽΗρῴδης ἔλεγεν } εἶπεν ὅτι ʽῸν ἐγὼ ἀπεκεφάλισα ʼΙωάννην, οὗτός ἐστιν· {Ν ἐστιν αὐτὸς ἠγέρθη ἐκ νεκρῶν > ἠγέρθη } αὐτὸς ἠγέρθη ἐκ νεκρῶν."
6,17,"Αὐτὸς γὰρ ὁ ʽΗρῴδης ἀποστείλας ἐκράτησεν τὸν ʼΙωάννην, καὶ ἔδησεν αὐτὸν ἐν φυλακῇ, διὰ ʽΗρῳδιάδα τὴν γυναῖκα Φιλίππου τοῦ ἀδελφοῦ αὐτοῦ, ὅτι αὐτὴν ἐγάμησεν."
6,18,ʼΈλεγεν γὰρ ὁ ʼΙωάννης τῷ ʽΗρῴδῃ ὅτι Οὐκ ἔξεστίν σοι ἔχειν τὴν γυναῖκα τοῦ ἀδελφοῦ σου.
6,19,"ʽΗ δὲ ʽΗρῳδιὰς ἐνεῖχεν αὐτῷ, καὶ ἤθελεν αὐτὸν ἀποκτεῖναι· καὶ οὐκ ἠδύνατο·"
6,20,"ὁ γὰρ ʽΗρῴδης ἐφοβεῖτο τὸν ʼΙωάννην, εἰδὼς αὐτὸν ἄνδρα δίκαιον καὶ ἅγιον, καὶ συνετήρει αὐτόν· καὶ ἀκούσας αὐτοῦ, πολλὰ ἐποίει, {Ν ἐποίει > ἠπόρει } καὶ ἡδέως αὐτοῦ ἤκουεν."
6,21,"Καὶ γενομένης ἡμέρας εὐκαίρου, ὅτε ʽΗρῴδης τοῖς γενεσίοις αὐτοῦ δεῖπνον ἐποίει {Ν ἐποίει > ἐποίησεν } τοῖς μεγιστᾶσιν αὐτοῦ καὶ τοῖς χιλιάρχοις καὶ τοῖς πρώτοις τῆς Γαλιλαίας,"
6,22,"καὶ εἰσελθούσης τῆς θυγατρὸς αὐτῆς {Ν αὐτῆς τῆς > αὐτοῦ } τῆς ʽΗρῳδιάδος καὶ ὀρχησαμένης, καὶ {Ν καὶ ἀρεσάσης > ἤρεσεν } ἀρεσάσης τῷ ʽΗρῴδῃ καὶ τοῖς συνανακειμένοις, εἶπεν ὁ βασιλεὺς τῷ κορασίῳ, Αἴτησόν με ὃ ἐὰν θέλῃς, καὶ δώσω σοί·"
6,23,"καὶ ὤμοσεν αὐτῇ ὅτι {Ν ὅτι ʽῸ > [πολλὰ] ʽΌ τι } ʽῸ ἐάν με αἰτήσῃς, δώσω σοί, ἕως ἡμίσους τῆς βασιλείας μου."
6,24,"ʽΗ {Ν ʽΗ δὲ ἐξελθοῦσα > Καὶ ἐξελθοῦσα } δὲ ἐξελθοῦσα εἶπεν τῇ μητρὶ αὐτῆς, Τί αἰτήσομαι; {Ν αἰτήσομαι > αἰτήσωμαι } ʽΗ δὲ εἶπεν, Τὴν κεφαλὴν ʼΙωάννου τοῦ βαπτιστοῦ. {Ν βαπτιστοῦ > βαπτίζοντος }"
6,25,"Καὶ εἰσελθοῦσα εὐθέως {Ν εὐθέως > εὐθὺς } μετὰ σπουδῆς πρὸς τὸν βασιλέα, ᾐτήσατο, λέγουσα, Θέλω ἵνα μοι {Ν μοι δῷς ἐξαυτῆς > ἐξαυτῆς δῷς μοι } δῷς ἐξαυτῆς ἐπὶ πίνακι τὴν κεφαλὴν ʼΙωάννου τοῦ βαπτιστοῦ."
6,26,"Καὶ περίλυπος γενόμενος ὁ βασιλεύς, διὰ τοὺς ὅρκους καὶ τοὺς συνανακειμένους {Ν συνανακειμένους > ἀνακειμένους } οὐκ ἠθέλησεν αὐτὴν {Ν αὐτὴν ἀθετῆσαι > ἀθετῆσαι αὐτήν } ἀθετῆσαι."
6,27,Καὶ εὐθέως {Ν εὐθέως > εὐθὺς } ἀποστείλας ὁ βασιλεὺς σπεκουλάτορα ἐπέταξεν ἐνεχθῆναι {Ν ἐνεχθῆναι > ἐνέγκαι } τὴν κεφαλὴν αὐτοῦ.
6,28,"ʽΟ {Ν ʽΟ δὲ > Καὶ } δὲ ἀπελθὼν ἀπεκεφάλισεν αὐτὸν ἐν τῇ φυλακῇ, καὶ ἤνεγκεν τὴν κεφαλὴν αὐτοῦ ἐπὶ πίνακι, καὶ ἔδωκεν αὐτὴν τῷ κορασίῳ· καὶ τὸ κοράσιον ἔδωκεν αὐτὴν τῇ μητρὶ αὐτῆς."
6,29,"Καὶ ἀκούσαντες οἱ μαθηταὶ αὐτοῦ ἦλθον, καὶ ἦραν τὸ πτῶμα αὐτοῦ, καὶ ἔθηκαν αὐτὸ ἐν μνημείῳ."
6,30,"Καὶ συνάγονται οἱ ἀπόστολοι πρὸς τὸν ʼΙησοῦν, καὶ ἀπήγγειλαν αὐτῷ πάντα, καὶ {Ν πάντα καὶ > πάντα } ὅσα ἐποίησαν καὶ ὅσα ἐδίδαξαν."
6,31,"Καὶ εἶπεν {Ν εἶπεν > λέγει } αὐτοῖς, Δεῦτε ὑμεῖς αὐτοὶ κατ' ἰδίαν εἰς ἔρημον τόπον, καὶ ἀναπαύεσθε {Ν ἀναπαύεσθε > ἀναπαύσασθε } ὀλίγον. ʼ ͂Ησαν γὰρ οἱ ἐρχόμενοι καὶ οἱ ὑπάγοντες πολλοί, καὶ οὐδὲ φαγεῖν εὐκαίρουν."
6,32,Καὶ ἀπῆλθον εἰς {Ν εἰς ἔρημον τόπον τῷ πλοίῳ > ἐν τῷ πλοίῳ εἰς ἔρημον τόπον } ἔρημον τόπον τῷ πλοίῳ κατ' ἰδίαν.
6,33,"Καὶ εἶδον αὐτοὺς ὑπάγοντας καὶ ἐπέγνωσαν αὐτὸν {Ν αὐτὸν πολλοί > πολλοί } πολλοί, καὶ πεζῇ ἀπὸ πασῶν τῶν πόλεων συνέδραμον ἐκεῖ, καὶ προῆλθον αὐτούς, καὶ {Ν καὶ συνῆλθον πρὸς αὐτόν > - } συνῆλθον πρὸς αὐτόν."
6,34,"Καὶ ἐξελθὼν εἶδεν ὁ {Ν ὁ ʼΙησοῦς > - } ʼΙησοῦς πολὺν ὄχλον, καὶ ἐσπλαγχνίσθη ἐπ' αὐτοῖς, {Ν αὐτοῖς > αὐτούς } ὅτι ἦσαν ὡς πρόβατα μὴ ἔχοντα ποιμένα· καὶ ἤρξατο διδάσκειν αὐτοὺς πολλά."
6,35,"Καὶ ἤδη ὥρας πολλῆς γενομένης, προσελθόντες αὐτῷ οἱ μαθηταὶ αὐτοῦ λέγουσιν {Ν λέγουσιν > ἔλεγον } ὅτι ʼΈρημός ἐστιν ὁ τόπος, καὶ ἤδη ὥρα πολλή·"
6,36,"ἀπόλυσον αὐτούς, ἵνα ἀπελθόντες εἰς τοὺς κύκλῳ ἀγροὺς καὶ κώμας ἀγοράσωσιν ἑαυτοῖς ἄρτους. {Ν ἄρτους Τί γὰρ φάγωσιν οὐκ ἔχουσιν > τί φάγωσιν } Τί γὰρ φάγωσιν οὐκ ἔχουσιν."
6,37,"ʽΟ δὲ ἀποκριθεὶς εἶπεν αὐτοῖς, Δότε αὐτοῖς ὑμεῖς φαγεῖν. Καὶ λέγουσιν αὐτῷ, ʼΑπελθόντες ἀγοράσωμεν δηναρίων διακοσίων ἄρτους, καὶ δῶμεν {Ν δῶμεν > δώσομεν } αὐτοῖς φαγεῖν;"
6,38,"ʽΟ δὲ λέγει αὐτοῖς, Πόσους ἄρτους ἔχετε; ʽΥπάγετε καὶ {Ν καὶ ἴδετε > ἴδετε } ἴδετε. Καὶ γνόντες λέγουσιν, Πέντε, καὶ δύο ἰχθύας."
6,39,Καὶ ἐπέταξεν αὐτοῖς ἀνακλῖναι πάντας συμπόσια συμπόσια ἐπὶ τῷ χλωρῷ χόρτῳ.
6,40,"Καὶ ἀνέπεσον {Ν ἀνέπεσον > ἀνέπεσαν } πρασιαὶ πρασιαί, ἀνὰ {Ν ἀνὰ ἑκατὸν καὶ ἀνὰ > κατὰ ἑκατὸν καὶ κατὰ } ἑκατὸν καὶ ἀνὰ πεντήκοντα."
6,41,"Καὶ λαβὼν τοὺς πέντε ἄρτους καὶ τοὺς δύο ἰχθύας, ἀναβλέψας εἰς τὸν οὐρανόν, εὐλόγησεν, καὶ κατέκλασεν τοὺς ἄρτους, καὶ ἐδίδου τοῖς μαθηταῖς αὐτοῦ {Ν αὐτοῦ > [αὐτοῦ] } ἵνα παραθῶσιν {Ν παραθῶσιν > παρατιθῶσιν } αὐτοῖς· καὶ τοὺς δύο ἰχθύας ἐμέρισεν πᾶσιν."
6,42,"Καὶ ἔφαγον πάντες, καὶ ἐχορτάσθησαν·"
6,43,"καὶ ἦραν κλασμάτων {Ν κλασμάτων δώδεκα κοφίνους πλήρεις > κλάσματα δώδεκα κοφίνων πληρώματα } δώδεκα κοφίνους πλήρεις, καὶ ἀπὸ τῶν ἰχθύων."
6,44,Καὶ ἦσαν οἱ φαγόντες τοὺς {Ν τοὺς ἄρτους > [τοὺς ἄρτουσ] } ἄρτους πεντακισχίλιοι ἄνδρες.
6,45,"Καὶ εὐθέως {Ν εὐθέως > εὐθὺς } ἠνάγκασεν τοὺς μαθητὰς αὐτοῦ ἐμβῆναι εἰς τὸ πλοῖον, καὶ προάγειν εἰς τὸ πέραν πρὸς Βηθσαϊδάν, ἕως αὐτὸς ἀπολύσῃ {Ν ἀπολύσῃ > ἀπολύει } τὸν ὄχλον."
6,46,"Καὶ ἀποταξάμενος αὐτοῖς, ἀπῆλθεν εἰς τὸ ὄρος προσεύξασθαι."
6,47,"Καὶ ὀψίας γενομένης, ἦν τὸ πλοῖον ἐν μέσῳ τῆς θαλάσσης, καὶ αὐτὸς μόνος ἐπὶ τῆς γῆς."
6,48,"Καὶ εἶδεν {Ν εἶδεν > ἰδὼν } αὐτοὺς βασανιζομένους ἐν τῷ ἐλαύνειν, ἦν γὰρ ὁ ἄνεμος ἐναντίος αὐτοῖς, καὶ {Ν καὶ περὶ > περὶ } περὶ τετάρτην φυλακὴν τῆς νυκτὸς ἔρχεται πρὸς αὐτούς, περιπατῶν ἐπὶ τῆς θαλάσσης· καὶ ἤθελεν παρελθεῖν αὐτούς."
6,49,"Οἱ δέ, ἰδόντες αὐτὸν περιπατοῦντα {Ν περιπατοῦντα ἐπὶ τῆς θαλάσσης > ἐπὶ τῆς θαλάσσης περιπατοῦντα } ἐπὶ τῆς θαλάσσης, ἔδοξαν φάντασμα {Ν φάντασμα εἶναι > ὅτι Φάντασμά ἐστιν } εἶναι, καὶ ἀνέκραξαν·"
6,50,"πάντες γὰρ αὐτὸν εἶδον, καὶ ἐταράχθησαν. Καὶ {Ν Καὶ εὐθέως > ʽΟ δὲ εὐθὺς } εὐθέως ἐλάλησεν μετ' αὐτῶν, καὶ λέγει αὐτοῖς, Θαρσεῖτε· ἐγώ εἰμι, μὴ φοβεῖσθε."
6,51,"Καὶ ἀνέβη πρὸς αὐτοὺς εἰς τὸ πλοῖον, καὶ ἐκόπασεν ὁ ἄνεμος· καὶ λίαν ἐκπερισσοῦ {Ν ἐκπερισσοῦ > [ἐκ περισσοῦ] } ἐν ἑαυτοῖς ἐξίσταντο, καὶ {Ν καὶ ἐθαύμαζον > - } ἐθαύμαζον."
6,52,Οὐ γὰρ συνῆκαν ἐπὶ τοῖς ἄρτοις· ἦν {Ν ἦν γὰρ > ἀλλ' ἦν } γὰρ αὐτῶν ἡ καρδία πεπωρωμένη.
6,53,"Καὶ διαπεράσαντες ἦλθον {Ν ἦλθον ἐπὶ τὴν γῆν > ἐπὶ τὴν γῆν ἦλθον εἰς } ἐπὶ τὴν γῆν Γεννησαρέτ, καὶ προσωρμίσθησαν."
6,54,"Καὶ ἐξελθόντων αὐτῶν ἐκ τοῦ πλοίου, εὐθέως {Ν εὐθέως > εὐθὺς } ἐπιγνόντες αὐτόν,"
6,55,"περιδραμόντες {Ν περιδραμόντες > περιέδραμον } ὅλην τὴν περίχωρον {Ν περίχωρον > χώραν } ἐκείνην, ἤρξαντο {Ν ἤρξαντο > καὶ ἤρξαντο } ἐπὶ τοῖς κραββάτοις {Ν κραββάτοις > κραβάττοις } τοὺς κακῶς ἔχοντας περιφέρειν, ὅπου ἤκουον ὅτι ἐκεῖ {Ν ἐκεῖ > - } ἐστιν."
6,56,"Καὶ ὅπου ἂν εἰσεπορεύετο εἰς κώμας ἢ πόλεις {Ν πόλεις ἢ > εἰς πόλεις ἢ εἰς } ἢ ἀγρούς, ἐν ταῖς ἀγοραῖς ἐτίθουν {Ν ἐτίθουν > ἐτίθεσαν } τοὺς ἀσθενοῦντας, καὶ παρεκάλουν αὐτὸν ἵνα κἂν τοῦ κρασπέδου τοῦ ἱματίου αὐτοῦ ἅψωνται· καὶ ὅσοι ἂν ἥπτοντο {Ν ἥπτοντο > ἥψαντο } αὐτοῦ ἐσῴζοντο."
7,1,"Καὶ συνάγονται πρὸς αὐτὸν οἱ Φαρισαῖοι, καί τινες τῶν γραμματέων, ἐλθόντες ἀπὸ ʽΙεροσολύμων·"
7,2,"καὶ ἰδόντες τινὰς τῶν μαθητῶν αὐτοῦ κοιναῖς {Ν κοιναῖς > ὅτι κοιναῖς } χερσίν, τοῦτ' ἔστιν ἀνίπτοις, ἐσθίοντας {Ν ἐσθίοντας ἄρτους ἐμέμψαντο > ἐσθίουσιν τοὺς ἄρτους } ἄρτους ἐμέμψαντο."
7,3,"Οἱ γὰρ Φαρισαῖοι καὶ πάντες οἱ ʼΙουδαῖοι, ἐὰν μὴ πυγμῇ νίψωνται τὰς χεῖρας, οὐκ ἐσθίουσιν, κρατοῦντες τὴν παράδοσιν τῶν πρεσβυτέρων·"
7,4,"καὶ ἀπὸ {Ν ἀπὸ > ἀπ' } ἀγορᾶς, ἐὰν μὴ βαπτίσωνται, οὐκ ἐσθίουσιν· καὶ ἄλλα πολλά ἐστιν ἃ παρέλαβον κρατεῖν, βαπτισμοὺς ποτηρίων καὶ ξεστῶν καὶ χαλκίων καὶ {Ν καὶ κλινῶν > [καὶ κλινῶν] } κλινῶν."
7,5,"ʼΈπειτα {Ν ʼΈπειτα > Καὶ } ἐπερωτῶσιν αὐτὸν οἱ Φαρισαῖοι καὶ οἱ γραμματεῖς, Διὰ τί οἱ {Ν οἱ μαθηταί σου οὐ περιπατοῦσιν > οὐ περιπατοῦσιν οἱ μαθηταί σου } μαθηταί σου οὐ περιπατοῦσιν κατὰ τὴν παράδοσιν τῶν πρεσβυτέρων, ἀλλὰ ἀνίπτοις {Ν ἀνίπτοις > κοιναῖς } χερσὶν ἐσθίουσιν τὸν ἄρτον;"
7,6,"ʽΟ δὲ ἀποκριθεὶς {Ν ἀποκριθεὶς > - } εἶπεν αὐτοῖς ὅτι {Ν ὅτι > - } Καλῶς προεφήτευσεν {Ν προεφήτευσεν > ἐπροφήτευσεν } ʼΗσαϊ ́ας περὶ ὑμῶν τῶν ὑποκριτῶν, ὡς γέγραπται, Οὗτος {Ν Οὗτος > [ὅτι] Οὗτος } ὁ λαὸς τοῖς χείλεσίν με τιμᾷ, ἡ δὲ καρδία αὐτῶν πόρρω ἀπέχει ἀπ' ἐμοῦ."
7,7,"Μάτην δὲ σέβονταί με, διδάσκοντες διδασκαλίας ἐντάλματα ἀνθρώπων."
7,8,"ʼΑφέντες γὰρ {Ν γὰρ > - } τὴν ἐντολὴν τοῦ θεοῦ, κρατεῖτε τὴν παράδοσιν τῶν ἀνθρώπων, βαπτισμοὺς {Ν βαπτισμοὺς ξεστῶν καὶ ποτηρίων καὶ ἄλλα παρόμοια τοιαῦτα πολλὰ ποιεῖτε > - } ξεστῶν καὶ ποτηρίων· καὶ ἄλλα παρόμοια τοιαῦτα πολλὰ ποιεῖτε."
7,9,"Καὶ ἔλεγεν αὐτοῖς, Καλῶς ἀθετεῖτε τὴν ἐντολὴν τοῦ θεοῦ, ἵνα τὴν παράδοσιν ὑμῶν τηρήσητε. {Ν τηρήσητε > στήσητε }"
7,10,"Μωσῆς {Ν Μωσῆς > Μωϋσῆς } γὰρ εἶπεν, Τίμα τὸν πατέρα σου καὶ τὴν μητέρα σου· καί, ʽΟ κακολογῶν πατέρα ἢ μητέρα θανάτῳ τελευτάτω·"
7,11,"ὑμεῖς δὲ λέγετε, ʼΕὰν εἴπῃ ἄνθρωπος τῷ πατρὶ ἢ τῇ μητρί, Κορβᾶν, ὅ ἐστιν, δῶρον, ὃ ἐὰν ἐξ ἐμοῦ ὠφεληθῇς·"
7,12,"καὶ {Ν καὶ > - } οὐκέτι ἀφίετε αὐτὸν οὐδὲν ποιῆσαι τῷ πατρὶ αὐτοῦ {Ν αὐτοῦ ἢ > ἢ } ἢ τῇ μητρὶ αὐτοῦ, {Ν μητρὶ αὐτοῦ >  μητρί }"
7,13,ἀκυροῦντες τὸν λόγον τοῦ θεοῦ τῇ παραδόσει ὑμῶν ᾗ παρεδώκατε· καὶ παρόμοια τοιαῦτα πολλὰ ποιεῖτε.
7,14,"Καὶ προσκαλεσάμενος πάντα {Ν πάντα > πάλιν } τὸν ὄχλον, ἔλεγεν αὐτοῖς, ʼΑκούετέ {Ν ʼΑκούετέ > ʼΑκούσατέ } μου πάντες, καὶ συνίετε. {Ν συνίετε > σύνετε }"
