chapter,verse,text
6,50,"πάντες γὰρ αὐτὸν εἶδον, καὶ ἐταράχθησαν. Καὶ εὐθέως ἐλάλησεν μετ’ αὐτῶν, καὶ λέγει αὐτοῖς, Θαρσεῖτε· ἐγώ εἰμι, μὴ φοβεῖσθε."
6,51,"Καὶ ἀνέβη πρὸς αὐτοὺς εἰς τὸ πλοῖον, καὶ ἐκόπασεν ὁ ἄνεμος· καὶ λίαν ἐκπερισσοῦ ἐν ἑαυτοῖς ἐξίσταντο, καὶ ἐθαύμαζον."
6,52,Οὐ γὰρ συνῆκαν ἐπὶ τοῖς ἄρτοις· ἦν γὰρ αὐτῶν ἡ καρδία πεπωρωμένη.
6,53,"
Καὶ διαπεράσαντες ἦλθον ἐπὶ τὴν γῆν Γεννησαρέτ, καὶ προσωρμίσθησαν."
6,54,"Καὶ ἐξελθόντων αὐτῶν ἐκ τοῦ πλοίου, εὐθέως ἐπιγνόντες αὐτόν,"
6,55,"περιδραμόντες ὅλην τὴν περίχωρον ἐκείνην, ἤρξαντο ἐπὶ τοῖς κραββάτοις τοὺς κακῶς ἔχοντας περιφέρειν, ὅπου ἤκουον ὅτι ἐκεῖ ἐστιν."
6,56,"Καὶ ὅπου ἂν εἰσεπορεύετο εἰς κώμας ἢ πόλεις ἢ ἀγρούς, ἐν ταῖς ἀγοραῖς ἐτίθουν τοὺς ἀσθενοῦντας, καὶ παρεκάλουν αὐτὸν ἵνα κἂν τοῦ κρασπέδου τοῦ ἱματίου αὐτοῦ ἅψωνται· καὶ ὅσοι ἂν ἥπτοντο αὐτοῦ ἐσῴζοντο."
7,1,"Καὶ συνάγονται πρὸς αὐτὸν οἱ Φαρισαῖοι, καί τινες τῶν γραμματέων, ἐλθόντες ἀπὸ Ἱεροσολύμων·"
7,2,"καὶ ἰδόντες τινὰς τῶν μαθητῶν αὐτοῦ κοιναῖς χερσίν, τοῦτ’ ἔστιν ἀνίπτοις, ἐσθίοντας ἄρτους ἐμέμψαντο."
7,3,"Οἱ γὰρ Φαρισαῖοι καὶ πάντες οἱ Ἰουδαῖοι, ἐὰν μὴ πυγμῇ νίψωνται τὰς χεῖρας, οὐκ ἐσθίουσιν, κρατοῦντες τὴν παράδοσιν τῶν πρεσβυτέρων·"
7,4,"καὶ ἀπὸ ἀγορᾶς, ἐὰν μὴ βαπτίσωνται, οὐκ ἐσθίουσιν· καὶ ἄλλα πολλά ἐστιν ἃ παρέλαβον κρατεῖν, βαπτισμοὺς ποτηρίων καὶ ξεστῶν καὶ χαλκίων καὶ κλινῶν."
7,5,"Ἔπειτα ἐπερωτῶσιν αὐτὸν οἱ Φαρισαῖοι καὶ οἱ γραμματεῖς, Διὰ τί οἱ μαθηταί σου οὐ περιπατοῦσιν κατὰ τὴν παράδοσιν τῶν πρεσβυτέρων, ἀλλὰ ἀνίπτοις χερσὶν ἐσθίουσιν τὸν ἄρτον;"
7,6,"Ὁ δὲ ἀποκριθεὶς εἶπεν αὐτοῖς ὅτι Καλῶς προεφήτευσεν Ἠσαΐας περὶ ὑμῶν τῶν ὑποκριτῶν, ὡς γέγραπται, Οὗτος ὁ λαὸς τοῖς χείλεσίν με τιμᾷ, ἡ δὲ καρδία αὐτῶν πόρρω ἀπέχει ἀπ’ ἐμοῦ."
7,7,"Μάτην δὲ σέβονταί με, διδάσκοντες διδασκαλίας ἐντάλματα ἀνθρώπων."
7,8,"Ἀφέντες γὰρ τὴν ἐντολὴν τοῦ θεοῦ, κρατεῖτε τὴν παράδοσιν τῶν ἀνθρώπων, βαπτισμοὺς ξεστῶν καὶ ποτηρίων· καὶ ἄλλα παρόμοια τοιαῦτα πολλὰ ποιεῖτε."
7,9,"Καὶ ἔλεγεν αὐτοῖς, Καλῶς ἀθετεῖτε τὴν ἐντολὴν τοῦ θεοῦ, ἵνα τὴν παράδοσιν ὑμῶν τηρήσητε."
7,10,"Μωσῆς γὰρ εἶπεν, Τίμα τὸν πατέρα σου καὶ τὴν μητέρα σου· καί, Ὁ κακολογῶν πατέρα ἢ μητέρα θανάτῳ τελευτάτω·"
7,11,"ὑμεῖς δὲ λέγετε, Ἐὰν εἴπῃ ἄνθρωπος τῷ πατρὶ ἢ τῇ μητρί, Κορβᾶν, ὅ ἐστιν, δῶρον, ὃ ἐὰν ἐξ ἐμοῦ ὠφεληθῇς·"
7,12,"καὶ οὐκέτι ἀφίετε αὐτὸν οὐδὲν ποιῆσαι τῷ πατρὶ αὐτοῦ ἢ τῇ μητρὶ αὐτοῦ,"
7,13,ἀκυροῦντες τὸν λόγον τοῦ θεοῦ τῇ παραδόσει ὑμῶν ᾗ παρεδώκατε· καὶ παρόμοια τοιαῦτα πολλὰ ποιεῖτε.
7,14,"Καὶ προσκαλεσάμενος πάντα τὸν ὄχλον, ἔλεγεν αὐτοῖς, Ἀκούετέ μου πάντες, καὶ συνίετε."
7,15,"Οὐδέν ἐστιν ἔξωθεν τοῦ ἀνθρώπου εἰσπορευόμενον εἰς αὐτόν, ὃ δύναται αὐτὸν κοινῶσαι· ἀλλὰ τὰ ἐκπορευόμενα ἀπ’ αὐτοῦ, ἐκεῖνά ἐστιν τὰ κοινοῦντα τὸν ἄνθρωπον."
7,16,Εἴ τις ἔχει ὦτα ἀκούειν ἀκουέτω.
7,17,"Καὶ ὅτε εἰσῆλθεν εἰς οἶκον ἀπὸ τοῦ ὄχλου, ἐπηρώτων αὐτὸν οἱ μαθηταὶ αὐτοῦ περὶ τῆς παραβολῆς."
7,18,"Καὶ λέγει αὐτοῖς, Οὕτως καὶ ὑμεῖς ἀσύνετοί ἐστε; Οὐ νοεῖτε ὅτι πᾶν τὸ ἔξωθεν εἰσπορευόμενον εἰς τὸν ἄνθρωπον οὐ δύναται αὐτὸν κοινῶσαι,"
7,19,"ὅτι οὐκ εἰσπορεύεται αὐτοῦ εἰς τὴν καρδίαν, ἀλλ’ εἰς τὴν κοιλίαν, καὶ εἰς τὸν ἀφεδρῶνα ἐκπορεύεται, καθαρίζον πάντα τὰ βρώματα."
7,20,"Ἔλεγεν δὲ ὅτι Τὸ ἐκ τοῦ ἀνθρώπου ἐκπορευόμενον, ἐκεῖνο κοινοῖ τὸν ἄνθρωπον."
7,21,"Ἔσωθεν γάρ, ἐκ τῆς καρδίας τῶν ἀνθρώπων οἱ διαλογισμοὶ οἱ κακοὶ ἐκπορεύονται, μοιχεῖαι, πορνεῖαι, φόνοι,"
7,22,"κλοπαί, πλεονεξίαι, πονηρίαι, δόλος, ἀσέλγεια, ὀφθαλμὸς πονηρός, βλασφημία, ὑπερηφανία, ἀφροσύνη·"
7,23,"πάντα ταῦτα τὰ πονηρὰ ἔσωθεν ἐκπορεύεται, καὶ κοινοῖ τὸν ἄνθρωπον."
7,24,"
Καὶ ἐκεῖθεν ἀναστὰς ἀπῆλθεν εἰς τὰ μεθόρια Τύρου καὶ Σιδῶνος. Καὶ εἰσελθὼν εἰς οἰκίαν, οὐδένα ἤθελεν γνῶναι, καὶ οὐκ ἠδυνήθη λαθεῖν."
7,25,"Ἀκούσασα γὰρ γυνὴ περὶ αὐτοῦ, ἧς εἶχεν τὸ θυγάτριον αὐτῆς πνεῦμα ἀκάθαρτον, ἐλθοῦσα προσέπεσεν πρὸς τοὺς πόδας αὐτοῦ·"
7,26,"ἦν δὲ ἡ γυνὴ Ἑλληνίς, Συραφοινίκισσα τῷ γένει· καὶ ἠρώτα αὐτὸν ἵνα τὸ δαιμόνιον ἐκβάλῃ ἐκ τῆς θυγατρὸς αὐτῆς."
7,27,"Ὁ δὲ Ἰησοῦς εἶπεν αὐτῇ, Ἄφες πρῶτον χορτασθῆναι τὰ τέκνα· οὐ γὰρ καλόν ἐστιν λαβεῖν τὸν ἄρτον τῶν τέκνων καὶ βαλεῖν τοῖς κυναρίοις."
7,28,"Ἡ δὲ ἀπεκρίθη καὶ λέγει αὐτῷ, Ναί, κύριε· καὶ γὰρ τὰ κυνάρια ὑποκάτω τῆς τραπέζης ἐσθίει ἀπὸ τῶν ψιχίων τῶν παιδίων."
7,29,"Καὶ εἶπεν αὐτῇ, Διὰ τοῦτον τὸν λόγον ὕπαγε· ἐξελήλυθεν τὸ δαιμόνιον ἐκ τῆς θυγατρός σου."
7,30,"Καὶ ἀπελθοῦσα εἰς τὸν οἶκον αὐτῆς, εὗρεν τὸ δαιμόνιον ἐξεληλυθός, καὶ τὴν θυγατέρα βεβλημένην ἐπὶ τῆς κλίνης."
7,31,"
Καὶ πάλιν ἐξελθὼν ἐκ τῶν ὁρίων Τύρου καὶ Σιδῶνος, ἦλθεν πρὸς τὴν θάλασσαν τῆς Γαλιλαίας, ἀνὰ μέσον τῶν ὁρίων Δεκαπόλεως."
7,32,"Καὶ φέρουσιν αὐτῷ κωφὸν μογγιλάλον, καὶ παρακαλοῦσιν αὐτὸν ἵνα ἐπιθῇ αὐτῷ τὴν χεῖρα."
7,33,"Καὶ ἀπολαβόμενος αὐτὸν ἀπὸ τοῦ ὄχλου κατ’ ἰδίαν, ἔβαλεν τοὺς δακτύλους αὐτοῦ εἰς τὰ ὦτα αὐτοῦ, καὶ πτύσας ἥψατο τῆς γλώσσης αὐτοῦ,"
7,34,"καὶ ἀναβλέψας εἰς τὸν οὐρανόν, ἐστέναξεν, καὶ λέγει αὐτῷ, Ἐφφαθά, ὅ ἐστιν, Διανοίχθητι."
7,35,"Καὶ εὐθέως διηνοίχθησαν αὐτοῦ αἱ ἀκοαί· καὶ ἐλύθη ὁ δεσμὸς τῆς γλώσσης αὐτοῦ, καὶ ἐλάλει ὀρθῶς."
7,36,"Καὶ διεστείλατο αὐτοῖς ἵνα μηδενὶ εἴπωσιν· ὅσον δὲ αὐτὸς αὐτοῖς διεστέλλετο, μᾶλλον περισσότερον ἐκήρυσσον."
7,37,"Καὶ ὑπερπερισσῶς ἐξεπλήσσοντο, λέγοντες, Καλῶς πάντα πεποίηκεν· καὶ τοὺς κωφοὺς ποιεῖ ἀκούειν, καὶ τοὺς ἀλάλους λαλεῖν."
8,1,"Ἐν ἐκείναις ταῖς ἡμέραις, παμπόλλου ὄχλου ὄντος, καὶ μὴ ἐχόντων τί φάγωσιν, προσκαλεσάμενος ὁ Ἰησοῦς τοὺς μαθητὰς αὐτοῦ λέγει αὐτοῖς,"
8,2,"Σπλαγχνίζομαι ἐπὶ τὸν ὄχλον, ὅτι ἤδη ἡμέραι τρεῖς προσμένουσίν μοι, καὶ οὐκ ἔχουσιν τί φάγωσιν·"
8,3,"καὶ ἐὰν ἀπολύσω αὐτοὺς νήστεις εἰς οἶκον αὐτῶν, ἐκλυθήσονται ἐν τῇ ὁδῷ· τινὲς γὰρ αὐτῶν μακρόθεν ἥκουσιν."
8,4,"Καὶ ἀπεκρίθησαν αὐτῷ οἱ μαθηταὶ αὐτοῦ, Πόθεν τούτους δυνήσεταί τις ὧδε χορτάσαι ἄρτων ἐπ’ ἐρημίας;"
8,5,"Καὶ ἐπηρώτα αὐτούς, Πόσους ἔχετε ἄρτους; Οἱ δὲ εἶπον, Ἑπτά."
8,6,"Καὶ παρήγγειλεν τῷ ὄχλῳ ἀναπεσεῖν ἐπὶ τῆς γῆς· καὶ λαβὼν τοὺς ἑπτὰ ἄρτους, εὐχαριστήσας ἔκλασεν καὶ ἐδίδου τοῖς μαθηταῖς αὐτοῦ, ἵνα παραθῶσιν· καὶ παρέθηκαν τῷ ὄχλῳ."
8,7,Καὶ εἶχον ἰχθύδια ὀλίγα· καὶ εὐλογήσας εἶπεν παραθεῖναι καὶ αὐτά.
8,8,"Ἔφαγον δέ, καὶ ἐχορτάσθησαν· καὶ ἦραν περισσεύματα κλασμάτων ἑπτὰ σπυρίδας."
8,9,Ἦσαν δὲ οἱ φαγόντες ὡς τετρακισχίλιοι· καὶ ἀπέλυσεν αὐτούς.
8,10,"Καὶ εὐθέως ἐμβὰς εἰς τὸ πλοῖον μετὰ τῶν μαθητῶν αὐτοῦ, ἦλθεν εἰς τὰ μέρη Δαλμανουθά."
8,11,"
Καὶ ἐξῆλθον οἱ Φαρισαῖοι, καὶ ἤρξαντο συζητεῖν αὐτῷ, ζητοῦντες παρ’ αὐτοῦ σημεῖον ἀπὸ τοῦ οὐρανοῦ, πειράζοντες αὐτόν."
8,12,"Καὶ ἀναστενάξας τῷ πνεύματι αὐτοῦ λέγει, Τί ἡ γενεὰ αὕτη σημεῖον ἐπιζητεῖ; Ἀμὴν λέγω ὑμῖν, εἰ δοθήσεται τῇ γενεᾷ ταύτῃ σημεῖον."
8,13,"Καὶ ἀφεὶς αὐτούς, ἐμβὰς πάλιν εἰς πλοῖον, ἀπῆλθεν εἰς τὸ πέραν."
8,14,"
Καὶ ἐπελάθοντο λαβεῖν ἄρτους, καὶ εἰ μὴ ἕνα ἄρτον οὐκ εἶχον μεθ’ ἑαυτῶν ἐν τῷ πλοίῳ."
8,15,"Καὶ διεστέλλετο αὐτοῖς, λέγων, Ὁρᾶτε, βλέπετε ἀπὸ τῆς ζύμης τῶν Φαρισαίων καὶ τῆς ζύμης Ἡρῴδου."
8,16,"Καὶ διελογίζοντο πρὸς ἀλλήλους, λέγοντες ὅτι Ἄρτους οὐκ ἔχομεν."
8,17,"Καὶ γνοὺς ὁ Ἰησοῦς λέγει αὐτοῖς, Τί διαλογίζεσθε ὅτι ἄρτους οὐκ ἔχετε; Οὔπω νοεῖτε, οὐδὲ συνίετε; Ἔτι πεπωρωμένην ἔχετε τὴν καρδίαν ὑμῶν;"
8,18,Ὀφθαλμοὺς ἔχοντες οὐ βλέπετε; Καὶ ὦτα ἔχοντες οὐκ ἀκούετε; Καὶ οὐ μνημονεύετε;
8,19,"Ὅτε τοὺς πέντε ἄρτους ἔκλασα εἰς τοὺς πεντακισχιλίους, πόσους κοφίνους πλήρεις κλασμάτων ἤρατε; Λέγουσιν αὐτῷ, Δώδεκα."
8,20,"Ὅτε δὲ τοὺς ἑπτὰ εἰς τοὺς τετρακισχιλίους, πόσων σπυρίδων πληρώματα κλασμάτων ἤρατε; Οἱ δὲ εἶπον, Ἑπτά."
8,21,"Καὶ ἔλεγεν αὐτοῖς, Πῶς οὐ συνίετε;"
8,22,"
Καὶ ἔρχεται εἰς Βηθσαϊδάν. Καὶ φέρουσιν αὐτῷ τυφλόν, καὶ παρακαλοῦσιν αὐτὸν ἵνα αὐτοῦ ἅψηται."
8,23,"Καὶ ἐπιλαβόμενος τῆς χειρὸς τοῦ τυφλοῦ, ἐξήγαγεν αὐτὸν ἔξω τῆς κώμης· καὶ πτύσας εἰς τὰ ὄμματα αὐτοῦ, ἐπιθεὶς τὰς χεῖρας αὐτῷ, ἐπηρώτα αὐτὸν εἴ τι βλέπει."
8,24,"Καὶ ἀναβλέψας ἔλεγεν, Βλέπω τοὺς ἀνθρώπους, ὅτι ὡς δένδρα ὁρῶ περιπατοῦντας."
8,25,"Εἶτα πάλιν ἐπέθηκεν τὰς χεῖρας ἐπὶ τοὺς ὀφθαλμοὺς αὐτοῦ, καὶ ἐποίησεν αὐτὸν ἀναβλέψαι. Καὶ ἀποκατεστάθη, καὶ ἐνέβλεψεν τηλαυγῶς ἅπαντας."
8,26,"Καὶ ἀπέστειλεν αὐτὸν εἰς τὸν οἶκον αὐτοῦ, λέγων, Μηδὲ εἰς τὴν κώμην εἰσέλθῃς, μηδὲ εἴπῃς τινὶ ἐν τῇ κώμῃ."
8,27,"
Καὶ ἐξῆλθεν ὁ Ἰησοῦς καὶ οἱ μαθηταὶ αὐτοῦ εἰς τὰς κώμας Καισαρείας τῆς Φιλίππου· καὶ ἐν τῇ ὁδῷ ἐπηρώτα τοὺς μαθητὰς αὐτοῦ, λέγων αὐτοῖς, Τίνα με λέγουσιν οἱ ἄνθρωποι εἶναι;"
8,28,"Οἱ δὲ ἀπεκρίθησαν, Ἰωάννην τὸν βαπτιστήν· καὶ ἄλλοι Ἠλίαν· ἄλλοι δὲ ἕνα τῶν προφητῶν."
8,29,"Καὶ αὐτὸς λέγει αὐτοῖς, Ὑμεῖς δὲ τίνα με λέγετε εἶναι; Ἀποκριθεὶς δὲ ὁ Πέτρος λέγει αὐτῷ, Σὺ εἶ ὁ χριστός."
8,30,"Καὶ ἐπετίμησεν αὐτοῖς, ἵνα μηδενὶ λέγωσιν περὶ αὐτοῦ."
8,31,"Καὶ ἤρξατο διδάσκειν αὐτούς, ὅτι δεῖ τὸν υἱὸν τοῦ ἀνθρώπου πολλὰ παθεῖν, καὶ ἀποδοκιμασθῆναι ἀπὸ τῶν πρεσβυτέρων καὶ τῶν ἀρχιερέων καὶ τῶν γραμματέων, καὶ ἀποκτανθῆναι, καὶ μετὰ τρεῖς ἡμέρας ἀναστῆναι·"
8,32,καὶ παρρησίᾳ τὸν λόγον ἐλάλει. Καὶ προσλαβόμενος αὐτὸν ὁ Πέτρος ἤρξατο ἐπιτιμᾷν αὐτῷ.
8,33,"Ὁ δὲ ἐπιστραφείς, καὶ ἰδὼν τοὺς μαθητὰς αὐτοῦ, ἐπετίμησεν τῷ Πέτρῳ, λέγων, Ὕπαγε ὀπίσω μου, Σατανᾶ· ὅτι οὐ φρονεῖς τὰ τοῦ θεοῦ, ἀλλὰ τὰ τῶν ἀνθρώπων."
8,34,"Καὶ προσκαλεσάμενος τὸν ὄχλον σὺν τοῖς μαθηταῖς αὐτοῦ, εἶπεν αὐτοῖς, Ὅστις θέλει ὀπίσω μου ἀκολουθεῖν, ἀπαρνησάσθω ἑαυτόν, καὶ ἀράτω τὸν σταυρὸν αὐτοῦ, καὶ ἀκολουθείτω μοι."
8,35,"Ὃς γὰρ ἂν θέλῃ τὴν ψυχὴν αὐτοῦ σῶσαι, ἀπολέσει αὐτήν· ὃς δ’ ἂν ἀπολέσῃ τὴν ἑαυτοῦ ψυχὴν ἕνεκεν ἐμοῦ καὶ τοῦ εὐαγγελίου, οὗτος σώσει αὐτήν."
8,36,"Τί γὰρ ὠφελήσει ἄνθρωπον, ἐὰν κερδήσῃ τὸν κόσμον ὅλον, καὶ ζημιωθῇ τὴν ψυχὴν αὐτοῦ;"
8,37,Ἢ τί δώσει ἄνθρωπος ἀντάλλαγμα τῆς ψυχῆς αὐτοῦ;
8,38,"Ὃς γὰρ ἐὰν ἐπαισχυνθῇ με καὶ τοὺς ἐμοὺς λόγους ἐν τῇ γενεᾷ ταύτῃ τῇ μοιχαλίδι καὶ ἁμαρτωλῷ, καὶ ὁ υἱὸς τοῦ ἀνθρώπου ἐπαισχυνθήσεται αὐτόν, ὅταν ἔλθῃ ἐν τῇ δόξῃ τοῦ πατρὸς αὐτοῦ μετὰ τῶν ἀγγέλων τῶν ἁγίων."
9,1,"Καὶ ἔλεγεν αὐτοῖς, Ἀμὴν λέγω ὑμῖν ὅτι εἰσίν τινες τῶν ὧδε ἑστηκότων, οἵτινες οὐ μὴ γεύσωνται θανάτου, ἕως ἂν ἴδωσιν τὴν βασιλείαν τοῦ θεοῦ ἐληλυθυῖαν ἐν δυνάμει."
9,2,"
Καὶ μεθ’ ἡμέρας ἓξ παραλαμβάνει ὁ Ἰησοῦς τὸν Πέτρον καὶ τὸν Ἰάκωβον καὶ Ἰωάννην, καὶ ἀναφέρει αὐτοὺς εἰς ὄρος ὑψηλὸν κατ’ ἰδίαν μόνους. Καὶ μετεμορφώθη ἔμπροσθεν αὐτῶν,"
9,3,"καὶ τὰ ἱμάτια αὐτοῦ ἐγένοντο στίλβοντα, λευκὰ λίαν ὡς χιών, οἷα γναφεὺς ἐπὶ τῆς γῆς οὐ δύναται λευκᾶναι."
9,4,"Καὶ ὤφθη αὐτοῖς Ἠλίας σὺν Μωσῇ, καὶ ἦσαν συλλαλοῦντες τῷ Ἰησοῦ."
9,5,"Καὶ ἀποκριθεὶς ὁ Πέτρος λέγει τῷ Ἰησοῦ, Ῥαββί, καλόν ἐστιν ἡμᾶς ὧδε εἶναι· καὶ ποιήσωμεν σκηνὰς τρεῖς, σοὶ μίαν, καὶ Μωσῇ μίαν, καὶ Ἠλίᾳ μίαν."
9,6,Οὐ γὰρ ᾔδει τί λαλήσει· ἦσαν γὰρ ἔκφοβοι.
9,7,"Καὶ ἐγένετο νεφέλη ἐπισκιάζουσα αὐτοῖς· καὶ ἦλθεν φωνὴ ἐκ τῆς νεφέλης, Οὗτός ἐστιν ὁ υἱός μου ὁ ἀγαπητός· αὐτοῦ ἀκούετε."
9,8,"Καὶ ἐξάπινα περιβλεψάμενοι, οὐκέτι οὐδένα εἶδον, ἀλλὰ τὸν Ἰησοῦν μόνον μεθ’ ἑαυτῶν."
9,9,"
Καταβαινόντων δὲ αὐτῶν ἀπὸ τοῦ ὄρους, διεστείλατο αὐτοῖς ἵνα μηδενὶ διηγήσωνται ἃ εἶδον, εἰ μὴ ὅταν ὁ υἱὸς τοῦ ἀνθρώπου ἐκ νεκρῶν ἀναστῇ."
9,10,"Καὶ τὸν λόγον ἐκράτησαν πρὸς ἑαυτούς, συζητοῦντες τί ἐστιν τὸ ἐκ νεκρῶν ἀναστῆναι."
9,11,"Καὶ ἐπηρώτων αὐτόν, λέγοντες ὅτι Λέγουσιν οἱ γραμματεῖς ὅτι Ἠλίαν δεῖ ἐλθεῖν πρῶτον;"
9,12,"Ὁ δὲ ἀποκριθείς, εἶπεν αὐτοῖς, Ἠλίας μὲν ἐλθὼν πρῶτον, ἀποκαθιστᾷ πάντα· καὶ πῶς γέγραπται ἐπὶ τὸν υἱὸν τοῦ ἀνθρώπου, ἵνα πολλὰ πάθῃ καὶ ἐξουδενωθῇ."
9,13,"Ἀλλὰ λέγω ὑμῖν ὅτι καὶ Ἠλίας ἐλήλυθεν, καὶ ἐποίησαν αὐτῷ ὅσα ἠθέλησαν, καθὼς γέγραπται ἐπ’ αὐτόν."
9,14,"
Καὶ ἐλθὼν πρὸς τοὺς μαθητάς, εἶδεν ὄχλον πολὺν περὶ αὐτούς, καὶ γραμματεῖς συζητοῦντας αὐτοῖς."
9,15,"Καὶ εὐθέως πᾶς ὁ ὄχλος ἰδὼν αὐτὸν ἐξεθαμβήθη, καὶ προστρέχοντες ἠσπάζοντο αὐτόν."
9,16,"Καὶ ἐπηρώτησεν τοὺς γραμματεῖς, Τί συζητεῖτε πρὸς αὐτούς;"
9,17,"Καὶ ἀποκριθεὶς εἷς ἐκ τοῦ ὄχλου εἶπεν, Διδάσκαλε, ἤνεγκα τὸν υἱόν μου πρός σε, ἔχοντα πνεῦμα ἄλαλον."
9,18,"Καὶ ὅπου ἂν αὐτὸν καταλάβῃ, ῥήσσει αὐτόν· καὶ ἀφρίζει, καὶ τρίζει τοὺς ὀδόντας αὐτοῦ, καὶ ξηραίνεται· καὶ εἶπον τοῖς μαθηταῖς σου ἵνα αὐτὸ ἐκβάλωσιν, καὶ οὐκ ἴσχυσαν."
9,19,"Ὁ δὲ ἀποκριθεὶς αὐτῷ λέγει, Ὦ γενεὰ ἄπιστος, ἕως πότε πρὸς ὑμᾶς ἔσομαι; Ἕως πότε ἀνέξομαι ὑμῶν; Φέρετε αὐτὸν πρός με."
9,20,"Καὶ ἤνεγκαν αὐτὸν πρὸς αὐτόν· καὶ ἰδὼν αὐτόν, εὐθέως τὸ πνεῦμα ἐσπάραξεν αὐτόν· καὶ πεσὼν ἐπὶ τῆς γῆς, ἐκυλίετο ἀφρίζων."
9,21,"Καὶ ἐπηρώτησεν τὸν πατέρα αὐτοῦ, Πόσος χρόνος ἐστίν, ὡς τοῦτο γέγονεν αὐτῷ; Ὁ δὲ εἶπεν, Παιδιόθεν."
9,22,"Καὶ πολλάκις αὐτὸν καὶ εἰς τὸ πῦρ ἔβαλεν καὶ εἰς ὕδατα, ἵνα ἀπολέσῃ αὐτόν· ἀλλ’ εἴ τι δύνασαι, βοήθησον ἡμῖν, σπλαγχνισθεὶς ἐφ’ ἡμᾶς."
9,23,"Ὁ δὲ Ἰησοῦς εἶπεν αὐτῷ, Τὸ εἰ δύνασαι πιστεῦσαι, πάντα δυνατὰ τῷ πιστεύοντι."
9,24,"Καὶ εὐθέως κράξας ὁ πατὴρ τοῦ παιδίου, μετὰ δακρύων ἔλεγεν, Πιστεύω, κύριε, βοήθει μου τῇ ἀπιστίᾳ."
9,25,"Ἰδὼν δὲ ὁ Ἰησοῦς ὅτι ἐπισυντρέχει ὄχλος, ἐπετίμησεν τῷ πνεύματι τῷ ἀκαθάρτῳ, λέγων αὐτῷ, Τὸ πνεῦμα τὸ ἄλαλον καὶ κωφόν, ἐγώ σοι ἐπιτάσσω, ἔξελθε ἐξ αὐτοῦ, καὶ μηκέτι εἰσέλθῃς εἰς αὐτόν."
9,26,"Καὶ κράξαν, καὶ πολλὰ σπαράξαν αὐτόν, ἐξῆλθεν· καὶ ἐγένετο ὡσεὶ νεκρός, ὥστε πολλοὺς λέγειν ὅτι ἀπέθανεν."
9,27,"Ὁ δὲ Ἰησοῦς κρατήσας αὐτὸν τῆς χειρός, ἤγειρεν αὐτόν· καὶ ἀνέστη."
9,28,"Καὶ εἰσελθόντα αὐτὸν εἰς οἶκον, οἱ μαθηταὶ αὐτοῦ ἐπηρώτων αὐτὸν κατ’ ἰδίαν ὅτι Ἡμεῖς οὐκ ἠδυνήθημεν ἐκβαλεῖν αὐτό;"
9,29,"Καὶ εἶπεν αὐτοῖς, Τοῦτο τὸ γένος ἐν οὐδενὶ δύναται ἐξελθεῖν, εἰ μὴ ἐν προσευχῇ καὶ νηστείᾳ."
9,30,"
Καὶ ἐκεῖθεν ἐξελθόντες παρεπορεύοντο διὰ τῆς Γαλιλαίας· καὶ οὐκ ἤθελεν ἵνα τις γνῷ."
9,31,"Ἐδίδασκεν γὰρ τοὺς μαθητὰς αὐτοῦ, καὶ ἔλεγεν αὐτοῖς ὅτι Ὁ υἱὸς τοῦ ἀνθρώπου παραδίδοται εἰς χεῖρας ἀνθρώπων, καὶ ἀποκτενοῦσιν αὐτόν· καὶ ἀποκτανθείς, τῇ τρίτῃ ἡμέρᾳ ἀναστήσεται."
9,32,"Οἱ δὲ ἠγνόουν τὸ ῥῆμα, καὶ ἐφοβοῦντο αὐτὸν ἐπερωτῆσαι."
9,33,"
Καὶ ἦλθεν εἰς Καπερναούμ· καὶ ἐν τῇ οἰκίᾳ γενόμενος ἐπηρώτα αὐτούς, Τί ἐν τῇ ὁδῷ πρὸς ἑαυτοὺς διελογίζεσθε;"
9,34,"Οἱ δὲ ἐσιώπων· πρὸς ἀλλήλους γὰρ διελέχθησαν ἐν τῇ ὁδῷ, τίς μείζων."
9,35,"Καὶ καθίσας ἐφώνησεν τοὺς δώδεκα, καὶ λέγει αὐτοῖς, Εἴ τις θέλει πρῶτος εἶναι, ἔσται πάντων ἔσχατος, καὶ πάντων διάκονος."
9,36,"Καὶ λαβὼν παιδίον, ἔστησεν αὐτὸ ἐν μέσῳ αὐτῶν· καὶ ἐναγκαλισάμενος αὐτό, εἶπεν αὐτοῖς·"
