chapter,verse,text
4,15,"Οὗτοι δέ εἰσιν οἱ παρὰ τὴν ὁδόν, ὅπου σπείρεται ὁ λόγος, καὶ ὅταν ἀκούσωσιν, εὐθέως ἔρχεται ὁ Σατανᾶς καὶ αἴρει τὸν λόγον τὸν ἐσπαρμένον ἐν ταῖς καρδίαις αὐτῶν."
4,16,"Καὶ οὗτοί εἰσιν ὁμοίως οἱ ἐπὶ τὰ πετρώδη σπειρόμενοι, οἵ, ὅταν ἀκούσωσιν τὸν λόγον, εὐθέως μετὰ χαρᾶς λαμβάνουσιν αὐτόν,"
4,17,"καὶ οὐκ ἔχουσιν ῥίζαν ἐν ἑαυτοῖς, ἀλλὰ πρόσκαιροί εἰσιν· εἶτα γενομένης θλίψεως ἢ διωγμοῦ διὰ τὸν λόγον, εὐθέως σκανδαλίζονται."
4,18,"Καὶ οὗτοί εἰσιν οἱ εἰς τὰς ἀκάνθας σπειρόμενοι, οἱ τὸν λόγον ἀκούοντες,"
4,19,"καὶ αἱ μέριμναι τοῦ αἰῶνος τούτου, καὶ ἡ ἀπάτη τοῦ πλούτου, καὶ αἱ περὶ τὰ λοιπὰ ἐπιθυμίαι εἰσπορευόμεναι συμπνίγουσιν τὸν λόγον, καὶ ἄκαρπος γίνεται."
4,20,"Καὶ οὗτοί εἰσιν οἱ ἐπὶ τὴν γῆν τὴν καλὴν σπαρέντες, οἵτινες ἀκούουσιν τὸν λόγον, καὶ παραδέχονται, καὶ καρποφοροῦσιν, ἐν τριάκοντα, καὶ ἐν ἑξήκοντα, καὶ ἐν ἑκατόν."
4,21,"
Καὶ ἔλεγεν αὐτοῖς, Μήτι ὁ λύχνος ἔρχεται ἵνα ὑπὸ τὸν μόδιον τεθῇ ἢ ὑπὸ τὴν κλίνην; Οὐχ ἵνα ἐπὶ τὴν λυχνίαν ἐπιτεθῇ;"
4,22,"Οὐ γάρ ἐστίν τι κρυπτόν, ὃ ἐὰν μὴ φανερωθῇ· οὐδὲ ἐγένετο ἀπόκρυφον, ἀλλ’ ἵνα εἰς φανερὸν ἔλθῃ."
4,23,Εἴ τις ἔχει ὦτα ἀκούειν ἀκουέτω.
4,24,"Καὶ ἔλεγεν αὐτοῖς, Βλέπετε τί ἀκούετε. Ἐν ᾧ μέτρῳ μετρεῖτε μετρηθήσεται ὑμῖν, καὶ προστεθήσεται ὑμῖν τοῖς ἀκούουσιν."
4,25,"Ὃς γὰρ ἂν ἔχῃ, δοθήσεται αὐτῷ· καὶ ὃς οὐκ ἔχει, καὶ ὃ ἔχει ἀρθήσεται ἀπ’ αὐτοῦ."
4,26,"
Καὶ ἔλεγεν, Οὕτως ἐστὶν ἡ βασιλεία τοῦ θεοῦ, ὡς ἐὰν ἄνθρωπος βάλῃ τὸν σπόρον ἐπὶ τῆς γῆς,"
4,27,"καὶ καθεύδῃ καὶ ἐγείρηται νύκτα καὶ ἡμέραν, καὶ ὁ σπόρος βλαστάνῃ καὶ μηκύνηται ὡς οὐκ οἶδεν αὐτός."
4,28,"Αὐτομάτη γὰρ ἡ γῆ καρποφορεῖ, πρῶτον χόρτον, εἶτα στάχυν, εἶτα πλήρη σῖτον ἐν τῷ στάχυϊ."
4,29,"Ὅταν δὲ παραδῷ ὁ καρπός, εὐθέως ἀποστέλλει τὸ δρέπανον, ὅτι παρέστηκεν ὁ θερισμός."
4,30,"
Καὶ ἔλεγεν, Τίνι ὁμοιώσωμεν τὴν βασιλείαν τοῦ θεοῦ; Ἢ ἐν ποίᾳ παραβολῇ παραβάλωμεν αὐτήν;"
4,31,"Ὡς κόκκον σινάπεως, ὅς, ὅταν σπαρῇ ἐπὶ τῆς γῆς, μικρότερος πάντων τῶν σπερμάτων ἐστὶν τῶν ἐπὶ τῆς γῆς·"
4,32,"καὶ ὅταν σπαρῇ, ἀναβαίνει, καὶ γίνεται πάντων τῶν λαχάνων μείζων, καὶ ποιεῖ κλάδους μεγάλους, ὥστε δύνασθαι ὑπὸ τὴν σκιὰν αὐτοῦ τὰ πετεινὰ τοῦ οὐρανοῦ κατασκηνοῦν."
4,33,"Καὶ τοιαύταις παραβολαῖς πολλαῖς ἐλάλει αὐτοῖς τὸν λόγον, καθὼς ἐδύναντο ἀκούειν·"
4,34,χωρὶς δὲ παραβολῆς οὐκ ἐλάλει αὐτοῖς· κατ’ ἰδίαν δὲ τοῖς μαθηταῖς αὐτοῦ ἐπέλυεν πάντα.
4,35,"
Καὶ λέγει αὐτοῖς ἐν ἐκείνῃ τῇ ἡμέρᾳ, ὀψίας γενομένης, Διέλθωμεν εἰς τὸ πέραν."
4,36,"Καὶ ἀφέντες τὸν ὄχλον, παραλαμβάνουσιν αὐτὸν ὡς ἦν ἐν τῷ πλοίῳ. Καὶ ἄλλα δὲ πλοιάρια ἦν μετ’ αὐτοῦ."
4,37,"Καὶ γίνεται λαῖλαψ ἀνέμου μεγάλη· τὰ δὲ κύματα ἐπέβαλλεν εἰς τὸ πλοῖον, ὥστε αὐτὸ ἤδη γεμίζεσθαι."
4,38,"Καὶ ἦν αὐτὸς ἐπὶ τῇ πρύμνῃ ἐπὶ τὸ προσκεφάλαιον καθεύδων· καὶ διεγείρουσιν αὐτόν, καὶ λέγουσιν αὐτῷ, Διδάσκαλε, οὐ μέλει σοι ὅτι ἀπολλύμεθα;"
4,39,"Καὶ διεγερθεὶς ἐπετίμησεν τῷ ἀνέμῳ, καὶ εἶπεν τῇ θαλάσσῃ, Σιώπα, πεφίμωσο. Καὶ ἐκόπασεν ὁ ἄνεμος, καὶ ἐγένετο γαλήνη μεγάλη."
4,40,"Καὶ εἶπεν αὐτοῖς, Τί δειλοί ἐστε οὕτως; Πῶς οὐκ ἔχετε πίστιν;"
4,41,"Καὶ ἐφοβήθησαν φόβον μέγαν, καὶ ἔλεγον πρὸς ἀλλήλους, Τίς ἄρα οὗτός ἐστιν, ὅτι καὶ ὁ ἄνεμος καὶ ἡ θάλασσα ὑπακούουσιν αὐτῷ;"
5,1,"Καὶ ἦλθον εἰς τὸ πέραν τῆς θαλάσσης, εἰς τὴν χώραν τῶν Γαδαρηνῶν."
5,2,"Καὶ ἐξελθόντι αὐτῷ ἐκ τοῦ πλοίου, εὐθέως ἀπήντησεν αὐτῷ ἐκ τῶν μνημείων ἄνθρωπος ἐν πνεύματι ἀκαθάρτῳ,"
5,3,"ὃς τὴν κατοίκησιν εἶχεν ἐν τοῖς μνήμασιν· καὶ οὔτε ἁλύσεσιν οὐδεὶς ἐδύνατο αὐτὸν δῆσαι,"
5,4,"διὰ τὸ αὐτὸν πολλάκις πέδαις καὶ ἁλύσεσιν δεδέσθαι, καὶ διεσπᾶσθαι ὑπ’ αὐτοῦ τὰς ἁλύσεις, καὶ τὰς πέδας συντετρίφθαι· καὶ οὐδεὶς αὐτὸν ἴσχυεν δαμάσαι·"
5,5,"καὶ διὰ παντός, νυκτὸς καὶ ἡμέρας, ἐν τοῖς ὄρεσιν καὶ ἐν τοῖς μνήμασιν ἦν κράζων καὶ κατακόπτων ἑαυτὸν λίθοις."
5,6,"Ἰδὼν δὲ τὸν Ἰησοῦν ἀπὸ μακρόθεν, ἔδραμεν καὶ προσεκύνησεν αὐτῷ,"
5,7,"καὶ κράξας φωνῇ μεγάλῃ εἶπεν, Τί ἐμοὶ καὶ σοί, Ἰησοῦ, υἱὲ τοῦ θεοῦ τοῦ ὑψίστου; Ὁρκίζω σε τὸν θεόν, μή με βασανίσῃς."
5,8,"Ἔλεγεν γὰρ αὐτῷ, Ἔξελθε, τὸ πνεῦμα τὸ ἀκάθαρτον, ἐκ τοῦ ἀνθρώπου."
5,9,"Καὶ ἐπηρώτα αὐτόν, Τί σοι ὄνομα; Καὶ ἀπεκρίθη, λέγων, Λεγεὼν ὄνομά μοι, ὅτι πολλοί ἐσμεν."
5,10,Καὶ παρεκάλει αὐτὸν πολλὰ ἵνα μὴ αὐτοὺς ἀποστείλῃ ἔξω τῆς χώρας.
5,11,Ἦν δὲ ἐκεῖ πρὸς τῷ ὄρει ἀγέλη χοίρων μεγάλη βοσκομένη·
5,12,"καὶ παρεκάλεσαν αὐτὸν πάντες οἱ δαίμονες, λέγοντες, Πέμψον ἡμᾶς εἰς τοὺς χοίρους, ἵνα εἰς αὐτοὺς εἰσέλθωμεν."
5,13,Καὶ ἐπέτρεψεν αὐτοῖς εὐθέως ὁ Ἰησοῦς. Καὶ ἐξελθόντα τὰ πνεύματα τὰ ἀκάθαρτα εἰσῆλθον εἰς τοὺς χοίρους· καὶ ὥρμησεν ἡ ἀγέλη κατὰ τοῦ κρημνοῦ εἰς τὴν θάλασσαν· ἦσαν δὲ ὡς δισχίλιοι· καὶ ἐπνίγοντο ἐν τῇ θαλάσσῃ.
5,14,"Οἱ δὲ βόσκοντες τοὺς χοίρους ἔφυγον, καὶ ἀνήγγειλαν εἰς τὴν πόλιν καὶ εἰς τοὺς ἀγρούς. Καὶ ἐξῆλθον ἰδεῖν τί ἐστιν τὸ γεγονός·"
5,15,"καὶ ἔρχονται πρὸς τὸν Ἰησοῦν, καὶ θεωροῦσιν τὸν δαιμονιζόμενον καθήμενον καὶ ἱματισμένον καὶ σωφρονοῦντα, τὸν ἐσχηκότα τὸν Λεγεῶνα· καὶ ἐφοβήθησαν."
5,16,"Διηγήσαντο δὲ αὐτοῖς οἱ ἰδόντες πῶς ἐγένετο τῷ δαιμονιζομένῳ, καὶ περὶ τῶν χοίρων."
5,17,Καὶ ἤρξαντο παρακαλεῖν αὐτὸν ἀπελθεῖν ἀπὸ τῶν ὁρίων αὐτῶν.
5,18,"Καὶ ἐμβάντος αὐτοῦ εἰς τὸ πλοῖον, παρεκάλει αὐτὸν ὁ δαιμονισθείς, ἵνα ᾖ μετ’ αὐτοῦ."
5,19,"Ὁ δὲ Ἰησοῦς οὐκ ἀφῆκεν αὐτόν, ἀλλὰ λέγει αὐτῷ, Ὕπαγε εἰς τὸν οἶκόν σου πρὸς τοὺς σούς, καὶ ἀνάγγειλον αὐτοῖς ὅσα σοι ὁ κύριος πεποίηκεν, καὶ ἠλέησέν σε."
5,20,Καὶ ἀπῆλθεν καὶ ἤρξατο κηρύσσειν ἐν τῇ Δεκαπόλει ὅσα ἐποίησεν αὐτῷ ὁ Ἰησοῦς· καὶ πάντες ἐθαύμαζον.
5,21,"
Καὶ διαπεράσαντος τοῦ Ἰησοῦ ἐν τῷ πλοίῳ πάλιν εἰς τὸ πέραν, συνήχθη ὄχλος πολὺς ἐπ’ αὐτόν, καὶ ἦν παρὰ τὴν θάλασσαν."
5,22,"Καὶ ἰδού, ἔρχεται εἷς τῶν ἀρχισυναγώγων, ὀνόματι Ἰάειρος, καὶ ἰδὼν αὐτόν, πίπτει πρὸς τοὺς πόδας αὐτοῦ,"
5,23,"καὶ παρεκάλει αὐτὸν πολλά, λέγων ὅτι Τὸ θυγάτριόν μου ἐσχάτως ἔχει· ἵνα ἐλθὼν ἐπιθῇς αὐτῇ τὰς χεῖρας, ὅπως σωθῇ καὶ ζήσεται."
5,24,"Καὶ ἀπῆλθεν μετ’ αὐτοῦ· καὶ ἠκολούθει αὐτῷ ὄχλος πολύς, καὶ συνέθλιβον αὐτόν."
5,25,"
Καὶ γυνή τις οὖσα ἐν ῥύσει αἵματος ἔτη δώδεκα,"
5,26,"καὶ πολλὰ παθοῦσα ὑπὸ πολλῶν ἰατρῶν, καὶ δαπανήσασα τὰ παρ’ αὐτῆς πάντα, καὶ μηδὲν ὠφεληθεῖσα, ἀλλὰ μᾶλλον εἰς τὸ χεῖρον ἐλθοῦσα,"
5,27,"ἀκούσασα περὶ τοῦ Ἰησοῦ, ἐλθοῦσα ἐν τῷ ὄχλῳ ὄπισθεν, ἥψατο τοῦ ἱματίου αὐτοῦ·"
5,28,"ἔλεγεν γὰρ ὅτι Κἂν τῶν ἱματίων αὐτοῦ ἅψωμαι, σωθήσομαι."
5,29,"Καὶ εὐθέως ἐξηράνθη ἡ πηγὴ τοῦ αἵματος αὐτῆς, καὶ ἔγνω τῷ σώματι ὅτι ἴαται ἀπὸ τῆς μάστιγος."
5,30,"Καὶ εὐθέως ὁ Ἰησοῦς ἐπιγνοὺς ἐν ἑαυτῷ τὴν ἐξ αὐτοῦ δύναμιν ἐξελθοῦσαν, ἐπιστραφεὶς ἐν τῷ ὄχλῳ, ἔλεγεν, Τίς μου ἥψατο τῶν ἱματίων;"
5,31,"Καὶ ἔλεγον αὐτῷ οἱ μαθηταὶ αὐτοῦ, Βλέπεις τὸν ὄχλον συνθλίβοντά σε, καὶ λέγεις, Τίς μου ἥψατο;"
5,32,Καὶ περιεβλέπετο ἰδεῖν τὴν τοῦτο ποιήσασαν.
5,33,"Ἡ δὲ γυνὴ φοβηθεῖσα καὶ τρέμουσα, εἰδυῖα ὃ γέγονεν ἐπ’ αὐτῇ, ἦλθεν καὶ προσέπεσεν αὐτῷ, καὶ εἶπεν αὐτῷ πᾶσαν τὴν ἀλήθειαν."
5,34,"Ὁ δὲ εἶπεν αὐτῇ, Θύγατερ, ἡ πίστις σου σέσωκέν σε· ὕπαγε εἰς εἰρήνην, καὶ ἴσθι ὑγιὴς ἀπὸ τῆς μάστιγός σου."
5,35,"
Ἔτι αὐτοῦ λαλοῦντος, ἔρχονται ἀπὸ τοῦ ἀρχισυναγώγου, λέγοντες ὅτι Ἡ θυγάτηρ σου ἀπέθανεν· τί ἔτι σκύλλεις τὸν διδάσκαλον;"
5,36,"Ὁ δὲ Ἰησοῦς εὐθέως ἀκούσας τὸν λόγον λαλούμενον λέγει τῷ ἀρχισυναγώγῳ, Μὴ φοβοῦ· μόνον πίστευε."
5,37,"Καὶ οὐκ ἀφῆκεν οὐδένα αὐτῷ συνακολουθῆσαι, εἰ μὴ Πέτρον καὶ Ἰάκωβον καὶ Ἰωάννην τὸν ἀδελφὸν Ἰακώβου."
5,38,"Καὶ ἔρχεται εἰς τὸν οἶκον τοῦ ἀρχισυναγώγου, καὶ θεωρεῖ θόρυβον, κλαίοντας καὶ ἀλαλάζοντας πολλά."
5,39,"Καὶ εἰσελθὼν λέγει αὐτοῖς, Τί θορυβεῖσθε καὶ κλαίετε; Τὸ παιδίον οὐκ ἀπέθανεν, ἀλλὰ καθεύδει."
5,40,"Καὶ κατεγέλων αὐτοῦ. Ὁ δέ, ἐκβαλὼν πάντας, παραλαμβάνει τὸν πατέρα τοῦ παιδίου καὶ τὴν μητέρα καὶ τοὺς μετ’ αὐτοῦ, καὶ εἰσπορεύεται ὅπου ἦν τὸ παιδίον ἀνακείμενον."
5,41,"Καὶ κρατήσας τῆς χειρὸς τοῦ παιδίου, λέγει αὐτῇ, Ταλιθά, κοῦμι· ὅ ἐστιν μεθερμηνευόμενον, Τὸ κοράσιον, σοὶ λέγω, ἔγειραι."
5,42,"Καὶ εὐθέως ἀνέστη τὸ κοράσιον καὶ περιεπάτει, ἦν γὰρ ἐτῶν δώδεκα· καὶ ἐξέστησαν ἐκστάσει μεγάλῃ."
5,43,Καὶ διεστείλατο αὐτοῖς πολλὰ ἵνα μηδεὶς γνῷ τοῦτο· καὶ εἶπεν δοθῆναι αὐτῇ φαγεῖν.
6,1,"Καὶ ἐξῆλθεν ἐκεῖθεν, καὶ ἦλθεν εἰς τὴν πατρίδα αὐτοῦ· καὶ ἀκολουθοῦσιν αὐτῷ οἱ μαθηταὶ αὐτοῦ."
6,2,"Καὶ γενομένου σαββάτου, ἤρξατο ἐν τῇ συναγωγῇ διδάσκειν· καὶ πολλοὶ ἀκούοντες ἐξεπλήσσοντο, λέγοντες, Πόθεν τούτῳ ταῦτα; Καὶ τίς ἡ σοφία ἡ δοθεῖσα αὐτῷ, καὶ δυνάμεις τοιαῦται διὰ τῶν χειρῶν αὐτοῦ γίνονται;"
6,3,"Οὐχ οὗτός ἐστιν ὁ τέκτων, ὁ υἱὸς Μαρίας, ἀδελφὸς δὲ Ἰακώβου καὶ Ἰωσῆ καὶ Ἰούδα καὶ Σίμωνος; Καὶ οὐκ εἰσὶν αἱ ἀδελφαὶ αὐτοῦ ὧδε πρὸς ἡμᾶς; Καὶ ἐσκανδαλίζοντο ἐν αὐτῷ."
6,4,"Ἔλεγεν δὲ αὐτοῖς ὁ Ἰησοῦς ὅτι Οὐκ ἔστιν προφήτης ἄτιμος, εἰ μὴ ἐν τῇ πατρίδι αὐτοῦ, καὶ ἐν τοῖς συγγενέσιν καὶ ἐν τῇ οἰκίᾳ αὐτοῦ."
6,5,"Καὶ οὐκ ἠδύνατο ἐκεῖ οὐδεμίαν δύναμιν ποιῆσαι, εἰ μὴ ὀλίγοις ἀρρώστοις ἐπιθεὶς τὰς χεῖρας, ἐθεράπευσεν."
6,6,"Καὶ ἐθαύμαζεν διὰ τὴν ἀπιστίαν αὐτῶν. 
Καὶ περιῆγεν τὰς κώμας κύκλῳ διδάσκων."
6,7,"
Καὶ προσκαλεῖται τοὺς δώδεκα, καὶ ἤρξατο αὐτοὺς ἀποστέλλειν δύο δύο, καὶ ἐδίδου αὐτοῖς ἐξουσίαν τῶν πνευμάτων τῶν ἀκαθάρτων."
6,8,"Καὶ παρήγγειλεν αὐτοῖς ἵνα μηδὲν αἴρωσιν εἰς ὁδόν, εἰ μὴ ῥάβδον μόνον· μὴ πήραν, μὴ ἄρτον, μὴ εἰς τὴν ζώνην χαλκόν·"
6,9,ἀλλ’ ὑποδεδεμένους σανδάλια· καὶ μὴ ἐνδύσησθε δύο χιτῶνας.
6,10,"Καὶ ἔλεγεν αὐτοῖς, Ὅπου ἐὰν εἰσέλθητε εἰς οἰκίαν, ἐκεῖ μένετε ἕως ἂν ἐξέλθητε ἐκεῖθεν."
6,11,"Καὶ ὅσοι ἂν μὴ δέξωνται ὑμᾶς, μηδὲ ἀκούσωσιν ὑμῶν, ἐκπορευόμενοι ἐκεῖθεν, ἐκτινάξατε τὸν χοῦν τὸν ὑποκάτω τῶν ποδῶν ὑμῶν εἰς μαρτύριον αὐτοῖς. Ἀμὴν λέγω ὑμῖν, ἀνεκτότερον ἔσται Σοδόμοις ἢ Γομόρροις ἐν ἡμέρᾳ κρίσεως, ἢ τῇ πόλει ἐκείνῃ."
6,12,Καὶ ἐξελθόντες ἐκήρυσσον ἵνα μετανοήσωσιν·
6,13,"καὶ δαιμόνια πολλὰ ἐξέβαλλον, καὶ ἤλειφον ἐλαίῳ πολλοὺς ἀρρώστους καὶ ἐθεράπευον."
6,14,"
Καὶ ἤκουσεν ὁ βασιλεὺς Ἡρῴδης, φανερὸν γὰρ ἐγένετο τὸ ὄνομα αὐτοῦ, καὶ ἔλεγεν ὅτι Ἰωάννης ὁ βαπτίζων ἐκ νεκρῶν ἠγέρθη, καὶ διὰ τοῦτο ἐνεργοῦσιν αἱ δυνάμεις ἐν αὐτῷ."
6,15,"Ἄλλοι ἔλεγον ὅτι Ἠλίας ἐστίν· ἄλλοι δὲ ἔλεγον ὅτι Προφήτης ἐστίν, ὡς εἷς τῶν προφητῶν."
6,16,"Ἀκούσας δὲ Ἡρῴδης εἶπεν ὅτι Ὃν ἐγὼ ἀπεκεφάλισα Ἰωάννην, οὗτός ἐστιν· αὐτὸς ἠγέρθη ἐκ νεκρῶν."
6,17,"Αὐτὸς γὰρ ὁ Ἡρῴδης ἀποστείλας ἐκράτησεν τὸν Ἰωάννην, καὶ ἔδησεν αὐτὸν ἐν φυλακῇ, διὰ Ἡρῳδιάδα τὴν γυναῖκα Φιλίππου τοῦ ἀδελφοῦ αὐτοῦ, ὅτι αὐτὴν ἐγάμησεν."
6,18,Ἔλεγεν γὰρ ὁ Ἰωάννης τῷ Ἡρῴδῃ ὅτι Οὐκ ἔξεστίν σοι ἔχειν τὴν γυναῖκα τοῦ ἀδελφοῦ σου.
6,19,"Ἡ δὲ Ἡρῳδιὰς ἐνεῖχεν αὐτῷ, καὶ ἤθελεν αὐτὸν ἀποκτεῖναι· καὶ οὐκ ἠδύνατο·"
6,20,"ὁ γὰρ Ἡρῴδης ἐφοβεῖτο τὸν Ἰωάννην, εἰδὼς αὐτὸν ἄνδρα δίκαιον καὶ ἅγιον, καὶ συνετήρει αὐτόν· καὶ ἀκούσας αὐτοῦ, πολλὰ ἐποίει, καὶ ἡδέως αὐτοῦ ἤκουεν."
6,21,"Καὶ γενομένης ἡμέρας εὐκαίρου, ὅτε Ἡρῴδης τοῖς γενεσίοις αὐτοῦ δεῖπνον ἐποίει τοῖς μεγιστᾶσιν αὐτοῦ καὶ τοῖς χιλιάρχοις καὶ τοῖς πρώτοις τῆς Γαλιλαίας,"
6,22,"καὶ εἰσελθούσης τῆς θυγατρὸς αὐτῆς τῆς Ἡρῳδιάδος καὶ ὀρχησαμένης, καὶ ἀρεσάσης τῷ Ἡρῴδῃ καὶ τοῖς συνανακειμένοις, εἶπεν ὁ βασιλεὺς τῷ κορασίῳ, Αἴτησόν με ὃ ἐὰν θέλῃς, καὶ δώσω σοί·"
6,23,"καὶ ὤμοσεν αὐτῇ ὅτι Ὃ ἐάν με αἰτήσῃς, δώσω σοί, ἕως ἡμίσους τῆς βασιλείας μου."
6,24,"Ἡ δὲ ἐξελθοῦσα εἶπεν τῇ μητρὶ αὐτῆς, Τί αἰτήσομαι; Ἡ δὲ εἶπεν, Τὴν κεφαλὴν Ἰωάννου τοῦ βαπτιστοῦ."
6,25,"Καὶ εἰσελθοῦσα εὐθέως μετὰ σπουδῆς πρὸς τὸν βασιλέα, ᾐτήσατο, λέγουσα, Θέλω ἵνα μοι δῷς ἐξαυτῆς ἐπὶ πίνακι τὴν κεφαλὴν Ἰωάννου τοῦ βαπτιστοῦ."
6,26,"Καὶ περίλυπος γενόμενος ὁ βασιλεύς, διὰ τοὺς ὅρκους καὶ τοὺς συνανακειμένους οὐκ ἠθέλησεν αὐτὴν ἀθετῆσαι."
6,27,Καὶ εὐθέως ἀποστείλας ὁ βασιλεὺς σπεκουλάτορα ἐπέταξεν ἐνεχθῆναι τὴν κεφαλὴν αὐτοῦ.
6,28,"Ὁ δὲ ἀπελθὼν ἀπεκεφάλισεν αὐτὸν ἐν τῇ φυλακῇ, καὶ ἤνεγκεν τὴν κεφαλὴν αὐτοῦ ἐπὶ πίνακι, καὶ ἔδωκεν αὐτὴν τῷ κορασίῳ· καὶ τὸ κοράσιον ἔδωκεν αὐτὴν τῇ μητρὶ αὐτῆς."
6,29,"Καὶ ἀκούσαντες οἱ μαθηταὶ αὐτοῦ ἦλθον, καὶ ἦραν τὸ πτῶμα αὐτοῦ, καὶ ἔθηκαν αὐτὸ ἐν μνημείῳ."
6,30,"
Καὶ συνάγονται οἱ ἀπόστολοι πρὸς τὸν Ἰησοῦν, καὶ ἀπήγγειλαν αὐτῷ πάντα, καὶ ὅσα ἐποίησαν καὶ ὅσα ἐδίδαξαν."
6,31,"Καὶ εἶπεν αὐτοῖς, Δεῦτε ὑμεῖς αὐτοὶ κατ’ ἰδίαν εἰς ἔρημον τόπον, καὶ ἀναπαύεσθε ὀλίγον. Ἦσαν γὰρ οἱ ἐρχόμενοι καὶ οἱ ὑπάγοντες πολλοί, καὶ οὐδὲ φαγεῖν εὐκαίρουν."
6,32,Καὶ ἀπῆλθον εἰς ἔρημον τόπον τῷ πλοίῳ κατ’ ἰδίαν.
6,33,"Καὶ εἶδον αὐτοὺς ὑπάγοντας καὶ ἐπέγνωσαν αὐτὸν πολλοί, καὶ πεζῇ ἀπὸ πασῶν τῶν πόλεων συνέδραμον ἐκεῖ, καὶ προῆλθον αὐτούς, καὶ συνῆλθον πρὸς αὐτόν."
6,34,"Καὶ ἐξελθὼν εἶδεν ὁ Ἰησοῦς πολὺν ὄχλον, καὶ ἐσπλαγχνίσθη ἐπ’ αὐτοῖς, ὅτι ἦσαν ὡς πρόβατα μὴ ἔχοντα ποιμένα· καὶ ἤρξατο διδάσκειν αὐτοὺς πολλά."
6,35,"Καὶ ἤδη ὥρας πολλῆς γενομένης, προσελθόντες αὐτῷ οἱ μαθηταὶ αὐτοῦ λέγουσιν ὅτι Ἔρημός ἐστιν ὁ τόπος, καὶ ἤδη ὥρα πολλή·"
6,36,"ἀπόλυσον αὐτούς, ἵνα ἀπελθόντες εἰς τοὺς κύκλῳ ἀγροὺς καὶ κώμας ἀγοράσωσιν ἑαυτοῖς ἄρτους. Τί γὰρ φάγωσιν οὐκ ἔχουσιν."
6,37,"Ὁ δὲ ἀποκριθεὶς εἶπεν αὐτοῖς, Δότε αὐτοῖς ὑμεῖς φαγεῖν. Καὶ λέγουσιν αὐτῷ, Ἀπελθόντες ἀγοράσωμεν δηναρίων διακοσίων ἄρτους, καὶ δῶμεν αὐτοῖς φαγεῖν;"
6,38,"Ὁ δὲ λέγει αὐτοῖς, Πόσους ἄρτους ἔχετε; Ὑπάγετε καὶ ἴδετε. Καὶ γνόντες λέγουσιν, Πέντε, καὶ δύο ἰχθύας."
6,39,Καὶ ἐπέταξεν αὐτοῖς ἀνακλῖναι πάντας συμπόσια συμπόσια ἐπὶ τῷ χλωρῷ χόρτῳ.
6,40,"Καὶ ἀνέπεσον πρασιαὶ πρασιαί, ἀνὰ ἑκατὸν καὶ ἀνὰ πεντήκοντα."
6,41,"Καὶ λαβὼν τοὺς πέντε ἄρτους καὶ τοὺς δύο ἰχθύας, ἀναβλέψας εἰς τὸν οὐρανόν, εὐλόγησεν, καὶ κατέκλασεν τοὺς ἄρτους, καὶ ἐδίδου τοῖς μαθηταῖς αὐτοῦ ἵνα παραθῶσιν αὐτοῖς· καὶ τοὺς δύο ἰχθύας ἐμέρισεν πᾶσιν."
6,42,"Καὶ ἔφαγον πάντες, καὶ ἐχορτάσθησαν·"
6,43,"καὶ ἦραν κλασμάτων δώδεκα κοφίνους πλήρεις, καὶ ἀπὸ τῶν ἰχθύων."
6,44,Καὶ ἦσαν οἱ φαγόντες τοὺς ἄρτους πεντακισχίλιοι ἄνδρες.
6,45,"
Καὶ εὐθέως ἠνάγκασεν τοὺς μαθητὰς αὐτοῦ ἐμβῆναι εἰς τὸ πλοῖον, καὶ προάγειν εἰς τὸ πέραν πρὸς Βηθσαϊδάν, ἕως αὐτὸς ἀπολύσῃ τὸν ὄχλον."
6,46,"Καὶ ἀποταξάμενος αὐτοῖς, ἀπῆλθεν εἰς τὸ ὄρος προσεύξασθαι."
6,47,"Καὶ ὀψίας γενομένης, ἦν τὸ πλοῖον ἐν μέσῳ τῆς θαλάσσης, καὶ αὐτὸς μόνος ἐπὶ τῆς γῆς."
6,48,"Καὶ εἶδεν αὐτοὺς βασανιζομένους ἐν τῷ ἐλαύνειν, ἦν γὰρ ὁ ἄνεμος ἐναντίος αὐτοῖς, καὶ περὶ τετάρτην φυλακὴν τῆς νυκτὸς ἔρχεται πρὸς αὐτούς, περιπατῶν ἐπὶ τῆς θαλάσσης· καὶ ἤθελεν παρελθεῖν αὐτούς."
6,49,"Οἱ δέ, ἰδόντες αὐτὸν περιπατοῦντα ἐπὶ τῆς θαλάσσης, ἔδοξαν φάντασμα εἶναι, καὶ ἀνέκραξαν·"
