chapter,verse,text
1,1,"Ἀρχὴ τοῦ εὐαγγελίου Ἰησοῦ χριστοῦ, υἱοῦ τοῦ θεοῦ."
1,2,"
Ὡς γέγραπται ἐν τοῖς προφήταις, Ἰδού, ἐγὼ ἀποστέλλω τὸν ἄγγελόν μου πρὸ προσώπου σου, ὃς κατασκευάσει τὴν ὁδόν σου ἔμπροσθέν σου."
1,3,"Φωνὴ βοῶντος ἐν τῇ ἐρήμῳ, Ἑτοιμάσατε τὴν ὁδὸν κυρίου· εὐθείας ποιεῖτε τὰς τρίβους αὐτοῦ."
1,4,"Ἐγένετο Ἰωάννης βαπτίζων ἐν τῇ ἐρήμῳ, καὶ κηρύσσων βάπτισμα μετανοίας εἰς ἄφεσιν ἁμαρτιῶν."
1,5,"Καὶ ἐξεπορεύετο πρὸς αὐτὸν πᾶσα ἡ Ἰουδαία χώρα, καὶ οἱ Ἱεροσολυμῖται, καὶ ἐβαπτίζοντο πάντες ἐν τῷ Ἰορδάνῃ ποταμῷ ὑπ’ αὐτοῦ, ἐξομολογούμενοι τὰς ἁμαρτίας αὐτῶν."
1,6,"Ἦν δὲ ὁ Ἰωάννης ἐνδεδυμένος τρίχας καμήλου, καὶ ζώνην δερματίνην περὶ τὴν ὀσφὺν αὐτοῦ, καὶ ἐσθίων ἀκρίδας καὶ μέλι ἄγριον."
1,7,"Καὶ ἐκήρυσσεν, λέγων, Ἔρχεται ὁ ἰσχυρότερός μου ὀπίσω μου, οὗ οὐκ εἰμὶ ἱκανὸς κύψας λῦσαι τὸν ἱμάντα τῶν ὑποδημάτων αὐτοῦ."
1,8,Ἐγὼ μὲν ἐβάπτισα ὑμᾶς ἐν ὕδατι· αὐτὸς δὲ βαπτίσει ὑμᾶς ἐν πνεύματι ἁγίῳ.
1,9,"
Καὶ ἐγένετο ἐν ἐκείναις ταῖς ἡμέραις, ἦλθεν Ἰησοῦς ἀπὸ Ναζαρὲτ τῆς Γαλιλαίας, καὶ ἐβαπτίσθη ὑπὸ Ἰωάννου εἰς τὸν Ἰορδάνην."
1,10,"Καὶ εὐθέως ἀναβαίνων ἀπὸ τοῦ ὕδατος, εἶδεν σχιζομένους τοὺς οὐρανούς, καὶ τὸ πνεῦμα ὡσεὶ περιστερὰν καταβαῖνον ἐπ’ αὐτόν·"
1,11,"καὶ φωνὴ ἐγένετο ἐκ τῶν οὐρανῶν, Σὺ εἶ ὁ υἱός μου ὁ ἀγαπητός, ἐν ᾧ εὐδόκησα."
1,12,"
Καὶ εὐθὺς τὸ πνεῦμα αὐτὸν ἐκβάλλει εἰς τὴν ἔρημον."
1,13,"Καὶ ἦν ἐκεῖ ἐν τῇ ἐρήμῳ ἡμέρας τεσσαράκοντα πειραζόμενος ὑπὸ τοῦ Σατανᾶ, καὶ ἦν μετὰ τῶν θηρίων, καὶ οἱ ἄγγελοι διηκόνουν αὐτῷ."
1,14,"
Μετὰ δὲ τὸ παραδοθῆναι τὸν Ἰωάννην, ἦλθεν ὁ Ἰησοῦς εἰς τὴν Γαλιλαίαν, κηρύσσων τὸ εὐαγγέλιον τῆς βασιλείας τοῦ θεοῦ,"
1,15,"καὶ λέγων ὅτι Πεπλήρωται ὁ καιρός, καὶ ἤγγικεν ἡ βασιλεία τοῦ θεοῦ· μετανοεῖτε, καὶ πιστεύετε ἐν τῷ εὐαγγελίῳ."
1,16,"
Περιπατῶν δὲ παρὰ τὴν θάλασσαν τῆς Γαλιλαίας εἶδεν Σίμωνα καὶ Ἀνδρέαν τὸν ἀδελφὸν αὐτοῦ τοῦ Σίμωνος βάλλοντας ἀμφίβληστρον ἐν τῇ θαλάσσῃ· ἦσαν γὰρ ἁλιεῖς."
1,17,"Καὶ εἶπεν αὐτοῖς ὁ Ἰησοῦς, Δεῦτε ὀπίσω μου, καὶ ποιήσω ὑμᾶς γενέσθαι ἁλιεῖς ἀνθρώπων."
1,18,"Καὶ εὐθέως ἀφέντες τὰ δίκτυα αὐτῶν, ἠκολούθησαν αὐτῷ."
1,19,"Καὶ προβὰς ἐκεῖθεν ὀλίγον, εἶδεν Ἰάκωβον τὸν τοῦ Ζεβεδαίου, καὶ Ἰωάννην τὸν ἀδελφὸν αὐτοῦ, καὶ αὐτοὺς ἐν τῷ πλοίῳ καταρτίζοντας τὰ δίκτυα."
1,20,Καὶ εὐθέως ἐκάλεσεν αὐτούς· καὶ ἀφέντες τὸν πατέρα αὐτῶν Ζεβεδαῖον ἐν τῷ πλοίῳ μετὰ τῶν μισθωτῶν ἀπῆλθον ὀπίσω αὐτοῦ.
1,21,"
Καὶ εἰσπορεύονται εἰς Καπερναούμ· καὶ εὐθέως τοῖς σάββασιν εἰσελθὼν εἰς τὴν συναγωγήν, ἐδίδασκεν."
1,22,"Καὶ ἐξεπλήσσοντο ἐπὶ τῇ διδαχῇ αὐτοῦ· ἦν γὰρ διδάσκων αὐτοὺς ὡς ἐξουσίαν ἔχων, καὶ οὐχ ὡς οἱ γραμματεῖς."
1,23,"Καὶ ἦν ἐν τῇ συναγωγῇ αὐτῶν ἄνθρωπος ἐν πνεύματι ἀκαθάρτῳ, καὶ ἀνέκραξεν,"
1,24,"λέγων, Ἔα, τί ἡμῖν καὶ σοί, Ἰησοῦ Ναζαρηνέ; Ἦλθες ἀπολέσαι ἡμᾶς; Οἶδά σε τίς εἶ, ὁ ἅγιος τοῦ θεοῦ."
1,25,"Καὶ ἐπετίμησεν αὐτῷ ὁ Ἰησοῦς, λέγων, Φιμώθητι, καὶ ἔξελθε ἐξ αὐτοῦ."
1,26,"Καὶ σπαράξαν αὐτὸν τὸ πνεῦμα τὸ ἀκάθαρτον καὶ κράξαν φωνῇ μεγάλῃ, ἐξῆλθεν ἐξ αὐτοῦ."
1,27,"Καὶ ἐθαμβήθησαν πάντες, ὥστε συζητεῖν πρὸς ἑαυτούς, λέγοντας, Τί ἐστιν τοῦτο; Τίς ἡ διδαχὴ ἡ καινὴ αὕτη, ὅτι κατ’ ἐξουσίαν καὶ τοῖς πνεύμασιν τοῖς ἀκαθάρτοις ἐπιτάσσει, καὶ ὑπακούουσιν αὐτῷ;"
1,28,Ἐξῆλθεν δὲ ἡ ἀκοὴ αὐτοῦ εὐθὺς εἰς ὅλην τὴν περίχωρον τῆς Γαλιλαίας.
1,29,"
Καὶ εὐθέως ἐκ τῆς συναγωγῆς ἐξελθόντες, ἦλθον εἰς τὴν οἰκίαν Σίμωνος καὶ Ἀνδρέου, μετὰ Ἰακώβου καὶ Ἰωάννου."
1,30,"Ἡ δὲ πενθερὰ Σίμωνος κατέκειτο πυρέσσουσα, καὶ εὐθέως λέγουσιν αὐτῷ περὶ αὐτῆς·"
1,31,"καὶ προσελθὼν ἤγειρεν αὐτήν, κρατήσας τῆς χειρὸς αὐτῆς· καὶ ἀφῆκεν αὐτὴν ὁ πυρετὸς εὐθέως, καὶ διηκόνει αὐτοῖς."
1,32,"
Ὀψίας δὲ γενομένης, ὅτε ἔδυ ὁ ἥλιος, ἔφερον πρὸς αὐτὸν πάντας τοὺς κακῶς ἔχοντας καὶ τοὺς δαιμονιζομένους·"
1,33,καὶ ἡ πόλις ὅλη ἐπισυνηγμένη ἦν πρὸς τὴν θύραν.
1,34,"Καὶ ἐθεράπευσεν πολλοὺς κακῶς ἔχοντας ποικίλαις νόσοις, καὶ δαιμόνια πολλὰ ἐξέβαλεν, καὶ οὐκ ἤφιεν λαλεῖν τὰ δαιμόνια, ὅτι ᾔδεισαν αὐτόν."
1,35,"
Καὶ πρωῒ ἔννυχον λίαν ἀναστὰς ἐξῆλθεν, καὶ ἀπῆλθεν εἰς ἔρημον τόπον, κἀκεῖ προσηύχετο."
1,36,Καὶ κατεδίωξαν αὐτὸν ὁ Σίμων καὶ οἱ μετ’ αὐτοῦ·
1,37,καὶ εὑρόντες αὐτὸν λέγουσιν αὐτῷ ὅτι Πάντες σε ζητοῦσιν.
1,38,"Καὶ λέγει αὐτοῖς, Ἄγωμεν εἰς τὰς ἐχομένας κωμοπόλεις, ἵνα καὶ ἐκεῖ κηρύξω· εἰς τοῦτο γὰρ ἐξελήλυθα."
1,39,"Καὶ ἦν κηρύσσων ἐν ταῖς συναγωγαῖς αὐτῶν εἰς ὅλην τὴν Γαλιλαίαν, καὶ τὰ δαιμόνια ἐκβάλλων."
1,40,"
Καὶ ἔρχεται πρὸς αὐτὸν λεπρός, παρακαλῶν αὐτὸν καὶ γονυπετῶν αὐτόν, καὶ λέγων αὐτῷ ὅτι Ἐὰν θέλῃς, δύνασαί με καθαρίσαι."
1,41,"Ὁ δὲ Ἰησοῦς σπλαγχνισθείς, ἐκτείνας τὴν χεῖρα, ἥψατο αὐτοῦ, καὶ λέγει αὐτῷ, Θέλω, καθαρίσθητι."
1,42,"Καὶ εἰπόντος αὐτοῦ εὐθέως ἀπῆλθεν ἀπ’ αὐτοῦ ἡ λέπρα, καὶ ἐκαθαρίσθη."
1,43,"Καὶ ἐμβριμησάμενος αὐτῷ, εὐθέως ἐξέβαλεν αὐτόν,"
1,44,"καὶ λέγει αὐτῷ, Ὅρα μηδενὶ μηδὲν εἴπῃς· ἀλλ’ ὕπαγε, σεαυτὸν δεῖξον τῷ ἱερεῖ, καὶ προσένεγκε περὶ τοῦ καθαρισμοῦ σου ἃ προσέταξεν Μωσῆς, εἰς μαρτύριον αὐτοῖς."
1,45,"Ὁ δὲ ἐξελθὼν ἤρξατο κηρύσσειν πολλὰ καὶ διαφημίζειν τὸν λόγον, ὥστε μηκέτι αὐτὸν δύνασθαι φανερῶς εἰς πόλιν εἰσελθεῖν, ἀλλ’ ἔξω ἐν ἐρήμοις τόποις ἦν· καὶ ἤρχοντο πρὸς αὐτὸν πανταχόθεν."
2,1,Καὶ εἰσῆλθεν πάλιν εἰς Καπερναοὺμ δι’ ἡμερῶν· καὶ ἠκούσθη ὅτι εἰς οἶκόν ἐστιν.
2,2,"Καὶ εὐθέως συνήχθησαν πολλοί, ὥστε μηκέτι χωρεῖν μηδὲ τὰ πρὸς τὴν θύραν· καὶ ἐλάλει αὐτοῖς τὸν λόγον."
2,3,"Καὶ ἔρχονται πρὸς αὐτόν, παραλυτικὸν φέροντες, αἰρόμενον ὑπὸ τεσσάρων."
2,4,"Καὶ μὴ δυνάμενοι προσεγγίσαι αὐτῷ διὰ τὸν ὄχλον, ἀπεστέγασαν τὴν στέγην ὅπου ἦν, καὶ ἐξορύξαντες χαλῶσιν τὸν κράββατον ἐφ’ ᾧ ὁ παραλυτικὸς κατέκειτο."
2,5,"Ἰδὼν δὲ ὁ Ἰησοῦς τὴν πίστιν αὐτῶν λέγει τῷ παραλυτικῷ, Τέκνον, ἀφέωνταί σοι αἱ ἁμαρτίαι σου."
2,6,"Ἦσαν δέ τινες τῶν γραμματέων ἐκεῖ καθήμενοι, καὶ διαλογιζόμενοι ἐν ταῖς καρδίαις αὐτῶν,"
2,7,"Τί οὗτος οὕτως λαλεῖ βλασφημίας; Τίς δύναται ἀφιέναι ἁμαρτίας εἰ μὴ εἷς, ὁ θεός;"
2,8,"Καὶ εὐθέως ἐπιγνοὺς ὁ Ἰησοῦς τῷ πνεύματι αὐτοῦ ὅτι οὕτως αὐτοὶ διαλογίζονται ἐν ἑαυτοῖς, εἶπεν αὐτοῖς, Τί ταῦτα διαλογίζεσθε ἐν ταῖς καρδίαις ὑμῶν;"
2,9,"Τί ἐστιν εὐκοπώτερον, εἰπεῖν τῷ παραλυτικῷ, Ἀφέωνταί σου αἱ ἁμαρτίαι, ἢ εἰπεῖν, Ἔγειραι, καὶ ἆρόν σου τὸν κράββατον, καὶ περιπάτει;"
2,10,Ἵνα δὲ εἰδῆτε ὅτι ἐξουσίαν ἔχει ὁ υἱὸς τοῦ ἀνθρώπου ἀφιέναι ἐπὶ τῆς γῆς ἁμαρτίας- λέγει τῷ παραλυτικῷ-
2,11,"Σοὶ λέγω, ἔγειραι καὶ ἆρον τὸν κράββατόν σου, καὶ ὕπαγε εἰς τὸν οἶκόν σου."
2,12,"Καὶ ἠγέρθη εὐθέως, καὶ ἄρας τὸν κράββατον, ἐξῆλθεν ἐναντίον πάντων· ὥστε ἐξίστασθαι πάντας, καὶ δοξάζειν τὸν θεόν, λέγοντας ὅτι Οὐδέποτε οὕτως εἴδομεν."
2,13,"
Καὶ ἐξῆλθεν πάλιν παρὰ τὴν θάλασσαν· καὶ πᾶς ὁ ὄχλος ἤρχετο πρὸς αὐτόν, καὶ ἐδίδασκεν αὐτούς."
2,14,"Καὶ παράγων εἶδεν Λευῒ τὸν τοῦ Ἀλφαίου καθήμενον ἐπὶ τὸ τελώνιον, καὶ λέγει αὐτῷ, Ἀκολούθει μοι. Καὶ ἀναστὰς ἠκολούθησεν αὐτῷ."
2,15,"Καὶ ἐγένετο ἐν τῷ κατακεῖσθαι αὐτὸν ἐν τῇ οἰκίᾳ αὐτοῦ, καὶ πολλοὶ τελῶναι καὶ ἁμαρτωλοὶ συνανέκειντο τῷ Ἰησοῦ καὶ τοῖς μαθηταῖς αὐτοῦ· ἦσαν γὰρ πολλοί, καὶ ἠκολούθησαν αὐτῷ."
2,16,"Καὶ οἱ γραμματεῖς καὶ οἱ Φαρισαῖοι, ἰδόντες αὐτὸν ἐσθίοντα μετὰ τῶν τελωνῶν καὶ ἁμαρτωλῶν, ἔλεγον τοῖς μαθηταῖς αὐτοῦ, Τί ὅτι μετὰ τῶν τελωνῶν καὶ ἁμαρτωλῶν ἐσθίει καὶ πίνει;"
2,17,"Καὶ ἀκούσας ὁ Ἰησοῦς λέγει αὐτοῖς, Οὐ χρείαν ἔχουσιν οἱ ἰσχύοντες ἰατροῦ, ἀλλ’ οἱ κακῶς ἔχοντες. Οὐκ ἦλθον καλέσαι δικαίους, ἀλλὰ ἁμαρτωλοὺς εἰς μετάνοιαν."
2,18,"
Καὶ ἦσαν οἱ μαθηταὶ Ἰωάννου καὶ οἱ τῶν Φαρισαίων νηστεύοντες· καὶ ἔρχονται καὶ λέγουσιν αὐτῷ, Διὰ τί οἱ μαθηταὶ Ἰωάννου καὶ οἱ τῶν Φαρισαίων νηστεύουσιν, οἱ δὲ σοὶ μαθηταὶ οὐ νηστεύουσιν;"
2,19,"Καὶ εἶπεν αὐτοῖς ὁ Ἰησοῦς, Μὴ δύνανται οἱ υἱοὶ τοῦ νυμφῶνος, ἐν ᾧ ὁ νυμφίος μετ’ αὐτῶν ἐστιν, νηστεύειν; Ὅσον χρόνον μεθ’ ἑαυτῶν ἔχουσιν τὸν νυμφίον, οὐ δύνανται νηστεύειν·"
2,20,"ἐλεύσονται δὲ ἡμέραι ὅταν ἀπαρθῇ ἀπ’ αὐτῶν ὁ νυμφίος, καὶ τότε νηστεύσουσιν ἐν ἐκείναις ταῖς ἡμέραις."
2,21,"Καὶ οὐδεὶς ἐπίβλημα ῥάκους ἀγνάφου ἐπιρράπτει ἐπὶ ἱματίῳ παλαιῷ· εἰ δὲ μή, αἴρει τὸ πλήρωμα αὐτοῦ τὸ καινὸν τοῦ παλαιοῦ, καὶ χεῖρον σχίσμα γίνεται."
2,22,"Καὶ οὐδεὶς βάλλει οἶνον νέον εἰς ἀσκοὺς παλαιούς· εἰ δὲ μή, ῥήσσει ὁ οἶνος ὁ νέος τοὺς ἀσκούς, καὶ ὁ οἶνος ἐκχεῖται καὶ οἱ ἀσκοὶ ἀπολοῦνται· ἀλλὰ οἶνον νέον εἰς ἀσκοὺς καινοὺς βλητέον."
2,23,"
Καὶ ἐγένετο παραπορεύεσθαι αὐτὸν ἐν τοῖς σάββασιν διὰ τῶν σπορίμων, καὶ ἤρξαντο οἱ μαθηταὶ αὐτοῦ ὁδὸν ποιεῖν τίλλοντες τοὺς στάχυας."
2,24,"Καὶ οἱ Φαρισαῖοι ἔλεγον αὐτῷ, Ἴδε, τί ποιοῦσιν ἐν τοῖς σάββασιν ὃ οὐκ ἔξεστιν;"
2,25,"Καὶ αὐτὸς ἔλεγεν αὐτοῖς, Οὐδέποτε ἀνέγνωτε τί ἐποίησεν Δαυίδ, ὅτε χρείαν ἔσχεν καὶ ἐπείνασεν αὐτὸς καὶ οἱ μετ’ αὐτοῦ;"
2,26,"Πῶς εἰσῆλθεν εἰς τὸν οἶκον τοῦ θεοῦ ἐπὶ Ἀβιάθαρ ἀρχιερέως, καὶ τοὺς ἄρτους τῆς προθέσεως ἔφαγεν, οὓς οὐκ ἔξεστιν φαγεῖν εἰ μὴ τοῖς ἱερεῦσιν, καὶ ἔδωκεν καὶ τοῖς σὺν αὐτῷ οὖσιν;"
2,27,"Καὶ ἔλεγεν αὐτοῖς, Τὸ σάββατον διὰ τὸν ἄνθρωπον ἐγένετο, οὐχ ὁ ἄνθρωπος διὰ τὸ σάββατον·"
2,28,ὥστε κύριός ἐστιν ὁ υἱὸς τοῦ ἀνθρώπου καὶ τοῦ σαββάτου.
3,1,"Καὶ εἰσῆλθεν πάλιν εἰς τὴν συναγωγήν, καὶ ἦν ἐκεῖ ἄνθρωπος ἐξηραμμένην ἔχων τὴν χεῖρα."
3,2,"Καὶ παρετήρουν αὐτὸν εἰ τοῖς σάββασιν θεραπεύσει αὐτόν, ἵνα κατηγορήσωσιν αὐτοῦ."
3,3,"Καὶ λέγει τῷ ἀνθρώπῳ τῷ ἐξηραμμένην ἔχοντι τὴν χεῖρα, Ἔγειραι εἰς τὸ μέσον."
3,4,"Καὶ λέγει αὐτοῖς, Ἔξεστιν τοῖς σάββασιν ἀγαθοποιῆσαι ἢ κακοποιῆσαι; Ψυχὴν σῶσαι ἢ ἀποκτεῖναι; Οἱ δὲ ἐσιώπων."
3,5,"Καὶ περιβλεψάμενος αὐτοὺς μετ’ ὀργῆς, συλλυπούμενος ἐπὶ τῇ πωρώσει τῆς καρδίας αὐτῶν, λέγει τῷ ἀνθρώπῳ, Ἔκτεινον τὴν χεῖρά σου. Καὶ ἐξέτεινεν, καὶ ἀποκατεστάθη ἡ χεὶρ αὐτοῦ ὑγιὴς ὡς ἡ ἄλλη."
3,6,"Καὶ ἐξελθόντες οἱ Φαρισαῖοι εὐθέως μετὰ τῶν Ἡρῳδιανῶν συμβούλιον ἐποίουν κατ’ αὐτοῦ, ὅπως αὐτὸν ἀπολέσωσιν."
3,7,"Καὶ ὁ Ἰησοῦς ἀνεχώρησεν μετὰ τῶν μαθητῶν αὐτοῦ πρὸς τὴν θάλασσαν· καὶ πολὺ πλῆθος ἀπὸ τῆς Γαλιλαίας ἠκολούθησαν αὐτῷ, καὶ ἀπὸ τῆς Ἰουδαίας,"
3,8,"καὶ ἀπὸ Ἱεροσολύμων, καὶ ἀπὸ τῆς Ἰδουμαίας, καὶ πέραν τοῦ Ἰορδάνου, καὶ οἱ περὶ Τύρον καὶ Σιδῶνα, πλῆθος πολύ, ἀκούσαντες ὅσα ἐποίει, ἦλθον πρὸς αὐτόν."
3,9,"Καὶ εἶπεν τοῖς μαθηταῖς αὐτοῦ ἵνα πλοιάριον προσκαρτερῇ αὐτῷ διὰ τὸν ὄχλον, ἵνα μὴ θλίβωσιν αὐτόν."
3,10,"Πολλοὺς γὰρ ἐθεράπευσεν, ὥστε ἐπιπίπτειν αὐτῷ, ἵνα αὐτοῦ ἅψωνται, ὅσοι εἶχον μάστιγας."
3,11,"Καὶ τὰ πνεύματα τὰ ἀκάθαρτα, ὅταν αὐτὸν ἐθεώρει, προσέπιπτεν αὐτῷ, καὶ ἔκραζεν, λέγοντα ὅτι Σὺ εἶ ὁ υἱὸς τοῦ θεοῦ."
3,12,Καὶ πολλὰ ἐπετίμα αὐτοῖς ἵνα μὴ φανερὸν αὐτὸν ποιήσωσιν.
3,13,"
Καὶ ἀναβαίνει εἰς τὸ ὄρος, καὶ προσκαλεῖται οὓς ἤθελεν αὐτός· καὶ ἀπῆλθον πρὸς αὐτόν."
3,14,"Καὶ ἐποίησεν δώδεκα, ἵνα ὦσιν μετ’ αὐτοῦ, καὶ ἵνα ἀποστέλλῃ αὐτοὺς κηρύσσειν,"
3,15,"καὶ ἔχειν ἐξουσίαν θεραπεύειν τὰς νόσους, καὶ ἐκβάλλειν τὰ δαιμόνια·"
3,16,καὶ ἐπέθηκεν τῷ Σίμωνι ὄνομα Πέτρον·
3,17,"καὶ Ἰάκωβον τὸν τοῦ Ζεβεδαίου, καὶ Ἰωάννην τὸν ἀδελφὸν τοῦ Ἰακώβου· καὶ ἐπέθηκεν αὐτοῖς ὀνόματα Βοανεργές, ὅ ἐστιν, Υἱοὶ Βροντῆς·"
3,18,"καὶ Ἀνδρέαν, καὶ Φίλιππον, καὶ Βαρθολομαῖον, καὶ Ματθαῖον, καὶ Θωμᾶν, καὶ Ἰάκωβον τὸν τοῦ Ἀλφαίου, καὶ Θαδδαῖον, καὶ Σίμωνα τὸν Κανανίτην,"
3,19,"καὶ Ἰούδαν Ἰσκαριώτην, ὃς καὶ παρέδωκεν αὐτόν. 
Καὶ ἔρχονται εἰς οἶκον·"
3,20,"καὶ συνέρχεται πάλιν ὄχλος, ὥστε μὴ δύνασθαι αὐτοὺς μήτε ἄρτον φαγεῖν."
3,21,Καὶ ἀκούσαντες οἱ παρ’ αὐτοῦ ἐξῆλθον κρατῆσαι αὐτόν· ἔλεγον γὰρ ὅτι Ἐξέστη.
3,22,"Καὶ οἱ γραμματεῖς οἱ ἀπὸ Ἱεροσολύμων καταβάντες ἔλεγον ὅτι Βεελζεβοὺλ ἔχει, καὶ ὅτι Ἐν τῷ ἄρχοντι τῶν δαιμονίων ἐκβάλλει τὰ δαιμόνια."
3,23,"Καὶ προσκαλεσάμενος αὐτούς, ἐν παραβολαῖς ἔλεγεν αὐτοῖς, Πῶς δύναται Σατανᾶς Σατανᾶν ἐκβάλλειν;"
3,24,"Καὶ ἐὰν βασιλεία ἐφ’ ἑαυτὴν μερισθῇ, οὐ δύναται σταθῆναι ἡ βασιλεία ἐκείνη."
3,25,"Καὶ ἐὰν οἰκία ἐφ’ ἑαυτὴν μερισθῇ, οὐ δύναται σταθῆναι ἡ οἰκία ἐκείνη."
3,26,"Καὶ εἰ ὁ Σατανᾶς ἀνέστη ἐφ’ ἑαυτὸν καὶ μεμέρισται, οὐ δύναται σταθῆναι, ἀλλὰ τέλος ἔχει."
3,27,"Οὐδεὶς δύναται τὰ σκεύη τοῦ ἰσχυροῦ, εἰσελθὼν εἰς τὴν οἰκίαν αὐτοῦ, διαρπάσαι, ἐὰν μὴ πρῶτον τὸν ἰσχυρὸν δήσῃ, καὶ τότε τὴν οἰκίαν αὐτοῦ διαρπάσῃ."
3,28,"Ἀμὴν λέγω ὑμῖν ὅτι πάντα ἀφεθήσεται τὰ ἁμαρτήματα τοῖς υἱοῖς τῶν ἀνθρώπων, καὶ βλασφημίαι ὅσας ἂν βλασφημήσωσιν·"
3,29,"ὃς δ’ ἂν βλασφημήσῃ εἰς τὸ πνεῦμα τὸ ἅγιον, οὐκ ἔχει ἄφεσιν εἰς τὸν αἰῶνα, ἀλλ’ ἔνοχός ἐστιν αἰωνίου κρίσεως."
3,30,"Ὅτι ἔλεγον, Πνεῦμα ἀκάθαρτον ἔχει."
3,31,"
Ἔρχονται οὖν οἱ ἀδελφοὶ καὶ ἡ μήτηρ αὐτοῦ, καὶ ἔξω ἑστῶτες ἀπέστειλαν πρὸς αὐτόν, φωνοῦντες αὐτόν."
3,32,"Καὶ ἐκάθητο ὄχλος περὶ αὐτόν· εἶπον δὲ αὐτῷ, Ἰδού, ἡ μήτηρ σου καὶ οἱ ἀδελφοί σου καὶ αἱ ἀδελφαί σου ἔξω ζητοῦσίν σε."
3,33,"Καὶ ἀπεκρίθη αὐτοῖς λέγων, Τίς ἐστιν ἡ μήτηρ μου ἢ οἱ ἀδελφοί μου;"
3,34,"Καὶ περιβλεψάμενος κύκλῳ τοὺς περὶ αὐτὸν καθημένους, λέγει, Ἴδε, ἡ μήτηρ μου καὶ οἱ ἀδελφοί μου."
3,35,"Ὃς γὰρ ἂν ποιήσῃ τὸ θέλημα τοῦ θεοῦ, οὗτος ἀδελφός μου καὶ ἀδελφή μου καὶ μήτηρ ἐστίν."
4,1,"Καὶ πάλιν ἤρξατο διδάσκειν παρὰ τὴν θάλασσαν. Καὶ συνήχθη πρὸς αὐτὸν ὄχλος πολύς, ὥστε αὐτὸν ἐμβάντα εἰς τὸ πλοῖον καθῆσθαι ἐν τῇ θαλάσσῃ· καὶ πᾶς ὁ ὄχλος πρὸς τὴν θάλασσαν ἐπὶ τῆς γῆς ἦν."
4,2,"Καὶ ἐδίδασκεν αὐτοὺς ἐν παραβολαῖς πολλά, καὶ ἔλεγεν αὐτοῖς ἐν τῇ διδαχῇ αὐτοῦ,"
4,3,"Ἀκούετε· ἰδού, ἐξῆλθεν ὁ σπείρων τοῦ σπεῖραι."
4,4,"Καὶ ἐγένετο ἐν τῷ σπείρειν, ὃ μὲν ἔπεσεν παρὰ τὴν ὁδόν, καὶ ἦλθεν τὰ πετεινὰ καὶ κατέφαγεν αὐτό."
4,5,"Ἄλλο δὲ ἔπεσεν ἐπὶ τὸ πετρῶδες, ὅπου οὐκ εἶχεν γῆν πολλήν· καὶ εὐθέως ἐξανέτειλεν, διὰ τὸ μὴ ἔχειν βάθος γῆς·"
4,6,"ἡλίου δὲ ἀνατείλαντος ἐκαυματίσθη, καὶ διὰ τὸ μὴ ἔχειν ῥίζαν ἐξηράνθη."
4,7,"Καὶ ἄλλο ἔπεσεν εἰς τὰς ἀκάνθας, καὶ ἀνέβησαν αἱ ἄκανθαι, καὶ συνέπνιξαν αὐτό, καὶ καρπὸν οὐκ ἔδωκεν."
4,8,"Καὶ ἄλλο ἔπεσεν εἰς τὴν γῆν τὴν καλήν· καὶ ἐδίδου καρπὸν ἀναβαίνοντα καὶ αὐξάνοντα, καὶ ἔφερεν ἐν τριάκοντα, καὶ ἐν ἑξήκοντα, καὶ ἐν ἑκατόν."
4,9,"Καὶ ἔλεγεν, Ὁ ἔχων ὦτα ἀκούειν ἀκουέτω."
4,10,"
Ὅτε δὲ ἐγένετο καταμόνας, ἠρώτησαν αὐτὸν οἱ περὶ αὐτὸν σὺν τοῖς δώδεκα τὴν παραβολήν."
4,11,"Καὶ ἔλεγεν αὐτοῖς, Ὑμῖν δέδοται γνῶναι τὸ μυστήριον τῆς βασιλείας τοῦ θεοῦ· ἐκείνοις δὲ τοῖς ἔξω, ἐν παραβολαῖς τὰ πάντα γίνεται·"
4,12,"ἵνα βλέποντες βλέπωσιν, καὶ μὴ ἴδωσιν· καὶ ἀκούοντες ἀκούωσιν, καὶ μὴ συνιῶσιν· μήποτε ἐπιστρέψωσιν, καὶ ἀφεθῇ αὐτοῖς τὰ ἁμαρτήματα."
4,13,"Καὶ λέγει αὐτοῖς, Οὐκ οἴδατε τὴν παραβολὴν ταύτην; Καὶ πῶς πάσας τὰς παραβολὰς γνώσεσθε;"
4,14,Ὁ σπείρων τὸν λόγον σπείρει.
