chapter,verse,text
12,17,"Καὶ ἀποκριθεὶς ὁ Ἰησοῦς εἶπεν αὐτοῖς, Ἀπόδοτε τὰ Καίσαρος Καίσαρι, καὶ τὰ τοῦ θεοῦ τῷ θεῷ. Καὶ ἐθαύμασαν ἐπ’ αὐτῷ."
12,18,"
Καὶ ἔρχονται Σαδδουκαῖοι πρὸς αὐτόν, οἵτινες λέγουσιν ἀνάστασιν μὴ εἶναι· καὶ ἐπηρώτησαν αὐτόν, λέγοντες,"
12,19,"Διδάσκαλε, Μωσῆς ἔγραψεν ἡμῖν ὅτι Ἐάν τινος ἀδελφὸς ἀποθάνῃ, καὶ καταλίπῃ γυναῖκα, καὶ τέκνα μὴ ἀφῇ, ἵνα λάβῃ ὁ ἀδελφὸς αὐτοῦ τὴν γυναῖκα αὐτοῦ, καὶ ἐξαναστήσῃ σπέρμα τῷ ἀδελφῷ αὐτοῦ."
12,20,"Ἑπτὰ ἀδελφοὶ ἦσαν· καὶ ὁ πρῶτος ἔλαβεν γυναῖκα, καὶ ἀποθνῄσκων οὐκ ἀφῆκεν σπέρμα·"
12,21,"καὶ ὁ δεύτερος ἔλαβεν αὐτήν, καὶ ἀπέθανεν, καὶ οὐδὲ αὐτὸς ἀφῆκεν σπέρμα· καὶ ὁ τρίτος ὡσαύτως."
12,22,"Καὶ ἔλαβον αὐτὴν οἱ ἑπτά, καὶ οὐκ ἀφῆκαν σπέρμα. Ἐσχάτη πάντων ἀπέθανεν καὶ ἡ γυνή."
12,23,"Ἐν τῇ ἀναστάσει, ὅταν ἀναστῶσιν, τίνος αὐτῶν ἔσται γυνή; Οἱ γὰρ ἑπτὰ ἔσχον αὐτὴν γυναῖκα."
12,24,"Καὶ ἀποκριθεὶς ὁ Ἰησοῦς εἶπεν αὐτοῖς, Οὐ διὰ τοῦτο πλανᾶσθε, μὴ εἰδότες τὰς γραφάς, μηδὲ τὴν δύναμιν τοῦ θεοῦ;"
12,25,"Ὅταν γὰρ ἐκ νεκρῶν ἀναστῶσιν, οὔτε γαμοῦσιν, οὔτε γαμίσκονται, ἀλλ’ εἰσὶν ὡς ἄγγελοι οἱ ἐν τοῖς οὐρανοῖς."
12,26,"Περὶ δὲ τῶν νεκρῶν, ὅτι ἐγείρονται, οὐκ ἀνέγνωτε ἐν τῇ βίβλῳ Μωσέως, ἐπὶ τοῦ βάτου, ὡς εἶπεν αὐτῷ ὁ θεός, λέγων, Ἐγὼ ὁ θεὸς Ἀβραάμ, καὶ ὁ θεὸς Ἰσαάκ, καὶ ὁ θεὸς Ἰακώβ;"
12,27,"Οὐκ ἔστιν ὁ θεὸς νεκρῶν, ἀλλὰ θεὸς ζώντων· ὑμεῖς οὖν πολὺ πλανᾶσθε."
12,28,"
Καὶ προσελθὼν εἷς τῶν γραμματέων, ἀκούσας αὐτῶν συζητούντων, εἰδὼς ὅτι καλῶς αὐτοῖς ἀπεκρίθη, ἐπηρώτησεν αὐτόν, Ποία ἐστὶν πρώτη πάντων ἐντολή;"
12,29,"Ὁ δὲ Ἰησοῦς ἀπεκρίθη αὐτῷ ὅτι Πρώτη πάντων τῶν ἐντολῶν, Ἄκουε, Ἰσραήλ· κύριος ὁ θεὸς ἡμῶν, κύριος εἷς ἐστίν·"
12,30,"καὶ ἀγαπήσεις κύριον τὸν θεόν σου ἐξ ὅλης τῆς καρδίας σου, καὶ ἐξ ὅλης τῆς ψυχῆς σου, καὶ ἐξ ὅλης τῆς διανοίας σου, καὶ ἐξ ὅλης τῆς ἰσχύος σου. Αὕτη πρώτη ἐντολή."
12,31,"Καὶ δευτέρα ὁμοία αὕτη, Ἀγαπήσεις τὸν πλησίον σου ὡς σεαυτόν. Μείζων τούτων ἄλλη ἐντολὴ οὐκ ἔστιν."
12,32,"Καὶ εἶπεν αὐτῷ ὁ γραμματεύς, Καλῶς, διδάσκαλε, ἐπ’ ἀληθείας εἶπας ὅτι εἷς ἐστιν, καὶ οὐκ ἔστιν ἄλλος πλὴν αὐτοῦ·"
12,33,"καὶ τὸ ἀγαπᾷν αὐτὸν ἐξ ὅλης τῆς καρδίας, καὶ ἐξ ὅλης τῆς συνέσεως, καὶ ἐξ ὅλης τῆς ψυχῆς, καὶ ἐξ ὅλης τῆς ἰσχύος, καὶ τὸ ἀγαπᾷν τὸν πλησίον ὡς ἑαυτόν, πλεῖόν ἐστιν πάντων τῶν ὁλοκαυτωμάτων καὶ θυσιῶν."
12,34,"Καὶ ὁ Ἰησοῦς ἰδὼν αὐτὸν ὅτι νουνεχῶς ἀπεκρίθη, εἶπεν αὐτῷ, Οὐ μακρὰν εἶ ἀπὸ τῆς βασιλείας τοῦ θεοῦ. Καὶ οὐδεὶς οὐκέτι ἐτόλμα αὐτὸν ἐπερωτῆσαι."
12,35,"
Καὶ ἀποκριθεὶς ὁ Ἰησοῦς ἔλεγεν, διδάσκων ἐν τῷ ἱερῷ, Πῶς λέγουσιν οἱ γραμματεῖς ὅτι ὁ χριστὸς υἱός ἐστιν Δαυίδ;"
12,36,"Αὐτὸς γὰρ Δαυὶδ εἶπεν ἐν πνεύματι ἁγίῳ, Λέγει ὁ κύριος τῷ κυρίῳ μου, Κάθου ἐκ δεξιῶν μου, ἕως ἂν θῶ τοὺς ἐχθρούς σου ὑποπόδιον τῶν ποδῶν σου."
12,37,Αὐτὸς οὖν Δαυὶδ λέγει αὐτὸν κύριον· καὶ πόθεν υἱὸς αὐτοῦ ἐστιν; Καὶ ὁ πολὺς ὄχλος ἤκουεν αὐτοῦ ἡδέως.
12,38,"
Καὶ ἔλεγεν αὐτοῖς ἐν τῇ διδαχῇ αὐτοῦ, Βλέπετε ἀπὸ τῶν γραμματέων, τῶν θελόντων ἐν στολαῖς περιπατεῖν, καὶ ἀσπασμοὺς ἐν ταῖς ἀγοραῖς,"
12,39,"καὶ πρωτοκαθεδρίας ἐν ταῖς συναγωγαῖς, καὶ πρωτοκλισίας ἐν τοῖς δείπνοις·"
12,40,"οἱ κατεσθίοντες τὰς οἰκίας τῶν χηρῶν, καὶ προφάσει μακρὰ προσευχόμενοι· οὗτοι λήψονται περισσότερον κρίμα."
12,41,"
Καὶ καθίσας ὁ Ἰησοῦς κατέναντι τοῦ γαζοφυλακίου ἐθεώρει πῶς ὁ ὄχλος βάλλει χαλκὸν εἰς τὸ γαζοφυλάκιον· καὶ πολλοὶ πλούσιοι ἔβαλλον πολλά."
12,42,"Καὶ ἐλθοῦσα μία χήρα πτωχὴ ἔβαλεν λεπτὰ δύο, ὅ ἐστιν κοδράντης."
12,43,"Καὶ προσκαλεσάμενος τοὺς μαθητὰς αὐτοῦ, λέγει αὐτοῖς, Ἀμὴν λέγω ὑμῖν ὅτι ἡ χήρα αὕτη ἡ πτωχὴ πλεῖον πάντων βέβληκεν τῶν βαλλόντων εἰς τὸ γαζοφυλάκιον·"
12,44,"πάντες γὰρ ἐκ τοῦ περισσεύοντος αὐτοῖς ἔβαλον· αὕτη δὲ ἐκ τῆς ὑστερήσεως αὐτῆς πάντα ὅσα εἶχεν ἔβαλεν, ὅλον τὸν βίον αὐτῆς."
13,1,"Καὶ ἐκπορευομένου αὐτοῦ ἐκ τοῦ ἱεροῦ, λέγει αὐτῷ εἷς τῶν μαθητῶν αὐτοῦ, Διδάσκαλε, ἴδε, ποταποὶ λίθοι καὶ ποταπαὶ οἰκοδομαί."
13,2,"Καὶ ὁ Ἰησοῦς ἀποκριθεὶς εἶπεν αὐτῷ, Βλέπεις ταύτας τὰς μεγάλας οἰκοδομάς; Οὐ μὴ ἀφεθῇ λίθος ἐπὶ λίθῳ, ὃς οὐ μὴ καταλυθῇ."
13,3,"
Καὶ καθημένου αὐτοῦ εἰς τὸ ὄρος τῶν Ἐλαιῶν κατέναντι τοῦ ἱεροῦ, ἐπηρώτων αὐτὸν κατ’ ἰδίαν Πέτρος καὶ Ἰάκωβος καὶ Ἰωάννης καὶ Ἀνδρέας,"
13,4,"Εἰπὲ ἡμῖν, πότε ταῦτα ἔσται; Καὶ τί τὸ σημεῖον ὅταν μέλλῃ πάντα ταῦτα συντελεῖσθαι;"
13,5,"Ὁ δὲ Ἰησοῦς ἀποκριθεὶς αὐτοῖς ἤρξατο λέγειν, Βλέπετε μή τις ὑμᾶς πλανήσῃ."
13,6,"Πολλοὶ γὰρ ἐλεύσονται ἐπὶ τῷ ὀνόματί μου, λέγοντες ὅτι Ἐγώ εἰμι· καὶ πολλοὺς πλανήσουσιν."
13,7,"Ὅταν δὲ ἀκούσητε πολέμους καὶ ἀκοὰς πολέμων, μὴ θροεῖσθε· δεῖ γὰρ γενέσθαι, ἀλλ’ οὔπω τὸ τέλος."
13,8,"Ἐγερθήσεται γὰρ ἔθνος ἐπὶ ἔθνος, καὶ βασιλεία ἐπὶ βασιλείαν· καὶ ἔσονται σεισμοὶ κατὰ τόπους, καὶ ἔσονται λιμοὶ καὶ ταραχαί· ἀρχαὶ ὠδίνων ταῦτα."
13,9,"
Βλέπετε δὲ ὑμεῖς ἑαυτούς· παραδώσουσιν γὰρ ὑμᾶς εἰς συνέδρια, καὶ εἰς συναγωγὰς δαρήσεσθε, καὶ ἐπὶ ἡγεμόνων καὶ βασιλέων σταθήσεσθε ἕνεκεν ἐμοῦ, εἰς μαρτύριον αὐτοῖς."
13,10,Καὶ εἰς πάντα τὰ ἔθνη δεῖ πρῶτον κηρυχθῆναι τὸ εὐαγγέλιον.
13,11,"Ὅταν δὲ ἀγάγωσιν ὑμᾶς παραδιδόντες, μὴ προμεριμνᾶτε τί λαλήσητε, μηδὲ μελετᾶτε· ἀλλ’ ὃ ἐὰν δοθῇ ὑμῖν ἐν ἐκείνῃ τῇ ὥρᾳ, τοῦτο λαλεῖτε· οὐ γάρ ἐστε ὑμεῖς οἱ λαλοῦντες, ἀλλὰ τὸ πνεῦμα τὸ ἅγιον."
13,12,"Παραδώσει δὲ ἀδελφὸς ἀδελφὸν εἰς θάνατον, καὶ πατὴρ τέκνον· καὶ ἐπαναστήσονται τέκνα ἐπὶ γονεῖς, καὶ θανατώσουσιν αὐτούς."
13,13,"Καὶ ἔσεσθε μισούμενοι ὑπὸ πάντων διὰ τὸ ὄνομά μου· ὁ δὲ ὑπομείνας εἰς τέλος, οὗτος σωθήσεται."
13,14,"
Ὅταν δὲ ἴδητε τὸ βδέλυγμα τῆς ἐρημώσεως, τὸ ῥηθὲν ὑπὸ Δανιὴλ τοῦ προφήτου, ἑστὼς ὅπου οὐ δεῖ- ὁ ἀναγινώσκων νοείτω- τότε οἱ ἐν τῇ Ἰουδαίᾳ φευγέτωσαν εἰς τὰ ὄρη·"
13,15,"ὁ δὲ ἐπὶ τοῦ δώματος μὴ καταβάτω εἰς τὴν οἰκίαν, μηδὲ εἰσελθέτω ἆραί τι ἐκ τῆς οἰκίας αὐτοῦ·"
13,16,"καὶ ὁ εἰς τὸν ἀγρὸν ὢν μὴ ἐπιστρεψάτω εἰς τὰ ὀπίσω, ἆραι τὸ ἱμάτιον αὐτοῦ."
13,17,Οὐαὶ δὲ ταῖς ἐν γαστρὶ ἐχούσαις καὶ ταῖς θηλαζούσαις ἐν ἐκείναις ταῖς ἡμέραις.
13,18,Προσεύχεσθε δὲ ἵνα μὴ γένηται ἡ φυγὴ ὑμῶν χειμῶνος.
13,19,"Ἔσονται γὰρ αἱ ἡμέραι ἐκεῖναι θλίψις, οἵα οὐ γέγονεν τοιαύτη ἀπ’ ἀρχῆς κτίσεως ἧς ἔκτισεν ὁ θεὸς ἕως τοῦ νῦν, καὶ οὐ μὴ γένηται."
13,20,"Καὶ εἰ μὴ κύριος ἐκολόβωσεν τὰς ἡμέρας, οὐκ ἂν ἐσώθη πᾶσα σάρξ· ἀλλὰ διὰ τοὺς ἐκλεκτούς, οὓς ἐξελέξατο, ἐκολόβωσεν τὰς ἡμέρας."
13,21,"Τότε ἐάν τις ὑμῖν εἴπῃ, Ἰδού, ὧδε ὁ χριστός, ἢ Ἰδού, ἐκεῖ, μὴ πιστεύετε."
13,22,"Ἐγερθήσονται γὰρ ψευδόχριστοι καὶ ψευδοπροφῆται, καὶ δώσουσιν σημεῖα καὶ τέρατα, πρὸς τὸ ἀποπλανᾷν, εἰ δυνατόν, καὶ τοὺς ἐκλεκτούς."
13,23,"Ὑμεῖς δὲ βλέπετε· ἰδού, προείρηκα ὑμῖν πάντα."
13,24,"
Ἀλλ’ ἐν ἐκείναις ταῖς ἡμέραις, μετὰ τὴν θλίψιν ἐκείνην, ὁ ἥλιος σκοτισθήσεται, καὶ ἡ σελήνη οὐ δώσει τὸ φέγγος αὐτῆς,"
13,25,"καὶ οἱ ἀστέρες τοῦ οὐρανοῦ ἔσονται ἐκπίπτοντες, καὶ αἱ δυνάμεις αἱ ἐν τοῖς οὐρανοῖς σαλευθήσονται."
13,26,Καὶ τότε ὄψονται τὸν υἱὸν τοῦ ἀνθρώπου ἐρχόμενον ἐν νεφέλαις μετὰ δυνάμεως πολλῆς καὶ δόξης.
13,27,"Καὶ τότε ἀποστελεῖ τοὺς ἀγγέλους αὐτοῦ, καὶ ἐπισυνάξει τοὺς ἐκλεκτοὺς αὐτοῦ ἐκ τῶν τεσσάρων ἀνέμων, ἀπ’ ἄκρου γῆς ἕως ἄκρου οὐρανοῦ."
13,28,"
Ἀπὸ δὲ τῆς συκῆς μάθετε τὴν παραβολήν· ὅταν αὐτῆς ἤδη ὁ κλάδος ἁπαλὸς γένηται, καὶ ἐκφύῃ τὰ φύλλα, γινώσκετε ὅτι ἐγγὺς τὸ θέρος ἐστίν·"
13,29,"οὕτως καὶ ὑμεῖς, ὅταν ταῦτα ἴδητε γινόμενα, γινώσκετε ὅτι ἐγγύς ἐστιν ἐπὶ θύραις."
13,30,"Ἀμὴν λέγω ὑμῖν ὅτι οὐ μὴ παρέλθῃ ἡ γενεὰ αὕτη, μέχρι οὗ πάντα ταῦτα γένηται."
13,31,"Ὁ οὐρανὸς καὶ ἡ γῆ παρελεύσεται, οἱ δὲ λόγοι μου οὐ μὴ παρέλθωσιν."
13,32,"Περὶ δὲ τῆς ἡμέρας ἐκείνης ἢ ὥρας οὐδεὶς οἶδεν, οὐδὲ οἱ ἄγγελοι οἱ ἐν οὐρανῷ, οὐδὲ ὁ υἱός, εἰ μὴ ὁ πατήρ."
13,33,"Βλέπετε, ἀγρυπνεῖτε καὶ προσεύχεσθε· οὐκ οἴδατε γὰρ πότε ὁ καιρός ἐστιν."
13,34,"Ὡς ἄνθρωπος ἀπόδημος ἀφεὶς τὴν οἰκίαν αὐτοῦ, καὶ δοὺς τοῖς δούλοις αὐτοῦ τὴν ἐξουσίαν, καὶ ἑκάστῳ τὸ ἔργον αὐτοῦ, καὶ τῷ θυρωρῷ ἐνετείλατο ἵνα γρηγορῇ."
13,35,"Γρηγορεῖτε οὖν· οὐκ οἴδατε γὰρ πότε ὁ κύριος τῆς οἰκίας ἔρχεται, ὀψέ, ἢ μεσονυκτίου, ἢ ἀλεκτοροφωνίας, ἢ πρωΐ·"
13,36,μὴ ἐλθὼν ἐξαίφνης εὕρῃ ὑμᾶς καθεύδοντας.
13,37,"Ἃ δὲ ὑμῖν λέγω πᾶσιν λέγω, Γρηγορεῖτε."
14,1,Ἦν δὲ τὸ Πάσχα καὶ τὰ ἄζυμα μετὰ δύο ἡμέρας· καὶ ἐζήτουν οἱ ἀρχιερεῖς καὶ οἱ γραμματεῖς πῶς αὐτὸν ἐν δόλῳ κρατήσαντες ἀποκτείνωσιν.
14,2,"Ἔλεγον δέ, Μὴ ἐν τῇ ἑορτῇ, μήποτε θόρυβος ἔσται τοῦ λαοῦ."
14,3,"
Καὶ ὄντος αὐτοῦ ἐν Βηθανίᾳ, ἐν τῇ οἰκίᾳ Σίμωνος τοῦ λεπροῦ, κατακειμένου αὐτοῦ, ἦλθεν γυνὴ ἔχουσα ἀλάβαστρον μύρου νάρδου πιστικῆς πολυτελοῦς· καὶ συντρίψασα τὸ ἀλάβαστρον, κατέχεεν αὐτοῦ κατὰ τῆς κεφαλῆς."
14,4,"Ἦσαν δέ τινες ἀγανακτοῦντες πρὸς ἑαυτούς, καὶ λέγοντες, Εἰς τί ἡ ἀπώλεια αὕτη τοῦ μύρου γέγονεν;"
14,5,"Ἠδύνατο γὰρ τοῦτο πραθῆναι ἐπάνω τριακοσίων δηναρίων, καὶ δοθῆναι τοῖς πτωχοῖς. Καὶ ἐνεβριμῶντο αὐτῇ."
14,6,"Ὁ δὲ Ἰησοῦς εἶπεν, Ἄφετε αὐτήν· τί αὐτῇ κόπους παρέχετε; Καλὸν ἔργον εἰργάσατο ἐν ἐμοί."
14,7,"Πάντοτε γὰρ τοὺς πτωχοὺς ἔχετε μεθ’ ἑαυτῶν, καὶ ὅταν θέλητε δύνασθε αὐτοὺς εὖ ποιῆσαι· ἐμὲ δὲ οὐ πάντοτε ἔχετε."
14,8,Ὃ ἔσχεν αὕτη ἐποίησεν· προέλαβεν μυρίσαι μου τὸ σῶμα εἰς τὸν ἐνταφιασμόν.
14,9,"Ἀμὴν λέγω ὑμῖν, ὅπου ἐὰν κηρυχθῇ τὸ εὐαγγέλιον τοῦτο εἰς ὅλον τὸν κόσμον, καὶ ὃ ἐποίησεν αὕτη λαληθήσεται εἰς μνημόσυνον αὐτῆς."
14,10,"
Καὶ ὁ Ἰούδας ὁ Ἰσκαριώτης, εἷς τῶν δώδεκα, ἀπῆλθεν πρὸς τοὺς ἀρχιερεῖς, ἵνα παραδῷ αὐτὸν αὐτοῖς."
14,11,"Οἱ δὲ ἀκούσαντες ἐχάρησαν, καὶ ἐπηγγείλαντο αὐτῷ ἀργύριον δοῦναι, καὶ ἐζήτει πῶς εὐκαίρως αὐτὸν παραδῷ."
14,12,"
Καὶ τῇ πρώτῃ ἡμέρᾳ τῶν ἀζύμων, ὅτε τὸ Πάσχα ἔθυον, λέγουσιν αὐτῷ οἱ μαθηταὶ αὐτοῦ, Ποῦ θέλεις ἀπελθόντες ἑτοιμάσωμεν ἵνα φάγῃς τὸ Πάσχα;"
14,13,"Καὶ ἀποστέλλει δύο τῶν μαθητῶν αὐτοῦ, καὶ λέγει αὐτοῖς, Ὑπάγετε εἰς τὴν πόλιν, καὶ ἀπαντήσει ὑμῖν ἄνθρωπος κεράμιον ὕδατος βαστάζων· ἀκολουθήσατε αὐτῷ,"
14,14,"καὶ ὅπου ἐὰν εἰσέλθῃ, εἴπατε τῷ οἰκοδεσπότῃ ὅτι Ὁ διδάσκαλος λέγει, Ποῦ ἐστιν τὸ κατάλυμα, ὅπου τὸ Πάσχα μετὰ τῶν μαθητῶν μου φάγω;"
14,15,Καὶ αὐτὸς ὑμῖν δείξει ἀνώγεον μέγα ἐστρωμένον ἕτοιμον· ἐκεῖ ἑτοιμάσατε ἡμῖν.
14,16,"Καὶ ἐξῆλθον οἱ μαθηταὶ αὐτοῦ, καὶ ἦλθον εἰς τὴν πόλιν, καὶ εὗρον καθὼς εἶπεν αὐτοῖς, καὶ ἡτοίμασαν τὸ Πάσχα."
14,17,"
Καὶ ὀψίας γενομένης ἔρχεται μετὰ τῶν δώδεκα."
14,18,"Καὶ ἀνακειμένων αὐτῶν καὶ ἐσθιόντων, εἶπεν ὁ Ἰησοῦς, Ἀμὴν λέγω ὑμῖν ὅτι εἷς ἐξ ὑμῶν παραδώσει με, ὁ ἐσθίων μετ’ ἐμοῦ."
14,19,"Οἱ δὲ ἤρξαντο λυπεῖσθαι, καὶ λέγειν αὐτῷ εἷς καθ’ εἷς, Μήτι ἐγώ; Καὶ ἄλλος, Μήτι ἐγώ;"
14,20,"Ὁ δὲ ἀποκριθεὶς εἶπεν αὐτοῖς, Εἷς ἐκ τῶν δώδεκα, ὁ ἐμβαπτόμενος μετ’ ἐμοῦ εἰς τὸ τρυβλίον."
14,21,"Ὁ μὲν υἱὸς τοῦ ἀνθρώπου ὑπάγει, καθὼς γέγραπται περὶ αὐτοῦ· οὐαὶ δὲ τῷ ἀνθρώπῳ ἐκείνῳ δι’ οὗ ὁ υἱὸς τοῦ ἀνθρώπου παραδίδοται· καλὸν ἦν αὐτῷ εἰ οὐκ ἐγεννήθη ὁ ἄνθρωπος ἐκεῖνος."
14,22,"
Καὶ ἐσθιόντων αὐτῶν, λαβὼν ὁ Ἰησοῦς ἄρτον, εὐλογήσας ἔκλασεν καὶ ἔδωκεν αὐτοῖς, καὶ εἶπεν, Λάβετε, φάγετε· τοῦτό ἐστιν τὸ σῶμά μου."
14,23,"Καὶ λαβὼν τὸ ποτήριον, εὐχαριστήσας ἔδωκεν αὐτοῖς, καὶ ἔπιον ἐξ αὐτοῦ πάντες."
14,24,"Καὶ εἶπεν αὐτοῖς, Τοῦτό ἐστιν τὸ αἷμά μου, τὸ τῆς καινῆς διαθήκης, τὸ περὶ πολλῶν ἐκχυνόμενον."
14,25,"Ἀμὴν λέγω ὑμῖν ὅτι οὐκέτι οὐ μὴ πίω ἐκ τοῦ γενήματος τῆς ἀμπέλου, ἕως τῆς ἡμέρας ἐκείνης ὅταν αὐτὸ πίνω καινὸν ἐν τῇ βασιλείᾳ τοῦ θεοῦ."
14,26,"
Καὶ ὑμνήσαντες ἐξῆλθον εἰς τὸ ὄρος τῶν Ἐλαιῶν."
14,27,"
Καὶ λέγει αὐτοῖς ὁ Ἰησοῦς ὅτι Πάντες σκανδαλισθήσεσθε ἐν ἐμοὶ ἐν τῇ νυκτὶ ταύτῃ· ὅτι γέγραπται, Πατάξω τὸν ποιμένα, καὶ διασκορπισθήσεται τὰ πρόβατα."
14,28,"Ἀλλὰ μετὰ τὸ ἐγερθῆναί με, προάξω ὑμᾶς εἰς τὴν Γαλιλαίαν."
14,29,"Ὁ δὲ Πέτρος ἔφη αὐτῷ, Καὶ εἰ πάντες σκανδαλισθήσονται, ἀλλ’ οὐκ ἐγώ."
14,30,"Καὶ λέγει αὐτῷ ὁ Ἰησοῦς, Ἀμὴν λέγω σοι ὅτι σὺ σήμερον ἐν τῇ νυκτὶ ταύτῃ, πρὶν ἢ δὶς ἀλέκτορα φωνῆσαι, τρὶς ἀπαρνήσῃ με."
14,31,"Ὁ δὲ ἐκπερισσοῦ ἔλεγεν μᾶλλον, Ἐάν με δέῃ συναποθανεῖν σοι, οὐ μή σε ἀπαρνήσωμαι. Ὡσαύτως δὲ καὶ πάντες ἔλεγον."
14,32,"
Καὶ ἔρχονται εἰς χωρίον οὗ τὸ ὄνομα Γεθσημανῆ, καὶ λέγει τοῖς μαθηταῖς αὐτοῦ, Καθίσατε ὧδε, ἕως προσεύξωμαι."
14,33,"Καὶ παραλαμβάνει τὸν Πέτρον καὶ Ἰάκωβον καὶ Ἰωάννην μεθ’ ἑαυτοῦ, καὶ ἤρξατο ἐκθαμβεῖσθαι καὶ ἀδημονεῖν."
14,34,"Καὶ λέγει αὐτοῖς, Περίλυπός ἐστιν ἡ ψυχή μου ἕως θανάτου· μείνατε ὧδε καὶ γρηγορεῖτε."
14,35,"Καὶ προσελθὼν μικρόν, ἔπεσεν ἐπὶ τῆς γῆς, καὶ προσηύχετο ἵνα, εἰ δυνατόν ἐστιν, παρέλθῃ ἀπ’ αὐτοῦ ἡ ὥρα."
14,36,"Καὶ ἔλεγεν, Ἀββᾶ, ὁ πατήρ, πάντα δυνατά σοι. Παρένεγκε τὸ ποτήριον ἀπ’ ἐμοῦ τοῦτο· ἀλλ’ οὐ τί ἐγὼ θέλω, ἀλλὰ τί σύ."
14,37,"Καὶ ἔρχεται καὶ εὑρίσκει αὐτοὺς καθεύδοντας, καὶ λέγει τῷ Πέτρῳ, Σίμων, καθεύδεις; Οὐκ ἴσχυσας μίαν ὥραν γρηγορῆσαι;"
14,38,"Γρηγορεῖτε καὶ προσεύχεσθε, ἵνα μὴ εἰσέλθητε εἰς πειρασμόν. Τὸ μὲν πνεῦμα πρόθυμον, ἡ δὲ σὰρξ ἀσθενής."
14,39,"Καὶ πάλιν ἀπελθὼν προσηύξατο, τὸν αὐτὸν λόγον εἰπών."
14,40,"Καὶ ὑποστρέψας εὗρεν αὐτοὺς πάλιν καθεύδοντας· ἦσαν γὰρ οἱ ὀφθαλμοὶ αὐτῶν βεβαρημένοι, καὶ οὐκ ᾔδεισαν τί αὐτῷ ἀποκριθῶσιν."
14,41,"Καὶ ἔρχεται τὸ τρίτον, καὶ λέγει αὐτοῖς, Καθεύδετε λοιπὸν καὶ ἀναπαύεσθε. Ἀπέχει· ἦλθεν ἡ ὥρα. Ἰδού, παραδίδοται ὁ υἱὸς τοῦ ἀνθρώπου εἰς τὰς χεῖρας τῶν ἁμαρτωλῶν."
14,42,"Ἐγείρεσθε, ἄγωμεν. Ἰδού, ὁ παραδιδούς με ἤγγικεν."
14,43,"
Καὶ εὐθέως, ἔτι αὐτοῦ λαλοῦντος, παραγίνεται Ἰούδας, εἷς ὢν τῶν δώδεκα, καὶ μετ’ αὐτοῦ ὄχλος πολὺς μετὰ μαχαιρῶν καὶ ξύλων, παρὰ τῶν ἀρχιερέων καὶ τῶν γραμματέων καὶ τῶν πρεσβυτέρων."
14,44,"Δεδώκει δὲ ὁ παραδιδοὺς αὐτὸν σύσσημον αὐτοῖς, λέγων, Ὃν ἂν φιλήσω, αὐτός ἐστιν· κρατήσατε αὐτόν, καὶ ἀπαγάγετε ἀσφαλῶς."
14,45,"Καὶ ἐλθών, εὐθέως προσελθὼν αὐτῷ λέγει αὐτῷ, Ῥαββί, ῥαββί· καὶ κατεφίλησεν αὐτόν."
14,46,"Οἱ δὲ ἐπέβαλον ἐπ’ αὐτὸν τὰς χεῖρας αὐτῶν, καὶ ἐκράτησαν αὐτόν."
14,47,"Εἷς δέ τις τῶν παρεστηκότων σπασάμενος τὴν μάχαιραν ἔπαισεν τὸν δοῦλον τοῦ ἀρχιερέως, καὶ ἀφεῖλεν αὐτοῦ τὸ ὠτίον."
14,48,"Καὶ ἀποκριθεὶς ὁ Ἰησοῦς εἶπεν αὐτοῖς, Ὡς ἐπὶ λῃστὴν ἐξήλθετε μετὰ μαχαιρῶν καὶ ξύλων συλλαβεῖν με;"
14,49,"Καθ’ ἡμέραν ἤμην πρὸς ὑμᾶς ἐν τῷ ἱερῷ διδάσκων, καὶ οὐκ ἐκρατήσατέ με· ἀλλ’ ἵνα πληρωθῶσιν αἱ γραφαί."
14,50,Καὶ ἀφέντες αὐτὸν πάντες ἔφυγον.
14,51,"
Καὶ εἷς τις νεανίσκος ἠκολούθησεν αὐτῷ, περιβεβλημένος σινδόνα ἐπὶ γυμνοῦ. Καὶ κρατοῦσιν αὐτὸν οἱ νεανίσκοι·"
14,52,ὁ δὲ καταλιπὼν τὴν σινδόνα γυμνὸς ἔφυγεν ἀπ’ αὐτῶν.
14,53,"
Καὶ ἀπήγαγον τὸν Ἰησοῦν πρὸς τὸν ἀρχιερέα· καὶ συνέρχονται αὐτῷ πάντες οἱ ἀρχιερεῖς καὶ οἱ πρεσβύτεροι καὶ οἱ γραμματεῖς."
